title,subhead,url,suscription,byline,img_url,article_type
Poland arrests Ukrainian suspect in Nord Stream sabotage,0,https://www.lemonde.fr/en/international/article/2025/09/30/poland-arrests-ukrainian-suspect-in-nord-stream-sabotage_6745947_4.html,Not premium,Le Monde,https://img.lemde.fr/2025/09/16/0/52/1041/694/360/0/95/0/33e8ac5_ftp-import-images-1-mfot83e8fijg-2025-09-16t104420z-1844204919-rc2xsga2i4m9-rtrmadp-3-ukraine-crisis-nordstream.JPG 2x,
"Trump's 20-point plan for Gaza, explained and analyzed",0,https://www.lemonde.fr/en/international/article/2025/09/30/gaza-trump-s-20-point-plan-explained-and-analyzed_6745944_4.html,Subscribers only,  By Samuel Forey ,https://img.lemde.fr/2025/09/16/0/52/1041/694/360/0/95/0/33e8ac5_ftp-import-images-1-mfot83e8fijg-2025-09-16t104420z-1844204919-rc2xsga2i4m9-rtrmadp-3-ukraine-crisis-nordstream.JPG 2x,
Moldova's fear of 'Russian threat' propelled Sandu's pro-European party to victory,0,https://www.lemonde.fr/en/international/article/2025/09/30/moldova-s-fear-of-the-russian-threat-propelled-sandu-s-pro-european-party-to-victory_6745933_4.html,Subscribers only,  By Marine Leduc ,https://img.lemde.fr/2025/09/16/0/52/1041/694/360/0/95/0/33e8ac5_ftp-import-images-1-mfot83e8fijg-2025-09-16t104420z-1844204919-rc2xsga2i4m9-rtrmadp-3-ukraine-crisis-nordstream.JPG 2x,
"Under pressure, Netanyahu accepts Trump's Gaza peace plan, but sets conditions",0,https://www.lemonde.fr/en/international/article/2025/09/30/netanyahu-accepts-trump-s-gaza-peace-plan-under-pressure-but-sets-conditions_6745930_4.html,Subscribers only,"  By Luc Bronner (Jerusalem, correspondent) ",https://img.lemde.fr/2025/09/16/0/52/1041/694/360/0/95/0/33e8ac5_ftp-import-images-1-mfot83e8fijg-2025-09-16t104420z-1844204919-rc2xsga2i4m9-rtrmadp-3-ukraine-crisis-nordstream.JPG 2x,
Sanctions against Russia spark rift between US and Europe over China,0,https://www.lemonde.fr/en/international/article/2025/09/15/sanctions-against-russia-spark-rift-between-us-and-europe-over-china_6745411_4.html,Subscribers only,"  By Philippe Jacqué (Brussels, Europe bureau), Philippe Ricard and Harold Thibault (Beijing (China) correspondent) ",https://img.lemde.fr/2025/09/16/0/52/1041/694/360/0/95/0/33e8ac5_ftp-import-images-1-mfot83e8fijg-2025-09-16t104420z-1844204919-rc2xsga2i4m9-rtrmadp-3-ukraine-crisis-nordstream.JPG 2x,
France's political instability puts Franco-German alliance to the test,0,https://www.lemonde.fr/en/opinion/article/2025/08/30/france-s-political-instability-puts-franco-german-alliance-to-the-test_6744873_23.html,Not premium,Le Monde,https://img.lemde.fr/2025/09/16/0/52/1041/694/360/0/95/0/33e8ac5_ftp-import-images-1-mfot83e8fijg-2025-09-16t104420z-1844204919-rc2xsga2i4m9-rtrmadp-3-ukraine-crisis-nordstream.JPG 2x,
France faces prospect of paying higher borrowing costs than Italy,0,https://www.lemonde.fr/en/economy/article/2025/08/19/france-faces-prospect-of-paying-higher-borrowing-costs-than-italy_6744519_19.html,Subscribers only,  By Denis Cosnard and Allan Kaval (Rome (Italy) correspondent) ,https://img.lemde.fr/2025/09/16/0/52/1041/694/360/0/95/0/33e8ac5_ftp-import-images-1-mfot83e8fijg-2025-09-16t104420z-1844204919-rc2xsga2i4m9-rtrmadp-3-ukraine-crisis-nordstream.JPG 2x,
French man arrested in Slovenia for crimes committed in Croatia during 1991 war,0,https://www.lemonde.fr/en/international/article/2025/08/06/french-man-arrested-in-slovenia-for-crimes-committed-in-croatia-during-1991-war_6744113_4.html,Subscribers only,  By Stéphanie Maupas (The Hague (Netherlands) correspondent) and Richard Schittly (Lyon (France) correspondent) ,https://img.lemde.fr/2025/09/16/0/52/1041/694/360/0/95/0/33e8ac5_ftp-import-images-1-mfot83e8fijg-2025-09-16t104420z-1844204919-rc2xsga2i4m9-rtrmadp-3-ukraine-crisis-nordstream.JPG 2x,
South African ambassador found dead outside Paris hotel,0,https://www.lemonde.fr/en/france/article/2025/09/30/south-african-ambassador-found-dead-outside-paris-hotel_6745945_7.html,Not premium,Le Monde with AFP,https://img.lemde.fr/2025/09/16/0/52/1041/694/360/0/95/0/33e8ac5_ftp-import-images-1-mfot83e8fijg-2025-09-16t104420z-1844204919-rc2xsga2i4m9-rtrmadp-3-ukraine-crisis-nordstream.JPG 2x,
From neo-Nazis to pedophilia: The online world of young men drawn to extreme violence,0,https://www.lemonde.fr/en/france/article/2025/09/30/from-neo-nazis-to-pedophilia-the-online-world-of-young-men-drawn-to-extreme-violence_6745953_7.html,Subscribers only,  By Damien Leloup and Soren Seelow ,https://img.lemde.fr/2025/09/16/0/52/1041/694/360/0/95/0/33e8ac5_ftp-import-images-1-mfot83e8fijg-2025-09-16t104420z-1844204919-rc2xsga2i4m9-rtrmadp-3-ukraine-crisis-nordstream.JPG 2x,
Paris mayoral candidate Rachida Dati will stand trial for corruption after election,0,https://www.lemonde.fr/en/france/article/2025/09/30/paris-mayoral-candidate-rachida-dati-will-stand-trial-for-corruption-after-election_6745942_7.html,Subscribers only,  By Hélène Bekmezian and Rémi Dupré ,https://img.lemde.fr/2025/09/16/0/52/1041/694/360/0/95/0/33e8ac5_ftp-import-images-1-mfot83e8fijg-2025-09-16t104420z-1844204919-rc2xsga2i4m9-rtrmadp-3-ukraine-crisis-nordstream.JPG 2x,
'Get up or I'll smash you': Protests in France were  marked by police brutality,0,https://www.lemonde.fr/en/france/article/2025/09/29/get-up-or-i-ll-smash-you-french-police-violence-mars-september-10-and-18-protests_6745889_7.html,Subscribers only,  By Antoine Albertini and Arthur Carpentier ,https://img.lemde.fr/2025/09/16/0/52/1041/694/360/0/95/0/33e8ac5_ftp-import-images-1-mfot83e8fijg-2025-09-16t104420z-1844204919-rc2xsga2i4m9-rtrmadp-3-ukraine-crisis-nordstream.JPG 2x,
Watch: Hundreds of thousands march in France against budget cuts,0,https://www.lemonde.fr/en/videos/video/2025/09/19/french-strikes-watch-what-happened-as-hundreds-of-thousands-marched-against-budget-cuts_6745548_108.html,Not premium,  By Le Monde's video desk   ,https://img.lemde.fr/2025/09/16/0/52/1041/694/360/0/95/0/33e8ac5_ftp-import-images-1-mfot83e8fijg-2025-09-16t104420z-1844204919-rc2xsga2i4m9-rtrmadp-3-ukraine-crisis-nordstream.JPG 2x,
Emmys 2025: 'Adolescence' star Owen Cooper becomes youngest winner for best supporting actor,0,https://www.lemonde.fr/en/videos/video/2025/09/15/emmys-2025-adolescence-star-owen-cooper-becomes-youngest-winner-for-best-supporting-actor_6745427_108.html,Not premium,  By Le Monde's video desk   ,https://img.lemde.fr/2025/09/16/0/52/1041/694/360/0/95/0/33e8ac5_ftp-import-images-1-mfot83e8fijg-2025-09-16t104420z-1844204919-rc2xsga2i4m9-rtrmadp-3-ukraine-crisis-nordstream.JPG 2x,
"From 'influence peddling' to 'corruption,' what is French Culture Minister Rachida Dati accused of?",0,https://www.lemonde.fr/en/videos/video/2025/09/06/from-influence-peddling-to-corruption-what-is-french-culture-minister-rachida-dati-accused-of_6745094_108.html,Not premium,"  By Alexis Tromas, Arthur Navet (Motion design) and Sinead McCausland ",https://img.lemde.fr/2025/09/16/0/52/1041/694/360/0/95/0/33e8ac5_ftp-import-images-1-mfot83e8fijg-2025-09-16t104420z-1844204919-rc2xsga2i4m9-rtrmadp-3-ukraine-crisis-nordstream.JPG 2x,
Watch: Tsunami warnings sound in Japan after 8.8 magnitude quake off Russian coast,0,https://www.lemonde.fr/en/videos/video/2025/07/30/watch-tsunami-warnings-sound-in-japan-after-8-8-magnitude-quake-off-russian-coast_6743900_108.html,Not premium,No byline,https://img.lemde.fr/2025/09/16/0/52/1041/694/360/0/95/0/33e8ac5_ftp-import-images-1-mfot83e8fijg-2025-09-16t104420z-1844204919-rc2xsga2i4m9-rtrmadp-3-ukraine-crisis-nordstream.JPG 2x,
NATO's new engagement rules mark a turning point in response to Russian incursions,0,https://www.lemonde.fr/en/opinion/article/2025/09/30/nato-s-new-engagement-rules-mark-a-turning-point-in-response-to-russian-incursions_6745924_23.html,Subscribers only,Chloé Hoorman,https://img.lemde.fr/2025/09/16/0/52/1041/694/360/0/95/0/33e8ac5_ftp-import-images-1-mfot83e8fijg-2025-09-16t104420z-1844204919-rc2xsga2i4m9-rtrmadp-3-ukraine-crisis-nordstream.JPG 2x,
Sarkozy's attacks on judges and the Trumpification of French public debate,0,https://www.lemonde.fr/en/opinion/article/2025/09/30/sarkozy-s-attacks-on-judges-and-the-trumpification-of-french-public-debate_6745932_23.html,Not premium,Le Monde,https://img.lemde.fr/2025/09/16/0/52/1041/694/360/0/95/0/33e8ac5_ftp-import-images-1-mfot83e8fijg-2025-09-16t104420z-1844204919-rc2xsga2i4m9-rtrmadp-3-ukraine-crisis-nordstream.JPG 2x,
Drone incursions: 'Russia is testing the resolve of democratic societies to respond to its threats',0,https://www.lemonde.fr/en/opinion/article/2025/09/30/drone-incursions-russia-is-testing-the-resolve-of-democratic-societies-to-respond-to-its-threats_6745931_23.html,Subscribers only,Nicolas Tenzer,https://img.lemde.fr/2025/09/16/0/52/1041/694/360/0/95/0/33e8ac5_ftp-import-images-1-mfot83e8fijg-2025-09-16t104420z-1844204919-rc2xsga2i4m9-rtrmadp-3-ukraine-crisis-nordstream.JPG 2x,
"Zucman tax: 'The super-rich pay far less tax than fellow citizens, yet extreme wealth is almost always tied to business'",0,https://www.lemonde.fr/en/opinion/article/2025/09/30/zucman-tax-the-super-rich-pay-significantly-fewer-taxes-than-their-fellow-citizens-and-yet-extreme-wealth-is-almost-always-tied-to-business_6745916_23.html,Subscribers only,Valérie Rabault,https://img.lemde.fr/2025/09/16/0/52/1041/694/360/0/95/0/33e8ac5_ftp-import-images-1-mfot83e8fijg-2025-09-16t104420z-1844204919-rc2xsga2i4m9-rtrmadp-3-ukraine-crisis-nordstream.JPG 2x,
"Vivian Jenna Wilson, Elon Musk's transgender daughter, has become a New York Fashion Week sensation",0,https://www.lemonde.fr/en/m-le-mag/article/2025/09/24/vivian-jenna-wilson-elon-musk-s-transgender-daughter-has-become-a-new-york-fashion-week-sensation_6745690_117.html,Subscribers only,  By Ève Minault ,https://img.lemde.fr/2025/09/16/0/52/1041/694/360/0/95/0/33e8ac5_ftp-import-images-1-mfot83e8fijg-2025-09-16t104420z-1844204919-rc2xsga2i4m9-rtrmadp-3-ukraine-crisis-nordstream.JPG 2x,
Historian Tal Bruttmann's sharp eye on the Holocaust,0,https://www.lemonde.fr/en/m-le-mag/article/2025/09/21/historian-tal-bruttmann-s-sharp-eye-on-the-holocaust_6745597_117.html,Subscribers only, By Valentine Faure ,https://img.lemde.fr/2025/09/16/0/52/1041/694/360/0/95/0/33e8ac5_ftp-import-images-1-mfot83e8fijg-2025-09-16t104420z-1844204919-rc2xsga2i4m9-rtrmadp-3-ukraine-crisis-nordstream.JPG 2x,
The silent and destructive spread of laughing gas: 'That shit took my whole life',0,https://www.lemonde.fr/en/m-le-mag/article/2025/09/20/the-silent-and-destructive-spread-of-laughing-gas-that-shit-took-my-whole-life_6745588_117.html,Subscribers only, By Yann Bouchez ,https://img.lemde.fr/2025/09/16/0/52/1041/694/360/0/95/0/33e8ac5_ftp-import-images-1-mfot83e8fijg-2025-09-16t104420z-1844204919-rc2xsga2i4m9-rtrmadp-3-ukraine-crisis-nordstream.JPG 2x,
"For the 250th anniversary of Jane Austen's birth, take a trip into the world of her superfans",0,https://www.lemonde.fr/en/m-le-mag/article/2025/09/20/on-the-250th-anniversary-of-jane-austen-s-birth-take-a-trip-into-the-world-of-the-english-novelist-s-superfans_6745580_117.html,Subscribers only," By Cécile Ducourtieux (London, correspondent) ",https://img.lemde.fr/2025/09/16/0/52/1041/694/360/0/95/0/33e8ac5_ftp-import-images-1-mfot83e8fijg-2025-09-16t104420z-1844204919-rc2xsga2i4m9-rtrmadp-3-ukraine-crisis-nordstream.JPG 2x,
Emma Reyes's still lifes relive in two Paris exhibitions,0,https://www.lemonde.fr/en/culture/article/2025/09/28/emma-reyes-still-lifes-finds-new-life-in-two-paris-exhibitions_6745877_30.html,Subscribers only,  By Emmanuelle Jardonnet ,https://img.lemde.fr/2025/09/16/0/52/1041/694/360/0/95/0/33e8ac5_ftp-import-images-1-mfot83e8fijg-2025-09-16t104420z-1844204919-rc2xsga2i4m9-rtrmadp-3-ukraine-crisis-nordstream.JPG 2x,
Tradition done right: Five Paris restaurants reimagining the classics,0,https://www.lemonde.fr/en/lifestyle/article/2025/09/08/tradition-done-right-five-paris-restaurants-reimagining-the-classics_6745133_37.html,Subscribers only, By Léo Pajon ,https://img.lemde.fr/2025/09/16/0/52/1041/694/360/0/95/0/33e8ac5_ftp-import-images-1-mfot83e8fijg-2025-09-16t104420z-1844204919-rc2xsga2i4m9-rtrmadp-3-ukraine-crisis-nordstream.JPG 2x,
Paris Design Week: A 15th edition marked by abundance,0,https://www.lemonde.fr/en/lifestyle/article/2025/09/05/paris-design-week-a-15th-edition-marked-by-abundance_6745060_37.html,Subscribers only,  By Véronique Lorelle ,https://img.lemde.fr/2025/09/16/0/52/1041/694/360/0/95/0/33e8ac5_ftp-import-images-1-mfot83e8fijg-2025-09-16t104420z-1844204919-rc2xsga2i4m9-rtrmadp-3-ukraine-crisis-nordstream.JPG 2x,
It's pain suisse time! Five places in and around Paris to find this treat,0,https://www.lemonde.fr/en/lifestyle/article/2025/09/04/it-s-pain-suisse-time-five-places-in-the-paris-region-to-find-this-treat_6745022_37.html,Subscribers only,  By Zazie Tavitian ,https://img.lemde.fr/2025/09/16/0/52/1041/694/360/0/95/0/33e8ac5_ftp-import-images-1-mfot83e8fijg-2025-09-16t104420z-1844204919-rc2xsga2i4m9-rtrmadp-3-ukraine-crisis-nordstream.JPG 2x,
Meloni's deficit reduction masks Italy's struggling economy,"While Rome boasts of ratings agencies upgrading its public debt, Italy's economy continues to suffer from sluggish growth, anemic productivity, persistent poverty and a continuing brain drain.",https://www.lemonde.fr/en/economy/article/2025/09/30/meloni-s-deficit-reduction-masks-italy-s-struggling-economy_6745957_19.html,Subscribers only,  By Allan Kaval (Rome (Italy) correspondent) ,https://img.lemde.fr/2025/09/16/0/52/1041/694/360/0/95/0/33e8ac5_ftp-import-images-1-mfot83e8fijg-2025-09-16t104420z-1844204919-rc2xsga2i4m9-rtrmadp-3-ukraine-crisis-nordstream.JPG 2x,
"Trump's 20-point plan for Gaza, explained and analyzed",0,https://www.lemonde.fr/en/international/article/2025/09/30/gaza-trump-s-20-point-plan-explained-and-analyzed_6745944_4.html,Subscribers only,  By Samuel Forey ,https://img.lemde.fr/2025/09/16/0/52/1041/694/360/0/95/0/33e8ac5_ftp-import-images-1-mfot83e8fijg-2025-09-16t104420z-1844204919-rc2xsga2i4m9-rtrmadp-3-ukraine-crisis-nordstream.JPG 2x,
"Trump's Gaza peace plan, a fragile compromise with few obligations for Israel",0,https://www.lemonde.fr/en/international/article/2025/09/30/trump-s-gaza-peace-plan-a-fragile-compromise-with-few-obligations-for-israel_6745927_4.html,Subscribers only,  By Piotr Smolar (Washington (United States) correspondent) ,https://img.lemde.fr/2025/09/16/0/52/1041/694/360/0/95/0/33e8ac5_ftp-import-images-1-mfot83e8fijg-2025-09-16t104420z-1844204919-rc2xsga2i4m9-rtrmadp-3-ukraine-crisis-nordstream.JPG 2x,
Former DRC president Kabila sentenced to death for 'treason' and 'war crimes',"A military court in Congo followed the prosecutor's request on Tuesday, sentencing Joseph Kabila, who is in exile, to death for 'treason' and 'war crimes.'",https://www.lemonde.fr/en/le-monde-africa/article/2025/09/30/former-drc-president-kabila-sentenced-to-death-for-treason-and-war-crimes_6745955_124.html,Subscribers only,  By Christophe Châtelot ,https://img.lemde.fr/2025/09/16/0/52/1041/694/360/0/95/0/33e8ac5_ftp-import-images-1-mfot83e8fijg-2025-09-16t104420z-1844204919-rc2xsga2i4m9-rtrmadp-3-ukraine-crisis-nordstream.JPG 2x,
NATO's new engagement rules mark a turning point in response to Russian incursions,"By opening the door on Tuesday, September 23, to shooting down Russian fighter jets that violate the Alliance's airspace, NATO allies have moved beyond supporting Ukraine with weapons and intelligence from behind the front lines.",https://www.lemonde.fr/en/opinion/article/2025/09/30/nato-s-new-engagement-rules-mark-a-turning-point-in-response-to-russian-incursions_6745924_23.html,Subscribers only,Chloé Hoorman,https://img.lemde.fr/2025/09/16/0/52/1041/694/360/0/95/0/33e8ac5_ftp-import-images-1-mfot83e8fijg-2025-09-16t104420z-1844204919-rc2xsga2i4m9-rtrmadp-3-ukraine-crisis-nordstream.JPG 2x,
Anesthesia's remarkable journey since the 19th century,"An exhibition at the Museum of the History of Medicine in Paris traces the saga of this discipline, from its beginnings to the major advances that transformed medical practice.",https://www.lemonde.fr/en/science/article/2025/09/30/anesthesia-s-remarkable-journey-since-the-19th-century_6745922_10.html,Subscribers only,  By Florence Rosier ,https://img.lemde.fr/2025/09/16/0/52/1041/694/360/0/95/0/33e8ac5_ftp-import-images-1-mfot83e8fijg-2025-09-16t104420z-1844204919-rc2xsga2i4m9-rtrmadp-3-ukraine-crisis-nordstream.JPG 2x,
From neo-Nazis to pedophilia: The online world of young men drawn to extreme violence,Two investigations launched in France shed light on a disturbing phenomenon originating in the United States: digital spaces where young boys engage in horribly deviant behavior.,https://www.lemonde.fr/en/france/article/2025/09/30/from-neo-nazis-to-pedophilia-the-online-world-of-young-men-drawn-to-extreme-violence_6745953_7.html,Subscribers only,  By Damien Leloup and Soren Seelow ,https://img.lemde.fr/2025/09/16/0/52/1041/694/360/0/95/0/33e8ac5_ftp-import-images-1-mfot83e8fijg-2025-09-16t104420z-1844204919-rc2xsga2i4m9-rtrmadp-3-ukraine-crisis-nordstream.JPG 2x,Investigation
South African ambassador found dead outside Paris hotel,0,https://www.lemonde.fr/en/france/article/2025/09/30/south-african-ambassador-found-dead-outside-paris-hotel_6745945_7.html,Not premium,Le Monde with AFP,https://img.lemde.fr/2025/09/16/0/52/1041/694/360/0/95/0/33e8ac5_ftp-import-images-1-mfot83e8fijg-2025-09-16t104420z-1844204919-rc2xsga2i4m9-rtrmadp-3-ukraine-crisis-nordstream.JPG 2x,
Paris struggles to curb car traffic without alienating road users,0,https://www.lemonde.fr/en/politics/article/2025/09/30/paris-struggles-to-curb-car-traffic-without-alienating-road-users_6745923_5.html,Subscribers only,  By Hélène Bekmezian ,https://img.lemde.fr/2025/09/16/0/52/1041/694/360/0/95/0/33e8ac5_ftp-import-images-1-mfot83e8fijg-2025-09-16t104420z-1844204919-rc2xsga2i4m9-rtrmadp-3-ukraine-crisis-nordstream.JPG 2x,
Trump and Pfizer announce agreement to lower the price of certain drugs,0,https://www.lemonde.fr/en/health/article/2025/09/30/trump-and-pfizer-announce-agreement-to-lower-the-price-of-certain-drugs_6745956_14.html,Not premium,Le Monde with AFP,https://img.lemde.fr/2025/09/16/0/52/1041/694/360/0/95/0/33e8ac5_ftp-import-images-1-mfot83e8fijg-2025-09-16t104420z-1844204919-rc2xsga2i4m9-rtrmadp-3-ukraine-crisis-nordstream.JPG 2x,
Taliban cut Afghanistan's internet and mobile networks in nationwide blackout,0,https://www.lemonde.fr/en/international/article/2025/09/30/taliban-cuts-afghanistan-s-internet-and-mobile-networks-in-nationwide-blackout_6745934_4.html,Not premium,Le Monde with AFP,https://img.lemde.fr/2025/09/16/0/52/1041/694/360/0/95/0/33e8ac5_ftp-import-images-1-mfot83e8fijg-2025-09-16t104420z-1844204919-rc2xsga2i4m9-rtrmadp-3-ukraine-crisis-nordstream.JPG 2x,
Poland arrests Ukrainian suspect in Nord Stream sabotage,0,https://www.lemonde.fr/en/international/article/2025/09/30/poland-arrests-ukrainian-suspect-in-nord-stream-sabotage_6745947_4.html,Not premium,Le Monde,https://img.lemde.fr/2025/09/16/0/52/1041/694/360/0/95/0/33e8ac5_ftp-import-images-1-mfot83e8fijg-2025-09-16t104420z-1844204919-rc2xsga2i4m9-rtrmadp-3-ukraine-crisis-nordstream.JPG 2x,
Asia's Gen Z rises up against entrenched political elites,0,https://www.lemonde.fr/en/international/article/2025/09/29/asia-s-gen-z-rises-up-against-entrenched-political-elites_6745909_4.html,Subscribers only,"  By Carole Dieterich (New Delhi, India, correspondence), Sophie Landrin (New Delhi, India, correspondent) and Brice Pedroletti (Bangkok, southeast Asia correspondent) ",https://img.lemde.fr/2025/09/16/0/52/1041/694/360/0/95/0/33e8ac5_ftp-import-images-1-mfot83e8fijg-2025-09-16t104420z-1844204919-rc2xsga2i4m9-rtrmadp-3-ukraine-crisis-nordstream.JPG 2x,
Ben Ali's daughter arrested in France at the request of Tunisian authorities,0,https://www.lemonde.fr/en/france/article/2025/09/30/ben-ali-s-daughter-arrested-in-france-at-the-request-of-tunisian-authorities_6745950_7.html,Not premium,Le Monde with AFP,https://img.lemde.fr/2025/09/16/0/52/1041/694/360/0/95/0/33e8ac5_ftp-import-images-1-mfot83e8fijg-2025-09-16t104420z-1844204919-rc2xsga2i4m9-rtrmadp-3-ukraine-crisis-nordstream.JPG 2x,
Moldova's fear of 'Russian threat' propelled Sandu's pro-European party to victory,0,https://www.lemonde.fr/en/international/article/2025/09/30/moldova-s-fear-of-the-russian-threat-propelled-sandu-s-pro-european-party-to-victory_6745933_4.html,Subscribers only,  By Marine Leduc ,https://img.lemde.fr/2025/09/16/0/52/1041/694/360/0/95/0/33e8ac5_ftp-import-images-1-mfot83e8fijg-2025-09-16t104420z-1844204919-rc2xsga2i4m9-rtrmadp-3-ukraine-crisis-nordstream.JPG 2x,
"JD Vance says US government 'headed to a shutdown,' blames Democrats",0,https://www.lemonde.fr/en/international/article/2025/09/30/jd-vance-says-us-government-headed-to-a-shutdown-blames-democrats_6745914_4.html,Not premium,Le Monde with AFP,https://img.lemde.fr/2025/09/16/0/52/1041/694/360/0/95/0/33e8ac5_ftp-import-images-1-mfot83e8fijg-2025-09-16t104420z-1844204919-rc2xsga2i4m9-rtrmadp-3-ukraine-crisis-nordstream.JPG 2x,
"In Greece, an abbot is arrested for trafficking religious artifacts",0,https://www.lemonde.fr/en/international/article/2025/09/30/in-greece-an-abbot-is-arrested-for-trafficking-religious-artifacts_6745918_4.html,Subscribers only,  By Marina Rafenberg (Athens (Greece) special correspondent) ,https://img.lemde.fr/2025/09/16/0/52/1041/694/360/0/95/0/33e8ac5_ftp-import-images-1-mfot83e8fijg-2025-09-16t104420z-1844204919-rc2xsga2i4m9-rtrmadp-3-ukraine-crisis-nordstream.JPG 2x,
Israeli researchers and universities face unprecedented wave of boycotts,0,https://www.lemonde.fr/en/international/article/2025/09/29/israeli-researchers-and-universities-face-an-unprecedented-wave-of-boycotts_6745905_4.html,Subscribers only,"  By Luc Bronner (Jerusalem, correspondent) ",https://img.lemde.fr/2025/09/16/0/52/1041/694/360/0/95/0/33e8ac5_ftp-import-images-1-mfot83e8fijg-2025-09-16t104420z-1844204919-rc2xsga2i4m9-rtrmadp-3-ukraine-crisis-nordstream.JPG 2x,
Paris mayoral candidate Rachida Dati will stand trial for corruption after election,0,https://www.lemonde.fr/en/france/article/2025/09/30/paris-mayoral-candidate-rachida-dati-will-stand-trial-for-corruption-after-election_6745942_7.html,Subscribers only,  By Hélène Bekmezian and Rémi Dupré ,https://img.lemde.fr/2025/09/16/0/52/1041/694/360/0/95/0/33e8ac5_ftp-import-images-1-mfot83e8fijg-2025-09-16t104420z-1844204919-rc2xsga2i4m9-rtrmadp-3-ukraine-crisis-nordstream.JPG 2x,
"Svalbard, the fastest-warming place on Earth","'Our planet at +1.5°C' (1/6). The Norwegian archipelago has warmed by 4°C over the past 30 years. Landslides and thawing permafrost threaten the population, whose way of life is highly greenhouse gas-intensive.",https://www.lemonde.fr/en/environment/article/2025/09/28/svalbard-the-fastest-warming-place-on-earth_6745872_114.html,Subscribers only, By Audrey Garric (Longyearbyen (Norway) special correspondent) and Adrienne Surprenant ,https://img.lemde.fr/2025/09/16/0/52/1041/694/360/0/95/0/33e8ac5_ftp-import-images-1-mfot83e8fijg-2025-09-16t104420z-1844204919-rc2xsga2i4m9-rtrmadp-3-ukraine-crisis-nordstream.JPG 2x,Feature
How can Europe withstand pressure from Russia and the US? Two experts debate,Tensions with Russia to the East and the United States to the West are testing Europe's model. Sylvain Kahn and Guillaume Lagane examine this shifting landscape and the possible responses.,https://www.lemonde.fr/en/books/article/2025/09/28/how-can-europe-withstand-pressure-from-russia-and-us-two-experts-debate_6745858_33.html,Subscribers only,  Interview by Florent Georgesco ,https://img.lemde.fr/2025/09/16/0/52/1041/694/360/0/95/0/33e8ac5_ftp-import-images-1-mfot83e8fijg-2025-09-16t104420z-1844204919-rc2xsga2i4m9-rtrmadp-3-ukraine-crisis-nordstream.JPG 2x,Interview
'Get up or I'll smash you': Protests in France were  marked by police brutality,Testimonies revealed the violence committed during the protests organized by the 'Block Everything' movement and a coalition of unions. Lawyers criticized 'extremely incomplete files' for the arrests conducted and denounce 'preventive police custody.',https://www.lemonde.fr/en/france/article/2025/09/29/get-up-or-i-ll-smash-you-french-police-violence-mars-september-10-and-18-protests_6745889_7.html,Subscribers only,  By Antoine Albertini and Arthur Carpentier ,https://img.lemde.fr/2025/09/16/0/52/1041/694/360/0/95/0/33e8ac5_ftp-import-images-1-mfot83e8fijg-2025-09-16t104420z-1844204919-rc2xsga2i4m9-rtrmadp-3-ukraine-crisis-nordstream.JPG 2x,In Depth
Sarkozy's attacks on judges and the Trumpification of French public debate,0,https://www.lemonde.fr/en/opinion/article/2025/09/30/sarkozy-s-attacks-on-judges-and-the-trumpification-of-french-public-debate_6745932_23.html,Not premium,Le Monde,https://img.lemde.fr/2025/09/16/0/52/1041/694/360/0/95/0/33e8ac5_ftp-import-images-1-mfot83e8fijg-2025-09-16t104420z-1844204919-rc2xsga2i4m9-rtrmadp-3-ukraine-crisis-nordstream.JPG 2x,Editorial
NATO's necessary response to drone incursions,0,https://www.lemonde.fr/en/opinion/article/2025/09/29/nato-s-necessary-response-to-drone-incursions_6745892_23.html,Not premium,Le Monde,https://img.lemde.fr/2025/09/16/0/52/1041/694/360/0/95/0/33e8ac5_ftp-import-images-1-mfot83e8fijg-2025-09-16t104420z-1844204919-rc2xsga2i4m9-rtrmadp-3-ukraine-crisis-nordstream.JPG 2x,Editorial
Samson of Gaza and Samson of Ukraine,0,https://www.lemonde.fr/en/international/article/2025/09/28/samson-of-gaza-and-samson-of-ukraine_6745860_4.html,Subscribe,Jean-Pierre Filiu,https://img.lemde.fr/2025/09/16/0/52/1041/694/360/0/95/0/33e8ac5_ftp-import-images-1-mfot83e8fijg-2025-09-16t104420z-1844204919-rc2xsga2i4m9-rtrmadp-3-ukraine-crisis-nordstream.JPG 2x,Column
