title,subhead,url,suscription,byline,img_url,article_type
'Nighttime prohibition': Warsaw city center bans alcohol sales at night,0,https://www.lemonde.fr/en/international/article/2025/12/03/nighttime-prohibition-warsaw-city-center-bans-alcohol-sales-at-night_6748094_4.html,Subscribers only,  By Hélène Bienvenu (Warsaw (Poland) correspondent) ,https://img.lemde.fr/2025/12/03/87/0/4660/3106/360/0/95/0/7d89132_upload-1-mysqthimo3ov-7d89132-upload-1-dwllatgzamur-000-dv1445925.jpg 2x,
Europe threatens to cut trade benefits for countries that refuse to cooperate on immigration,0,https://www.lemonde.fr/en/international/article/2025/12/03/europe-threatens-to-cut-trade-benefits-for-countries-that-refuse-to-cooperate-on-immigration_6748092_4.html,Subscribers only,"  By Philippe Jacqué (Brussels, Europe bureau) ",https://img.lemde.fr/2025/12/03/87/0/4660/3106/360/0/95/0/7d89132_upload-1-mysqthimo3ov-7d89132-upload-1-dwllatgzamur-000-dv1445925.jpg 2x,
"Federica Mogherini, former EU foreign policy chief, taken into police custody over suspected fraud",0,https://www.lemonde.fr/en/international/article/2025/12/02/federica-mogherini-former-eu-foreign-policy-chief-taken-into-police-custody-over-suspected-fraud_6748087_4.html,Subscribers only,"  By Philippe Jacqué (Brussels, Europe bureau) and Jean-Pierre Stroobants (Brussels, correspondent) ",https://img.lemde.fr/2025/12/03/87/0/4660/3106/360/0/95/0/7d89132_upload-1-mysqthimo3ov-7d89132-upload-1-dwllatgzamur-000-dv1445925.jpg 2x,
Zelensky urged to reform his leadership amid ongoing peace talks,0,https://www.lemonde.fr/en/international/article/2025/12/02/zelensky-urged-to-reform-his-leadership-amid-ongoing-peace-talks_6748086_4.html,Subscribers only," By Thomas d’Istria (Kyiv, correspondent) ",https://img.lemde.fr/2025/12/03/87/0/4660/3106/360/0/95/0/7d89132_upload-1-mysqthimo3ov-7d89132-upload-1-dwllatgzamur-000-dv1445925.jpg 2x,
Bosnia and Herzegovina's Serb entity elects ally of  former leader Dodik,0,https://www.lemonde.fr/en/international/article/2025/11/24/bosnia-and-herzegovina-s-serb-entity-elects-ally-of-former-leader-dodik_6747765_4.html,Subscribers only,  By Rémy Ourdan (Banja Luka (Bosnia and Herzegovina) special correspondent) ,https://img.lemde.fr/2025/12/03/87/0/4660/3106/360/0/95/0/7d89132_upload-1-mysqthimo3ov-7d89132-upload-1-dwllatgzamur-000-dv1445925.jpg 2x,
"In France's Somme, bagpipers keep the memory of the Great War alive",0,https://www.lemonde.fr/en/history/article/2025/11/11/in-france-s-somme-bagpipers-keep-the-memory-of-the-great-war-alive_6747347_157.html,Subscribers only," By Marie-Béatrice Baudet (Ovillers-la-Boisselle [Somme], special correspondent) ",https://img.lemde.fr/2025/12/03/87/0/4660/3106/360/0/95/0/7d89132_upload-1-mysqthimo3ov-7d89132-upload-1-dwllatgzamur-000-dv1445925.jpg 2x,
Latvia: Public mobilization grows in support of treaty for preventing violence against women,0,https://www.lemonde.fr/en/international/article/2025/11/06/in-latvia-public-mobilization-continues-to-grow-in-support-of-the-istanbul-convention-for-preventing-violence-against-women_6747156_4.html,Subscribers only,  By Anne-Françoise Hivert (Malmö (Sweden) correspondent) ,https://img.lemde.fr/2025/12/03/87/0/4660/3106/360/0/95/0/7d89132_upload-1-mysqthimo3ov-7d89132-upload-1-dwllatgzamur-000-dv1445925.jpg 2x,
"After Charlie Kirk's murder, Europe's far right swears allegiance to Trump's politics",0,https://www.lemonde.fr/en/les-decodeurs/article/2025/10/20/the-murder-of-charlie-kirk-how-europe-s-far-right-swore-allegiance-to-trump-s-politics_6746586_8.html,Subscribers only, By Allan Kaval (Rome (Italy) correspondent) and Manon Romain (with Clément Guillou and Le Monde correspondents in Europe) ,https://img.lemde.fr/2025/12/03/87/0/4660/3106/360/0/95/0/7d89132_upload-1-mysqthimo3ov-7d89132-upload-1-dwllatgzamur-000-dv1445925.jpg 2x,
Suspected member of Louvre heist gang joins others in detention,0,https://www.lemonde.fr/en/france/article/2025/12/02/suspected-member-of-louvre-heist-gang-joins-others-in-detention_6748088_7.html,Not premium,Le Monde with AFP,https://img.lemde.fr/2025/12/03/87/0/4660/3106/360/0/95/0/7d89132_upload-1-mysqthimo3ov-7d89132-upload-1-dwllatgzamur-000-dv1445925.jpg 2x,
Marseille grapples with drug trafficking: 'They are so many and they have so much money',0,https://www.lemonde.fr/en/france/article/2025/12/02/marseille-grapples-with-drug-trafficking-they-are-so-many-and-they-have-so-much-money_6748047_7.html,Subscribers only, By Grégoire Biseau (Marseille (France) special correspondent) and Gilles Rof (Marseille (France) correspondent) ,https://img.lemde.fr/2025/12/03/87/0/4660/3106/360/0/95/0/7d89132_upload-1-mysqthimo3ov-7d89132-upload-1-dwllatgzamur-000-dv1445925.jpg 2x,
Foreign interference: Why France is raising its voice and turning to the courts,0,https://www.lemonde.fr/en/france/article/2025/12/01/foreign-interference-why-france-is-raising-its-voice-and-turning-to-the-courts_6748034_7.html,Subscribers only,  By Jacques Follorou ,https://img.lemde.fr/2025/12/03/87/0/4660/3106/360/0/95/0/7d89132_upload-1-mysqthimo3ov-7d89132-upload-1-dwllatgzamur-000-dv1445925.jpg 2x,
French mayor convicted and set to be incarcerated in sex-tape blackmail case,0,https://www.lemonde.fr/en/france/article/2025/12/01/french-mayor-convicted-and-set-to-be-incarcerated-in-sex-tape-blackmail-case_6748032_7.html,Subscribers only,  By Richard Schittly (Lyon (France) correspondent) ,https://img.lemde.fr/2025/12/03/87/0/4660/3106/360/0/95/0/7d89132_upload-1-mysqthimo3ov-7d89132-upload-1-dwllatgzamur-000-dv1445925.jpg 2x,
"Israel's D9 bulldozer, a tool of destruction in Gaza",0,https://www.lemonde.fr/en/videos/video/2025/11/27/israel-s-d9-bulldozer-a-tool-of-destruction-in-gaza_6747870_108.html,Subscribers only,"  By Liselotte Mas, Elsa Longueville (motion design) and Sinead McCausland ",https://img.lemde.fr/2025/12/03/87/0/4660/3106/360/0/95/0/7d89132_upload-1-mysqthimo3ov-7d89132-upload-1-dwllatgzamur-000-dv1445925.jpg 2x,
"Ukraine's Pokrovsk faces fierce fighting, footage analyzed by Le Monde reveals",0,https://www.lemonde.fr/en/videos/video/2025/11/21/ukraine-s-pokrovsk-faces-fierce-fighting-footage-analyzed-by-le-monde-reveals_6747708_108.html,Subscribers only,"  By Alexandre Horn, Gabriel Lecointre (edit), Elisa Bellanger (motion design) and Sinead McCausland ",https://img.lemde.fr/2025/12/03/87/0/4660/3106/360/0/95/0/7d89132_upload-1-mysqthimo3ov-7d89132-upload-1-dwllatgzamur-000-dv1445925.jpg 2x,
Afghanistan: Relentless repression continues over four years into Taliban's rule,0,https://www.lemonde.fr/en/videos/video/2025/10/04/afghanistan-relentless-repression-continues-over-four-years-into-taliban-s-rule_6746092_108.html,Not premium,"  By Chloé Denis, Félix Pommier (Motion design) and Sinead McCausland ",https://img.lemde.fr/2025/12/03/87/0/4660/3106/360/0/95/0/7d89132_upload-1-mysqthimo3ov-7d89132-upload-1-dwllatgzamur-000-dv1445925.jpg 2x,
Watch: Hundreds of thousands march in France against budget cuts,0,https://www.lemonde.fr/en/videos/video/2025/09/19/french-strikes-watch-what-happened-as-hundreds-of-thousands-marched-against-budget-cuts_6745548_108.html,Not premium,  By Le Monde's video desk   ,https://img.lemde.fr/2025/12/03/87/0/4660/3106/360/0/95/0/7d89132_upload-1-mysqthimo3ov-7d89132-upload-1-dwllatgzamur-000-dv1445925.jpg 2x,
Donald Trump and the spread of impunity,0,https://www.lemonde.fr/en/opinion/article/2025/12/02/donald-trump-and-the-spread-of-impunity_6748066_23.html,Not premium,Le Monde,https://img.lemde.fr/2025/12/03/87/0/4660/3106/360/0/95/0/7d89132_upload-1-mysqthimo3ov-7d89132-upload-1-dwllatgzamur-000-dv1445925.jpg 2x,
The war in Sudan: A tragic symptom of US powerlessness,0,https://www.lemonde.fr/en/opinion/article/2025/12/03/the-war-in-sudan-a-tragic-symptom-of-us-powerlessness_6748090_23.html,Subscribers only,Noé Hochet-Bodin,https://img.lemde.fr/2025/12/03/87/0/4660/3106/360/0/95/0/7d89132_upload-1-mysqthimo3ov-7d89132-upload-1-dwllatgzamur-000-dv1445925.jpg 2x,
French PM Lecornu's budget strategy is put to the test of Parliament,0,https://www.lemonde.fr/en/opinion/article/2025/12/02/french-pm-lecornu-s-budget-strategy-is-put-to-the-test-of-parliament_6748072_23.html,Subscribers only,Solenn de Royer,https://img.lemde.fr/2025/12/03/87/0/4660/3106/360/0/95/0/7d89132_upload-1-mysqthimo3ov-7d89132-upload-1-dwllatgzamur-000-dv1445925.jpg 2x,
"'Through his first trip, Pope Leo XIV asserts a diplomatic style that gives him the stature of an arbiter'",0,https://www.lemonde.fr/en/opinion/article/2025/12/02/francois-mabille-political-scientist-through-his-first-trip-pope-leo-xiv-asserts-a-diplomatic-style-that-gives-him-the-stature-of-an-arbiter_6748051_23.html,Subscribers only,François Mabille,https://img.lemde.fr/2025/12/03/87/0/4660/3106/360/0/95/0/7d89132_upload-1-mysqthimo3ov-7d89132-upload-1-dwllatgzamur-000-dv1445925.jpg 2x,
The first time Le Monde wrote about Jeffrey Epstein,0,https://www.lemonde.fr/en/m-le-mag/article/2025/12/01/the-first-time-le-monde-wrote-about-jeffrey-epstein_6748001_117.html,Subscribers only,Gaspard Dhellemmes,https://img.lemde.fr/2025/12/03/87/0/4660/3106/360/0/95/0/7d89132_upload-1-mysqthimo3ov-7d89132-upload-1-dwllatgzamur-000-dv1445925.jpg 2x,
The last-minute fight to save Gaza's ancient archaeological treasures,0,https://www.lemonde.fr/en/m-le-mag/article/2025/11/30/the-last-minute-fight-to-save-gaza-s-ancient-archaeological-treasures_6747984_117.html,Subscribers only, By Samuel Forey ,https://img.lemde.fr/2025/12/03/87/0/4660/3106/360/0/95/0/7d89132_upload-1-mysqthimo3ov-7d89132-upload-1-dwllatgzamur-000-dv1445925.jpg 2x,
The art of being Oscar Wilde's grandson,0,https://www.lemonde.fr/en/m-le-mag/article/2025/11/30/the-art-of-being-oscar-wilde-s-grandson_6747977_117.html,Subscribers only,  By Clémentine Goldszal ,https://img.lemde.fr/2025/12/03/87/0/4660/3106/360/0/95/0/7d89132_upload-1-mysqthimo3ov-7d89132-upload-1-dwllatgzamur-000-dv1445925.jpg 2x,
"Gay Talese, the last titan of the American press",0,https://www.lemonde.fr/en/m-le-mag/article/2025/11/29/gay-talese-the-last-titan-of-the-american-press_6747954_117.html,Subscribers only, By Clémentine Goldszal ,https://img.lemde.fr/2025/12/03/87/0/4660/3106/360/0/95/0/7d89132_upload-1-mysqthimo3ov-7d89132-upload-1-dwllatgzamur-000-dv1445925.jpg 2x,
"Bayonne's 'Little Louvre,' the Bonnat-Helleu Museum, reopens after 14 years",0,https://www.lemonde.fr/en/culture/article/2025/11/28/bayonne-s-little-louvre-the-bonnat-helleu-museum-reopens-after-14-years_6747913_30.html,Subscribers only,  By Roxana Azimi (Bayonne (France) special correspondent) ,https://img.lemde.fr/2025/12/03/87/0/4660/3106/360/0/95/0/7d89132_upload-1-mysqthimo3ov-7d89132-upload-1-dwllatgzamur-000-dv1445925.jpg 2x,
Victor Hugo's interior architecture on display in Paris,0,https://www.lemonde.fr/en/lifestyle/article/2025/11/23/victor-hugo-s-interior-architecture-on-display-in-paris_6747753_37.html,Subscribers only,  By Véronique Lorelle ,https://img.lemde.fr/2025/12/03/87/0/4660/3106/360/0/95/0/7d89132_upload-1-mysqthimo3ov-7d89132-upload-1-dwllatgzamur-000-dv1445925.jpg 2x,
A stroll through Cachan: From a royal aqueduct to a panoramic garden,0,https://www.lemonde.fr/en/lifestyle/article/2025/11/22/a-stroll-through-cachan-from-a-royal-aqueduct-to-a-panoramic-garden_6747720_37.html,Subscribers only, By Delphine Le Feuvre ,https://img.lemde.fr/2025/12/03/87/0/4660/3106/360/0/95/0/7d89132_upload-1-mysqthimo3ov-7d89132-upload-1-dwllatgzamur-000-dv1445925.jpg 2x,
Azzedine Alaïa's Dior collection on view in Paris,0,https://www.lemonde.fr/en/lifestyle/article/2025/11/21/azzedine-alaia-s-dior-collection-on-view-in-paris_6747679_37.html,Subscribers only,  By Elvire von Bardeleben ,https://img.lemde.fr/2025/12/03/87/0/4660/3106/360/0/95/0/7d89132_upload-1-mysqthimo3ov-7d89132-upload-1-dwllatgzamur-000-dv1445925.jpg 2x,
The significant trade imbalance between France and China,"Even as Chinese competition increasingly undermines French industries, including in innovation, many French companies argue that maintaining a presence in China remains essential. President Emmanuel Macron is visiting the country from December 3 to 5.",https://www.lemonde.fr/en/economy/article/2025/12/03/the-significant-trade-imbalance-between-france-and-china_6748097_19.html,Subscribers only,"  By Harold Thibault (Shanghai (China) special correspondent) and Jordan Pouille (Beijing (China), correspondent) ",https://img.lemde.fr/2025/12/03/87/0/4660/3106/360/0/95/0/7d89132_upload-1-mysqthimo3ov-7d89132-upload-1-dwllatgzamur-000-dv1445925.jpg 2x,
Kremlin says Ukraine talks with US 'useful' but a 'lot of work' ahead,0,https://www.lemonde.fr/en/international/article/2025/12/02/if-europe-wants-war-with-russia-we-are-ready-putin_6748079_4.html,Not premium,Le Monde with AFP,https://img.lemde.fr/2025/12/03/87/0/4660/3106/360/0/95/0/7d89132_upload-1-mysqthimo3ov-7d89132-upload-1-dwllatgzamur-000-dv1445925.jpg 2x,
The war in Sudan: A tragic symptom of US powerlessness,0,https://www.lemonde.fr/en/opinion/article/2025/12/03/the-war-in-sudan-a-tragic-symptom-of-us-powerlessness_6748090_23.html,Subscribers only,Noé Hochet-Bodin,https://img.lemde.fr/2025/12/03/87/0/4660/3106/360/0/95/0/7d89132_upload-1-mysqthimo3ov-7d89132-upload-1-dwllatgzamur-000-dv1445925.jpg 2x,
'Nighttime prohibition': Warsaw city center bans alcohol sales at night,"Nearly 180 municipalities in Poland have already opted to ban the sale of alcohol at night. On November 1, two central districts in Warsaw followed suit. The measure, which was initially intended to apply across the entire capital, has sparked heated debate.",https://www.lemonde.fr/en/international/article/2025/12/03/nighttime-prohibition-warsaw-city-center-bans-alcohol-sales-at-night_6748094_4.html,Subscribers only,  By Hélène Bienvenu (Warsaw (Poland) correspondent) ,https://img.lemde.fr/2025/12/03/87/0/4660/3106/360/0/95/0/7d89132_upload-1-mysqthimo3ov-7d89132-upload-1-dwllatgzamur-000-dv1445925.jpg 2x,
Afghan man pleads not guilty to murder charges in US National Guard shooting,"Rahmanullah Lakanwal, 29, is charged with first-degree murder for the death of Sarah Beckstrom, 20, a National Guard member from West Virginia. Attorney General Pam Bondi has said she plans to seek the death penalty for Lakanwal, who allegedly drove cross-country to carry out the shooting near the White House on November 26.",https://www.lemonde.fr/en/global-issues/article/2025/12/02/afghan-man-pleads-not-guilty-in-us-national-guard-shooting_6748089_199.html,Not premium,Le Monde with AFP,https://img.lemde.fr/2025/12/03/87/0/4660/3106/360/0/95/0/7d89132_upload-1-mysqthimo3ov-7d89132-upload-1-dwllatgzamur-000-dv1445925.jpg 2x,
All the magnetic poetry of Takis on display at Galerie Xippas in Paris,"An exhibition showcases the diversity and coherence of the Greek artist's work, which includes aerial sculptures crafted from magnets.",https://www.lemonde.fr/en/culture/article/2025/12/03/all-the-magnetic-poetry-of-takis-on-display-at-galerie-xippas-in-paris_6748093_30.html,Subscribers only,  By Philippe Dagen ,https://img.lemde.fr/2025/12/03/87/0/4660/3106/360/0/95/0/7d89132_upload-1-mysqthimo3ov-7d89132-upload-1-dwllatgzamur-000-dv1445925.jpg 2x,
Vanessa Dougnac: 'The supremacy of Hinduism in India is unprecedented: a form of internal colonization',"The journalist covered India for 25 years before being forced to leave the country under pressure from the Modi government. She reflects on her experiences and a new beginning in her book, 'Jungles.'",https://www.lemonde.fr/en/books/article/2025/12/03/vanessa-dougnac-the-supremacy-of-hinduism-in-india-is-unprecedented-a-form-of-internal-colonization_6748095_33.html,Subscribers only,"  Interview by Sophie Landrin (New Delhi, India, correspondent) ",https://img.lemde.fr/2025/12/03/87/0/4660/3106/360/0/95/0/7d89132_upload-1-mysqthimo3ov-7d89132-upload-1-dwllatgzamur-000-dv1445925.jpg 2x,Interview
Trump administration dismisses eight immigration judges in New York City,0,https://www.lemonde.fr/en/global-issues/article/2025/12/03/trump-administration-dismisses-eight-immigration-judges-in-new-york-city_6748096_199.html,Not premium,Le Monde with AFP,https://img.lemde.fr/2025/12/03/87/0/4660/3106/360/0/95/0/7d89132_upload-1-mysqthimo3ov-7d89132-upload-1-dwllatgzamur-000-dv1445925.jpg 2x,
"Federica Mogherini, former EU foreign policy chief, taken into police custody over suspected fraud",0,https://www.lemonde.fr/en/international/article/2025/12/02/federica-mogherini-former-eu-foreign-policy-chief-taken-into-police-custody-over-suspected-fraud_6748087_4.html,Subscribers only,"  By Philippe Jacqué (Brussels, Europe bureau) and Jean-Pierre Stroobants (Brussels, correspondent) ",https://img.lemde.fr/2025/12/03/87/0/4660/3106/360/0/95/0/7d89132_upload-1-mysqthimo3ov-7d89132-upload-1-dwllatgzamur-000-dv1445925.jpg 2x,
Europe threatens to cut trade benefits for countries that refuse to cooperate on immigration,0,https://www.lemonde.fr/en/international/article/2025/12/03/europe-threatens-to-cut-trade-benefits-for-countries-that-refuse-to-cooperate-on-immigration_6748092_4.html,Subscribers only,"  By Philippe Jacqué (Brussels, Europe bureau) ",https://img.lemde.fr/2025/12/03/87/0/4660/3106/360/0/95/0/7d89132_upload-1-mysqthimo3ov-7d89132-upload-1-dwllatgzamur-000-dv1445925.jpg 2x,
Trump rants about 'the rotten country' of Somalia and its people: 'We don't want them',0,https://www.lemonde.fr/en/international/article/2025/12/03/we-don-t-want-them-trump-says-of-somali-immigrants_6748091_4.html,Not premium,Le Monde with AFP,https://img.lemde.fr/2025/12/03/87/0/4660/3106/360/0/95/0/7d89132_upload-1-mysqthimo3ov-7d89132-upload-1-dwllatgzamur-000-dv1445925.jpg 2x,
Suspected member of Louvre heist gang joins others in detention,0,https://www.lemonde.fr/en/france/article/2025/12/02/suspected-member-of-louvre-heist-gang-joins-others-in-detention_6748088_7.html,Not premium,Le Monde with AFP,https://img.lemde.fr/2025/12/03/87/0/4660/3106/360/0/95/0/7d89132_upload-1-mysqthimo3ov-7d89132-upload-1-dwllatgzamur-000-dv1445925.jpg 2x,
"Trump administration targets foreigners, beyond undocumented migrants",0,https://www.lemonde.fr/en/international/article/2025/12/02/trump-administration-targets-foreigners-beyond-undocumented-migrants_6748059_4.html,Subscribers only,  By Piotr Smolar (Washington (United States) correspondent) ,https://img.lemde.fr/2025/12/03/87/0/4660/3106/360/0/95/0/7d89132_upload-1-mysqthimo3ov-7d89132-upload-1-dwllatgzamur-000-dv1445925.jpg 2x,
Francis Ford Coppola auctions his watches after  'Megalopolis' disaster,0,https://www.lemonde.fr/en/culture/article/2025/12/02/francis-ford-coppola-auctions-his-watches-after-megalopolis-disaster_6748080_30.html,Subscribers only,  By Arnaud Leparmentier (San Francisco (United States) correspondent) ,https://img.lemde.fr/2025/12/03/87/0/4660/3106/360/0/95/0/7d89132_upload-1-mysqthimo3ov-7d89132-upload-1-dwllatgzamur-000-dv1445925.jpg 2x,
French PM Lecornu's budget strategy is put to the test of Parliament,0,https://www.lemonde.fr/en/opinion/article/2025/12/02/french-pm-lecornu-s-budget-strategy-is-put-to-the-test-of-parliament_6748072_23.html,Subscribers only,Solenn de Royer,https://img.lemde.fr/2025/12/03/87/0/4660/3106/360/0/95/0/7d89132_upload-1-mysqthimo3ov-7d89132-upload-1-dwllatgzamur-000-dv1445925.jpg 2x,
Macron travels to China with slim hopes of swaying Beijing on Ukraine and trade,0,https://www.lemonde.fr/en/international/article/2025/12/02/macron-travels-to-china-with-slim-hopes-of-swaying-beijing-on-ukraine-and-trade_6748081_4.html,Subscribers only,  By Philippe Ricard (Beijing (China) special correspondent) and Harold Thibault (Beijing (China) correspondent) ,https://img.lemde.fr/2025/12/03/87/0/4660/3106/360/0/95/0/7d89132_upload-1-mysqthimo3ov-7d89132-upload-1-dwllatgzamur-000-dv1445925.jpg 2x,
Rare Fabergé 'Winter Egg' sells for record-breaking $30.2 million,0,https://www.lemonde.fr/en/culture/article/2025/12/02/rare-faberge-winter-egg-sells-for-record-breaking-30-2-million_6748085_30.html,Not premium,Le Monde with AP,https://img.lemde.fr/2025/12/03/87/0/4660/3106/360/0/95/0/7d89132_upload-1-mysqthimo3ov-7d89132-upload-1-dwllatgzamur-000-dv1445925.jpg 2x,
Christophe Gleizes: The life on hold of a French journalist imprisoned in Algeria,0,https://www.lemonde.fr/en/le-monde-africa/article/2025/12/02/christophe-gleizes-the-life-on-hold-of-a-french-journalist-imprisoned-in-algeria_6748078_124.html,Subscribers only, By Brice Laemle and Simon Roger ,https://img.lemde.fr/2025/12/03/87/0/4660/3106/360/0/95/0/7d89132_upload-1-mysqthimo3ov-7d89132-upload-1-dwllatgzamur-000-dv1445925.jpg 2x,
Honduran ex-president pardoned by Trump is released from US prison,0,https://www.lemonde.fr/en/international/article/2025/12/02/honduran-ex-president-receives-surprise-pardon-by-trump-released-from-us-prison_6748073_4.html,Not premium,Le Monde with AFP,https://img.lemde.fr/2025/12/03/87/0/4660/3106/360/0/95/0/7d89132_upload-1-mysqthimo3ov-7d89132-upload-1-dwllatgzamur-000-dv1445925.jpg 2x,
Marseille grapples with drug trafficking: 'They are so many and they have so much money',"After the murder of Mehdi Kessaci, the brother of an activist against drug trafficking, Le Monde spoke with residents of housing projects, social workers, judges and police officers. They described a growing sense of powerlessness and danger.",https://www.lemonde.fr/en/france/article/2025/12/02/marseille-grapples-with-drug-trafficking-they-are-so-many-and-they-have-so-much-money_6748047_7.html,Subscribers only, By Grégoire Biseau (Marseille (France) special correspondent) and Gilles Rof (Marseille (France) correspondent) ,https://img.lemde.fr/2025/12/03/87/0/4660/3106/360/0/95/0/7d89132_upload-1-mysqthimo3ov-7d89132-upload-1-dwllatgzamur-000-dv1445925.jpg 2x,Long Read
When private anger turns into a social force,"In France, anger is everywhere: in the public sphere, in the media and at the ballot box. The majority of French people under the age of 35 say they have experienced it. From private feelings to collective outcries, they search for ways to channel this emotion.",https://www.lemonde.fr/en/politics/article/2025/12/01/when-private-anger-turns-into-a-social-force_6748003_5.html,Subscribers only,  By Adam Lebert ,https://img.lemde.fr/2025/12/03/87/0/4660/3106/360/0/95/0/7d89132_upload-1-mysqthimo3ov-7d89132-upload-1-dwllatgzamur-000-dv1445925.jpg 2x,Investigation
The art of being Oscar Wilde's grandson,"As Ireland prepares to mark the 125th anniversary of Oscar Wilde's death, Merlin Holland, his only living descendant, works in France to protect the memory of a man who was long viewed as scandalous.",https://www.lemonde.fr/en/m-le-mag/article/2025/11/30/the-art-of-being-oscar-wilde-s-grandson_6747977_117.html,Subscribers only,  By Clémentine Goldszal ,https://img.lemde.fr/2025/12/03/87/0/4660/3106/360/0/95/0/7d89132_upload-1-mysqthimo3ov-7d89132-upload-1-dwllatgzamur-000-dv1445925.jpg 2x,Conversation
Donald Trump and the spread of impunity,0,https://www.lemonde.fr/en/opinion/article/2025/12/02/donald-trump-and-the-spread-of-impunity_6748066_23.html,Not premium,Le Monde,https://img.lemde.fr/2025/12/03/87/0/4660/3106/360/0/95/0/7d89132_upload-1-mysqthimo3ov-7d89132-upload-1-dwllatgzamur-000-dv1445925.jpg 2x,Editorial
"'Through his first trip, Pope Leo XIV asserts a diplomatic style that gives him the stature of an arbiter'",0,https://www.lemonde.fr/en/opinion/article/2025/12/02/francois-mabille-political-scientist-through-his-first-trip-pope-leo-xiv-asserts-a-diplomatic-style-that-gives-him-the-stature-of-an-arbiter_6748051_23.html,Subscribe,François Mabille,https://img.lemde.fr/2025/12/03/87/0/4660/3106/360/0/95/0/7d89132_upload-1-mysqthimo3ov-7d89132-upload-1-dwllatgzamur-000-dv1445925.jpg 2x,Op-Ed
Trump's interference and contradictions across Latin America,0,https://www.lemonde.fr/en/opinion/article/2025/12/01/trump-s-interference-and-contradictions-across-latin-america_6748016_23.html,Not premium,Le Monde,https://img.lemde.fr/2025/12/03/87/0/4660/3106/360/0/95/0/7d89132_upload-1-mysqthimo3ov-7d89132-upload-1-dwllatgzamur-000-dv1445925.jpg 2x,Editorial
