title,subhead,url,suscription,byline,img_url,article_type
EU to loan €90 billion to Ukraine while delaying Mercosur deal,0,https://www.lemonde.fr/en/international/article/2025/12/19/eu-to-loan-90-billion-to-ukraine-amid-delay-to-mercosur-deal_6748666_4.html,Subscribers only,"  By Virginie Malingre (Brussels, Europe bureau) and Philippe Jacqué (Brussels, Europe bureau) ",https://img.lemde.fr/2025/12/18/0/0/5578/3719/360/0/95/0/7428658_upload-1-ftfmsb2kxc1x-874130.jpg 2x,
Trump dogged by cost of living crisis and Republican revolt,0,https://www.lemonde.fr/en/international/article/2025/12/19/trump-dogged-by-cost-of-living-crisis-and-republican-dissent_6748663_4.html,Subscribers only,  By Piotr Smolar (Washington (United States) correspondent) ,https://img.lemde.fr/2025/12/18/0/0/5578/3719/360/0/95/0/7428658_upload-1-ftfmsb2kxc1x-874130.jpg 2x,
"In Quebec, Islam is at the heart of new debates on secularism",0,https://www.lemonde.fr/en/international/article/2025/12/19/in-quebec-islam-is-at-the-heart-of-new-debates-on-secularism_6748654_4.html,Subscribers only,"  By Eliott Dumoulin (Montreal, Canada, correspondent) ",https://img.lemde.fr/2025/12/18/0/0/5578/3719/360/0/95/0/7428658_upload-1-ftfmsb2kxc1x-874130.jpg 2x,
Battle erupts over Honduras' presidential election ballot count,0,https://www.lemonde.fr/en/international/article/2025/12/19/in-honduras-battle-erupts-over-presidential-election-ballot-count_6748651_4.html,Subscribers only,  By Anne Vigna (Mexico City (Mexico) correspondent) ,https://img.lemde.fr/2025/12/18/0/0/5578/3719/360/0/95/0/7428658_upload-1-ftfmsb2kxc1x-874130.jpg 2x,
'Trump's ideological challenge to Europe is more dangerous than the security one',0,https://www.lemonde.fr/en/opinion/article/2025/12/11/trump-s-ideological-challenge-to-europe-is-more-dangerous-than-the-security-one_6748393_23.html,Subscribers only,Sylvie Kauffmann,https://img.lemde.fr/2025/12/18/0/0/5578/3719/360/0/95/0/7428658_upload-1-ftfmsb2kxc1x-874130.jpg 2x,
"Attacked by Trump, Europe wavers between denial and fear of reprisals",0,https://www.lemonde.fr/en/international/article/2025/12/11/attacked-by-trump-europe-wavers-between-denial-and-fear-of-reprisals_6748382_4.html,Subscribers only,"  By Philippe Jacqué (Brussels, Europe bureau) and Virginie Malingre (Brussels, Europe bureau) ",https://img.lemde.fr/2025/12/18/0/0/5578/3719/360/0/95/0/7428658_upload-1-ftfmsb2kxc1x-874130.jpg 2x,
Bosnia and Herzegovina's Serb entity elects ally of  former leader Dodik,0,https://www.lemonde.fr/en/international/article/2025/11/24/bosnia-and-herzegovina-s-serb-entity-elects-ally-of-former-leader-dodik_6747765_4.html,Subscribers only,  By Rémy Ourdan (Banja Luka (Bosnia and Herzegovina) special correspondent) ,https://img.lemde.fr/2025/12/18/0/0/5578/3719/360/0/95/0/7428658_upload-1-ftfmsb2kxc1x-874130.jpg 2x,
"In France's Somme, bagpipers keep the memory of the Great War alive",0,https://www.lemonde.fr/en/history/article/2025/11/11/in-france-s-somme-bagpipers-keep-the-memory-of-the-great-war-alive_6747347_157.html,Subscribers only," By Marie-Béatrice Baudet (Ovillers-la-Boisselle [Somme], special correspondent) ",https://img.lemde.fr/2025/12/18/0/0/5578/3719/360/0/95/0/7428658_upload-1-ftfmsb2kxc1x-874130.jpg 2x,
French police raid home of Culture Minister Rachida Dati in corruption probe,0,https://www.lemonde.fr/en/france/article/2025/12/18/french-police-raid-home-of-culture-minister-rachida-dati-in-corruption-probe_6748642_7.html,Not premium,Le Monde with AFP,https://img.lemde.fr/2025/12/18/0/0/5578/3719/360/0/95/0/7428658_upload-1-ftfmsb2kxc1x-874130.jpg 2x,
"French anesthetist sentenced to life in prison: 'We cannot bring back our loved ones, but at least there is a semblance of justice'",0,https://www.lemonde.fr/en/france/article/2025/12/19/french-anesthetist-sentenced-to-life-in-prison-we-cannot-bring-back-our-loved-ones-but-at-least-there-is-a-semblance-of-justice_6748670_7.html,Subscribers only,"  By Willy Graff (Besançon, correspondence) ",https://img.lemde.fr/2025/12/18/0/0/5578/3719/360/0/95/0/7428658_upload-1-ftfmsb2kxc1x-874130.jpg 2x,
"At the Rétrofutur Museum in Paris, looking to the past to better understand the future",0,https://www.lemonde.fr/en/france/article/2025/12/18/at-the-retrofutur-museum-in-paris-looking-to-the-past-to-better-understand-the-future_6748646_7.html,Subscribers only,  By David Larousserie ,https://img.lemde.fr/2025/12/18/0/0/5578/3719/360/0/95/0/7428658_upload-1-ftfmsb2kxc1x-874130.jpg 2x,
The Sarkozys' damning indictment in witness Takieddine's false retraction,0,https://www.lemonde.fr/en/france/article/2025/12/18/the-sarkozys-s-damning-indictment-in-witness-takieddine-s-false-retraction_6748631_7.html,Subscribers only,  By Rémi Dupré ,https://img.lemde.fr/2025/12/18/0/0/5578/3719/360/0/95/0/7428658_upload-1-ftfmsb2kxc1x-874130.jpg 2x,
The French studio behind a viral Christmas ad,0,https://www.lemonde.fr/en/videos/video/2025/12/12/the-french-studio-behind-a-viral-christmas-ad_6748436_108.html,Not premium,"  By Le Monde's video desk, Antoine Apelbaum   and Sinead McCausland (Le Monde in English) ",https://img.lemde.fr/2025/12/18/0/0/5578/3719/360/0/95/0/7428658_upload-1-ftfmsb2kxc1x-874130.jpg 2x,
"Israel's D9 bulldozer, a tool of destruction in Gaza",0,https://www.lemonde.fr/en/videos/video/2025/11/27/israel-s-d9-bulldozer-a-tool-of-destruction-in-gaza_6747870_108.html,Subscribers only,"  By Liselotte Mas, Elsa Longueville (motion design) and Sinead McCausland ",https://img.lemde.fr/2025/12/18/0/0/5578/3719/360/0/95/0/7428658_upload-1-ftfmsb2kxc1x-874130.jpg 2x,
"Ukraine's Pokrovsk faces fierce fighting, footage analyzed by Le Monde reveals",0,https://www.lemonde.fr/en/videos/video/2025/11/21/ukraine-s-pokrovsk-faces-fierce-fighting-footage-analyzed-by-le-monde-reveals_6747708_108.html,Subscribers only,"  By Alexandre Horn, Gabriel Lecointre (edit), Elisa Bellanger (motion design) and Sinead McCausland ",https://img.lemde.fr/2025/12/18/0/0/5578/3719/360/0/95/0/7428658_upload-1-ftfmsb2kxc1x-874130.jpg 2x,
Afghanistan: Relentless repression continues over four years into Taliban's rule,0,https://www.lemonde.fr/en/videos/video/2025/10/04/afghanistan-relentless-repression-continues-over-four-years-into-taliban-s-rule_6746092_108.html,Not premium,"  By Chloé Denis, Félix Pommier (Motion design) and Sinead McCausland ",https://img.lemde.fr/2025/12/18/0/0/5578/3719/360/0/95/0/7428658_upload-1-ftfmsb2kxc1x-874130.jpg 2x,
'The US doubts that a Europe it describes as decadent is worthy of being counted as an ally',0,https://www.lemonde.fr/en/opinion/article/2025/12/18/the-us-doubts-that-a-europe-it-describes-as-decadent-is-worthy-of-being-counted-as-an-ally_6748636_23.html,Subscribers only,Alain Frachon,https://img.lemde.fr/2025/12/18/0/0/5578/3719/360/0/95/0/7428658_upload-1-ftfmsb2kxc1x-874130.jpg 2x,
"Sydney attack: 'Relatively spared from terrorism, Australia is therefore less prepared for it'",0,https://www.lemonde.fr/en/opinion/article/2025/12/19/sydney-attack-relatively-spared-from-terrorism-australia-is-therefore-less-prepared-for-it_6748659_23.html,Subscribers only,Romain Fathi,https://img.lemde.fr/2025/12/18/0/0/5578/3719/360/0/95/0/7428658_upload-1-ftfmsb2kxc1x-874130.jpg 2x,
Russian assets: Europe faces up to its responsibilities,0,https://www.lemonde.fr/en/opinion/article/2025/12/18/russian-assets-europe-faces-up-to-its-responsibilities_6748627_23.html,Not premium,Le Monde,https://img.lemde.fr/2025/12/18/0/0/5578/3719/360/0/95/0/7428658_upload-1-ftfmsb2kxc1x-874130.jpg 2x,
"'Freed from the Western bogeyman, countries of the Global South would quickly be dominated by the Chinese superpower'",0,https://www.lemonde.fr/en/opinion/article/2025/12/17/freed-from-the-western-bogeyman-countries-of-the-global-south-would-quickly-be-dominated-by-the-chinese-superpower_6748607_23.html,Subscribers only,Gilles Paris,https://img.lemde.fr/2025/12/18/0/0/5578/3719/360/0/95/0/7428658_upload-1-ftfmsb2kxc1x-874130.jpg 2x,
"Pina Picierno, the Italian MEP threatened by Russia for backing Ukraine",0,https://www.lemonde.fr/en/m-le-mag/article/2025/12/19/pina-picierno-the-italian-mep-threatened-by-russia-for-backing-ukraine_6748658_117.html,Subscribers only,  By Olivier Faye ,https://img.lemde.fr/2025/12/18/0/0/5578/3719/360/0/95/0/7428658_upload-1-ftfmsb2kxc1x-874130.jpg 2x,
"Astoria, Zohran Mamdani's working-class New York",0,https://www.lemonde.fr/en/m-le-mag/article/2025/12/19/astoria-zohran-mamdani-s-working-class-new-york_6748657_117.html,Subscribers only, By Nicolas Chapuis (New York (United States) correspondent) ,https://img.lemde.fr/2025/12/18/0/0/5578/3719/360/0/95/0/7428658_upload-1-ftfmsb2kxc1x-874130.jpg 2x,
Trump's FBI purge: 'We are not trending toward an authoritarian force. We are at one',0,https://www.lemonde.fr/en/m-le-mag/article/2025/12/14/trump-s-fbi-purge-we-are-not-trending-toward-an-authoritarian-force-we-are-at-one_6748490_117.html,Subscribers only, By Olivier Faye ,https://img.lemde.fr/2025/12/18/0/0/5578/3719/360/0/95/0/7428658_upload-1-ftfmsb2kxc1x-874130.jpg 2x,
A meat-forward restaurant and an exclusive club for the rich: The Washington of Trump loyalists,0,https://www.lemonde.fr/en/m-le-mag/article/2025/12/14/a-meat-forward-restaurant-and-an-exclusive-club-for-the-rich-the-washington-of-trump-loyalists_6748486_117.html,Subscribers only,  By Clément Ghys and Eve Minault ,https://img.lemde.fr/2025/12/18/0/0/5578/3719/360/0/95/0/7428658_upload-1-ftfmsb2kxc1x-874130.jpg 2x,
Five creative craft workshops to enjoy doing in Paris with your child,0,https://www.lemonde.fr/en/intimacy/article/2025/12/13/in-paris-five-creative-craft-workshops-to-enjoy-doing-with-your-child_6748451_310.html,Subscribers only,  By Tiphaine Thuillier ,https://img.lemde.fr/2025/12/18/0/0/5578/3719/360/0/95/0/7428658_upload-1-ftfmsb2kxc1x-874130.jpg 2x,
Jewels of power go on display in Paris,0,https://www.lemonde.fr/en/culture/article/2025/12/11/the-power-gems-on-display-in-paris_6748374_30.html,Not premium,  By Valentin Pérez   ,https://img.lemde.fr/2025/12/18/0/0/5578/3719/360/0/95/0/7428658_upload-1-ftfmsb2kxc1x-874130.jpg 2x,
Five spots in Paris to enjoy a (great) plant-based sandwich,0,https://www.lemonde.fr/en/lifestyle/article/2025/12/04/in-paris-five-spots-to-enjoy-a-great-plant-based-sandwich_6748131_37.html,Subscribers only,  By Lucas Scaltritti ,https://img.lemde.fr/2025/12/18/0/0/5578/3719/360/0/95/0/7428658_upload-1-ftfmsb2kxc1x-874130.jpg 2x,
"Bayonne's 'Little Louvre,' the Bonnat-Helleu Museum, reopens after 14 years",0,https://www.lemonde.fr/en/culture/article/2025/11/28/bayonne-s-little-louvre-the-bonnat-helleu-museum-reopens-after-14-years_6747913_30.html,Subscribers only,  By Roxana Azimi (Bayonne (France) special correspondent) ,https://img.lemde.fr/2025/12/18/0/0/5578/3719/360/0/95/0/7428658_upload-1-ftfmsb2kxc1x-874130.jpg 2x,
EU to loan €90 billion to Ukraine while delaying Mercosur deal,"The aid allocated to Kyiv will take the form of a zero-interest loan, after the bloc failed to agree on using frozen Russian assets. Meanwhile, the free trade agreement with the South American Mercosur trade bloc was postponed to January, as Italy joined France in blocking it.",https://www.lemonde.fr/en/international/article/2025/12/19/eu-to-loan-90-billion-to-ukraine-amid-delay-to-mercosur-deal_6748666_4.html,Subscribers only,"  By Virginie Malingre (Brussels, Europe bureau) and Philippe Jacqué (Brussels, Europe bureau) ",https://img.lemde.fr/2025/12/18/0/0/5578/3719/360/0/95/0/7428658_upload-1-ftfmsb2kxc1x-874130.jpg 2x,
French lawmakers fail to agree on state budget bill,0,https://www.lemonde.fr/en/france/article/2025/12/19/french-lawmakers-fail-to-agree-on-a-state-budget-bill_6748664_7.html,Not premium,Le Monde with AFP,https://img.lemde.fr/2025/12/18/0/0/5578/3719/360/0/95/0/7428658_upload-1-ftfmsb2kxc1x-874130.jpg 2x,
Putin says Russian troops 'are advancing along the entire line of contact' in Ukraine,0,https://www.lemonde.fr/en/international/article/2025/12/19/vladimir-putin-says-russian-troops-are-advancing-in-an-annual-press-conference_6748668_4.html,Not premium,Le Monde with AFP,https://img.lemde.fr/2025/12/18/0/0/5578/3719/360/0/95/0/7428658_upload-1-ftfmsb2kxc1x-874130.jpg 2x,
"Louvre staff call off strike and museum to open 'as normal,' unions say","Union leaders on Friday said staff at the Paris museum had voted against another day of stoppages, but warned of future industrial action because of 'insufficient progress' in talks with management and the Culture Ministry.",https://www.lemonde.fr/en/france/article/2025/12/19/louvre-staff-call-off-strike-museum-to-open-as-normal-unions_6748665_7.html,Not premium,Le Monde with AP and AFP,https://img.lemde.fr/2025/12/18/0/0/5578/3719/360/0/95/0/7428658_upload-1-ftfmsb2kxc1x-874130.jpg 2x,
French public debt reaches a new high at 117.4% of GDP,"France's public debt has now reached €3.482 trillion, the national statistics bureau announced on December 19. It stands at 117.4% of GDP, a record level outside times of war or pandemic. With no sign of fiscal recovery, analysts have warned that a market crisis cannot be ruled out.",https://www.lemonde.fr/en/politics/article/2025/12/19/french-public-debt-reaches-a-new-high-at-117-4-of-gdp_6748671_5.html,Subscribers only,  By Denis Cosnard ,https://img.lemde.fr/2025/12/18/0/0/5578/3719/360/0/95/0/7428658_upload-1-ftfmsb2kxc1x-874130.jpg 2x,
"French anesthetist sentenced to life in prison: 'We cannot bring back our loved ones, but at least there is a semblance of justice'",A criminal court in eastern France found Frédéric Péchier guilty of 30 poisonings: 12 murders and 18 attempted murders. His sentence includes a 22-year period during which he is ineligible for parole and a permanent ban from practicing medicine. His lawyer announced he will appeal the verdict.,https://www.lemonde.fr/en/france/article/2025/12/19/french-anesthetist-sentenced-to-life-in-prison-we-cannot-bring-back-our-loved-ones-but-at-least-there-is-a-semblance-of-justice_6748670_7.html,Subscribers only,"  By Willy Graff (Besançon, correspondence) ",https://img.lemde.fr/2025/12/18/0/0/5578/3719/360/0/95/0/7428658_upload-1-ftfmsb2kxc1x-874130.jpg 2x,
Trump dogged by cost of living crisis and Republican revolt,"The US president tried to defuse Americans' dissatisfaction with the economy in a televised address on Wednesday. He continued to blame Joe Biden, but struggled to grasp the extent of the issue – provoking tensions within his own party.",https://www.lemonde.fr/en/international/article/2025/12/19/trump-dogged-by-cost-of-living-crisis-and-republican-dissent_6748663_4.html,Subscribers only,  By Piotr Smolar (Washington (United States) correspondent) ,https://img.lemde.fr/2025/12/18/0/0/5578/3719/360/0/95/0/7428658_upload-1-ftfmsb2kxc1x-874130.jpg 2x,In Depth
"Brown University shooting suspect, a 48-year-old Portuguese national, found dead",0,https://www.lemonde.fr/en/international/article/2025/12/19/brown-university-shooting-suspect-found-dead-says-police-chief_6748656_4.html,Not premium,Le Monde with AFP,https://img.lemde.fr/2025/12/18/0/0/5578/3719/360/0/95/0/7428658_upload-1-ftfmsb2kxc1x-874130.jpg 2x,
"Astoria, Zohran Mamdani's working-class New York",0,https://www.lemonde.fr/en/m-le-mag/article/2025/12/19/astoria-zohran-mamdani-s-working-class-new-york_6748657_117.html,Subscribers only, By Nicolas Chapuis (New York (United States) correspondent) ,https://img.lemde.fr/2025/12/18/0/0/5578/3719/360/0/95/0/7428658_upload-1-ftfmsb2kxc1x-874130.jpg 2x,
Trump administration suspends green card lottery after Brown University shooting,0,https://www.lemonde.fr/en/international/article/2025/12/19/trump-administration-suspends-the-us-green-card-lottery_6748661_4.html,Not premium,Le Monde with AFP,https://img.lemde.fr/2025/12/18/0/0/5578/3719/360/0/95/0/7428658_upload-1-ftfmsb2kxc1x-874130.jpg 2x,
"Pina Picierno, the Italian MEP threatened by Russia for backing Ukraine",0,https://www.lemonde.fr/en/m-le-mag/article/2025/12/19/pina-picierno-the-italian-mep-threatened-by-russia-for-backing-ukraine_6748658_117.html,Subscribers only,  By Olivier Faye ,https://img.lemde.fr/2025/12/18/0/0/5578/3719/360/0/95/0/7428658_upload-1-ftfmsb2kxc1x-874130.jpg 2x,
"'Weaving, embroidering, sublimating': Palais Galliera in Paris spotlights an array of craftsmanship",0,https://www.lemonde.fr/en/lifestyle/article/2025/12/19/weaving-embroidering-sublimating-palais-galliera-in-paris-spotlights-an-array-of-craftsmanship_6748655_37.html,Subscribers only,  By Elvire von Bardeleben ,https://img.lemde.fr/2025/12/18/0/0/5578/3719/360/0/95/0/7428658_upload-1-ftfmsb2kxc1x-874130.jpg 2x,
Australia announces  gun buyback scheme as hundreds swim to honor Bondi shooting victims,0,https://www.lemonde.fr/en/international/article/2025/12/19/hundreds-swim-paddle-off-bondi-beach-to-honor-shooting-victims_6748648_4.html,Not premium,Le Monde with AFP,https://img.lemde.fr/2025/12/18/0/0/5578/3719/360/0/95/0/7428658_upload-1-ftfmsb2kxc1x-874130.jpg 2x,
TikTok signs joint venture deal to avoid US ban threat,0,https://www.lemonde.fr/en/international/article/2025/12/19/tiktok-signs-joint-venture-deal-to-avoid-us-ban-threat_6748660_4.html,Not premium,Le Monde with AFP,https://img.lemde.fr/2025/12/18/0/0/5578/3719/360/0/95/0/7428658_upload-1-ftfmsb2kxc1x-874130.jpg 2x,
"In Quebec, Islam is at the heart of new debates on secularism",0,https://www.lemonde.fr/en/international/article/2025/12/19/in-quebec-islam-is-at-the-heart-of-new-debates-on-secularism_6748654_4.html,Subscribers only,"  By Eliott Dumoulin (Montreal, Canada, correspondent) ",https://img.lemde.fr/2025/12/18/0/0/5578/3719/360/0/95/0/7428658_upload-1-ftfmsb2kxc1x-874130.jpg 2x,
"Trump shifts NASA priority to Moon mission, not Mars",0,https://www.lemonde.fr/en/international/article/2025/12/19/trump-shifts-nasa-priority-to-moon-mission-not-mars_6748669_4.html,Not premium,Le Monde with AFP,https://img.lemde.fr/2025/12/18/0/0/5578/3719/360/0/95/0/7428658_upload-1-ftfmsb2kxc1x-874130.jpg 2x,
"At the Rétrofutur Museum in Paris, looking to the past to better understand the future",0,https://www.lemonde.fr/en/france/article/2025/12/18/at-the-retrofutur-museum-in-paris-looking-to-the-past-to-better-understand-the-future_6748646_7.html,Subscribers only,  By David Larousserie ,https://img.lemde.fr/2025/12/18/0/0/5578/3719/360/0/95/0/7428658_upload-1-ftfmsb2kxc1x-874130.jpg 2x,
Violence erupts in Bangladesh after wounded youth leader dies,0,https://www.lemonde.fr/en/international/article/2025/12/19/violence-erupts-in-bangladesh-after-wounded-youth-leader-dies_6748647_4.html,Not premium,Le Monde with AFP,https://img.lemde.fr/2025/12/18/0/0/5578/3719/360/0/95/0/7428658_upload-1-ftfmsb2kxc1x-874130.jpg 2x,
Benin's failed coup shines a light on the army's discontent,0,https://www.lemonde.fr/en/le-monde-africa/article/2025/12/18/benin-s-failed-coup-shines-a-light-on-the-army-s-discontent_6748644_124.html,Subscribers only,  By Benjamin Roger (Cotonou (Benin) special correspondent) ,https://img.lemde.fr/2025/12/18/0/0/5578/3719/360/0/95/0/7428658_upload-1-ftfmsb2kxc1x-874130.jpg 2x,
'It is easier to flatter the people than to serve. Therein lies the last obstacle to an RN victory in 2027',"Populism has never been stronger in France, but there is a crucial difference between flattering the people and serving them, and the Rassemblement National is currently stumbling on that divide, writes Le Monde columnist Françoise Fressoz.",https://www.lemonde.fr/en/opinion/article/2025/12/16/it-is-easier-to-flatter-the-people-than-to-serve-therein-lies-the-last-obstacle-to-an-rn-victory-in-2027_6748559_23.html,Subscribers only,Françoise Fressoz,https://img.lemde.fr/2025/12/18/0/0/5578/3719/360/0/95/0/7428658_upload-1-ftfmsb2kxc1x-874130.jpg 2x,Column
A French farmer's distress: 'I found the first dead cow when I went to the pasture',"Near Benque, a village an hour from Toulouse, farmer Christian Lasserre discovered three carcasses on Saturday. He fears a new outbreak of lumpy skin disease and the culling of the entire herd.",https://www.lemonde.fr/en/economy/article/2025/12/17/a-french-farmer-s-distress-i-found-the-first-dead-cow-when-i-went-to-the-pasture_6748577_19.html,Subscribers only," By Raphaëlle Bacqué (Benque (southwestern France), special correspondent) ",https://img.lemde.fr/2025/12/18/0/0/5578/3719/360/0/95/0/7428658_upload-1-ftfmsb2kxc1x-874130.jpg 2x,Feature
Minnesota's Somali community stands up to Trump: 'We are no less American than other Americans',"After the revelation of a Covid-19 relief fraud scheme involving nearly 80 individuals of Somali origin, the American president deployed immigration police within the large Somali community in Minnesota, whose members are predominantly US citizens.",https://www.lemonde.fr/en/international/article/2025/12/16/minnesota-s-somali-community-stands-up-to-trump-we-are-no-less-american-than-other-americans_6748564_4.html,Subscribers only," By Nicolas Chapuis (Minneapolis (Minnesota), special correspondent) ",https://img.lemde.fr/2025/12/18/0/0/5578/3719/360/0/95/0/7428658_upload-1-ftfmsb2kxc1x-874130.jpg 2x,Feature
"Sydney attack: 'Relatively spared from terrorism, Australia is therefore less prepared for it'",0,https://www.lemonde.fr/en/opinion/article/2025/12/19/sydney-attack-relatively-spared-from-terrorism-australia-is-therefore-less-prepared-for-it_6748659_23.html,Subscribe,Romain Fathi,https://img.lemde.fr/2025/12/18/0/0/5578/3719/360/0/95/0/7428658_upload-1-ftfmsb2kxc1x-874130.jpg 2x,Op-Ed
"Gabriel Zucman, economist: 'The idea of a sclerotic Europe facing an American El Dorado has little basis in fact'",0,https://www.lemonde.fr/en/opinion/article/2025/12/17/gabriel-zucman-economist-the-idea-of-a-sclerotic-europe-facing-a-american-el-dorado-has-little-basis-in-fact_6748589_23.html,Subscribe,Gabriel Zucman,https://img.lemde.fr/2025/12/18/0/0/5578/3719/360/0/95/0/7428658_upload-1-ftfmsb2kxc1x-874130.jpg 2x,Op-Ed
Russian assets: Europe faces up to its responsibilities,0,https://www.lemonde.fr/en/opinion/article/2025/12/18/russian-assets-europe-faces-up-to-its-responsibilities_6748627_23.html,Not premium,Le Monde,https://img.lemde.fr/2025/12/18/0/0/5578/3719/360/0/95/0/7428658_upload-1-ftfmsb2kxc1x-874130.jpg 2x,Editorial
