title,subhead,url,suscription,byline,img_url,article_type
Trump leverages tariffs to support Jair Bolsonaro,0,https://www.lemonde.fr/en/international/article/2025/07/10/trump-uses-tariffs-to-support-jair-bolsonaro_6743223_4.html,Subscribers only,  By Bruno Meyerfeld (Rio de Janeiro (Brazil) correspondent) ,https://img.lemde.fr/2025/06/29/0/0/4423/2948/360/0/95/0/1fe5336_ftp-import-images-1-tqeq4kkwbapa-2025-06-29t171734z-711017320-rc2hcfa51ssc-rtrmadp-3-brazil-protest-bolsonaro.JPG 2x,
The strategic hurdles for France-UK military cooperation,0,https://www.lemonde.fr/en/international/article/2025/07/10/the-strategic-hurdles-for-france-uk-military-cooperation_6743219_4.html,Subscribers only,"  By Elise Vincent and Cécile Ducourtieux (London, correspondent) ",https://img.lemde.fr/2025/06/29/0/0/4423/2948/360/0/95/0/1fe5336_ftp-import-images-1-tqeq4kkwbapa-2025-06-29t171734z-711017320-rc2hcfa51ssc-rtrmadp-3-brazil-protest-bolsonaro.JPG 2x,
European Commission dismisses interpreter over suspected espionage for Moscow,0,https://www.lemonde.fr/en/international/article/2025/07/10/european-commission-dismisses-interpreter-over-suspected-espionage-for-moscow_6743216_4.html,Subscribers only,  By Jacques Follorou ,https://img.lemde.fr/2025/06/29/0/0/4423/2948/360/0/95/0/1fe5336_ftp-import-images-1-tqeq4kkwbapa-2025-06-29t171734z-711017320-rc2hcfa51ssc-rtrmadp-3-brazil-protest-bolsonaro.JPG 2x,
"Kilmar Abrego Garcia's ordeals, an allegory of Trump's crackdown on undocumented immigrants",0,https://www.lemonde.fr/en/international/article/2025/07/10/the-tribulations-of-kilmar-abrego-garcia-an-allegory-of-the-trump-administration-s-crackdown-on-undocumented-immigrants_6743215_4.html,Subscribers only,  By Corine Lesnes (San Francisco (United States) correspondent) ,https://img.lemde.fr/2025/06/29/0/0/4423/2948/360/0/95/0/1fe5336_ftp-import-images-1-tqeq4kkwbapa-2025-06-29t171734z-711017320-rc2hcfa51ssc-rtrmadp-3-brazil-protest-bolsonaro.JPG 2x,
London hopes for a shift in French immigration policy in the Channel,0,https://www.lemonde.fr/en/international/article/2025/07/09/london-hopes-for-a-shift-in-french-immigration-policy-in-the-english-channel_6743178_4.html,Subscribers only,"  By Cécile Ducourtieux (London, correspondent) and Julia Pascual ",https://img.lemde.fr/2025/06/29/0/0/4423/2948/360/0/95/0/1fe5336_ftp-import-images-1-tqeq4kkwbapa-2025-06-29t171734z-711017320-rc2hcfa51ssc-rtrmadp-3-brazil-protest-bolsonaro.JPG 2x,
"France will lend Bayeux Tapestry to the UK, Macron announces",0,https://www.lemonde.fr/en/europe/article/2025/07/08/france-will-lend-bayeux-tapestry-to-the-uk-macron-announces_6743160_143.html,Subscribers only,  By Roxana Azimi   ,https://img.lemde.fr/2025/06/29/0/0/4423/2948/360/0/95/0/1fe5336_ftp-import-images-1-tqeq4kkwbapa-2025-06-29t171734z-711017320-rc2hcfa51ssc-rtrmadp-3-brazil-protest-bolsonaro.JPG 2x,
Europe in an untenable position after US bombings of Iran,0,https://www.lemonde.fr/en/europe/article/2025/06/23/europe-in-an-untenable-position-after-us-bombings-of-iran_6742626_143.html,Subscribers only,  By Philippe Ricard ,https://img.lemde.fr/2025/06/29/0/0/4423/2948/360/0/95/0/1fe5336_ftp-import-images-1-tqeq4kkwbapa-2025-06-29t171734z-711017320-rc2hcfa51ssc-rtrmadp-3-brazil-protest-bolsonaro.JPG 2x,
EU lawmakers seek to end statute of limitations for child sex abuse cases,0,https://www.lemonde.fr/en/europe/article/2025/06/17/eu-lawmakers-seek-to-end-statute-of-limitations-for-child-sex-abuse-cases_6742434_143.html,Not premium,Le Monde,https://img.lemde.fr/2025/06/29/0/0/4423/2948/360/0/95/0/1fe5336_ftp-import-images-1-tqeq4kkwbapa-2025-06-29t171734z-711017320-rc2hcfa51ssc-rtrmadp-3-brazil-protest-bolsonaro.JPG 2x,
French police raid far-right RN party's HQ over suspected illegal campaign financing,0,https://www.lemonde.fr/en/france/article/2025/07/09/french-police-raid-far-right-rn-party-s-hq-over-suspected-illegal-campaign-financing_6743193_7.html,Subscribers only,  By Laura Motet and Clément Guillou ,https://img.lemde.fr/2025/06/29/0/0/4423/2948/360/0/95/0/1fe5336_ftp-import-images-1-tqeq4kkwbapa-2025-06-29t171734z-711017320-rc2hcfa51ssc-rtrmadp-3-brazil-protest-bolsonaro.JPG 2x,
Poverty and inequality in France reach highest levels in 30 years,0,https://www.lemonde.fr/en/france/article/2025/07/09/poverty-and-inequality-in-france-reach-highest-levels-in-30-years_6743177_7.html,Subscribers only,  By Claire Ané ,https://img.lemde.fr/2025/06/29/0/0/4423/2948/360/0/95/0/1fe5336_ftp-import-images-1-tqeq4kkwbapa-2025-06-29t171734z-711017320-rc2hcfa51ssc-rtrmadp-3-brazil-protest-bolsonaro.JPG 2x,
Man sentenced to life without parole for 2019 jihadist attack in French prison,0,https://www.lemonde.fr/en/france/article/2025/07/08/man-sentenced-to-life-without-parole-for-2019-jihadist-attack-in-french-prison_6743146_7.html,Subscribers only,  By Soren Seelow ,https://img.lemde.fr/2025/06/29/0/0/4423/2948/360/0/95/0/1fe5336_ftp-import-images-1-tqeq4kkwbapa-2025-06-29t171734z-711017320-rc2hcfa51ssc-rtrmadp-3-brazil-protest-bolsonaro.JPG 2x,
France's Channel intervention strategy questioned after footage shows gendarmes stabbing migrant boat,0,https://www.lemonde.fr/en/france/article/2025/07/08/france-s-channel-intervention-strategy-questioned-after-footage-shows-gendarmes-stabbing-migrant-boat_6743137_7.html,Subscribers only,  By Julia Pascual ,https://img.lemde.fr/2025/06/29/0/0/4423/2948/360/0/95/0/1fe5336_ftp-import-images-1-tqeq4kkwbapa-2025-06-29t171734z-711017320-rc2hcfa51ssc-rtrmadp-3-brazil-protest-bolsonaro.JPG 2x,
What is France's 'Black code' and why hasn't it been repealed?,0,https://www.lemonde.fr/en/videos/video/2025/05/31/what-is-france-s-black-code-and-why-hasn-t-it-been-repealed_6741860_108.html,Not premium,"  By Chloé Denis, Olivier Escher (motion design) and Diana Liu ",https://img.lemde.fr/2025/06/29/0/0/4423/2948/360/0/95/0/1fe5336_ftp-import-images-1-tqeq4kkwbapa-2025-06-29t171734z-711017320-rc2hcfa51ssc-rtrmadp-3-brazil-protest-bolsonaro.JPG 2x,
How was the European Union created?,0,https://www.lemonde.fr/en/videos/video/2025/05/29/how-was-the-european-union-created_6741795_108.html,Not premium,"  By Alexis Tromas, Robin Gasser (motion design) and Diana Liu ",https://img.lemde.fr/2025/06/29/0/0/4423/2948/360/0/95/0/1fe5336_ftp-import-images-1-tqeq4kkwbapa-2025-06-29t171734z-711017320-rc2hcfa51ssc-rtrmadp-3-brazil-protest-bolsonaro.JPG 2x,
Glide bombs: Russia's secret to making cheap weapons,0,https://www.lemonde.fr/en/videos/video/2025/05/25/glide-bombs-russia-s-secret-to-making-cheap-weapons_6741646_108.html,Subscribers only,"  By Thomas Eydoux, Marceau Bretonnier and Sinead McCausland ",https://img.lemde.fr/2025/06/29/0/0/4423/2948/360/0/95/0/1fe5336_ftp-import-images-1-tqeq4kkwbapa-2025-06-29t171734z-711017320-rc2hcfa51ssc-rtrmadp-3-brazil-protest-bolsonaro.JPG 2x,
How does the conclave pick the new pope?,0,https://www.lemonde.fr/en/videos/video/2025/05/07/how-does-the-conclave-pick-the-new-pope_6741005_108.html,Not premium,"  By Alexis Tromas, Félix Pommier (Motion design) and Diana Liu ",https://img.lemde.fr/2025/06/29/0/0/4423/2948/360/0/95/0/1fe5336_ftp-import-images-1-tqeq4kkwbapa-2025-06-29t171734z-711017320-rc2hcfa51ssc-rtrmadp-3-brazil-protest-bolsonaro.JPG 2x,
"'Faced with Trump and an out-of-touch Democratic leadership, a left-wing surge is taking hold in the US'",0,https://www.lemonde.fr/en/opinion/article/2025/07/10/faced-with-trump-and-an-out-of-touch-democratic-leadership-a-left-wing-surge-takes-hold-in-the-united-states_6743214_23.html,Subscribers only,Mathieu Bonzom,https://img.lemde.fr/2025/06/29/0/0/4423/2948/360/0/95/0/1fe5336_ftp-import-images-1-tqeq4kkwbapa-2025-06-29t171734z-711017320-rc2hcfa51ssc-rtrmadp-3-brazil-protest-bolsonaro.JPG 2x,
The limits of Trump's tariff strategy,0,https://www.lemonde.fr/en/opinion/article/2025/07/10/the-limits-of-trump-s-tariff-strategy_6743227_23.html,Not premium,Le Monde,https://img.lemde.fr/2025/06/29/0/0/4423/2948/360/0/95/0/1fe5336_ftp-import-images-1-tqeq4kkwbapa-2025-06-29t171734z-711017320-rc2hcfa51ssc-rtrmadp-3-brazil-protest-bolsonaro.JPG 2x,
"'Trump treats his allies in Asia like those in Europe, with intimidation and blackmail'",0,https://www.lemonde.fr/en/opinion/article/2025/07/10/trump-treats-his-allies-in-asia-like-those-in-europe-with-intimidation-and-blackmail-the-result-is-the-same-trust-breaks-down_6743222_23.html,Subscribers only,Sylvie Kauffmann,https://img.lemde.fr/2025/06/29/0/0/4423/2948/360/0/95/0/1fe5336_ftp-import-images-1-tqeq4kkwbapa-2025-06-29t171734z-711017320-rc2hcfa51ssc-rtrmadp-3-brazil-protest-bolsonaro.JPG 2x,
"'On migration issues, we would like those in power to stick to the numbers, facts and science'",0,https://www.lemonde.fr/en/opinion/article/2025/07/10/najat-vallaud-belkacem-on-migration-issues-we-would-like-those-in-power-to-stick-to-the-numbers-facts-and-science_6743217_23.html,Subscribers only, Interview by Pascal Riché ,https://img.lemde.fr/2025/06/29/0/0/4423/2948/360/0/95/0/1fe5336_ftp-import-images-1-tqeq4kkwbapa-2025-06-29t171734z-711017320-rc2hcfa51ssc-rtrmadp-3-brazil-protest-bolsonaro.JPG 2x,
Spain's Costa Blanca bears the scars of a real estate frenzy,0,https://www.lemonde.fr/en/m-le-mag/article/2025/07/09/spain-s-costa-blanca-bears-the-scars-of-a-real-estate-frenzy_6743171_117.html,Subscribers only, By Sandrine Morel (Madrid (Spain) correspondent) ,https://img.lemde.fr/2025/06/29/0/0/4423/2948/360/0/95/0/1fe5336_ftp-import-images-1-tqeq4kkwbapa-2025-06-29t171734z-711017320-rc2hcfa51ssc-rtrmadp-3-brazil-protest-bolsonaro.JPG 2x,
In the jaws of the Jackal: How an informant orchestrated a policewoman's fall,0,https://www.lemonde.fr/en/m-le-mag/article/2025/07/06/in-the-jaws-of-the-jackal-how-an-informant-orchestrated-a-policewoman-s-fall_6743075_117.html,Subscribers only, By Raphaël Malkin ,https://img.lemde.fr/2025/06/29/0/0/4423/2948/360/0/95/0/1fe5336_ftp-import-images-1-tqeq4kkwbapa-2025-06-29t171734z-711017320-rc2hcfa51ssc-rtrmadp-3-brazil-protest-bolsonaro.JPG 2x,
"The arms dealer, the general's daughter and the speed demon: An inheritance battle",0,https://www.lemonde.fr/en/m-le-mag/article/2025/07/06/the-arms-dealer-the-general-s-daughter-and-the-speed-demon-an-inheritance-battle_6743074_117.html,Subscribers only, By François Krug ,https://img.lemde.fr/2025/06/29/0/0/4423/2948/360/0/95/0/1fe5336_ftp-import-images-1-tqeq4kkwbapa-2025-06-29t171734z-711017320-rc2hcfa51ssc-rtrmadp-3-brazil-protest-bolsonaro.JPG 2x,
"The opportune return of Reza Pahlavi, Iran's crown prince, following US airstrikes",0,https://www.lemonde.fr/en/m-le-mag/article/2025/07/05/the-opportune-return-of-reza-pahlavi-iran-s-crown-prince-following-us-airstrikes_6743051_117.html,Subscribers only,  By Louis Imbert ,https://img.lemde.fr/2025/06/29/0/0/4423/2948/360/0/95/0/1fe5336_ftp-import-images-1-tqeq4kkwbapa-2025-06-29t171734z-711017320-rc2hcfa51ssc-rtrmadp-3-brazil-protest-bolsonaro.JPG 2x,
Nice's Contemporary Art Biennale explores the city's unique relationship to the sea,0,https://www.lemonde.fr/en/culture/article/2025/07/06/nice-s-contemporary-art-biennale-explores-the-city-s-unique-relationship-to-the-sea_6743081_30.html,Subscribers only,  By Harry Bellet (Nice) ,https://img.lemde.fr/2025/06/29/0/0/4423/2948/360/0/95/0/1fe5336_ftp-import-images-1-tqeq4kkwbapa-2025-06-29t171734z-711017320-rc2hcfa51ssc-rtrmadp-3-brazil-protest-bolsonaro.JPG 2x,
"Dubuffet, Hokusai, Giacometti: 20 must-see exhibitions this summer, in Paris and beyond",0,https://www.lemonde.fr/en/culture/article/2025/06/28/20-must-see-exhibitions-this-summer-in-paris-and-beyond_6742801_30.html,Subscribers only,"  By Roxana Azimi, Harry Bellet, Philippe Dagen, Alexis Duval, Angèle Guicharnaud, Claire Guillot, Emmanuelle Jardonnet, Sylvie Kerviel and Emmanuelle Lequeux ",https://img.lemde.fr/2025/06/29/0/0/4423/2948/360/0/95/0/1fe5336_ftp-import-images-1-tqeq4kkwbapa-2025-06-29t171734z-711017320-rc2hcfa51ssc-rtrmadp-3-brazil-protest-bolsonaro.JPG 2x,
Five cultural outings to enjoy with a baby in Paris,0,https://www.lemonde.fr/en/intimacy/article/2025/06/27/five-cultural-outings-to-enjoy-in-paris-with-a-baby_6742762_310.html,Subscribers only,  By Tiphaine Thuillier ,https://img.lemde.fr/2025/06/29/0/0/4423/2948/360/0/95/0/1fe5336_ftp-import-images-1-tqeq4kkwbapa-2025-06-29t171734z-711017320-rc2hcfa51ssc-rtrmadp-3-brazil-protest-bolsonaro.JPG 2x,
New museum will honor Art Nouveau genius Hector Guimard in Paris,0,https://www.lemonde.fr/en/culture/article/2025/06/25/new-museum-will-honor-art-nouveau-genius-hector-guimard-in-paris_6742701_30.html,Subscribers only,  By Philippe d’Indevillers ,https://img.lemde.fr/2025/06/29/0/0/4423/2948/360/0/95/0/1fe5336_ftp-import-images-1-tqeq4kkwbapa-2025-06-29t171734z-711017320-rc2hcfa51ssc-rtrmadp-3-brazil-protest-bolsonaro.JPG 2x,
"'Trump treats his allies in Asia like those in Europe, with intimidation and blackmail'","Australian Prime Minister Anthony Albanese is pushing back against the Trump administration's dictates and plans to meet Xi Jinping in Beijing before heading to Washington, observes Le Monde columnist Sylvie Kauffmann.",https://www.lemonde.fr/en/opinion/article/2025/07/10/trump-treats-his-allies-in-asia-like-those-in-europe-with-intimidation-and-blackmail-the-result-is-the-same-trust-breaks-down_6743222_23.html,Subscribers only,Sylvie Kauffmann,https://img.lemde.fr/2025/06/29/0/0/4423/2948/360/0/95/0/1fe5336_ftp-import-images-1-tqeq4kkwbapa-2025-06-29t171734z-711017320-rc2hcfa51ssc-rtrmadp-3-brazil-protest-bolsonaro.JPG 2x,
The strategic hurdles for France-UK military cooperation,0,https://www.lemonde.fr/en/international/article/2025/07/10/the-strategic-hurdles-for-france-uk-military-cooperation_6743219_4.html,Subscribers only,"  By Elise Vincent and Cécile Ducourtieux (London, correspondent) ",https://img.lemde.fr/2025/06/29/0/0/4423/2948/360/0/95/0/1fe5336_ftp-import-images-1-tqeq4kkwbapa-2025-06-29t171734z-711017320-rc2hcfa51ssc-rtrmadp-3-brazil-protest-bolsonaro.JPG 2x,
"Moulin Rouge blades to spin again, one year after falling off",0,https://www.lemonde.fr/en/france/article/2025/07/10/moulin-rouge-blades-to-spin-again-one-year-after-falling-off_6743224_7.html,Not premium,Le Monde with AFP,https://img.lemde.fr/2025/06/29/0/0/4423/2948/360/0/95/0/1fe5336_ftp-import-images-1-tqeq4kkwbapa-2025-06-29t171734z-711017320-rc2hcfa51ssc-rtrmadp-3-brazil-protest-bolsonaro.JPG 2x,
European Commission dismisses interpreter over suspected espionage for Moscow,"A translator present during a high-level, closed-door meeting with Ukrainian President Volodymyr Zelensky in late 2024 was caught taking notes, something that is strictly prohibited in this type of meeting.",https://www.lemonde.fr/en/international/article/2025/07/10/european-commission-dismisses-interpreter-over-suspected-espionage-for-moscow_6743216_4.html,Subscribers only,  By Jacques Follorou ,https://img.lemde.fr/2025/06/29/0/0/4423/2948/360/0/95/0/1fe5336_ftp-import-images-1-tqeq4kkwbapa-2025-06-29t171734z-711017320-rc2hcfa51ssc-rtrmadp-3-brazil-protest-bolsonaro.JPG 2x,
"Fire near Narbonne, France, brought under control but 'will go down in history'","A wildfire sparked in southern France on Monday was brought under control in the evening on Wednesday, July 9. More than 1,050 professional and volunteer firefighters, taken by surprise by its speed and intensity, were mobilized to contain its spread.",https://www.lemonde.fr/en/environment/article/2025/07/10/fire-near-narbonne-france-brought-under-control-but-will-go-down-in-history_6743225_114.html,Subscribers only," By Maryline Baumard (Bages (southern France), special correspondent) ",https://img.lemde.fr/2025/06/29/0/0/4423/2948/360/0/95/0/1fe5336_ftp-import-images-1-tqeq4kkwbapa-2025-06-29t171734z-711017320-rc2hcfa51ssc-rtrmadp-3-brazil-protest-bolsonaro.JPG 2x,
Paris inaugurates bike lane named after cyclist killed by motorist,"The new 'Paul Varry' bike lane is the first in the capital to be given an official name and plaque, nine months after the young man's death.",https://www.lemonde.fr/en/politics/article/2025/07/10/paris-inaugurates-bike-lane-named-after-cyclist-killed-by-motorist_6743226_5.html,Subscribers only,  By Hélène Bekmezian ,https://img.lemde.fr/2025/06/29/0/0/4423/2948/360/0/95/0/1fe5336_ftp-import-images-1-tqeq4kkwbapa-2025-06-29t171734z-711017320-rc2hcfa51ssc-rtrmadp-3-brazil-protest-bolsonaro.JPG 2x,
"'Faced with Trump and an out-of-touch Democratic leadership, a left-wing surge is taking hold in the US'","On June 24, Zohran Mamdani, a member of the Democratic Party's left wing, won the party's nomination for mayor of New York City. While his path to victory will likely be difficult, academic Mathieu Bonzom argues that the rise of the American left is becoming increasingly credible.",https://www.lemonde.fr/en/opinion/article/2025/07/10/faced-with-trump-and-an-out-of-touch-democratic-leadership-a-left-wing-surge-takes-hold-in-the-united-states_6743214_23.html,Subscribers only,Mathieu Bonzom,https://img.lemde.fr/2025/06/29/0/0/4423/2948/360/0/95/0/1fe5336_ftp-import-images-1-tqeq4kkwbapa-2025-06-29t171734z-711017320-rc2hcfa51ssc-rtrmadp-3-brazil-protest-bolsonaro.JPG 2x,Op-Ed
Trump leverages tariffs to support Jair Bolsonaro,0,https://www.lemonde.fr/en/international/article/2025/07/10/trump-uses-tariffs-to-support-jair-bolsonaro_6743223_4.html,Subscribers only,  By Bruno Meyerfeld (Rio de Janeiro (Brazil) correspondent) ,https://img.lemde.fr/2025/06/29/0/0/4423/2948/360/0/95/0/1fe5336_ftp-import-images-1-tqeq4kkwbapa-2025-06-29t171734z-711017320-rc2hcfa51ssc-rtrmadp-3-brazil-protest-bolsonaro.JPG 2x,
"Nan Goldin confronts Arles photo festival audience about Gaza war: '75,000 Palestinians have been killed'",0,https://www.lemonde.fr/en/culture/article/2025/07/10/nan-goldin-confronts-arles-photo-festival-audience-about-gaza-war-75-000-palestinians-have-been-killed_6743221_30.html,Subscribers only,"  By Claire Guillot (Arles (France), special correspondent) ",https://img.lemde.fr/2025/06/29/0/0/4423/2948/360/0/95/0/1fe5336_ftp-import-images-1-tqeq4kkwbapa-2025-06-29t171734z-711017320-rc2hcfa51ssc-rtrmadp-3-brazil-protest-bolsonaro.JPG 2x,
Hamas agrees to partial hostage release in 'difficult' truce talks,0,https://www.lemonde.fr/en/international/article/2025/07/09/hamas-agrees-to-partial-hostage-release-in-difficult-truce-talks_6743209_4.html,Not premium,Le Monde with AFP,https://img.lemde.fr/2025/06/29/0/0/4423/2948/360/0/95/0/1fe5336_ftp-import-images-1-tqeq4kkwbapa-2025-06-29t171734z-711017320-rc2hcfa51ssc-rtrmadp-3-brazil-protest-bolsonaro.JPG 2x,
"'On migration issues, we would like those in power to stick to the numbers, facts and science'",0,https://www.lemonde.fr/en/opinion/article/2025/07/10/najat-vallaud-belkacem-on-migration-issues-we-would-like-those-in-power-to-stick-to-the-numbers-facts-and-science_6743217_23.html,Subscribers only, Interview by Pascal Riché ,https://img.lemde.fr/2025/06/29/0/0/4423/2948/360/0/95/0/1fe5336_ftp-import-images-1-tqeq4kkwbapa-2025-06-29t171734z-711017320-rc2hcfa51ssc-rtrmadp-3-brazil-protest-bolsonaro.JPG 2x,
PSG crushes Real Madrid 4-0 to reach Club World Cup Final against Chelsea,0,https://www.lemonde.fr/en/sports/article/2025/07/09/paris-saint-germain-crush-real-madrid-4-0-to-reach-club-world-cup-final-against-chelsea_6743210_9.html,Not premium,Le Monde with AFP,https://img.lemde.fr/2025/06/29/0/0/4423/2948/360/0/95/0/1fe5336_ftp-import-images-1-tqeq4kkwbapa-2025-06-29t171734z-711017320-rc2hcfa51ssc-rtrmadp-3-brazil-protest-bolsonaro.JPG 2x,
South Korean court orders new arrest of disgraced ex-president Yoon Suk Yeol,0,https://www.lemonde.fr/en/international/article/2025/07/10/south-korean-court-orders-new-arrest-of-disgraced-ex-president-yoon-suk-yeol_6743212_4.html,Not premium,Le Monde with AP and AFP,https://img.lemde.fr/2025/06/29/0/0/4423/2948/360/0/95/0/1fe5336_ftp-import-images-1-tqeq4kkwbapa-2025-06-29t171734z-711017320-rc2hcfa51ssc-rtrmadp-3-brazil-protest-bolsonaro.JPG 2x,
"In Bhutan, yaks are in danger in the land of happiness",0,https://www.lemonde.fr/en/environment/article/2025/07/09/in-bhutan-yaks-are-in-danger-in-the-land-of-happiness_6743206_114.html,Subscribers only," By Bruno Philip (Laya, Thimphu (Bhutan), special correspondent) ",https://img.lemde.fr/2025/06/29/0/0/4423/2948/360/0/95/0/1fe5336_ftp-import-images-1-tqeq4kkwbapa-2025-06-29t171734z-711017320-rc2hcfa51ssc-rtrmadp-3-brazil-protest-bolsonaro.JPG 2x,
"Kilmar Abrego Garcia's ordeals, an allegory of Trump's crackdown on undocumented immigrants",0,https://www.lemonde.fr/en/international/article/2025/07/10/the-tribulations-of-kilmar-abrego-garcia-an-allegory-of-the-trump-administration-s-crackdown-on-undocumented-immigrants_6743215_4.html,Subscribers only,  By Corine Lesnes (San Francisco (United States) correspondent) ,https://img.lemde.fr/2025/06/29/0/0/4423/2948/360/0/95/0/1fe5336_ftp-import-images-1-tqeq4kkwbapa-2025-06-29t171734z-711017320-rc2hcfa51ssc-rtrmadp-3-brazil-protest-bolsonaro.JPG 2x,
Trump announces 50% tariffs on copper,0,https://www.lemonde.fr/en/economy/article/2025/07/10/trump-says-50-levy-on-copper-to-take-effect-on-august-1_6743218_19.html,Not premium,Le Monde with AFP,https://img.lemde.fr/2025/06/29/0/0/4423/2948/360/0/95/0/1fe5336_ftp-import-images-1-tqeq4kkwbapa-2025-06-29t171734z-711017320-rc2hcfa51ssc-rtrmadp-3-brazil-protest-bolsonaro.JPG 2x,
"French lawyer who defended child abuser surgeon dies in apparent suicide, prosecutor says",0,https://www.lemonde.fr/en/france/article/2025/07/09/french-lawyer-who-defended-child-abuser-surgeon-le-scouarnec-dies-in-apparent-suicide_6743204_7.html,Not premium,Le Monde with AFP,https://img.lemde.fr/2025/06/29/0/0/4423/2948/360/0/95/0/1fe5336_ftp-import-images-1-tqeq4kkwbapa-2025-06-29t171734z-711017320-rc2hcfa51ssc-rtrmadp-3-brazil-protest-bolsonaro.JPG 2x,
Is the post-coital moment always a sad one?,0,https://www.lemonde.fr/en/intimacy/article/2025/07/10/is-the-postcoital-moment-always-a-sad-one_6743220_310.html,Subscribers only,Maïa Mazaurette,https://img.lemde.fr/2025/06/29/0/0/4423/2948/360/0/95/0/1fe5336_ftp-import-images-1-tqeq4kkwbapa-2025-06-29t171734z-711017320-rc2hcfa51ssc-rtrmadp-3-brazil-protest-bolsonaro.JPG 2x,
Hermès family edges out Bernard Arnault in new ranking of France's richest,0,https://www.lemonde.fr/en/economy/article/2025/07/09/hermes-family-edges-out-bernard-arnault-in-new-ranking-of-france-s-richest_6743205_19.html,Subscribers only,  By Juliette Garnier ,https://img.lemde.fr/2025/06/29/0/0/4423/2948/360/0/95/0/1fe5336_ftp-import-images-1-tqeq4kkwbapa-2025-06-29t171734z-711017320-rc2hcfa51ssc-rtrmadp-3-brazil-protest-bolsonaro.JPG 2x,
French police raid far-right RN party's HQ over suspected illegal campaign financing,"Investigators are focusing particularly on loans granted by wealthy party members to the Rassemblement National and its candidates, as part of a judicial inquiry opened over suspicions of illegal financing in the far-right party's recent campaigns.",https://www.lemonde.fr/en/france/article/2025/07/09/french-police-raid-far-right-rn-party-s-hq-over-suspected-illegal-campaign-financing_6743193_7.html,Subscribers only,  By Laura Motet and Clément Guillou ,https://img.lemde.fr/2025/06/29/0/0/4423/2948/360/0/95/0/1fe5336_ftp-import-images-1-tqeq4kkwbapa-2025-06-29t171734z-711017320-rc2hcfa51ssc-rtrmadp-3-brazil-protest-bolsonaro.JPG 2x,News
Channel crossings by migrants in small boats are on the rise,"Since the beginning of the year, more than 20,000 men, women and children have managed to reach the United Kingdom – 7,000 more than during the same period in 2024. At least 15 people have died while attempting the crossing.",https://www.lemonde.fr/en/france/article/2025/07/08/channel-crossings-by-migrants-in-small-boats-are-on-the-rise_6743133_7.html,Subscribers only," By Julia Pascual (Boulogne-sur-Mer, Dunkirk and Loon-Plage special correspondent) ",https://img.lemde.fr/2025/06/29/0/0/4423/2948/360/0/95/0/1fe5336_ftp-import-images-1-tqeq4kkwbapa-2025-06-29t171734z-711017320-rc2hcfa51ssc-rtrmadp-3-brazil-protest-bolsonaro.JPG 2x,Feature
Is southern France ready for a surge in wildfires?,"France is bracing for a risky summer. The national weather service has classified the Mediterranean arc at 'high' or 'very high' fire alert. While the country has learned lessons from major blazes in 2022, its firefighting aircraft fleet is aging.",https://www.lemonde.fr/en/environment/article/2025/07/09/is-southern-france-ready-for-a-surge-in-wildfires_6743203_114.html,Subscribers only,  By Maryline Baumard and Léa Sanchez ,https://img.lemde.fr/2025/06/29/0/0/4423/2948/360/0/95/0/1fe5336_ftp-import-images-1-tqeq4kkwbapa-2025-06-29t171734z-711017320-rc2hcfa51ssc-rtrmadp-3-brazil-protest-bolsonaro.JPG 2x,In Depth
The limits of Trump's tariff strategy,0,https://www.lemonde.fr/en/opinion/article/2025/07/10/the-limits-of-trump-s-tariff-strategy_6743227_23.html,Not premium,Le Monde,https://img.lemde.fr/2025/06/29/0/0/4423/2948/360/0/95/0/1fe5336_ftp-import-images-1-tqeq4kkwbapa-2025-06-29t171734z-711017320-rc2hcfa51ssc-rtrmadp-3-brazil-protest-bolsonaro.JPG 2x,Editorial
'Negotiating with Donald Trump is like playing chess with a pigeon',0,https://www.lemonde.fr/en/opinion/article/2025/07/08/negotiating-with-donald-trump-is-like-playing-chess-with-a-pigeon_6743135_23.html,Subscribe,Pascal Riché,https://img.lemde.fr/2025/06/29/0/0/4423/2948/360/0/95/0/1fe5336_ftp-import-images-1-tqeq4kkwbapa-2025-06-29t171734z-711017320-rc2hcfa51ssc-rtrmadp-3-brazil-protest-bolsonaro.JPG 2x,Column
Macron's disappointing record on poverty,0,https://www.lemonde.fr/en/opinion/article/2025/07/08/macron-s-disappointing-record-on-poverty_6743163_23.html,Not premium,Le Monde,https://img.lemde.fr/2025/06/29/0/0/4423/2948/360/0/95/0/1fe5336_ftp-import-images-1-tqeq4kkwbapa-2025-06-29t171734z-711017320-rc2hcfa51ssc-rtrmadp-3-brazil-protest-bolsonaro.JPG 2x,Editorial
