title,subhead,url,suscription,byline,img_url,article_type
Ukrainian soldiers' rotations on the front line are growing ever longer,0,https://www.lemonde.fr/en/international/article/2025/11/08/ukrainian-soldiers-s-rotations-on-the-front-line-are-growing-ever-longer_6747250_4.html,Subscribers only,  By Thomas d’Istria (Kharkiv and Donetsk regions (Ukraine) special correspondent) ,https://img.lemde.fr/2025/11/06/0/0/6000/4000/360/0/95/0/8cb65c8_upload-1-hylcduzucyy3-098426.jpg 2x,
"In the West Bank, children are the target of Israeli soldiers",0,https://www.lemonde.fr/en/international/article/2025/11/07/in-the-west-bank-children-are-the-target-of-israeli-soldiers_6747236_4.html,Subscribers only," By Lucas Minisini (Sebastia, Tulkarem, Al-Rihiya (West Bank) special correspondent) ",https://img.lemde.fr/2025/11/06/0/0/6000/4000/360/0/95/0/8cb65c8_upload-1-hylcduzucyy3-098426.jpg 2x,
EU considers Norwegian solution to guarantee Ukraine's 'reparations loan',0,https://www.lemonde.fr/en/international/article/2025/11/07/eu-considers-norwegian-solution-to-guarantee-ukraine-s-reparations-loan_6747232_4.html,Subscribers only,"  By Anne-Françoise Hivert (Malmö (Sweden) regional correspondent) and Virginie Malingre (Brussels, Europe bureau) ",https://img.lemde.fr/2025/11/06/0/0/6000/4000/360/0/95/0/8cb65c8_upload-1-hylcduzucyy3-098426.jpg 2x,
US submits draft resolution to UN Security Council for international force in Gaza,0,https://www.lemonde.fr/en/international/article/2025/11/07/us-submits-draft-resolution-to-un-security-council-for-international-force-in-gaza_6747224_4.html,Subscribers only,  By Philippe Ricard ,https://img.lemde.fr/2025/11/06/0/0/6000/4000/360/0/95/0/8cb65c8_upload-1-hylcduzucyy3-098426.jpg 2x,
Latvia: Public mobilization grows in support of treaty for preventing violence against women,0,https://www.lemonde.fr/en/international/article/2025/11/06/in-latvia-public-mobilization-continues-to-grow-in-support-of-the-istanbul-convention-for-preventing-violence-against-women_6747156_4.html,Subscribers only,  By Anne-Françoise Hivert (Malmö (Sweden) correspondent) ,https://img.lemde.fr/2025/11/06/0/0/6000/4000/360/0/95/0/8cb65c8_upload-1-hylcduzucyy3-098426.jpg 2x,
"After Charlie Kirk's murder, Europe's far right swears allegiance to Trump's politics",0,https://www.lemonde.fr/en/les-decodeurs/article/2025/10/20/the-murder-of-charlie-kirk-how-europe-s-far-right-swore-allegiance-to-trump-s-politics_6746586_8.html,Subscribers only, By Allan Kaval (Rome (Italy) correspondent) and Manon Romain (with Clément Guillou and Le Monde correspondents in Europe) ,https://img.lemde.fr/2025/11/06/0/0/6000/4000/360/0/95/0/8cb65c8_upload-1-hylcduzucyy3-098426.jpg 2x,
Sanctions against Russia spark rift between US and Europe over China,0,https://www.lemonde.fr/en/international/article/2025/09/15/sanctions-against-russia-spark-rift-between-us-and-europe-over-china_6745411_4.html,Subscribers only,"  By Philippe Jacqué (Brussels, Europe bureau), Philippe Ricard and Harold Thibault (Beijing (China) correspondent) ",https://img.lemde.fr/2025/11/06/0/0/6000/4000/360/0/95/0/8cb65c8_upload-1-hylcduzucyy3-098426.jpg 2x,
France's political instability puts Franco-German alliance to the test,0,https://www.lemonde.fr/en/opinion/article/2025/08/30/france-s-political-instability-puts-franco-german-alliance-to-the-test_6744873_23.html,Not premium,Le Monde,https://img.lemde.fr/2025/11/06/0/0/6000/4000/360/0/95/0/8cb65c8_upload-1-hylcduzucyy3-098426.jpg 2x,
France rights chief says police officers who beat a Black man used 'racist' slurs,0,https://www.lemonde.fr/en/france/article/2025/11/07/france-rights-chief-says-police-officers-who-beat-a-black-man-used-racist-slurs_6747222_7.html,Not premium,Le Monde with AFP,https://img.lemde.fr/2025/11/06/0/0/6000/4000/360/0/95/0/8cb65c8_upload-1-hylcduzucyy3-098426.jpg 2x,
"Mission Congress, an ambitious Catholic gathering with a wide range of sometimes controversial guests",0,https://www.lemonde.fr/en/france/article/2025/11/08/mission-congress-an-ambitious-catholic-gathering-with-a-wide-range-of-sometimes-controversial-guests_6747245_7.html,Subscribers only,  By Sarah Belouezzane ,https://img.lemde.fr/2025/11/06/0/0/6000/4000/360/0/95/0/8cb65c8_upload-1-hylcduzucyy3-098426.jpg 2x,
French-Palestinian activist files complaint for 'deportation' after his expulsion from Israel in 2022,0,https://www.lemonde.fr/en/france/article/2025/11/07/french-palestinian-activist-files-complaint-for-deportation-after-his-expulsion-from-israel-in-2022_6747235_7.html,Subscribers only,  By Christophe Ayad ,https://img.lemde.fr/2025/11/06/0/0/6000/4000/360/0/95/0/8cb65c8_upload-1-hylcduzucyy3-098426.jpg 2x,
French minister says officers were 'not in line with regulations' after footage of 2023 protest revealed,0,https://www.lemonde.fr/en/france/article/2025/11/06/french-minister-says-officers-were-not-in-line-with-regulations-after-footage-of-2023-protest-revealed_6747189_7.html,Subscribers only,  By Arthur Carpentier ,https://img.lemde.fr/2025/11/06/0/0/6000/4000/360/0/95/0/8cb65c8_upload-1-hylcduzucyy3-098426.jpg 2x,
Afghanistan: Relentless repression continues over four years into Taliban's rule,0,https://www.lemonde.fr/en/videos/video/2025/10/04/afghanistan-relentless-repression-continues-over-four-years-into-taliban-s-rule_6746092_108.html,Not premium,"  By Chloé Denis, Félix Pommier (Motion design) and Sinead McCausland ",https://img.lemde.fr/2025/11/06/0/0/6000/4000/360/0/95/0/8cb65c8_upload-1-hylcduzucyy3-098426.jpg 2x,
Watch: Hundreds of thousands march in France against budget cuts,0,https://www.lemonde.fr/en/videos/video/2025/09/19/french-strikes-watch-what-happened-as-hundreds-of-thousands-marched-against-budget-cuts_6745548_108.html,Not premium,  By Le Monde's video desk   ,https://img.lemde.fr/2025/11/06/0/0/6000/4000/360/0/95/0/8cb65c8_upload-1-hylcduzucyy3-098426.jpg 2x,
Emmys 2025: 'Adolescence' star Owen Cooper becomes youngest winner for best supporting actor,0,https://www.lemonde.fr/en/videos/video/2025/09/15/emmys-2025-adolescence-star-owen-cooper-becomes-youngest-winner-for-best-supporting-actor_6745427_108.html,Not premium,  By Le Monde's video desk   ,https://img.lemde.fr/2025/11/06/0/0/6000/4000/360/0/95/0/8cb65c8_upload-1-hylcduzucyy3-098426.jpg 2x,
"From 'influence peddling' to 'corruption,' what is French Culture Minister Rachida Dati accused of?",0,https://www.lemonde.fr/en/videos/video/2025/09/06/from-influence-peddling-to-corruption-what-is-french-culture-minister-rachida-dati-accused-of_6745094_108.html,Not premium,"  By Alexis Tromas, Arthur Navet  and Sinead McCausland ",https://img.lemde.fr/2025/11/06/0/0/6000/4000/360/0/95/0/8cb65c8_upload-1-hylcduzucyy3-098426.jpg 2x,
"'With Grokipedia, AI will be trained using the world as Elon Musk describes, perceives and desires it'",0,https://www.lemonde.fr/en/opinion/article/2025/11/08/with-grokipedia-ai-will-be-trained-using-the-world-as-elon-musk-describes-perceives-and-desires-it_6747249_23.html,Subscribers only,Julien Malaurent,https://img.lemde.fr/2025/11/06/0/0/6000/4000/360/0/95/0/8cb65c8_upload-1-hylcduzucyy3-098426.jpg 2x,
Serbia's student protest movement is caught in a nationalist trap,0,https://www.lemonde.fr/en/opinion/article/2025/11/08/serbia-s-student-protest-movement-is-caught-in-a-nationalist-trap_6747251_23.html,Subscribers only,Jean-Baptiste Chastand,https://img.lemde.fr/2025/11/06/0/0/6000/4000/360/0/95/0/8cb65c8_upload-1-hylcduzucyy3-098426.jpg 2x,
"Ofer Bronchtein and Daniel Cohn-Bendit: '30 years after the death of Yitzhak Rabin, paying tribute is not enough: We must return to his priorities'",0,https://www.lemonde.fr/en/opinion/article/2025/11/08/ofer-bronchtein-and-daniel-cohn-bendit-30-years-after-the-death-of-yitzhak-rabin-paying-tribute-is-not-enough-we-must-return-to-his-priorities_6747243_23.html,Subscribers only,Ofer Bronchtein,https://img.lemde.fr/2025/11/06/0/0/6000/4000/360/0/95/0/8cb65c8_upload-1-hylcduzucyy3-098426.jpg 2x,
United Kingdom struggles to acknowledge the far right's rise,0,https://www.lemonde.fr/en/opinion/article/2025/11/07/united-kingdom-struggles-to-acknowledge-the-far-right-s-rise_6747227_23.html,Subscribers only,Cécile Ducourtieux,https://img.lemde.fr/2025/11/06/0/0/6000/4000/360/0/95/0/8cb65c8_upload-1-hylcduzucyy3-098426.jpg 2x,
"What one trillion dollars means, according to Le Monde",0,https://www.lemonde.fr/en/m-le-mag/article/2025/11/08/what-one-trillion-dollars-means-according-to-le-monde_6747247_117.html,Subscribers only,Benoît Hopquin,https://img.lemde.fr/2025/11/06/0/0/6000/4000/360/0/95/0/8cb65c8_upload-1-hylcduzucyy3-098426.jpg 2x,
Marlene Dumas becomes first contemporary woman artist in Louvre's permanent collection,0,https://www.lemonde.fr/en/m-le-mag/article/2025/11/07/marlene-dumas-becomes-first-contemporary-woman-to-join-the-louvre-s-permanent-collection_6747215_117.html,Subscribers only, By Clément Ghys ,https://img.lemde.fr/2025/11/06/0/0/6000/4000/360/0/95/0/8cb65c8_upload-1-hylcduzucyy3-098426.jpg 2x,
Finland's former prime minister Sanna Marin has a new memoir,0,https://www.lemonde.fr/en/m-le-mag/article/2025/11/05/finland-s-former-prime-minister-sanna-marin-has-a-new-memoir_6747117_117.html,Subscribers only,  By Anne-Françoise Hivert (Malmö (Sweden) correspondent) ,https://img.lemde.fr/2025/11/06/0/0/6000/4000/360/0/95/0/8cb65c8_upload-1-hylcduzucyy3-098426.jpg 2x,
"Rosalía returns with mystical album: 'God has given me so much, the least I could do is make an album for him'",0,https://www.lemonde.fr/en/m-le-mag/article/2025/11/03/rosal-a-returns-with-mystical-album-god-has-given-me-so-much-the-least-i-could-do-is-make-an-album-for-him_6747063_117.html,Subscribers only, By Aureliano Tonet ,https://img.lemde.fr/2025/11/06/0/0/6000/4000/360/0/95/0/8cb65c8_upload-1-hylcduzucyy3-098426.jpg 2x,
"Three historical walks in Paris, in the footsteps of the French Revolution",0,https://www.lemonde.fr/en/intimacy/article/2025/11/07/three-historical-walks-in-paris-in-the-footsteps-of-the-french-revolution_6747207_310.html,Subscribers only,  By Yoanna Sultan-R'bibo ,https://img.lemde.fr/2025/11/06/0/0/6000/4000/360/0/95/0/8cb65c8_upload-1-hylcduzucyy3-098426.jpg 2x,
The Orient Express pulls up in Paris: An opulent journey into the 1920s,0,https://www.lemonde.fr/en/lifestyle/article/2025/11/02/the-orient-express-pulls-up-in-paris-an-opulent-journey-into-the-1920s_6747014_37.html,Subscribers only, By Valentin Pérez ,https://img.lemde.fr/2025/11/06/0/0/6000/4000/360/0/95/0/8cb65c8_upload-1-hylcduzucyy3-098426.jpg 2x,
Twelve artistic happenings to catch outside Art Basel Paris,0,https://www.lemonde.fr/en/culture/article/2025/10/24/twelve-artistic-happenings-to-catch-outside-art-basel-paris_6746743_30.html,Subscribers only,"  By Roxana Azimi, Philippe Dagen, Claire Guillot, Emmanuelle Jardonnet, Sylvie Kerviel and Emmanuelle Lequeux ",https://img.lemde.fr/2025/11/06/0/0/6000/4000/360/0/95/0/8cb65c8_upload-1-hylcduzucyy3-098426.jpg 2x,
A new Israeli-Palestinian restaurant promotes peace through food in Paris,0,https://www.lemonde.fr/en/m-le-mag/article/2025/10/22/a-new-israeli-palestinian-restaurant-promotes-peace-through-food-in-paris_6746662_117.html,Subscribers only,  By Gaspard Dhellemmes ,https://img.lemde.fr/2025/11/06/0/0/6000/4000/360/0/95/0/8cb65c8_upload-1-hylcduzucyy3-098426.jpg 2x,
Ukrainian soldiers' rotations on the front line are growing ever longer,"The Cross of Military Merit, awarded by President Zelensky to two soldiers who held their position for 165 days, highlights the rising difficulty of rotating infantrymen under constant threat from Russian drones.",https://www.lemonde.fr/en/international/article/2025/11/08/ukrainian-soldiers-s-rotations-on-the-front-line-are-growing-ever-longer_6747250_4.html,Subscribers only,  By Thomas d’Istria (Kharkiv and Donetsk regions (Ukraine) special correspondent) ,https://img.lemde.fr/2025/11/06/0/0/6000/4000/360/0/95/0/8cb65c8_upload-1-hylcduzucyy3-098426.jpg 2x,
Russian strikes trigger power cuts in several Ukrainian regions,0,https://www.lemonde.fr/en/international/article/2025/11/08/russian-strikes-trigger-power-cuts-in-several-ukrainian-regions_6747246_4.html,Not premium,Le Monde with AFP,https://img.lemde.fr/2025/11/06/0/0/6000/4000/360/0/95/0/8cb65c8_upload-1-hylcduzucyy3-098426.jpg 2x,
Serbia's student protest movement is caught in a nationalist trap,0,https://www.lemonde.fr/en/opinion/article/2025/11/08/serbia-s-student-protest-movement-is-caught-in-a-nationalist-trap_6747251_23.html,Subscribers only,Jean-Baptiste Chastand,https://img.lemde.fr/2025/11/06/0/0/6000/4000/360/0/95/0/8cb65c8_upload-1-hylcduzucyy3-098426.jpg 2x,
"'With Grokipedia, AI will be trained using the world as Elon Musk describes, perceives and desires it'","In an op-ed for Le Monde, Julien Malaurent, the deputy managing director of ESSEC Business School, warns of the consequences that could result from the launch of Grokipedia, Elon Musk's encyclopedia. Entirely generated by artificial intelligence, the platform heralds an epistemological revolution.",https://www.lemonde.fr/en/opinion/article/2025/11/08/with-grokipedia-ai-will-be-trained-using-the-world-as-elon-musk-describes-perceives-and-desires-it_6747249_23.html,Subscribers only,Julien Malaurent,https://img.lemde.fr/2025/11/06/0/0/6000/4000/360/0/95/0/8cb65c8_upload-1-hylcduzucyy3-098426.jpg 2x,
"Mission Congress, an ambitious Catholic gathering with a wide range of sometimes controversial guests","The Accor Arena is hosting Mission Congress on Friday and Saturday in Paris, an event that declares itself a 'mission of evangelization' and seeks to bring together all branches of the Catholic Church.",https://www.lemonde.fr/en/france/article/2025/11/08/mission-congress-an-ambitious-catholic-gathering-with-a-wide-range-of-sometimes-controversial-guests_6747245_7.html,Subscribers only,  By Sarah Belouezzane ,https://img.lemde.fr/2025/11/06/0/0/6000/4000/360/0/95/0/8cb65c8_upload-1-hylcduzucyy3-098426.jpg 2x,
"'It's alive!': On Netflix, Guillermo del Toro breathes energy and beauty into the myth of 'Frankenstein'",The Mexican filmmaker distills the essence of his cinema in this inspired take on Mary Shelley's novel.,https://www.lemonde.fr/en/culture/article/2025/11/07/it-s-alive-on-netflix-guillermo-del-toro-breathes-energy-and-beauty-into-the-myth-of-frankenstein_6747239_30.html,Subscribers only,  By Thomas Sotinel ,https://img.lemde.fr/2025/11/06/0/0/6000/4000/360/0/95/0/8cb65c8_upload-1-hylcduzucyy3-098426.jpg 2x,
Top French YouTuber caught in flood of AI-generated racist videos on Sora,"Fake clips depicting Tibo InShape making racist statements have flooded social media. While he has said it was 'dark humor' and condemned the words, the phenomenon raises new questions about moderation in the era of artificial intelligence.",https://www.lemonde.fr/en/pixels/article/2025/11/08/top-french-youtuber-caught-in-flood-of-ai-generated-racist-videos-on-sora_6747253_13.html,Subscribers only,  By Morgane Tual ,https://img.lemde.fr/2025/11/06/0/0/6000/4000/360/0/95/0/8cb65c8_upload-1-hylcduzucyy3-098426.jpg 2x,In Depth
Chinese automaker BYD shows outsized global ambitions,0,https://www.lemonde.fr/en/economy/article/2025/11/08/chinese-automaker-byd-shows-outsized-global-ambitions_6747252_19.html,Subscribers only,"  By Sophie Fay (Zhengzhou (China), special correspondent) ",https://img.lemde.fr/2025/11/06/0/0/6000/4000/360/0/95/0/8cb65c8_upload-1-hylcduzucyy3-098426.jpg 2x,
US removes Syrian president from terror list ahead of Washington visit,0,https://www.lemonde.fr/en/international/article/2025/11/08/us-removes-syrian-president-from-terror-list-ahead-of-washington-visit_6747248_4.html,Not premium,Le Monde with AFP,https://img.lemde.fr/2025/11/06/0/0/6000/4000/360/0/95/0/8cb65c8_upload-1-hylcduzucyy3-098426.jpg 2x,
"Ofer Bronchtein and Daniel Cohn-Bendit: '30 years after the death of Yitzhak Rabin, paying tribute is not enough: We must return to his priorities'",0,https://www.lemonde.fr/en/opinion/article/2025/11/08/ofer-bronchtein-and-daniel-cohn-bendit-30-years-after-the-death-of-yitzhak-rabin-paying-tribute-is-not-enough-we-must-return-to-his-priorities_6747243_23.html,Subscribers only,Ofer Bronchtein,https://img.lemde.fr/2025/11/06/0/0/6000/4000/360/0/95/0/8cb65c8_upload-1-hylcduzucyy3-098426.jpg 2x,
Trump grants Hungary one-year sanctions exemption on Russian oil,0,https://www.lemonde.fr/en/international/article/2025/11/08/trump-grants-hungary-sanctions-exemption-on-russian-oil_6747242_4.html,Not premium,Le Monde with AFP,https://img.lemde.fr/2025/11/06/0/0/6000/4000/360/0/95/0/8cb65c8_upload-1-hylcduzucyy3-098426.jpg 2x,
"In the West Bank, children are the target of Israeli soldiers",0,https://www.lemonde.fr/en/international/article/2025/11/07/in-the-west-bank-children-are-the-target-of-israeli-soldiers_6747236_4.html,Subscribers only," By Lucas Minisini (Sebastia, Tulkarem, Al-Rihiya (West Bank) special correspondent) ",https://img.lemde.fr/2025/11/06/0/0/6000/4000/360/0/95/0/8cb65c8_upload-1-hylcduzucyy3-098426.jpg 2x,
DNA pioneer James D. Watson dies at 97,0,https://www.lemonde.fr/en/science/article/2025/11/07/dna-pioneer-james-d-watson-dies-at-97_6747238_10.html,Not premium,Le Monde with AP,https://img.lemde.fr/2025/11/06/0/0/6000/4000/360/0/95/0/8cb65c8_upload-1-hylcduzucyy3-098426.jpg 2x,
US submits draft resolution to UN Security Council for international force in Gaza,0,https://www.lemonde.fr/en/international/article/2025/11/07/us-submits-draft-resolution-to-un-security-council-for-international-force-in-gaza_6747224_4.html,Subscribers only,  By Philippe Ricard ,https://img.lemde.fr/2025/11/06/0/0/6000/4000/360/0/95/0/8cb65c8_upload-1-hylcduzucyy3-098426.jpg 2x,
French-Palestinian activist files complaint for 'deportation' after his expulsion from Israel in 2022,0,https://www.lemonde.fr/en/france/article/2025/11/07/french-palestinian-activist-files-complaint-for-deportation-after-his-expulsion-from-israel-in-2022_6747235_7.html,Subscribers only,  By Christophe Ayad ,https://img.lemde.fr/2025/11/06/0/0/6000/4000/360/0/95/0/8cb65c8_upload-1-hylcduzucyy3-098426.jpg 2x,
United Kingdom struggles to acknowledge the far right's rise,0,https://www.lemonde.fr/en/opinion/article/2025/11/07/united-kingdom-struggles-to-acknowledge-the-far-right-s-rise_6747227_23.html,Subscribers only,Cécile Ducourtieux,https://img.lemde.fr/2025/11/06/0/0/6000/4000/360/0/95/0/8cb65c8_upload-1-hylcduzucyy3-098426.jpg 2x,
France urges citizens to leave Mali temporarily due to jihadist blockade,0,https://www.lemonde.fr/en/international/article/2025/11/07/france-urges-citizens-to-leave-mali-temporarily-due-to-jihadist-blockade_6747233_4.html,Not premium,Le Monde with AFP,https://img.lemde.fr/2025/11/06/0/0/6000/4000/360/0/95/0/8cb65c8_upload-1-hylcduzucyy3-098426.jpg 2x,
Israel receives remains of hostage from Gaza,0,https://www.lemonde.fr/en/international/article/2025/11/08/israel-receives-remains-of-hostage-from-gaza_6747244_4.html,Not premium,Le Monde with AFP,https://img.lemde.fr/2025/11/06/0/0/6000/4000/360/0/95/0/8cb65c8_upload-1-hylcduzucyy3-098426.jpg 2x,
'Made in France' clothing manufacturers struggle to survive amid competition from fast fashion,0,https://www.lemonde.fr/en/economy/article/2025/11/07/made-in-france-clothing-manufacturers-struggle-to-survive-amid-competition-from-fast-fashion_6747237_19.html,Subscribers only,  By Juliette Garnier ,https://img.lemde.fr/2025/11/06/0/0/6000/4000/360/0/95/0/8cb65c8_upload-1-hylcduzucyy3-098426.jpg 2x,
The American retirees who benefit from free French social security,"Attracted by French universal health coverage, many Americans have chosen to settle in the country, where they are also exempt from paying income tax.",https://www.lemonde.fr/en/politics/article/2025/11/06/the-american-retirees-who-benefit-from-free-french-social-security_6747192_5.html,Subscribers only,"  By Yves Tréca-Durand (Angers (France), correspondent) ",https://img.lemde.fr/2025/11/06/0/0/6000/4000/360/0/95/0/8cb65c8_upload-1-hylcduzucyy3-098426.jpg 2x,In Depth
'It's like they're coming out of a cult': Ukraine tackles Russian indoctrination of repatriated children,"To date, 1,762 Ukrainian children have been repatriated after being forcibly transferred by Moscow. Ukrainians are working to de-indoctrinate them and are warning that today, all children living under occupation, Russified and militarized, are being torn from their country without even having to be physically deported.",https://www.lemonde.fr/en/international/article/2025/11/06/it-s-like-they-re-coming-out-of-a-cult-ukraine-tackles-russian-indoctrination-of-repatriated-children_6747195_4.html,Subscribers only, By Faustine Vincent (Special correspondent in Kyiv) ,https://img.lemde.fr/2025/11/06/0/0/6000/4000/360/0/95/0/8cb65c8_upload-1-hylcduzucyy3-098426.jpg 2x,Investigation
'There's almost no water left': On the front lines of climate change in southern France,"'Our planet at +1.5°C' (6/6). Persistent drought, record temperatures, wildfires: Faced with the most acute effects of global warming, residents of the Aude department in southern France are looking for ways to keep their region alive.",https://www.lemonde.fr/en/environment/article/2025/11/04/there-s-almost-no-water-left-on-the-front-lines-of-climate-change-in-southern-france_6747106_114.html,Subscribers only," By Léa Sanchez (Laroque-de-Fa, Narbonne, Ribaute (France) special correspondent) and Adrienne Surprenant ",https://img.lemde.fr/2025/11/06/0/0/6000/4000/360/0/95/0/8cb65c8_upload-1-hylcduzucyy3-098426.jpg 2x,Feature
COP30: Sending a message of unity and perseverance,0,https://www.lemonde.fr/en/opinion/article/2025/11/07/cop30-sending-a-message-of-unity-and-perseverance_6747216_23.html,Not premium,Le Monde,https://img.lemde.fr/2025/11/06/0/0/6000/4000/360/0/95/0/8cb65c8_upload-1-hylcduzucyy3-098426.jpg 2x,Editorial
Donald Trump's rough patch,0,https://www.lemonde.fr/en/opinion/article/2025/11/06/donald-trump-s-rough-patch_6747181_23.html,Not premium,Le Monde,https://img.lemde.fr/2025/11/06/0/0/6000/4000/360/0/95/0/8cb65c8_upload-1-hylcduzucyy3-098426.jpg 2x,Editorial
"'Democrats Mamdani and Spanberger won under the same banner, but not with the same ideas'",0,https://www.lemonde.fr/en/opinion/article/2025/11/05/democrats-mamdani-and-spanberger-won-under-the-same-banner-but-not-with-the-same-ideas_6747152_23.html,Subscribe,Gilles Paris,https://img.lemde.fr/2025/11/06/0/0/6000/4000/360/0/95/0/8cb65c8_upload-1-hylcduzucyy3-098426.jpg 2x,Column
