title,subhead,url,suscription,byline,img_url,article_type
Trump targets more opponents after 'dirty cop' Comey: 'I think there will be others',0,https://www.lemonde.fr/en/international/article/2025/09/27/trump-targets-more-opponents-after-dirty-cop-comey-i-think-there-will-be-others_6745804_4.html,Not premium,Le Monde,https://img.lemde.fr/2025/09/25/0/0/9000/6000/360/0/95/0/f76383f_ftp-import-images-1-1bgtzqyhizd4-5995836-01-06.jpg 2x,
Denmark is unsettled by a wave of drone incursions,0,https://www.lemonde.fr/en/international/article/2025/09/27/denmark-is-unsettled-by-a-wave-of-drone-incursions_6745790_4.html,Subscribers only,  By Anne-Françoise Hivert (Malmö (Sweden) correspondent) ,https://img.lemde.fr/2025/09/25/0/0/9000/6000/360/0/95/0/f76383f_ftp-import-images-1-1bgtzqyhizd4-5995836-01-06.jpg 2x,
UN Security Council rejects Russia and China's last-ditch effort to delay sanctions on Iran,0,https://www.lemonde.fr/en/international/article/2025/09/27/un-security-council-rejects-russia-and-china-s-last-ditch-effort-to-delay-sanctions-on-iran_6745789_4.html,Not premium,Le Monde,https://img.lemde.fr/2025/09/25/0/0/9000/6000/360/0/95/0/f76383f_ftp-import-images-1-1bgtzqyhizd4-5995836-01-06.jpg 2x,
"Isolated at the UN, Netanyahu defies the international community",0,https://www.lemonde.fr/en/international/article/2025/09/27/isolated-at-the-un-netanyahu-defies-the-international-community_6745788_4.html,Subscribers only,"  By Luc Bronner (Jerusalem, correspondent) ",https://img.lemde.fr/2025/09/25/0/0/9000/6000/360/0/95/0/f76383f_ftp-import-images-1-1bgtzqyhizd4-5995836-01-06.jpg 2x,
Sanctions against Russia spark rift between US and Europe over China,0,https://www.lemonde.fr/en/international/article/2025/09/15/sanctions-against-russia-spark-rift-between-us-and-europe-over-china_6745411_4.html,Subscribers only,"  By Philippe Jacqué (Brussels, Europe bureau), Philippe Ricard and Harold Thibault (Beijing (China) correspondent) ",https://img.lemde.fr/2025/09/25/0/0/9000/6000/360/0/95/0/f76383f_ftp-import-images-1-1bgtzqyhizd4-5995836-01-06.jpg 2x,
France's political instability puts Franco-German alliance to the test,0,https://www.lemonde.fr/en/opinion/article/2025/08/30/france-s-political-instability-puts-franco-german-alliance-to-the-test_6744873_23.html,Not premium,Le Monde,https://img.lemde.fr/2025/09/25/0/0/9000/6000/360/0/95/0/f76383f_ftp-import-images-1-1bgtzqyhizd4-5995836-01-06.jpg 2x,
France faces prospect of paying higher borrowing costs than Italy,0,https://www.lemonde.fr/en/economy/article/2025/08/19/france-faces-prospect-of-paying-higher-borrowing-costs-than-italy_6744519_19.html,Subscribers only,  By Denis Cosnard and Allan Kaval (Rome (Italy) correspondent) ,https://img.lemde.fr/2025/09/25/0/0/9000/6000/360/0/95/0/f76383f_ftp-import-images-1-1bgtzqyhizd4-5995836-01-06.jpg 2x,
French man arrested in Slovenia for crimes committed in Croatia during 1991 war,0,https://www.lemonde.fr/en/international/article/2025/08/06/french-man-arrested-in-slovenia-for-crimes-committed-in-croatia-during-1991-war_6744113_4.html,Subscribers only,  By Stéphanie Maupas (The Hague (Netherlands) correspondent) and Richard Schittly (Lyon (France) correspondent) ,https://img.lemde.fr/2025/09/25/0/0/9000/6000/360/0/95/0/f76383f_ftp-import-images-1-1bgtzqyhizd4-5995836-01-06.jpg 2x,
The day Sarkozy learned he was going to prison,0,https://www.lemonde.fr/en/france/article/2025/09/26/the-day-sarkozy-learned-he-was-going-to-prison_6745758_7.html,Subscribers only,  By Franck Johannès ,https://img.lemde.fr/2025/09/25/0/0/9000/6000/360/0/95/0/f76383f_ftp-import-images-1-1bgtzqyhizd4-5995836-01-06.jpg 2x,
"France has been 'dropping out of democracy' since 2017, warns an NGO report",0,https://www.lemonde.fr/en/france/article/2025/09/27/france-has-been-dropping-out-of-democracy-since-2017-warns-an-ngo-report_6745803_7.html,Subscribers only,  By Christophe Ayad ,https://img.lemde.fr/2025/09/25/0/0/9000/6000/360/0/95/0/f76383f_ftp-import-images-1-1bgtzqyhizd4-5995836-01-06.jpg 2x,
"Excerpt from the decision convicting Sarkozy: 'Acts of exceptional seriousness, likely to undermine citizens' trust'",0,https://www.lemonde.fr/en/france/article/2025/09/26/excerpt-from-the-decision-in-sarkozy-s-conviction-acts-of-exceptional-seriousness-likely-to-undermine-citizens-trust_6745782_7.html,Subscribers only,  By Franck Johannès ,https://img.lemde.fr/2025/09/25/0/0/9000/6000/360/0/95/0/f76383f_ftp-import-images-1-1bgtzqyhizd4-5995836-01-06.jpg 2x,
French conservatives outraged at Sarkozy's prison sentence,0,https://www.lemonde.fr/en/france/article/2025/09/25/french-conservatives-outraged-at-sarkozy-s-prison-sentence_6745744_7.html,Subscribers only,  By Alexandre Pedro ,https://img.lemde.fr/2025/09/25/0/0/9000/6000/360/0/95/0/f76383f_ftp-import-images-1-1bgtzqyhizd4-5995836-01-06.jpg 2x,
Watch: Hundreds of thousands march in France against budget cuts,0,https://www.lemonde.fr/en/videos/video/2025/09/19/french-strikes-watch-what-happened-as-hundreds-of-thousands-marched-against-budget-cuts_6745548_108.html,Not premium,  By Le Monde's video desk   ,https://img.lemde.fr/2025/09/25/0/0/9000/6000/360/0/95/0/f76383f_ftp-import-images-1-1bgtzqyhizd4-5995836-01-06.jpg 2x,
Emmys 2025: 'Adolescence' star Owen Cooper becomes youngest winner for best supporting actor,0,https://www.lemonde.fr/en/videos/video/2025/09/15/emmys-2025-adolescence-star-owen-cooper-becomes-youngest-winner-for-best-supporting-actor_6745427_108.html,Not premium,  By Le Monde's video desk   ,https://img.lemde.fr/2025/09/25/0/0/9000/6000/360/0/95/0/f76383f_ftp-import-images-1-1bgtzqyhizd4-5995836-01-06.jpg 2x,
"From 'influence peddling' to 'corruption,' what is French Culture Minister Rachida Dati accused of?",0,https://www.lemonde.fr/en/videos/video/2025/09/06/from-influence-peddling-to-corruption-what-is-french-culture-minister-rachida-dati-accused-of_6745094_108.html,Not premium,"  By Alexis Tromas, Arthur Navet (Motion design) and Sinead McCausland ",https://img.lemde.fr/2025/09/25/0/0/9000/6000/360/0/95/0/f76383f_ftp-import-images-1-1bgtzqyhizd4-5995836-01-06.jpg 2x,
Watch: Tsunami warnings sound in Japan after 8.8 magnitude quake off Russian coast,0,https://www.lemonde.fr/en/videos/video/2025/07/30/watch-tsunami-warnings-sound-in-japan-after-8-8-magnitude-quake-off-russian-coast_6743900_108.html,Not premium,No byline,https://img.lemde.fr/2025/09/25/0/0/9000/6000/360/0/95/0/f76383f_ftp-import-images-1-1bgtzqyhizd4-5995836-01-06.jpg 2x,
Sarkozy conviction: No one is above the law,0,https://www.lemonde.fr/en/opinion/article/2025/09/26/sarkozy-conviction-no-one-is-above-the-law_6745763_23.html,Not premium,Le Monde,https://img.lemde.fr/2025/09/25/0/0/9000/6000/360/0/95/0/f76383f_ftp-import-images-1-1bgtzqyhizd4-5995836-01-06.jpg 2x,
'To frame Kirk's death as escalation misses the truth. The real threat is normalization',0,https://www.lemonde.fr/en/opinion/article/2025/09/26/to-frame-kirk-s-death-as-escalation-misses-the-truth-the-real-threat-is-normalization_6745775_23.html,Subscribers only,Clionadh Raleigh,https://img.lemde.fr/2025/09/25/0/0/9000/6000/360/0/95/0/f76383f_ftp-import-images-1-1bgtzqyhizd4-5995836-01-06.jpg 2x,
'Israel's isolation is the price of pursuing a war in Gaza without clear objectives',0,https://www.lemonde.fr/en/opinion/article/2025/09/26/israel-s-isolation-is-the-price-of-pursuing-a-war-in-gaza-without-clear-objectives_6745764_23.html,Subscribers only,Gilles Paris,https://img.lemde.fr/2025/09/25/0/0/9000/6000/360/0/95/0/f76383f_ftp-import-images-1-1bgtzqyhizd4-5995836-01-06.jpg 2x,
"'In Sudan, it is as if a congenital curse is at work. And the worst is yet to come'",0,https://www.lemonde.fr/en/opinion/article/2025/09/26/in-sudan-it-is-as-if-a-congenital-curse-is-at-work-and-the-worst-is-yet-to-come_6745757_23.html,Subscribers only,Alain Frachon,https://img.lemde.fr/2025/09/25/0/0/9000/6000/360/0/95/0/f76383f_ftp-import-images-1-1bgtzqyhizd4-5995836-01-06.jpg 2x,
"Vivian Jenna Wilson, Elon Musk's transgender daughter, has become a New York Fashion Week sensation",0,https://www.lemonde.fr/en/m-le-mag/article/2025/09/24/vivian-jenna-wilson-elon-musk-s-transgender-daughter-has-become-a-new-york-fashion-week-sensation_6745690_117.html,Subscribers only,  By Ève Minault ,https://img.lemde.fr/2025/09/25/0/0/9000/6000/360/0/95/0/f76383f_ftp-import-images-1-1bgtzqyhizd4-5995836-01-06.jpg 2x,
Historian Tal Bruttmann's sharp eye on the Holocaust,0,https://www.lemonde.fr/en/m-le-mag/article/2025/09/21/historian-tal-bruttmann-s-sharp-eye-on-the-holocaust_6745597_117.html,Subscribers only, By Valentine Faure ,https://img.lemde.fr/2025/09/25/0/0/9000/6000/360/0/95/0/f76383f_ftp-import-images-1-1bgtzqyhizd4-5995836-01-06.jpg 2x,
The silent and destructive spread of laughing gas: 'That shit took my whole life',0,https://www.lemonde.fr/en/m-le-mag/article/2025/09/20/the-silent-and-destructive-spread-of-laughing-gas-that-shit-took-my-whole-life_6745588_117.html,Subscribers only, By Yann Bouchez ,https://img.lemde.fr/2025/09/25/0/0/9000/6000/360/0/95/0/f76383f_ftp-import-images-1-1bgtzqyhizd4-5995836-01-06.jpg 2x,
"For the 250th anniversary of Jane Austen's birth, take a trip into the world of her superfans",0,https://www.lemonde.fr/en/m-le-mag/article/2025/09/20/on-the-250th-anniversary-of-jane-austen-s-birth-take-a-trip-into-the-world-of-the-english-novelist-s-superfans_6745580_117.html,Subscribers only," By Cécile Ducourtieux (London, correspondent) ",https://img.lemde.fr/2025/09/25/0/0/9000/6000/360/0/95/0/f76383f_ftp-import-images-1-1bgtzqyhizd4-5995836-01-06.jpg 2x,
Tradition done right: Five Paris restaurants reimagining the classics,0,https://www.lemonde.fr/en/lifestyle/article/2025/09/08/tradition-done-right-five-paris-restaurants-reimagining-the-classics_6745133_37.html,Subscribers only, By Léo Pajon ,https://img.lemde.fr/2025/09/25/0/0/9000/6000/360/0/95/0/f76383f_ftp-import-images-1-1bgtzqyhizd4-5995836-01-06.jpg 2x,
Paris Design Week: A 15th edition marked by abundance,0,https://www.lemonde.fr/en/lifestyle/article/2025/09/05/paris-design-week-a-15th-edition-marked-by-abundance_6745060_37.html,Subscribers only,  By Véronique Lorelle ,https://img.lemde.fr/2025/09/25/0/0/9000/6000/360/0/95/0/f76383f_ftp-import-images-1-1bgtzqyhizd4-5995836-01-06.jpg 2x,
It's pain suisse time! Five places in and around Paris to find this treat,0,https://www.lemonde.fr/en/lifestyle/article/2025/09/04/it-s-pain-suisse-time-five-places-in-the-paris-region-to-find-this-treat_6745022_37.html,Subscribers only,  By Zazie Tavitian ,https://img.lemde.fr/2025/09/25/0/0/9000/6000/360/0/95/0/f76383f_ftp-import-images-1-1bgtzqyhizd4-5995836-01-06.jpg 2x,
"At Musée d'Orsay, a Courbet painting gets a new life before visitors' eyes",0,https://www.lemonde.fr/en/culture/article/2025/07/26/at-musee-d-orsay-a-courbet-painting-gets-a-new-life-before-visitors-eyes_6743744_30.html,Subscribers only,  By Max Blanc ,https://img.lemde.fr/2025/09/25/0/0/9000/6000/360/0/95/0/f76383f_ftp-import-images-1-1bgtzqyhizd4-5995836-01-06.jpg 2x,
Is America still a dream destination for French artists?,"Since Donald Trump was elected, several musicians have canceled their US tours. However, in France, artists have refused to sever ties, mixing solidarity and pragmatism toward a market that remains all-powerful.",https://www.lemonde.fr/en/culture/article/2025/09/27/is-america-still-a-dream-destination-for-french-artists_6745800_30.html,Subscribers only,  By Roxana Azimi   ,https://img.lemde.fr/2025/09/25/0/0/9000/6000/360/0/95/0/f76383f_ftp-import-images-1-1bgtzqyhizd4-5995836-01-06.jpg 2x,
"Isolated at the UN, Netanyahu defies the international community",0,https://www.lemonde.fr/en/international/article/2025/09/27/isolated-at-the-un-netanyahu-defies-the-international-community_6745788_4.html,Subscribers only,"  By Luc Bronner (Jerusalem, correspondent) ",https://img.lemde.fr/2025/09/25/0/0/9000/6000/360/0/95/0/f76383f_ftp-import-images-1-1bgtzqyhizd4-5995836-01-06.jpg 2x,
Denmark is unsettled by a wave of drone incursions,0,https://www.lemonde.fr/en/international/article/2025/09/27/denmark-is-unsettled-by-a-wave-of-drone-incursions_6745790_4.html,Subscribers only,  By Anne-Françoise Hivert (Malmö (Sweden) correspondent) ,https://img.lemde.fr/2025/09/25/0/0/9000/6000/360/0/95/0/f76383f_ftp-import-images-1-1bgtzqyhizd4-5995836-01-06.jpg 2x,
UN Security Council rejects Russia and China's last-ditch effort to delay sanctions on Iran,"Barring an eleventh-hour deal, the reinstatement of sanctions – triggered by Britain, France and Germany – will once again freeze Iranian assets abroad, halt arms deals with Tehran and penalize any development of Iran's ballistic missile program, among other measures.",https://www.lemonde.fr/en/international/article/2025/09/27/un-security-council-rejects-russia-and-china-s-last-ditch-effort-to-delay-sanctions-on-iran_6745789_4.html,Not premium,Le Monde,https://img.lemde.fr/2025/09/25/0/0/9000/6000/360/0/95/0/f76383f_ftp-import-images-1-1bgtzqyhizd4-5995836-01-06.jpg 2x,
Paris-Berlin and Paris-Vienna night trains under threat as the French government withdraws subsidies,"Following the government's decision to end financial support, these two loss-making routes are expected to cease operations by the end of 2025.",https://www.lemonde.fr/en/economy/article/2025/09/27/paris-berlin-and-paris-vienna-night-trains-under-threat-as-the-french-government-withdraws-subsidies_6745799_19.html,Subscribers only,  By Jonathan Parienté ,https://img.lemde.fr/2025/09/25/0/0/9000/6000/360/0/95/0/f76383f_ftp-import-images-1-1bgtzqyhizd4-5995836-01-06.jpg 2x,
"'Put Your Soul on Your Hand and Walk,' a cinematic memorial to Palestinian photographer Fatma Hassona","In this powerful documentary, Sepideh Farsi reveals her phone exchanges with the young woman who documented daily life in Gaza before her death on April 16, the victim of an Israeli attack.",https://www.lemonde.fr/en/culture/article/2025/09/27/put-your-soul-on-your-hand-and-walk-a-cinematic-memorial-to-palestinian-photographer-fatma-hassona_6745802_30.html,Subscribers only,  By Clarisse Fabre ,https://img.lemde.fr/2025/09/25/0/0/9000/6000/360/0/95/0/f76383f_ftp-import-images-1-1bgtzqyhizd4-5995836-01-06.jpg 2x,
"France has been 'dropping out of democracy' since 2017, warns an NGO report","The report, published by the International Federation for Human Rights on Thursday, cites a 'profound, structural deterioration in the environment in which society can speak out and act' and restrictions on civil liberties.",https://www.lemonde.fr/en/france/article/2025/09/27/france-has-been-dropping-out-of-democracy-since-2017-warns-an-ngo-report_6745803_7.html,Subscribers only,  By Christophe Ayad ,https://img.lemde.fr/2025/09/25/0/0/9000/6000/360/0/95/0/f76383f_ftp-import-images-1-1bgtzqyhizd4-5995836-01-06.jpg 2x,Round-up
Trump targets more opponents after 'dirty cop' Comey: 'I think there will be others',0,https://www.lemonde.fr/en/international/article/2025/09/27/trump-targets-more-opponents-after-dirty-cop-comey-i-think-there-will-be-others_6745804_4.html,Not premium,Le Monde,https://img.lemde.fr/2025/09/25/0/0/9000/6000/360/0/95/0/f76383f_ftp-import-images-1-1bgtzqyhizd4-5995836-01-06.jpg 2x,
Guinea Supreme Court confirms vote to change constitution,0,https://www.lemonde.fr/en/international/article/2025/09/27/guinea-supreme-court-confirms-vote-to-change-constitution_6745801_4.html,Not premium,Le Monde with AFP,https://img.lemde.fr/2025/09/25/0/0/9000/6000/360/0/95/0/f76383f_ftp-import-images-1-1bgtzqyhizd4-5995836-01-06.jpg 2x,
Kimmel boycott ends as Sinclair and Nexstar put the late-night comedian back on the air,0,https://www.lemonde.fr/en/international/article/2025/09/27/kimmel-boycott-ends-as-sinclair-and-nexstar-put-the-late-night-comedian-back-on-the-air_6745791_4.html,Not premium,Le Monde with AFP,https://img.lemde.fr/2025/09/25/0/0/9000/6000/360/0/95/0/f76383f_ftp-import-images-1-1bgtzqyhizd4-5995836-01-06.jpg 2x,
Sarkozy's conviction: Five questions about what happens next,0,https://www.lemonde.fr/en/les-decodeurs/article/2025/09/26/sarkozy-s-conviction-five-questions-about-what-happens-next_6745771_8.html,Not premium,  By Les Décodeurs ,https://img.lemde.fr/2025/09/25/0/0/9000/6000/360/0/95/0/f76383f_ftp-import-images-1-1bgtzqyhizd4-5995836-01-06.jpg 2x,
"Zohran Mamdani, the 'socialist' symbolizing Democratic voters' revolt",0,https://www.lemonde.fr/en/international/article/2025/09/26/zohran-mamdani-the-socialist-symbolizing-democratic-voters-revolt_6745785_4.html,Subscribers only,  By Nicolas Chapuis (New York (United States) correspondent) ,https://img.lemde.fr/2025/09/25/0/0/9000/6000/360/0/95/0/f76383f_ftp-import-images-1-1bgtzqyhizd4-5995836-01-06.jpg 2x,
'To frame Kirk's death as escalation misses the truth. The real threat is normalization',0,https://www.lemonde.fr/en/opinion/article/2025/09/26/to-frame-kirk-s-death-as-escalation-misses-the-truth-the-real-threat-is-normalization_6745775_23.html,Subscribers only,Clionadh Raleigh,https://img.lemde.fr/2025/09/25/0/0/9000/6000/360/0/95/0/f76383f_ftp-import-images-1-1bgtzqyhizd4-5995836-01-06.jpg 2x,
A Turkish feminist activist removes the hijab she had worn for decades,0,https://www.lemonde.fr/en/international/article/2025/09/26/in-turkey-a-feminist-activist-removes-the-hijab-she-wore-for-decades_6745756_4.html,Subscribers only,  By Nicolas Bourcier (Istanbul (Turkey) correspondent) ,https://img.lemde.fr/2025/09/25/0/0/9000/6000/360/0/95/0/f76383f_ftp-import-images-1-1bgtzqyhizd4-5995836-01-06.jpg 2x,
"Paris's Mausolée, once a clandestine graffiti residence, now opens its doors to the public",0,https://www.lemonde.fr/en/culture/article/2025/09/26/in-paris-the-mausolee-formerly-a-clandestine-graffiti-residence-opens-its-doors-to-the-public_6745754_30.html,Subscribers only,  By Emmanuelle Jardonnet ,https://img.lemde.fr/2025/09/25/0/0/9000/6000/360/0/95/0/f76383f_ftp-import-images-1-1bgtzqyhizd4-5995836-01-06.jpg 2x,
Why Netanyahu's plane avoided French airspace,0,https://www.lemonde.fr/en/international/article/2025/09/26/why-netanyahu-s-plane-avoided-french-airspace_6745773_4.html,Subscribers only,  By Claire Gatinois ,https://img.lemde.fr/2025/09/25/0/0/9000/6000/360/0/95/0/f76383f_ftp-import-images-1-1bgtzqyhizd4-5995836-01-06.jpg 2x,
'Israel's isolation is the price of pursuing a war in Gaza without clear objectives',0,https://www.lemonde.fr/en/opinion/article/2025/09/26/israel-s-isolation-is-the-price-of-pursuing-a-war-in-gaza-without-clear-objectives_6745764_23.html,Subscribers only,Gilles Paris,https://img.lemde.fr/2025/09/25/0/0/9000/6000/360/0/95/0/f76383f_ftp-import-images-1-1bgtzqyhizd4-5995836-01-06.jpg 2x,
French court jails three women who joined IS in Syria,0,https://www.lemonde.fr/en/international/article/2025/09/26/french-court-jails-three-women-who-joined-is-in-syria_6745787_4.html,Not premium,Le Monde with AFP,https://img.lemde.fr/2025/09/25/0/0/9000/6000/360/0/95/0/f76383f_ftp-import-images-1-1bgtzqyhizd4-5995836-01-06.jpg 2x,
"French PM vows new government early October, says an austerity budget is 'out of the question'",0,https://www.lemonde.fr/en/france/article/2025/09/26/french-pm-vows-new-government-early-october-says-an-austerity-budget-is-out-of-the-question_6745786_7.html,Not premium,Le Monde with AFP,https://img.lemde.fr/2025/09/25/0/0/9000/6000/360/0/95/0/f76383f_ftp-import-images-1-1bgtzqyhizd4-5995836-01-06.jpg 2x,
"Excerpt from the decision convicting Sarkozy: 'Acts of exceptional seriousness, likely to undermine citizens' trust'",Former French president Nicolas Sarkozy was found guilty of criminal conspiracy in the case of alleged Libyan financing of his 2007 presidential campaign. Here is part of the court's decision.,https://www.lemonde.fr/en/france/article/2025/09/26/excerpt-from-the-decision-in-sarkozy-s-conviction-acts-of-exceptional-seriousness-likely-to-undermine-citizens-trust_6745782_7.html,Subscribers only,  By Franck Johannès ,https://img.lemde.fr/2025/09/25/0/0/9000/6000/360/0/95/0/f76383f_ftp-import-images-1-1bgtzqyhizd4-5995836-01-06.jpg 2x,In Depth
A troubling surge of anti-Ukrainian xenophobia in Poland,"Since the country's presidential election in May, during which toxic rhetoric about immigration gained traction, reports of a growing sense of insecurity have increased within the Ukrainian community.",https://www.lemonde.fr/en/international/article/2025/09/26/in-poland-a-troubling-surge-in-anti-ukrainian-xenophobia_6745755_4.html,Subscribers only,  By Jakub Iwaniuk (Warsaw (Poland) special correspondent) ,https://img.lemde.fr/2025/09/25/0/0/9000/6000/360/0/95/0/f76383f_ftp-import-images-1-1bgtzqyhizd4-5995836-01-06.jpg 2x,Letter from...
Sarkozy's other legal battlefield: Qatar,"Although not currently facing charges, the former French president is implicated in two judicial investigations: one concerning the controversial awarding of the 2022 FIFA World Cup to Qatar, and another linked to French businessman Arnaud Lagardère.",https://www.lemonde.fr/en/france/article/2025/09/25/sarkozy-s-other-legal-battlefield-qatar_6745741_7.html,Subscribers only,  By Rémi Dupré ,https://img.lemde.fr/2025/09/25/0/0/9000/6000/360/0/95/0/f76383f_ftp-import-images-1-1bgtzqyhizd4-5995836-01-06.jpg 2x,In Depth
Sarkozy conviction: No one is above the law,0,https://www.lemonde.fr/en/opinion/article/2025/09/26/sarkozy-conviction-no-one-is-above-the-law_6745763_23.html,Not premium,Le Monde,https://img.lemde.fr/2025/09/25/0/0/9000/6000/360/0/95/0/f76383f_ftp-import-images-1-1bgtzqyhizd4-5995836-01-06.jpg 2x,Editorial
"'By going after Kimmel, Trump intended to put an end to shows that mock him. The opposite has happened'",0,https://www.lemonde.fr/en/international/article/2025/09/26/by-going-after-jimmy-kimmel-donald-trump-intended-to-put-an-end-to-the-shows-that-mock-him-the-opposite-has-happened_6745751_4.html,Subscribe,Michel Guerrin,https://img.lemde.fr/2025/09/25/0/0/9000/6000/360/0/95/0/f76383f_ftp-import-images-1-1bgtzqyhizd4-5995836-01-06.jpg 2x,Column
The US plan to expel hundreds of thousands of Palestinians from Gaza,0,https://www.lemonde.fr/en/international/article/2025/09/21/the-us-plan-to-expel-hundreds-of-thousands-of-palestinians-from-gaza_6745606_4.html,Subscribe,Jean-Pierre Filiu,https://img.lemde.fr/2025/09/25/0/0/9000/6000/360/0/95/0/f76383f_ftp-import-images-1-1bgtzqyhizd4-5995836-01-06.jpg 2x,Column
