title,subhead,url,suscription,byline,img_url,article_type
Finland faces yet another racist scandal,0,https://www.lemonde.fr/en/international/article/2025/12/20/finland-faces-yet-another-racist-scandal_6748691_4.html,Subscribers only,  By Anne-Françoise Hivert (Malmö (Sweden) correspondent) ,https://img.lemde.fr/2025/12/12/0/0/6144/4096/360/0/95/0/80affc2_ftp-1-mcenoaw4iqiy-1e24922755464a71ad58a71273e923d1-0-a1a103081d144b209392e008988f71b8.jpg 2x,
US sets record defense budget but imposes limits on Donald Trump's military ambitions,0,https://www.lemonde.fr/en/international/article/2025/12/19/us-sets-record-defense-budget-but-imposes-limits-on-donald-trump-s-military-ambitions_6748683_4.html,Subscribers only,  By Chloé Hoorman and Elise Vincent ,https://img.lemde.fr/2025/12/12/0/0/6144/4096/360/0/95/0/80affc2_ftp-1-mcenoaw4iqiy-1e24922755464a71ad58a71273e923d1-0-a1a103081d144b209392e008988f71b8.jpg 2x,
EU to loan €90 billion to Ukraine while delaying Mercosur deal,0,https://www.lemonde.fr/en/international/article/2025/12/19/eu-to-loan-90-billion-to-ukraine-amid-delay-to-mercosur-deal_6748666_4.html,Subscribers only,"  By Virginie Malingre (Brussels, Europe bureau) and Philippe Jacqué (Brussels, Europe bureau) ",https://img.lemde.fr/2025/12/12/0/0/6144/4096/360/0/95/0/80affc2_ftp-1-mcenoaw4iqiy-1e24922755464a71ad58a71273e923d1-0-a1a103081d144b209392e008988f71b8.jpg 2x,
Trump dogged by cost of living crisis and Republican revolt,0,https://www.lemonde.fr/en/international/article/2025/12/19/trump-dogged-by-cost-of-living-crisis-and-republican-dissent_6748663_4.html,Subscribers only,  By Piotr Smolar (Washington (United States) correspondent) ,https://img.lemde.fr/2025/12/12/0/0/6144/4096/360/0/95/0/80affc2_ftp-1-mcenoaw4iqiy-1e24922755464a71ad58a71273e923d1-0-a1a103081d144b209392e008988f71b8.jpg 2x,
'Trump's ideological challenge to Europe is more dangerous than the security one',0,https://www.lemonde.fr/en/opinion/article/2025/12/11/trump-s-ideological-challenge-to-europe-is-more-dangerous-than-the-security-one_6748393_23.html,Subscribers only,Sylvie Kauffmann,https://img.lemde.fr/2025/12/12/0/0/6144/4096/360/0/95/0/80affc2_ftp-1-mcenoaw4iqiy-1e24922755464a71ad58a71273e923d1-0-a1a103081d144b209392e008988f71b8.jpg 2x,
"Attacked by Trump, Europe wavers between denial and fear of reprisals",0,https://www.lemonde.fr/en/international/article/2025/12/11/attacked-by-trump-europe-wavers-between-denial-and-fear-of-reprisals_6748382_4.html,Subscribers only,"  By Philippe Jacqué (Brussels, Europe bureau) and Virginie Malingre (Brussels, Europe bureau) ",https://img.lemde.fr/2025/12/12/0/0/6144/4096/360/0/95/0/80affc2_ftp-1-mcenoaw4iqiy-1e24922755464a71ad58a71273e923d1-0-a1a103081d144b209392e008988f71b8.jpg 2x,
Bosnia and Herzegovina's Serb entity elects ally of  former leader Dodik,0,https://www.lemonde.fr/en/international/article/2025/11/24/bosnia-and-herzegovina-s-serb-entity-elects-ally-of-former-leader-dodik_6747765_4.html,Subscribers only,  By Rémy Ourdan (Banja Luka (Bosnia and Herzegovina) special correspondent) ,https://img.lemde.fr/2025/12/12/0/0/6144/4096/360/0/95/0/80affc2_ftp-1-mcenoaw4iqiy-1e24922755464a71ad58a71273e923d1-0-a1a103081d144b209392e008988f71b8.jpg 2x,
"In France's Somme, bagpipers keep the memory of the Great War alive",0,https://www.lemonde.fr/en/history/article/2025/11/11/in-france-s-somme-bagpipers-keep-the-memory-of-the-great-war-alive_6747347_157.html,Subscribers only," By Marie-Béatrice Baudet (Ovillers-la-Boisselle [Somme], special correspondent) ",https://img.lemde.fr/2025/12/12/0/0/6144/4096/360/0/95/0/80affc2_ftp-1-mcenoaw4iqiy-1e24922755464a71ad58a71273e923d1-0-a1a103081d144b209392e008988f71b8.jpg 2x,
French lawmakers fail to agree on state budget bill,0,https://www.lemonde.fr/en/france/article/2025/12/19/french-lawmakers-fail-to-agree-on-a-state-budget-bill_6748664_7.html,Not premium,Le Monde with AFP,https://img.lemde.fr/2025/12/12/0/0/6144/4096/360/0/95/0/80affc2_ftp-1-mcenoaw4iqiy-1e24922755464a71ad58a71273e923d1-0-a1a103081d144b209392e008988f71b8.jpg 2x,
"French anesthetist sentenced to life in prison: 'We cannot bring back our loved ones, but at least there is a semblance of justice'",0,https://www.lemonde.fr/en/france/article/2025/12/19/french-anesthetist-sentenced-to-life-in-prison-we-cannot-bring-back-our-loved-ones-but-at-least-there-is-a-semblance-of-justice_6748670_7.html,Subscribers only,"  By Willy Graff (Besançon, correspondence) ",https://img.lemde.fr/2025/12/12/0/0/6144/4096/360/0/95/0/80affc2_ftp-1-mcenoaw4iqiy-1e24922755464a71ad58a71273e923d1-0-a1a103081d144b209392e008988f71b8.jpg 2x,
"At the Rétrofutur Museum in Paris, looking to the past to better understand the future",0,https://www.lemonde.fr/en/france/article/2025/12/18/at-the-retrofutur-museum-in-paris-looking-to-the-past-to-better-understand-the-future_6748646_7.html,Subscribers only,  By David Larousserie ,https://img.lemde.fr/2025/12/12/0/0/6144/4096/360/0/95/0/80affc2_ftp-1-mcenoaw4iqiy-1e24922755464a71ad58a71273e923d1-0-a1a103081d144b209392e008988f71b8.jpg 2x,
The Sarkozys' damning indictment in witness Takieddine's false retraction,0,https://www.lemonde.fr/en/france/article/2025/12/18/the-sarkozys-s-damning-indictment-in-witness-takieddine-s-false-retraction_6748631_7.html,Subscribers only,  By Rémi Dupré ,https://img.lemde.fr/2025/12/12/0/0/6144/4096/360/0/95/0/80affc2_ftp-1-mcenoaw4iqiy-1e24922755464a71ad58a71273e923d1-0-a1a103081d144b209392e008988f71b8.jpg 2x,
The French studio behind a viral Christmas ad,0,https://www.lemonde.fr/en/videos/video/2025/12/12/the-french-studio-behind-a-viral-christmas-ad_6748436_108.html,Not premium,"  By Le Monde's video desk, Antoine Apelbaum   and Sinead McCausland (Le Monde in English) ",https://img.lemde.fr/2025/12/12/0/0/6144/4096/360/0/95/0/80affc2_ftp-1-mcenoaw4iqiy-1e24922755464a71ad58a71273e923d1-0-a1a103081d144b209392e008988f71b8.jpg 2x,
"Israel's D9 bulldozer, a tool of destruction in Gaza",0,https://www.lemonde.fr/en/videos/video/2025/11/27/israel-s-d9-bulldozer-a-tool-of-destruction-in-gaza_6747870_108.html,Subscribers only,"  By Liselotte Mas, Elsa Longueville (motion design) and Sinead McCausland ",https://img.lemde.fr/2025/12/12/0/0/6144/4096/360/0/95/0/80affc2_ftp-1-mcenoaw4iqiy-1e24922755464a71ad58a71273e923d1-0-a1a103081d144b209392e008988f71b8.jpg 2x,
"Ukraine's Pokrovsk faces fierce fighting, footage analyzed by Le Monde reveals",0,https://www.lemonde.fr/en/videos/video/2025/11/21/ukraine-s-pokrovsk-faces-fierce-fighting-footage-analyzed-by-le-monde-reveals_6747708_108.html,Subscribers only,"  By Alexandre Horn, Gabriel Lecointre (edit), Elisa Bellanger (motion design) and Sinead McCausland ",https://img.lemde.fr/2025/12/12/0/0/6144/4096/360/0/95/0/80affc2_ftp-1-mcenoaw4iqiy-1e24922755464a71ad58a71273e923d1-0-a1a103081d144b209392e008988f71b8.jpg 2x,
Afghanistan: Relentless repression continues over four years into Taliban's rule,0,https://www.lemonde.fr/en/videos/video/2025/10/04/afghanistan-relentless-repression-continues-over-four-years-into-taliban-s-rule_6746092_108.html,Not premium,"  By Chloé Denis, Félix Pommier (Motion design) and Sinead McCausland ",https://img.lemde.fr/2025/12/12/0/0/6144/4096/360/0/95/0/80affc2_ftp-1-mcenoaw4iqiy-1e24922755464a71ad58a71273e923d1-0-a1a103081d144b209392e008988f71b8.jpg 2x,
"Sydney attack: 'Relatively spared from terrorism, Australia is therefore less prepared for it'",0,https://www.lemonde.fr/en/opinion/article/2025/12/19/sydney-attack-relatively-spared-from-terrorism-australia-is-therefore-less-prepared-for-it_6748659_23.html,Subscribers only,Romain Fathi,https://img.lemde.fr/2025/12/12/0/0/6144/4096/360/0/95/0/80affc2_ftp-1-mcenoaw4iqiy-1e24922755464a71ad58a71273e923d1-0-a1a103081d144b209392e008988f71b8.jpg 2x,
"'There was a theft at the Louvre because, in a museum, security always takes a back seat to art and welcoming the public'",0,https://www.lemonde.fr/en/opinion/article/2025/12/19/there-was-a-theft-at-the-louvre-because-in-a-museum-security-always-takes-a-back-seat-to-art-and-welcoming-the-public_6748681_23.html,Subscribers only,Michel Guerrin,https://img.lemde.fr/2025/12/12/0/0/6144/4096/360/0/95/0/80affc2_ftp-1-mcenoaw4iqiy-1e24922755464a71ad58a71273e923d1-0-a1a103081d144b209392e008988f71b8.jpg 2x,
Trump and the risks of adventurism in Venezuela,0,https://www.lemonde.fr/en/opinion/article/2025/12/19/trump-and-the-risks-of-adventurism-in-venezuela_6748678_23.html,Not premium,Le Monde,https://img.lemde.fr/2025/12/12/0/0/6144/4096/360/0/95/0/80affc2_ftp-1-mcenoaw4iqiy-1e24922755464a71ad58a71273e923d1-0-a1a103081d144b209392e008988f71b8.jpg 2x,
"'Private geoengineering comes at a cost, and that cost is public'",0,https://www.lemonde.fr/en/opinion/article/2025/12/19/private-geoengineering-comes-at-a-cost-and-that-cost-is-public_6748677_23.html,Subscribers only,Janos Pasztor,https://img.lemde.fr/2025/12/12/0/0/6144/4096/360/0/95/0/80affc2_ftp-1-mcenoaw4iqiy-1e24922755464a71ad58a71273e923d1-0-a1a103081d144b209392e008988f71b8.jpg 2x,
"Pina Picierno, the Italian MEP threatened by Russia for backing Ukraine",0,https://www.lemonde.fr/en/m-le-mag/article/2025/12/19/pina-picierno-the-italian-mep-threatened-by-russia-for-backing-ukraine_6748658_117.html,Subscribers only,  By Olivier Faye ,https://img.lemde.fr/2025/12/12/0/0/6144/4096/360/0/95/0/80affc2_ftp-1-mcenoaw4iqiy-1e24922755464a71ad58a71273e923d1-0-a1a103081d144b209392e008988f71b8.jpg 2x,
"Astoria, Zohran Mamdani's working-class New York",0,https://www.lemonde.fr/en/m-le-mag/article/2025/12/19/astoria-zohran-mamdani-s-working-class-new-york_6748657_117.html,Subscribers only, By Nicolas Chapuis (New York (United States) correspondent) ,https://img.lemde.fr/2025/12/12/0/0/6144/4096/360/0/95/0/80affc2_ftp-1-mcenoaw4iqiy-1e24922755464a71ad58a71273e923d1-0-a1a103081d144b209392e008988f71b8.jpg 2x,
Trump's FBI purge: 'We are not trending toward an authoritarian force. We are at one',0,https://www.lemonde.fr/en/m-le-mag/article/2025/12/14/trump-s-fbi-purge-we-are-not-trending-toward-an-authoritarian-force-we-are-at-one_6748490_117.html,Subscribers only, By Olivier Faye ,https://img.lemde.fr/2025/12/12/0/0/6144/4096/360/0/95/0/80affc2_ftp-1-mcenoaw4iqiy-1e24922755464a71ad58a71273e923d1-0-a1a103081d144b209392e008988f71b8.jpg 2x,
A meat-forward restaurant and an exclusive club for the rich: The Washington of Trump loyalists,0,https://www.lemonde.fr/en/m-le-mag/article/2025/12/14/a-meat-forward-restaurant-and-an-exclusive-club-for-the-rich-the-washington-of-trump-loyalists_6748486_117.html,Subscribers only,  By Clément Ghys and Eve Minault ,https://img.lemde.fr/2025/12/12/0/0/6144/4096/360/0/95/0/80affc2_ftp-1-mcenoaw4iqiy-1e24922755464a71ad58a71273e923d1-0-a1a103081d144b209392e008988f71b8.jpg 2x,
Five creative craft workshops to enjoy doing in Paris with your child,0,https://www.lemonde.fr/en/intimacy/article/2025/12/13/in-paris-five-creative-craft-workshops-to-enjoy-doing-with-your-child_6748451_310.html,Subscribers only,  By Tiphaine Thuillier ,https://img.lemde.fr/2025/12/12/0/0/6144/4096/360/0/95/0/80affc2_ftp-1-mcenoaw4iqiy-1e24922755464a71ad58a71273e923d1-0-a1a103081d144b209392e008988f71b8.jpg 2x,
Jewels of power go on display in Paris,0,https://www.lemonde.fr/en/culture/article/2025/12/11/the-power-gems-on-display-in-paris_6748374_30.html,Not premium,  By Valentin Pérez   ,https://img.lemde.fr/2025/12/12/0/0/6144/4096/360/0/95/0/80affc2_ftp-1-mcenoaw4iqiy-1e24922755464a71ad58a71273e923d1-0-a1a103081d144b209392e008988f71b8.jpg 2x,
Five spots in Paris to enjoy a (great) plant-based sandwich,0,https://www.lemonde.fr/en/lifestyle/article/2025/12/04/in-paris-five-spots-to-enjoy-a-great-plant-based-sandwich_6748131_37.html,Subscribers only,  By Lucas Scaltritti ,https://img.lemde.fr/2025/12/12/0/0/6144/4096/360/0/95/0/80affc2_ftp-1-mcenoaw4iqiy-1e24922755464a71ad58a71273e923d1-0-a1a103081d144b209392e008988f71b8.jpg 2x,
"Bayonne's 'Little Louvre,' the Bonnat-Helleu Museum, reopens after 14 years",0,https://www.lemonde.fr/en/culture/article/2025/11/28/bayonne-s-little-louvre-the-bonnat-helleu-museum-reopens-after-14-years_6747913_30.html,Subscribers only,  By Roxana Azimi (Bayonne (France) special correspondent) ,https://img.lemde.fr/2025/12/12/0/0/6144/4096/360/0/95/0/80affc2_ftp-1-mcenoaw4iqiy-1e24922755464a71ad58a71273e923d1-0-a1a103081d144b209392e008988f71b8.jpg 2x,
Farmer anger spreads in protests from southern France to Brussels,"The protest movement among French farmers intensified on Thursday, fueled by the outbreak of lumpy skin disease among cattle. Convoys demonstrated in Brussels against the EU-Mercosur free trade agreement, changes to the EU's Common Agricultural Policy and a proposed new fertilizer tax.",https://www.lemonde.fr/en/economy/article/2025/12/19/farmer-anger-spreads-in-protests-from-southern-france-to-brussels_6748680_19.html,Subscribers only," By Philippe Gagnebet (Toulouse, correspondent), Richard Schittly (Lyon (France) correspondent), Jean-Pierre Stroobants (Brussels, correspondent) and Florence Traullé (Lille, correspondent) ",https://img.lemde.fr/2025/12/12/0/0/6144/4096/360/0/95/0/80affc2_ftp-1-mcenoaw4iqiy-1e24922755464a71ad58a71273e923d1-0-a1a103081d144b209392e008988f71b8.jpg 2x,
US says more than 70 targets hit in strikes against IS in Syria,0,https://www.lemonde.fr/en/international/article/2025/12/19/pentagon-announces-syria-operation-in-response-to-attack-on-us-troops_6748686_4.html,Not premium,Le Monde with AP and AFP,https://img.lemde.fr/2025/12/12/0/0/6144/4096/360/0/95/0/80affc2_ftp-1-mcenoaw4iqiy-1e24922755464a71ad58a71273e923d1-0-a1a103081d144b209392e008988f71b8.jpg 2x,
EU-Mercosur deal divides France's agricultural sectors,0,https://www.lemonde.fr/en/economy/article/2025/12/19/eu-mercosur-deal-divides-france-s-agricultural-sectors_6748675_19.html,Subscribers only,  By Laurence Girard ,https://img.lemde.fr/2025/12/12/0/0/6144/4096/360/0/95/0/80affc2_ftp-1-mcenoaw4iqiy-1e24922755464a71ad58a71273e923d1-0-a1a103081d144b209392e008988f71b8.jpg 2x,
"US Justice Department begins release of Epstein files, including previously unseen photos of Clinton","The vast disclosure included seven pages listing 254 masseuses – every name obscured beneath thick black bars and the explanation 'redacted to protect potential victim information.' The newly released photographs included a younger-looking Bill Clinton reclining in a hot tub, part of the image obscured by a stark black rectangle.",https://www.lemonde.fr/en/international/article/2025/12/20/us-justice-department-begins-release-of-epstein-files_6748690_4.html,Not premium,Le Monde with AFP,https://img.lemde.fr/2025/12/12/0/0/6144/4096/360/0/95/0/80affc2_ftp-1-mcenoaw4iqiy-1e24922755464a71ad58a71273e923d1-0-a1a103081d144b209392e008988f71b8.jpg 2x,
Trump announces lower drug price deals with 9 pharmaceutical companies,"The US President, on Friday, also vowed to urge US health insurance executives to voluntarily lower costs, as millions of Americans brace for a surge in premiums that could prove politically damaging for Republicans.",https://www.lemonde.fr/en/international/article/2025/12/19/trump-to-ask-health-insurance-companies-to-lower-costs-as-he-announces-lower-drug-price-deals_6748687_4.html,Not premium,Le Monde with AP and AFP,https://img.lemde.fr/2025/12/12/0/0/6144/4096/360/0/95/0/80affc2_ftp-1-mcenoaw4iqiy-1e24922755464a71ad58a71273e923d1-0-a1a103081d144b209392e008988f71b8.jpg 2x,
"'Emily in Paris,' season 5, on Netflix: Her weekend in Rome","The production moved a few episodes to Italy, where, once again, it is the character Sylvie, played by Philippine Leroy-Beaulieu, who delivers the best moments.",https://www.lemonde.fr/en/culture/article/2025/12/20/emily-in-paris-season-5-on-netflix-her-weekend-in-rome_6748689_30.html,Subscribers only,  By Audrey Fournier ,https://img.lemde.fr/2025/12/12/0/0/6144/4096/360/0/95/0/80affc2_ftp-1-mcenoaw4iqiy-1e24922755464a71ad58a71273e923d1-0-a1a103081d144b209392e008988f71b8.jpg 2x,
"'There was a theft at the Louvre because, in a museum, security always takes a back seat to art and welcoming the public'","Since the robbery on October 19, there have been calls for the resignation of Laurence des Cars, the institution's president. But she is far from being solely responsible for the failures that allowed this theft to take place, argues Le Monde columnist Michel Guerrin.",https://www.lemonde.fr/en/opinion/article/2025/12/19/there-was-a-theft-at-the-louvre-because-in-a-museum-security-always-takes-a-back-seat-to-art-and-welcoming-the-public_6748681_23.html,Subscribers only,Michel Guerrin,https://img.lemde.fr/2025/12/12/0/0/6144/4096/360/0/95/0/80affc2_ftp-1-mcenoaw4iqiy-1e24922755464a71ad58a71273e923d1-0-a1a103081d144b209392e008988f71b8.jpg 2x,Column
"Without a budget, France plans to start 2026 with special finance law",0,https://www.lemonde.fr/en/politics/article/2025/12/19/without-a-budget-france-plans-to-start-2026-with-special-finance-law_6748672_5.html,Subscribers only,  By Denis Cosnard ,https://img.lemde.fr/2025/12/12/0/0/6144/4096/360/0/95/0/80affc2_ftp-1-mcenoaw4iqiy-1e24922755464a71ad58a71273e923d1-0-a1a103081d144b209392e008988f71b8.jpg 2x,
Gaza civil defense says 5 killed in Israeli shelling of shelter,0,https://www.lemonde.fr/en/international/article/2025/12/19/gaza-civil-defense-says-5-killed-in-israeli-shelling-of-shelter_6748685_4.html,Not premium,Le Monde with AFP,https://img.lemde.fr/2025/12/12/0/0/6144/4096/360/0/95/0/80affc2_ftp-1-mcenoaw4iqiy-1e24922755464a71ad58a71273e923d1-0-a1a103081d144b209392e008988f71b8.jpg 2x,
Perrier: Nestlé allowed to continue natural mineral water production despite recent contamination incidents,0,https://www.lemonde.fr/en/environment/article/2025/12/19/perrier-nestle-allowed-to-continue-natural-mineral-water-production-despite-recent-contamination-incidents_6748673_114.html,Subscribers only,  By Stéphane Mandard ,https://img.lemde.fr/2025/12/12/0/0/6144/4096/360/0/95/0/80affc2_ftp-1-mcenoaw4iqiy-1e24922755464a71ad58a71273e923d1-0-a1a103081d144b209392e008988f71b8.jpg 2x,
Finland faces yet another racist scandal,0,https://www.lemonde.fr/en/international/article/2025/12/20/finland-faces-yet-another-racist-scandal_6748691_4.html,Subscribers only,  By Anne-Françoise Hivert (Malmö (Sweden) correspondent) ,https://img.lemde.fr/2025/12/12/0/0/6144/4096/360/0/95/0/80affc2_ftp-1-mcenoaw4iqiy-1e24922755464a71ad58a71273e923d1-0-a1a103081d144b209392e008988f71b8.jpg 2x,
"After a month of Shein at French department store BHV, controversy fails to boost sales",0,https://www.lemonde.fr/en/economy/article/2025/12/20/after-a-month-of-shein-at-french-department-store-bhv-controversy-fails-to-boost-sales_6748688_19.html,Subscribers only,  By Sacha Leclère ,https://img.lemde.fr/2025/12/12/0/0/6144/4096/360/0/95/0/80affc2_ftp-1-mcenoaw4iqiy-1e24922755464a71ad58a71273e923d1-0-a1a103081d144b209392e008988f71b8.jpg 2x,
Trump dogged by cost of living crisis and Republican revolt,0,https://www.lemonde.fr/en/international/article/2025/12/19/trump-dogged-by-cost-of-living-crisis-and-republican-dissent_6748663_4.html,Subscribers only,  By Piotr Smolar (Washington (United States) correspondent) ,https://img.lemde.fr/2025/12/12/0/0/6144/4096/360/0/95/0/80affc2_ftp-1-mcenoaw4iqiy-1e24922755464a71ad58a71273e923d1-0-a1a103081d144b209392e008988f71b8.jpg 2x,
Rubio says won't force deal on Ukraine as Europeans join Miami talks,0,https://www.lemonde.fr/en/international/article/2025/12/19/rubio-says-won-t-force-deal-on-ukraine-as-europeans-join-miami-talks_6748684_4.html,Not premium,Le Monde with AFP,https://img.lemde.fr/2025/12/12/0/0/6144/4096/360/0/95/0/80affc2_ftp-1-mcenoaw4iqiy-1e24922755464a71ad58a71273e923d1-0-a1a103081d144b209392e008988f71b8.jpg 2x,
US sets record defense budget but imposes limits on Donald Trump's military ambitions,0,https://www.lemonde.fr/en/international/article/2025/12/19/us-sets-record-defense-budget-but-imposes-limits-on-donald-trump-s-military-ambitions_6748683_4.html,Subscribers only,  By Chloé Hoorman and Elise Vincent ,https://img.lemde.fr/2025/12/12/0/0/6144/4096/360/0/95/0/80affc2_ftp-1-mcenoaw4iqiy-1e24922755464a71ad58a71273e923d1-0-a1a103081d144b209392e008988f71b8.jpg 2x,
"Louvre staff call off strike and museum to open 'as normal,' unions say",0,https://www.lemonde.fr/en/france/article/2025/12/19/louvre-staff-call-off-strike-museum-to-open-as-normal-unions_6748665_7.html,Not premium,Le Monde with AP and AFP,https://img.lemde.fr/2025/12/12/0/0/6144/4096/360/0/95/0/80affc2_ftp-1-mcenoaw4iqiy-1e24922755464a71ad58a71273e923d1-0-a1a103081d144b209392e008988f71b8.jpg 2x,
French public debt reaches a new high at 117.4% of GDP,0,https://www.lemonde.fr/en/politics/article/2025/12/19/french-public-debt-reaches-a-new-high-at-117-4-of-gdp_6748671_5.html,Subscribers only,  By Denis Cosnard ,https://img.lemde.fr/2025/12/12/0/0/6144/4096/360/0/95/0/80affc2_ftp-1-mcenoaw4iqiy-1e24922755464a71ad58a71273e923d1-0-a1a103081d144b209392e008988f71b8.jpg 2x,
"Astoria, Zohran Mamdani's working-class New York",0,https://www.lemonde.fr/en/m-le-mag/article/2025/12/19/astoria-zohran-mamdani-s-working-class-new-york_6748657_117.html,Subscribers only, By Nicolas Chapuis (New York (United States) correspondent) ,https://img.lemde.fr/2025/12/12/0/0/6144/4096/360/0/95/0/80affc2_ftp-1-mcenoaw4iqiy-1e24922755464a71ad58a71273e923d1-0-a1a103081d144b209392e008988f71b8.jpg 2x,
EU to loan €90 billion to Ukraine while delaying Mercosur deal,0,https://www.lemonde.fr/en/international/article/2025/12/19/eu-to-loan-90-billion-to-ukraine-amid-delay-to-mercosur-deal_6748666_4.html,Subscribers only,"  By Virginie Malingre (Brussels, Europe bureau) and Philippe Jacqué (Brussels, Europe bureau) ",https://img.lemde.fr/2025/12/12/0/0/6144/4096/360/0/95/0/80affc2_ftp-1-mcenoaw4iqiy-1e24922755464a71ad58a71273e923d1-0-a1a103081d144b209392e008988f71b8.jpg 2x,
'It is easier to flatter the people than to serve. Therein lies the last obstacle to an RN victory in 2027',"Populism has never been stronger in France, but there is a crucial difference between flattering the people and serving them, and the Rassemblement National is currently stumbling on that divide, writes Le Monde columnist Françoise Fressoz.",https://www.lemonde.fr/en/opinion/article/2025/12/16/it-is-easier-to-flatter-the-people-than-to-serve-therein-lies-the-last-obstacle-to-an-rn-victory-in-2027_6748559_23.html,Subscribers only,Françoise Fressoz,https://img.lemde.fr/2025/12/12/0/0/6144/4096/360/0/95/0/80affc2_ftp-1-mcenoaw4iqiy-1e24922755464a71ad58a71273e923d1-0-a1a103081d144b209392e008988f71b8.jpg 2x,Column
A French farmer's distress: 'I found the first dead cow when I went to the pasture',"Near Benque, a village an hour from Toulouse, farmer Christian Lasserre discovered three carcasses on Saturday. He fears a new outbreak of lumpy skin disease and the culling of the entire herd.",https://www.lemonde.fr/en/economy/article/2025/12/17/a-french-farmer-s-distress-i-found-the-first-dead-cow-when-i-went-to-the-pasture_6748577_19.html,Subscribers only," By Raphaëlle Bacqué (Benque (southwestern France), special correspondent) ",https://img.lemde.fr/2025/12/12/0/0/6144/4096/360/0/95/0/80affc2_ftp-1-mcenoaw4iqiy-1e24922755464a71ad58a71273e923d1-0-a1a103081d144b209392e008988f71b8.jpg 2x,Feature
New York's community kitchens reveal the American cost-of-living crisis,"In the world's largest economy, where prices for consumer goods, including food, have soared since the Covid-19 pandemic, 41 million people rely on government-issued food stamps to have enough to eat every day.",https://www.lemonde.fr/en/economy/article/2025/12/17/inside-one-of-new-york-s-community-kitchens-at-the-forefront-of-the-cost-of-living-crisis-in-the-united-states_6748570_19.html,Subscribers only,  By Nicolas Chapuis (New York (United States) correspondent) ,https://img.lemde.fr/2025/12/12/0/0/6144/4096/360/0/95/0/80affc2_ftp-1-mcenoaw4iqiy-1e24922755464a71ad58a71273e923d1-0-a1a103081d144b209392e008988f71b8.jpg 2x,Feature
Trump and the risks of adventurism in Venezuela,0,https://www.lemonde.fr/en/opinion/article/2025/12/19/trump-and-the-risks-of-adventurism-in-venezuela_6748678_23.html,Not premium,Le Monde,https://img.lemde.fr/2025/12/12/0/0/6144/4096/360/0/95/0/80affc2_ftp-1-mcenoaw4iqiy-1e24922755464a71ad58a71273e923d1-0-a1a103081d144b209392e008988f71b8.jpg 2x,Editorial
'The US doubts that a Europe it describes as decadent is worthy of being counted as an ally',0,https://www.lemonde.fr/en/opinion/article/2025/12/18/the-us-doubts-that-a-europe-it-describes-as-decadent-is-worthy-of-being-counted-as-an-ally_6748636_23.html,Subscribe,Alain Frachon,https://img.lemde.fr/2025/12/12/0/0/6144/4096/360/0/95/0/80affc2_ftp-1-mcenoaw4iqiy-1e24922755464a71ad58a71273e923d1-0-a1a103081d144b209392e008988f71b8.jpg 2x,Column
"Sydney attack: 'Relatively spared from terrorism, Australia is therefore less prepared for it'",0,https://www.lemonde.fr/en/opinion/article/2025/12/19/sydney-attack-relatively-spared-from-terrorism-australia-is-therefore-less-prepared-for-it_6748659_23.html,Subscribe,Romain Fathi,https://img.lemde.fr/2025/12/12/0/0/6144/4096/360/0/95/0/80affc2_ftp-1-mcenoaw4iqiy-1e24922755464a71ad58a71273e923d1-0-a1a103081d144b209392e008988f71b8.jpg 2x,Op-Ed
