title,subhead,url,suscription,byline,img_url,article_type
Israeli kibbutzim ravaged by October 7 attacks rebuild while honoring the past,0,https://www.lemonde.fr/en/international/article/2025/10/07/israeli-kibbutzim-ravaged-by-october-7-attacks-rebuild-while-honoring-the-past_6746174_4.html,Subscribers only, By Samuel Forey ,https://img.lemde.fr/2025/10/05/0/0/6000/4000/360/0/95/0/00d2f98_upload-1-dlrueirgvpuc-20250917-kibbutz-rehab-253.jpg 2x,
Trump's ineffective campaign to secure the Nobel Peace Prize,0,https://www.lemonde.fr/en/international/article/2025/10/07/donald-trump-s-ineffective-campaign-to-secure-the-nobel-peace-prize_6746172_4.html,Subscribers only,  By Anne-Françoise Hivert (Malmö (Sweden) correspondent) ,https://img.lemde.fr/2025/10/05/0/0/6000/4000/360/0/95/0/00d2f98_upload-1-dlrueirgvpuc-20250917-kibbutz-rehab-253.jpg 2x,
Tony Blair's denial of Palestine,0,https://www.lemonde.fr/en/international/article/2025/10/06/tony-blair-s-denial-of-palestine_6746164_4.html,Subscribers only,Jean-Pierre Filiu,https://img.lemde.fr/2025/10/05/0/0/6000/4000/360/0/95/0/00d2f98_upload-1-dlrueirgvpuc-20250917-kibbutz-rehab-253.jpg 2x,
Morocco's prime minister faces challenge from the streets,0,https://www.lemonde.fr/en/international/article/2025/10/06/morocco-s-prime-minister-faces-challenge-from-the-streets_6746161_4.html,Subscribers only,"  By Alexandre Aublanc (Casablanca (Morocco), correspondent) ",https://img.lemde.fr/2025/10/05/0/0/6000/4000/360/0/95/0/00d2f98_upload-1-dlrueirgvpuc-20250917-kibbutz-rehab-253.jpg 2x,
Sanctions against Russia spark rift between US and Europe over China,0,https://www.lemonde.fr/en/international/article/2025/09/15/sanctions-against-russia-spark-rift-between-us-and-europe-over-china_6745411_4.html,Subscribers only,"  By Philippe Jacqué (Brussels, Europe bureau), Philippe Ricard and Harold Thibault (Beijing (China) correspondent) ",https://img.lemde.fr/2025/10/05/0/0/6000/4000/360/0/95/0/00d2f98_upload-1-dlrueirgvpuc-20250917-kibbutz-rehab-253.jpg 2x,
France's political instability puts Franco-German alliance to the test,0,https://www.lemonde.fr/en/opinion/article/2025/08/30/france-s-political-instability-puts-franco-german-alliance-to-the-test_6744873_23.html,Not premium,Le Monde,https://img.lemde.fr/2025/10/05/0/0/6000/4000/360/0/95/0/00d2f98_upload-1-dlrueirgvpuc-20250917-kibbutz-rehab-253.jpg 2x,
France faces prospect of paying higher borrowing costs than Italy,0,https://www.lemonde.fr/en/economy/article/2025/08/19/france-faces-prospect-of-paying-higher-borrowing-costs-than-italy_6744519_19.html,Subscribers only,  By Denis Cosnard and Allan Kaval (Rome (Italy) correspondent) ,https://img.lemde.fr/2025/10/05/0/0/6000/4000/360/0/95/0/00d2f98_upload-1-dlrueirgvpuc-20250917-kibbutz-rehab-253.jpg 2x,
French man arrested in Slovenia for crimes committed in Croatia during 1991 war,0,https://www.lemonde.fr/en/international/article/2025/08/06/french-man-arrested-in-slovenia-for-crimes-committed-in-croatia-during-1991-war_6744113_4.html,Subscribers only,  By Stéphanie Maupas (The Hague (Netherlands) correspondent) and Richard Schittly (Lyon (France) correspondent) ,https://img.lemde.fr/2025/10/05/0/0/6000/4000/360/0/95/0/00d2f98_upload-1-dlrueirgvpuc-20250917-kibbutz-rehab-253.jpg 2x,
Pelicot rape appeal trial begins with feeling of déjà-vu,0,https://www.lemonde.fr/en/france/article/2025/10/07/pelicot-rape-appeal-trial-begins-with-feeling-of-deja-vu_6746188_7.html,Subscribers only,  By Henri Seckel ,https://img.lemde.fr/2025/10/05/0/0/6000/4000/360/0/95/0/00d2f98_upload-1-dlrueirgvpuc-20250917-kibbutz-rehab-253.jpg 2x,
"At the Jubillar trial, too much and too little in the first two weeks",0,https://www.lemonde.fr/en/france/article/2025/10/07/at-the-jubillar-trial-too-much-and-too-little-in-the-first-two-weeks_6746177_7.html,Subscribers only,  By Pascale Robert-Diard ,https://img.lemde.fr/2025/10/05/0/0/6000/4000/360/0/95/0/00d2f98_upload-1-dlrueirgvpuc-20250917-kibbutz-rehab-253.jpg 2x,
Pelicot rape case returns to court for lone appellant's trial,0,https://www.lemonde.fr/en/france/article/2025/10/06/pelicot-rape-case-returns-to-court-for-lone-appellant-s-trial_6746131_7.html,Subscribers only,  By Henri Seckel ,https://img.lemde.fr/2025/10/05/0/0/6000/4000/360/0/95/0/00d2f98_upload-1-dlrueirgvpuc-20250917-kibbutz-rehab-253.jpg 2x,
"At Cédric Jubillar's trial, a snapshot of cruelty",0,https://www.lemonde.fr/en/france/article/2025/10/03/at-cedric-jubillar-s-trial-a-snapshot-of-cruelty_6746048_7.html,Subscribers only,"  By Pascale Robert-Diard (Albi, special correspondent) ",https://img.lemde.fr/2025/10/05/0/0/6000/4000/360/0/95/0/00d2f98_upload-1-dlrueirgvpuc-20250917-kibbutz-rehab-253.jpg 2x,
Afghanistan: Relentless repression continues over four years into Taliban's rule,0,https://www.lemonde.fr/en/videos/video/2025/10/04/afghanistan-relentless-repression-continues-over-four-years-into-taliban-s-rule_6746092_108.html,Not premium,"  By Chloé Denis, Félix Pommier (Motion design) and Sinead McCausland ",https://img.lemde.fr/2025/10/05/0/0/6000/4000/360/0/95/0/00d2f98_upload-1-dlrueirgvpuc-20250917-kibbutz-rehab-253.jpg 2x,
Watch: Hundreds of thousands march in France against budget cuts,0,https://www.lemonde.fr/en/videos/video/2025/09/19/french-strikes-watch-what-happened-as-hundreds-of-thousands-marched-against-budget-cuts_6745548_108.html,Not premium,  By Le Monde's video desk   ,https://img.lemde.fr/2025/10/05/0/0/6000/4000/360/0/95/0/00d2f98_upload-1-dlrueirgvpuc-20250917-kibbutz-rehab-253.jpg 2x,
Emmys 2025: 'Adolescence' star Owen Cooper becomes youngest winner for best supporting actor,0,https://www.lemonde.fr/en/videos/video/2025/09/15/emmys-2025-adolescence-star-owen-cooper-becomes-youngest-winner-for-best-supporting-actor_6745427_108.html,Not premium,  By Le Monde's video desk   ,https://img.lemde.fr/2025/10/05/0/0/6000/4000/360/0/95/0/00d2f98_upload-1-dlrueirgvpuc-20250917-kibbutz-rehab-253.jpg 2x,
"From 'influence peddling' to 'corruption,' what is French Culture Minister Rachida Dati accused of?",0,https://www.lemonde.fr/en/videos/video/2025/09/06/from-influence-peddling-to-corruption-what-is-french-culture-minister-rachida-dati-accused-of_6745094_108.html,Not premium,"  By Alexis Tromas, Arthur Navet (Motion design) and Sinead McCausland ",https://img.lemde.fr/2025/10/05/0/0/6000/4000/360/0/95/0/00d2f98_upload-1-dlrueirgvpuc-20250917-kibbutz-rehab-253.jpg 2x,
France's political crisis shows leaders losing their sense of responsibility,0,https://www.lemonde.fr/en/opinion/article/2025/10/07/france-s-political-crisis-shows-leaders-losing-their-sense-of-responsibility_6746187_23.html,Not premium,Le Monde,https://img.lemde.fr/2025/10/05/0/0/6000/4000/360/0/95/0/00d2f98_upload-1-dlrueirgvpuc-20250917-kibbutz-rehab-253.jpg 2x,
'French politics has become baroque',0,https://www.lemonde.fr/en/opinion/article/2025/10/06/french-politics-has-become-baroque_6746150_23.html,Subscribers only,Bruno Cautrès,https://img.lemde.fr/2025/10/05/0/0/6000/4000/360/0/95/0/00d2f98_upload-1-dlrueirgvpuc-20250917-kibbutz-rehab-253.jpg 2x,
Did Lecornu ever truly believe in his promise of change?,0,https://www.lemonde.fr/en/opinion/article/2025/10/06/did-lecornu-ever-truly-believe-in-his-promise-of-change_6746149_23.html,Subscribers only,Nathalie Segaunes,https://img.lemde.fr/2025/10/05/0/0/6000/4000/360/0/95/0/00d2f98_upload-1-dlrueirgvpuc-20250917-kibbutz-rehab-253.jpg 2x,
Trump's Gaza plan: A glimmer of hope that needs support,0,https://www.lemonde.fr/en/opinion/article/2025/10/06/trump-s-gaza-plan-a-glimmer-of-hope-that-needs-support_6746146_23.html,Not premium,Le Monde,https://img.lemde.fr/2025/10/05/0/0/6000/4000/360/0/95/0/00d2f98_upload-1-dlrueirgvpuc-20250917-kibbutz-rehab-253.jpg 2x,
Sweden's new list of 'cultural values' sparks controversy,0,https://www.lemonde.fr/en/m-le-mag/article/2025/10/05/a-tool-for-integration-or-identity-politics-sweden-s-new-list-of-cultural-values-sparks-controversy_6746124_117.html,Subscribers only,  By Anne-Françoise Hivert (Malmö (Sweden) regional correspondent) ,https://img.lemde.fr/2025/10/05/0/0/6000/4000/360/0/95/0/00d2f98_upload-1-dlrueirgvpuc-20250917-kibbutz-rehab-253.jpg 2x,
The making of the Agnès b. cardigan,0,https://www.lemonde.fr/en/m-le-mag/article/2025/10/05/the-making-of-the-agnes-b-cardigan_6746115_117.html,Subscribers only, By Sophie Abriat ,https://img.lemde.fr/2025/10/05/0/0/6000/4000/360/0/95/0/00d2f98_upload-1-dlrueirgvpuc-20250917-kibbutz-rehab-253.jpg 2x,
The West Bank village of Palestine's forgotten Americans,0,https://www.lemonde.fr/en/m-le-mag/article/2025/10/05/the-west-bank-village-of-palestine-s-forgotten-americans_6746112_117.html,Subscribers only, By Sandra Mehl ,https://img.lemde.fr/2025/10/05/0/0/6000/4000/360/0/95/0/00d2f98_upload-1-dlrueirgvpuc-20250917-kibbutz-rehab-253.jpg 2x,
The dyeing marvels of 'magician' Serge Haouzi,0,https://www.lemonde.fr/en/m-le-mag/article/2025/10/05/the-dyeing-marvels-of-magician-serge-haouzi_6746106_117.html,Subscribers only, By Sophie Abriat ,https://img.lemde.fr/2025/10/05/0/0/6000/4000/360/0/95/0/00d2f98_upload-1-dlrueirgvpuc-20250917-kibbutz-rehab-253.jpg 2x,
Five fun ways to discover Paris and its surroundings with your family,0,https://www.lemonde.fr/en/intimacy/article/2025/10/02/five-fun-ways-to-discover-paris-and-its-surroundings-with-your-family_6745998_310.html,Subscribers only,  By Tiphaine Thuillier ,https://img.lemde.fr/2025/10/05/0/0/6000/4000/360/0/95/0/00d2f98_upload-1-dlrueirgvpuc-20250917-kibbutz-rehab-253.jpg 2x,
Emma Reyes's still lifes relive in two Paris exhibitions,0,https://www.lemonde.fr/en/culture/article/2025/09/28/emma-reyes-still-lifes-finds-new-life-in-two-paris-exhibitions_6745877_30.html,Subscribers only,  By Emmanuelle Jardonnet ,https://img.lemde.fr/2025/10/05/0/0/6000/4000/360/0/95/0/00d2f98_upload-1-dlrueirgvpuc-20250917-kibbutz-rehab-253.jpg 2x,
Tradition done right: Five Paris restaurants reimagining the classics,0,https://www.lemonde.fr/en/lifestyle/article/2025/09/08/tradition-done-right-five-paris-restaurants-reimagining-the-classics_6745133_37.html,Subscribers only, By Léo Pajon ,https://img.lemde.fr/2025/10/05/0/0/6000/4000/360/0/95/0/00d2f98_upload-1-dlrueirgvpuc-20250917-kibbutz-rehab-253.jpg 2x,
Paris Design Week: A 15th edition marked by abundance,0,https://www.lemonde.fr/en/lifestyle/article/2025/09/05/paris-design-week-a-15th-edition-marked-by-abundance_6745060_37.html,Subscribers only,  By Véronique Lorelle ,https://img.lemde.fr/2025/10/05/0/0/6000/4000/360/0/95/0/00d2f98_upload-1-dlrueirgvpuc-20250917-kibbutz-rehab-253.jpg 2x,
"After PM's resignation, Macron hints at snap elections","President Emmanuel Macron gave Sébastien Lecornu 48 hours to resolve the crisis, saying he will 'take his responsibilities' if efforts fail. The move was a way of pushing the Socialists and conservatives toward compromise.",https://www.lemonde.fr/en/politics/article/2025/10/07/after-pm-s-resignation-macron-hints-at-snap-elections_6746179_5.html,Subscribers only,  By Nathalie Segaunes ,https://img.lemde.fr/2025/10/05/0/0/6000/4000/360/0/95/0/00d2f98_upload-1-dlrueirgvpuc-20250917-kibbutz-rehab-253.jpg 2x,
Israeli kibbutzim ravaged by October 7 attacks rebuild while honoring the past,"Be'eri, Kfar Aza and Nir Oz were the communities hit the hardest by the attack carried out by Hamas two years ago. Since then, each has tried to reinvent itself, in its own way and at its own pace.",https://www.lemonde.fr/en/international/article/2025/10/07/israeli-kibbutzim-ravaged-by-october-7-attacks-rebuild-while-honoring-the-past_6746174_4.html,Subscribers only, By Samuel Forey ,https://img.lemde.fr/2025/10/05/0/0/6000/4000/360/0/95/0/00d2f98_upload-1-dlrueirgvpuc-20250917-kibbutz-rehab-253.jpg 2x,
Pelicot rape appeal trial begins with feeling of déjà-vu,"The only convicted defendant to appeal claimed on Monday that he had not intended to rape, repeating the argument he made at the first trial. He is expected to confront Dominique Pelicot and video evidence of his acts on Tuesday.",https://www.lemonde.fr/en/france/article/2025/10/07/pelicot-rape-appeal-trial-begins-with-feeling-of-deja-vu_6746188_7.html,Subscribers only,  By Henri Seckel ,https://img.lemde.fr/2025/10/05/0/0/6000/4000/360/0/95/0/00d2f98_upload-1-dlrueirgvpuc-20250917-kibbutz-rehab-253.jpg 2x,
Trump's ineffective campaign to secure the Nobel Peace Prize,"The American president's aggressive tactics have taken Norwegian experts by surprise. Yet in Oslo, the committee responsible for awarding the prize remains unfazed by attempts at influence, according to its secretary.",https://www.lemonde.fr/en/international/article/2025/10/07/donald-trump-s-ineffective-campaign-to-secure-the-nobel-peace-prize_6746172_4.html,Subscribers only,  By Anne-Françoise Hivert (Malmö (Sweden) correspondent) ,https://img.lemde.fr/2025/10/05/0/0/6000/4000/360/0/95/0/00d2f98_upload-1-dlrueirgvpuc-20250917-kibbutz-rehab-253.jpg 2x,
"With Matthieu Blazy, Chanel leaps into a new universe",The French-Belgian designer's first show for Chanel on Monday was one of the most highly anticipated events of Paris Fashion Week. His flair for craftsmanship and the elegance of Gabrielle Chanel blended seamlessly in this spring-summer 2026 collection.,https://www.lemonde.fr/en/lifestyle/article/2025/10/07/with-matthieu-blazy-chanel-dives-into-a-new-universe_6746183_37.html,Not premium, By Elvire von Bardeleben ,https://img.lemde.fr/2025/10/05/0/0/6000/4000/360/0/95/0/00d2f98_upload-1-dlrueirgvpuc-20250917-kibbutz-rehab-253.jpg 2x,News
2025 Nobel Prize in Physics rewards research into quantum mechanical tunneling,0,https://www.lemonde.fr/en/international/article/2025/10/07/2025-nobel-prize-in-physics-rewards-research-into-quantum-mechanical-tunneling_6746186_4.html,Not premium,Le Monde with AP,https://img.lemde.fr/2025/10/05/0/0/6000/4000/360/0/95/0/00d2f98_upload-1-dlrueirgvpuc-20250917-kibbutz-rehab-253.jpg 2x,
"First day of Hamas-Israel talks in Egypt ends on 'positive' note, mediators say",0,https://www.lemonde.fr/en/international/article/2025/10/07/first-day-of-hamas-israel-talks-in-egypt-ends-on-positive-note-mediators-say_6746168_4.html,Not premium,Le Monde with AFP,https://img.lemde.fr/2025/10/05/0/0/6000/4000/360/0/95/0/00d2f98_upload-1-dlrueirgvpuc-20250917-kibbutz-rehab-253.jpg 2x,
France's left more fragmented than ever after Lecornu's resignation,0,https://www.lemonde.fr/en/politics/article/2025/10/07/france-s-left-more-fragmented-than-ever-after-lecornu-s-resignation_6746176_5.html,Subscribers only,  By Sandrine Cassini and Olivier Pérou ,https://img.lemde.fr/2025/10/05/0/0/6000/4000/360/0/95/0/00d2f98_upload-1-dlrueirgvpuc-20250917-kibbutz-rehab-253.jpg 2x,
Far right calls for snap elections after Lecornu's resignation,0,https://www.lemonde.fr/en/politics/article/2025/10/07/far-right-calls-for-snap-legislative-elections-after-lecornu-s-resignation_6746181_5.html,Subscribers only,  By Clément Guillou and Corentin Lesueur ,https://img.lemde.fr/2025/10/05/0/0/6000/4000/360/0/95/0/00d2f98_upload-1-dlrueirgvpuc-20250917-kibbutz-rehab-253.jpg 2x,
"Antoni Lallican, photojournalist killed in Ukraine, was 'insatiably curious and truly interested in others'",0,https://www.lemonde.fr/en/obituaries/article/2025/10/07/antoni-lallican-a-french-photojournalist-killed-in-ukraine-was-insatiably-curious-and-truly-interested-in-others_6746169_15.html,Subscribers only, By Aude Dassonville and Brice Laemle ,https://img.lemde.fr/2025/10/05/0/0/6000/4000/360/0/95/0/00d2f98_upload-1-dlrueirgvpuc-20250917-kibbutz-rehab-253.jpg 2x,
Madagascar president names army general as prime minister amid youth-led protests,0,https://www.lemonde.fr/en/international/article/2025/10/06/madagascar-president-names-army-general-as-prime-minister-amid-youth-led-protests_6746166_4.html,Not premium,Le Monde with AFP,https://img.lemde.fr/2025/10/05/0/0/6000/4000/360/0/95/0/00d2f98_upload-1-dlrueirgvpuc-20250917-kibbutz-rehab-253.jpg 2x,
Germany's Merz says EU should scrap 2035 combustion engine ban,0,https://www.lemonde.fr/en/international/article/2025/10/07/germany-s-merz-says-eu-should-scrap-2035-combustion-engine-ban_6746167_4.html,Not premium,Le Monde with AFP,https://img.lemde.fr/2025/10/05/0/0/6000/4000/360/0/95/0/00d2f98_upload-1-dlrueirgvpuc-20250917-kibbutz-rehab-253.jpg 2x,
Financial markets forced to adapt to French political uncertainty,0,https://www.lemonde.fr/en/economy/article/2025/10/07/financial-markets-forced-to-adapt-to-french-political-uncertainty_6746170_19.html,Subscribers only,  By Marc Angrand ,https://img.lemde.fr/2025/10/05/0/0/6000/4000/360/0/95/0/00d2f98_upload-1-dlrueirgvpuc-20250917-kibbutz-rehab-253.jpg 2x,
Egyptian Khaled El-Enany is elected to lead UNESCO,0,https://www.lemonde.fr/en/culture/article/2025/10/07/egyptian-khaled-el-enany-is-elected-to-lead-unesco_6746171_30.html,Subscribers only,  By Roxana Azimi   ,https://img.lemde.fr/2025/10/05/0/0/6000/4000/360/0/95/0/00d2f98_upload-1-dlrueirgvpuc-20250917-kibbutz-rehab-253.jpg 2x,
Morocco's prime minister faces challenge from the streets,0,https://www.lemonde.fr/en/international/article/2025/10/06/morocco-s-prime-minister-faces-challenge-from-the-streets_6746161_4.html,Subscribers only,"  By Alexandre Aublanc (Casablanca (Morocco), correspondent) ",https://img.lemde.fr/2025/10/05/0/0/6000/4000/360/0/95/0/00d2f98_upload-1-dlrueirgvpuc-20250917-kibbutz-rehab-253.jpg 2x,
Sweden's new list of 'cultural values' sparks controversy,"'Pippi Longstocking,' Ikea, Bergman: In early September, Sweden's conservative government unveiled a list aimed at defining a 'common frame of reference' to promote the integration of foreigners. The opposition has condemned the project's nostalgic vision.",https://www.lemonde.fr/en/m-le-mag/article/2025/10/05/a-tool-for-integration-or-identity-politics-sweden-s-new-list-of-cultural-values-sparks-controversy_6746124_117.html,Subscribers only,  By Anne-Françoise Hivert (Malmö (Sweden) regional correspondent) ,https://img.lemde.fr/2025/10/05/0/0/6000/4000/360/0/95/0/00d2f98_upload-1-dlrueirgvpuc-20250917-kibbutz-rehab-253.jpg 2x,In Depth
Morocco's prime minister faces challenge from the streets,"Aziz Akhannouch finds himself under pressure, as part of the country's youth calls on King Mohammed VI to remove him from office. The king is expected to address Parliament on Friday.",https://www.lemonde.fr/en/international/article/2025/10/06/morocco-s-prime-minister-faces-challenge-from-the-streets_6746161_4.html,Subscribers only,"  By Alexandre Aublanc (Casablanca (Morocco), correspondent) ",https://img.lemde.fr/2025/10/05/0/0/6000/4000/360/0/95/0/00d2f98_upload-1-dlrueirgvpuc-20250917-kibbutz-rehab-253.jpg 2x,News
Tony Blair's denial of Palestine,"The close ties between former British prime minister Tony Blair and Benjamin Netanyahu have made him a key player in Donald Trump's plan for Gaza, writes historian Jean-Pierre Filiu in his column.",https://www.lemonde.fr/en/international/article/2025/10/06/tony-blair-s-denial-of-palestine_6746164_4.html,Subscribers only,Jean-Pierre Filiu,https://img.lemde.fr/2025/10/05/0/0/6000/4000/360/0/95/0/00d2f98_upload-1-dlrueirgvpuc-20250917-kibbutz-rehab-253.jpg 2x,Column
France's political crisis shows leaders losing their sense of responsibility,0,https://www.lemonde.fr/en/opinion/article/2025/10/07/france-s-political-crisis-shows-leaders-losing-their-sense-of-responsibility_6746187_23.html,Not premium,Le Monde,https://img.lemde.fr/2025/10/05/0/0/6000/4000/360/0/95/0/00d2f98_upload-1-dlrueirgvpuc-20250917-kibbutz-rehab-253.jpg 2x,Editorial
Trump's Gaza plan: A glimmer of hope that needs support,0,https://www.lemonde.fr/en/opinion/article/2025/10/06/trump-s-gaza-plan-a-glimmer-of-hope-that-needs-support_6746146_23.html,Not premium,Le Monde,https://img.lemde.fr/2025/10/05/0/0/6000/4000/360/0/95/0/00d2f98_upload-1-dlrueirgvpuc-20250917-kibbutz-rehab-253.jpg 2x,Editorial
Haoues Seniguer: 'The lack of a political solution in the Israel-Palestine conflict has benefited a brutalized form of religion',0,https://www.lemonde.fr/en/religions/article/2025/10/06/haoues-seniguer-the-lack-of-a-political-solution-in-the-israel-palestine-conflict-has-benefited-a-brutalized-form-of-religion_6746129_63.html,Subscribe,  Interview by Virginie Larousse ,https://img.lemde.fr/2025/10/05/0/0/6000/4000/360/0/95/0/00d2f98_upload-1-dlrueirgvpuc-20250917-kibbutz-rehab-253.jpg 2x,Interview
