title,subhead,url,suscription,byline,img_url,article_type
"In the defense industry, Franco-German projects face deep uncertainty",0,https://www.lemonde.fr/en/international/article/2025/08/30/in-the-defense-industry-franco-german-projects-face-deep-uncertainty_6744862_4.html,Subscribers only,  By Olivier Pinaud ,https://img.lemde.fr/2025/08/29/0/0/5736/3824/360/0/95/0/896f69c_upload-1-4ifieleupx7i-789142.jpg 2x,
US uses visa restrictions against Palestinian Authority ahead of UN General Assembly,0,https://www.lemonde.fr/en/international/article/2025/08/30/the-us-uses-visa-restrictions-against-the-palestinian-authority-ahead-of-the-un-general-assembly_6744857_4.html,Subscribers only,  By Piotr Smolar (Washington (United States) correspondent) ,https://img.lemde.fr/2025/08/29/0/0/5736/3824/360/0/95/0/896f69c_upload-1-4ifieleupx7i-789142.jpg 2x,
"In Japan, a misunderstood cooperation project with Africa sparks xenophobic backlash",0,https://www.lemonde.fr/en/international/article/2025/08/30/in-japan-a-misunderstood-cooperation-project-with-africa-sparks-xenophobic-backlash_6744856_4.html,Subscribers only,  By Philippe Mesmer (Tokyo (Japan) correspondent) ,https://img.lemde.fr/2025/08/29/0/0/5736/3824/360/0/95/0/896f69c_upload-1-4ifieleupx7i-789142.jpg 2x,
Trump's MAGA supporters split over his foreign policy,0,https://www.lemonde.fr/en/international/article/2025/08/29/trump-s-supporters-split-over-his-foreign-policy_6744837_4.html,Subscribers only,  By Piotr Smolar (Washington (United States) correspondent) ,https://img.lemde.fr/2025/08/29/0/0/5736/3824/360/0/95/0/896f69c_upload-1-4ifieleupx7i-789142.jpg 2x,
France faces prospect of paying higher borrowing costs than Italy,0,https://www.lemonde.fr/en/economy/article/2025/08/19/france-faces-prospect-of-paying-higher-borrowing-costs-than-italy_6744519_19.html,Subscribers only,  By Denis Cosnard and Allan Kaval (Rome (Italy) correspondent) ,https://img.lemde.fr/2025/08/29/0/0/5736/3824/360/0/95/0/896f69c_upload-1-4ifieleupx7i-789142.jpg 2x,
French man arrested in Slovenia for crimes committed in Croatia during 1991 war,0,https://www.lemonde.fr/en/international/article/2025/08/06/french-man-arrested-in-slovenia-for-crimes-committed-in-croatia-during-1991-war_6744113_4.html,Subscribers only,  By Stéphanie Maupas (The Hague (Netherlands) correspondent) and Richard Schittly (Lyon (France) correspondent) ,https://img.lemde.fr/2025/08/29/0/0/5736/3824/360/0/95/0/896f69c_upload-1-4ifieleupx7i-789142.jpg 2x,
"30 years after the Bosnian War, its refugees still cannot return home",0,https://www.lemonde.fr/en/international/article/2025/08/03/thirty-years-after-the-bosnian-war-its-refugees-still-cannot-return-home_6744026_4.html,Subscribers only," By Jean-Baptiste Chastand (Visegrad, Bosnia and Herzegovina, special correspondent) ",https://img.lemde.fr/2025/08/29/0/0/5736/3824/360/0/95/0/896f69c_upload-1-4ifieleupx7i-789142.jpg 2x,
Early and intense wildfire season has arrived around the Mediterranean,0,https://www.lemonde.fr/en/europe/article/2025/07/17/wildfire-season-arrives-early-and-intense-around-the-mediterranean_6743466_143.html,Subscribers only,"  By Maryline Baumard, Olivier Bonnel (Rome, correspondent), Nicolas Bourcier (Istanbul (Turkey) correspondent), Isabelle Piquer (Madrid (Spain) correspondent), Marina Rafenberg (Athens (Greece) correspondent) and Hélène Sallon (Beirut (Lebanon) correspondent) ",https://img.lemde.fr/2025/08/29/0/0/5736/3824/360/0/95/0/896f69c_upload-1-4ifieleupx7i-789142.jpg 2x,
Macron vows to serve out his mandate amid budget crisis,0,https://www.lemonde.fr/en/france/article/2025/08/29/macron-vows-to-serve-out-his-mandate-amid-budget-crisis_6744846_7.html,Not premium,Le Monde with AFP,https://img.lemde.fr/2025/08/29/0/0/5736/3824/360/0/95/0/896f69c_upload-1-4ifieleupx7i-789142.jpg 2x,
"Conditions for scholarship students in France continue to worsen: 'We work, we get assistance, but we're still poor'",0,https://www.lemonde.fr/en/france/article/2025/08/29/conditions-for-scholarship-students-in-france-continue-to-worsen-we-work-we-get-assistance-but-we-re-still-poor_6744819_7.html,Subscribers only,  By Emma Barets ,https://img.lemde.fr/2025/08/29/0/0/5736/3824/360/0/95/0/896f69c_upload-1-4ifieleupx7i-789142.jpg 2x,
France faces record number of homeless children as school year begins,0,https://www.lemonde.fr/en/france/article/2025/08/28/france-faces-record-number-of-homeless-children-as-school-year-begins_6744812_7.html,Subscribers only,  By Claire Ané ,https://img.lemde.fr/2025/08/29/0/0/5736/3824/360/0/95/0/896f69c_upload-1-4ifieleupx7i-789142.jpg 2x,
Confidence vote: Online bettors put French PM Bayrou's downfall at 89%,0,https://www.lemonde.fr/en/france/article/2025/08/28/confidence-vote-online-bettors-put-pm-bayrou-s-downfall-at-89_6744783_7.html,Subscribers only,  By Denis Cosnard ,https://img.lemde.fr/2025/08/29/0/0/5736/3824/360/0/95/0/896f69c_upload-1-4ifieleupx7i-789142.jpg 2x,
Watch: Tsunami warnings sound in Japan after 8.8 magnitude quake off Russian coast,0,https://www.lemonde.fr/en/videos/video/2025/07/30/watch-tsunami-warnings-sound-in-japan-after-8-8-magnitude-quake-off-russian-coast_6743900_108.html,Not premium,No byline,https://img.lemde.fr/2025/08/29/0/0/5736/3824/360/0/95/0/896f69c_upload-1-4ifieleupx7i-789142.jpg 2x,
What is France's 'Black code' and why hasn't it been repealed?,0,https://www.lemonde.fr/en/videos/video/2025/05/31/what-is-france-s-black-code-and-why-hasn-t-it-been-repealed_6741860_108.html,Not premium,"  By Chloé Denis, Olivier Escher (motion design) and Diana Liu ",https://img.lemde.fr/2025/08/29/0/0/5736/3824/360/0/95/0/896f69c_upload-1-4ifieleupx7i-789142.jpg 2x,
How was the European Union created?,0,https://www.lemonde.fr/en/videos/video/2025/05/29/how-was-the-european-union-created_6741795_108.html,Not premium,"  By Alexis Tromas, Robin Gasser (motion design) and Diana Liu ",https://img.lemde.fr/2025/08/29/0/0/5736/3824/360/0/95/0/896f69c_upload-1-4ifieleupx7i-789142.jpg 2x,
Glide bombs: Russia's secret to making cheap weapons,0,https://www.lemonde.fr/en/videos/video/2025/05/25/glide-bombs-russia-s-secret-to-making-cheap-weapons_6741646_108.html,Subscribers only,"  By Thomas Eydoux, Marceau Bretonnier and Sinead McCausland ",https://img.lemde.fr/2025/08/29/0/0/5736/3824/360/0/95/0/896f69c_upload-1-4ifieleupx7i-789142.jpg 2x,
France: Compromising on a budget is necessary to avoid spiraling debt,0,https://www.lemonde.fr/en/opinion/article/2025/08/29/france-compromising-on-a-budget-is-necessary-to-avoid-spiraling-debt_6744839_23.html,Not premium,Le Monde,https://img.lemde.fr/2025/08/29/0/0/5736/3824/360/0/95/0/896f69c_upload-1-4ifieleupx7i-789142.jpg 2x,
'Pretending that environmental protection is just a concern for hipsters means leaving the working-class population to their fate',0,https://www.lemonde.fr/en/opinion/article/2025/08/30/pretending-that-environmental-protection-is-just-a-concern-for-hipsters-means-leaving-the-working-class-population-to-their-fate_6744855_23.html,Subscribers only,Lutz Sager,https://img.lemde.fr/2025/08/29/0/0/5736/3824/360/0/95/0/896f69c_upload-1-4ifieleupx7i-789142.jpg 2x,
Iranian nuclear issue requires urgent diplomatic action,0,https://www.lemonde.fr/en/opinion/article/2025/08/28/iranian-nuclear-program-requires-urgent-diplomatic-action_6744804_23.html,Not premium,Le Monde,https://img.lemde.fr/2025/08/29/0/0/5736/3824/360/0/95/0/896f69c_upload-1-4ifieleupx7i-789142.jpg 2x,
'French PM Bayrou's near-abdication is perplexing',0,https://www.lemonde.fr/en/opinion/article/2025/08/28/french-pm-bayrou-s-near-abdication-is-perplexing_6744788_23.html,Subscribers only,Olivier Rozenberg,https://img.lemde.fr/2025/08/29/0/0/5736/3824/360/0/95/0/896f69c_upload-1-4ifieleupx7i-789142.jpg 2x,
"Vanessa Paradis, a French icon",0,https://www.lemonde.fr/en/m-le-mag/article/2025/08/30/vanessa-paradis-a-french-icon_6744859_117.html,Subscribers only, By Elise Karlin ,https://img.lemde.fr/2025/08/29/0/0/5736/3824/360/0/95/0/896f69c_upload-1-4ifieleupx7i-789142.jpg 2x,
Argentina falls in love with a poetic livestream from the ocean: 'Patrick Star is Argentinian!',0,https://www.lemonde.fr/en/m-le-mag/article/2025/08/29/how-argentina-fell-in-love-with-a-poetic-live-stream-from-the-depths-of-the-ocean-patrick-the-starfish-is-argentinian_6744822_117.html,Subscribers only,  By Flora Genoux (Buenos Aires (Argentina) correspondent) ,https://img.lemde.fr/2025/08/29/0/0/5736/3824/360/0/95/0/896f69c_upload-1-4ifieleupx7i-789142.jpg 2x,
"In Kyiv, Oleksandr Glyadelov's images defy the bombs",0,https://www.lemonde.fr/en/m-le-mag/article/2025/08/28/in-kyiv-oleksandr-glyadelov-s-images-defy-the-bombs_6744816_117.html,Subscribers only,  By Ariane Chemin ,https://img.lemde.fr/2025/08/29/0/0/5736/3824/360/0/95/0/896f69c_upload-1-4ifieleupx7i-789142.jpg 2x,
"Who is Ibtissame Lachgar, the Moroccan activist accused of insulting Islam?",0,https://www.lemonde.fr/en/m-le-mag/article/2025/08/27/who-is-ibtissame-lachgar-the-moroccan-activist-accused-of-insulting-islam_6744767_117.html,Subscribers only,"  By Alexandre Aublanc (Casablanca (Morocco), correspondent) ",https://img.lemde.fr/2025/08/29/0/0/5736/3824/360/0/95/0/896f69c_upload-1-4ifieleupx7i-789142.jpg 2x,
"At Musée d'Orsay, a Courbet painting gets a new life before visitors' eyes",0,https://www.lemonde.fr/en/culture/article/2025/07/26/at-musee-d-orsay-a-courbet-painting-gets-a-new-life-before-visitors-eyes_6743744_30.html,Subscribers only,  By Max Blanc ,https://img.lemde.fr/2025/08/29/0/0/5736/3824/360/0/95/0/896f69c_upload-1-4ifieleupx7i-789142.jpg 2x,
Avignon Festival 2025: An edition marked by emotion and fragility,0,https://www.lemonde.fr/en/culture/article/2025/07/26/avignon-festival-2025-an-edition-marked-by-emotion-and-fragility_6743733_30.html,Subscribers only,"  By Fabienne Darge (Avignon, France, special correspondent) ",https://img.lemde.fr/2025/08/29/0/0/5736/3824/360/0/95/0/896f69c_upload-1-4ifieleupx7i-789142.jpg 2x,
The challenge of surtitling at the Avignon Festival,0,https://www.lemonde.fr/en/culture/article/2025/07/20/the-challenge-of-surtitling-at-the-avignon-festival_6743560_30.html,Subscribers only,  By Calypso Joyeux ,https://img.lemde.fr/2025/08/29/0/0/5736/3824/360/0/95/0/896f69c_upload-1-4ifieleupx7i-789142.jpg 2x,
"In Arles, Fragonard's Museum of Fashion and Costume gracefully unveils treasures",0,https://www.lemonde.fr/en/m-le-mag/article/2025/07/17/in-arles-fragonard-s-museum-of-fashion-and-costume-gracefully-unveils-treasures_6743450_117.html,Subscribers only, By Litza Georgopoulos ,https://img.lemde.fr/2025/08/29/0/0/5736/3824/360/0/95/0/896f69c_upload-1-4ifieleupx7i-789142.jpg 2x,
"Vanessa Paradis, a French icon","Recognized today as both a singer and an actress, the artist still appears affected by the attacks she suffered early during her fame. With the release of her eighth album 'Le Retour des beaux jours' ('The Return of Sunny Days'), Paradis agreed to an interview, but remained on her guard.",https://www.lemonde.fr/en/m-le-mag/article/2025/08/30/vanessa-paradis-a-french-icon_6744859_117.html,Subscribers only, By Elise Karlin ,https://img.lemde.fr/2025/08/29/0/0/5736/3824/360/0/95/0/896f69c_upload-1-4ifieleupx7i-789142.jpg 2x,
US appeals court finds Trump's global tariffs illegal,0,https://www.lemonde.fr/en/international/article/2025/08/30/us-appeals-court-finds-trump-s-global-tariffs-illegal_6744853_4.html,Not premium,Le Monde with AFP,https://img.lemde.fr/2025/08/29/0/0/5736/3824/360/0/95/0/896f69c_upload-1-4ifieleupx7i-789142.jpg 2x,
US uses visa restrictions against Palestinian Authority ahead of UN General Assembly,0,https://www.lemonde.fr/en/international/article/2025/08/30/the-us-uses-visa-restrictions-against-the-palestinian-authority-ahead-of-the-un-general-assembly_6744857_4.html,Subscribers only,  By Piotr Smolar (Washington (United States) correspondent) ,https://img.lemde.fr/2025/08/29/0/0/5736/3824/360/0/95/0/896f69c_upload-1-4ifieleupx7i-789142.jpg 2x,
"In Japan, a misunderstood cooperation project with Africa sparks xenophobic backlash","Outraged reactions from many Japanese citizens to the program – largely fueled by misinformation – reveal growing anxiety about immigration, even though it is necessary in an aging country.",https://www.lemonde.fr/en/international/article/2025/08/30/in-japan-a-misunderstood-cooperation-project-with-africa-sparks-xenophobic-backlash_6744856_4.html,Subscribers only,  By Philippe Mesmer (Tokyo (Japan) correspondent) ,https://img.lemde.fr/2025/08/29/0/0/5736/3824/360/0/95/0/896f69c_upload-1-4ifieleupx7i-789142.jpg 2x,
'Pretending that environmental protection is just a concern for hipsters means leaving the working-class population to their fate',"Economist Lutz Sager writes in an op-ed for Le Monde that underserved communities are the first victims of air pollution, which causes 40,000 preventable deaths each year in France.",https://www.lemonde.fr/en/opinion/article/2025/08/30/pretending-that-environmental-protection-is-just-a-concern-for-hipsters-means-leaving-the-working-class-population-to-their-fate_6744855_23.html,Subscribers only,Lutz Sager,https://img.lemde.fr/2025/08/29/0/0/5736/3824/360/0/95/0/896f69c_upload-1-4ifieleupx7i-789142.jpg 2x,
"Venice Film Festival: Noah Baumbach, Yorgos Lanthimos and Werner Herzog test our belief systems with layers of nuance",Several of the films that premiered at the beginning of the festival invited viewers to reflect on questions of identity.,https://www.lemonde.fr/en/culture/article/2025/08/30/venice-film-festival-noah-baumbach-yorgos-lanthimos-and-werner-herzog-test-our-belief-systems-with-layers-of-nuance_6744854_30.html,Subscribers only,  By Boris Bastide ,https://img.lemde.fr/2025/08/29/0/0/5736/3824/360/0/95/0/896f69c_upload-1-4ifieleupx7i-789142.jpg 2x,
"Ultra-processed foods cause negative health effects within weeks, study finds","In a clinical trial similar to those used for testing medicines, scientists studied the health impacts of a diet filled with ultra-processed foods. Results show that numerous biological processes are affected.",https://www.lemonde.fr/en/science/article/2025/08/30/ultra-processed-foods-cause-negative-health-effects-within-weeks-study-finds_6744861_10.html,Subscribers only,  By Stéphane Foucart ,https://img.lemde.fr/2025/08/29/0/0/5736/3824/360/0/95/0/896f69c_upload-1-4ifieleupx7i-789142.jpg 2x,News
White House lashes out at 'foreign influence' after 'Politico' criticizes US envoy Witkoff,0,https://www.lemonde.fr/en/international/article/2025/08/29/white-house-lashes-out-at-foreign-influence-after-politico-criticizes-us-envoy-witkoff_6744851_4.html,Not premium,Le Monde with AFP,https://img.lemde.fr/2025/08/29/0/0/5736/3824/360/0/95/0/896f69c_upload-1-4ifieleupx7i-789142.jpg 2x,
Texas governor signs new voting map pushed by Trump to gain 5 GOP seats in Congress in 2026,0,https://www.lemonde.fr/en/international/article/2025/08/30/texas-governor-signs-new-voting-map-pushed-by-trump-to-gain-5-gop-seats-in-congress-in-2026_6744860_4.html,Not premium,Le Monde with AP,https://img.lemde.fr/2025/08/29/0/0/5736/3824/360/0/95/0/896f69c_upload-1-4ifieleupx7i-789142.jpg 2x,
Ben Shelton and Frances Tiafoe crash out in the third round of the US Open,0,https://www.lemonde.fr/en/sports/article/2025/08/30/ben-shelton-and-frances-tiafoe-crash-out-in-the-third-round-of-the-us-open_6744858_9.html,Not premium,Le Monde with AP and AFP,https://img.lemde.fr/2025/08/29/0/0/5736/3824/360/0/95/0/896f69c_upload-1-4ifieleupx7i-789142.jpg 2x,
Are tariffs good for the climate?,0,https://www.lemonde.fr/en/economy/article/2025/08/29/are-tariffs-good-for-the-climate_6744848_19.html,Subscribers only,  By Eric Albert ,https://img.lemde.fr/2025/08/29/0/0/5736/3824/360/0/95/0/896f69c_upload-1-4ifieleupx7i-789142.jpg 2x,
EU rocked by Trump's attack on digital regulation,0,https://www.lemonde.fr/en/economy/article/2025/08/29/eu-rocked-by-trump-s-attack-on-digital-regulation_6744852_19.html,Subscribers only,  By Cédric Vallet (Brussels (Belgium) correspondent) ,https://img.lemde.fr/2025/08/29/0/0/5736/3824/360/0/95/0/896f69c_upload-1-4ifieleupx7i-789142.jpg 2x,
"Trump moves to block $5 billion in foreign aid, raising risk of government shutdown",0,https://www.lemonde.fr/en/international/article/2025/08/29/trump-moves-to-block-5-billion-in-foreign-aid-raising-risk-of-government-shutdown_6744849_4.html,Not premium,Le Monde with AFP,https://img.lemde.fr/2025/08/29/0/0/5736/3824/360/0/95/0/896f69c_upload-1-4ifieleupx7i-789142.jpg 2x,
"At Gaza's border, influencers broadcast Israeli propaganda",0,https://www.lemonde.fr/en/international/article/2025/08/29/at-gaza-s-border-influencers-broadcast-israeli-propaganda_6744833_4.html,Subscribers only,"  By Luc Bronner (Jerusalem, correspondent) ",https://img.lemde.fr/2025/08/29/0/0/5736/3824/360/0/95/0/896f69c_upload-1-4ifieleupx7i-789142.jpg 2x,
Russia hits out at Macron for calling Putin an 'ogre',0,https://www.lemonde.fr/en/international/article/2025/08/29/russia-hits-out-at-macron-for-calling-putin-an-ogre_6744840_4.html,Not premium,Le Monde with AFP,https://img.lemde.fr/2025/08/29/0/0/5736/3824/360/0/95/0/896f69c_upload-1-4ifieleupx7i-789142.jpg 2x,
French unions call for nationwide strike over 'horror show' budget,0,https://www.lemonde.fr/en/politics/article/2025/08/29/french-unions-call-for-nationwide-strike-over-horror-show-budget_6744841_5.html,Not premium,Le Monde with AFP,https://img.lemde.fr/2025/08/29/0/0/5736/3824/360/0/95/0/896f69c_upload-1-4ifieleupx7i-789142.jpg 2x,
France's deficit reduction threatened by expected fall of PM Bayrou,0,https://www.lemonde.fr/en/politics/article/2025/08/29/france-s-deficit-reduction-threatened-by-expected-fall-of-pm-bayrou_6744835_5.html,Subscribers only,  By Denis Cosnard ,https://img.lemde.fr/2025/08/29/0/0/5736/3824/360/0/95/0/896f69c_upload-1-4ifieleupx7i-789142.jpg 2x,
Trump's MAGA supporters split over his foreign policy,0,https://www.lemonde.fr/en/international/article/2025/08/29/trump-s-supporters-split-over-his-foreign-policy_6744837_4.html,Subscribers only,  By Piotr Smolar (Washington (United States) correspondent) ,https://img.lemde.fr/2025/08/29/0/0/5736/3824/360/0/95/0/896f69c_upload-1-4ifieleupx7i-789142.jpg 2x,
Macron vows to serve out his mandate amid budget crisis,0,https://www.lemonde.fr/en/france/article/2025/08/29/macron-vows-to-serve-out-his-mandate-amid-budget-crisis_6744846_7.html,Not premium,Le Monde with AFP,https://img.lemde.fr/2025/08/29/0/0/5736/3824/360/0/95/0/896f69c_upload-1-4ifieleupx7i-789142.jpg 2x,
"Mohammed VI, Islam and the Islamists","'The Enigma of Mohammed VI' (6/6). His status as 'commander of the faithful' has given the Moroccan king a unique aura and has enabled him to push back against the ambitions of Islamists, whose political project and way of life he rejects.",https://www.lemonde.fr/en/summer-reads/article/2025/08/29/mohammed-vi-islam-and-the-islamists_6744845_183.html,Subscribers only, By Christophe Ayad and Frédéric Bobin ,https://img.lemde.fr/2025/08/29/0/0/5736/3824/360/0/95/0/896f69c_upload-1-4ifieleupx7i-789142.jpg 2x,Investigation
Air quality in Paris: Monitoring agency reports significant improvement over 10 years,"According to Airparif, the independent body monitoring air quality in the Paris region, policies have had a 'significant and measurable impact.'",https://www.lemonde.fr/en/environment/article/2025/08/29/air-quality-in-paris-airparif-reports-significant-improvement-over-ten-years_6744818_114.html,Subscribers only,  By Hélène Bekmezian ,https://img.lemde.fr/2025/08/29/0/0/5736/3824/360/0/95/0/896f69c_upload-1-4ifieleupx7i-789142.jpg 2x,News
France faces record number of homeless children as school year begins,"The seventh annual barometer conducted by UNICEF France and the Federation of Solidarity Actors found that 2,159 children were left without shelter on the night of August 18, even after their families had managed to reach the emergency housing hotline.",https://www.lemonde.fr/en/france/article/2025/08/28/france-faces-record-number-of-homeless-children-as-school-year-begins_6744812_7.html,Subscribers only,  By Claire Ané ,https://img.lemde.fr/2025/08/29/0/0/5736/3824/360/0/95/0/896f69c_upload-1-4ifieleupx7i-789142.jpg 2x,In Depth
France: Compromising on a budget is necessary to avoid spiraling debt,0,https://www.lemonde.fr/en/opinion/article/2025/08/29/france-compromising-on-a-budget-is-necessary-to-avoid-spiraling-debt_6744839_23.html,Not premium,Le Monde,https://img.lemde.fr/2025/08/29/0/0/5736/3824/360/0/95/0/896f69c_upload-1-4ifieleupx7i-789142.jpg 2x,Editorial
French PM Bayrou's high-stakes gamble,0,https://www.lemonde.fr/en/opinion/article/2025/08/26/french-pm-bayrou-s-high-stakes-gamble_6744728_23.html,Not premium,Le Monde,https://img.lemde.fr/2025/08/29/0/0/5736/3824/360/0/95/0/896f69c_upload-1-4ifieleupx7i-789142.jpg 2x,Editorial
Live death of French streamer: 'It took a tragedy and a media storm to force the government to act',0,https://www.lemonde.fr/en/opinion/article/2025/08/27/live-death-of-french-streamer-it-took-a-tragedy-and-a-media-storm-to-force-the-government-to-act_6744771_23.html,Subscribe,Nathalie Tehio,https://img.lemde.fr/2025/08/29/0/0/5736/3824/360/0/95/0/896f69c_upload-1-4ifieleupx7i-789142.jpg 2x,Op-Ed
