title,subhead,url,suscription,byline,img_url,article_type
Israel and EU reach deal for slow resumption of humanitarian aid in Gaza,0,https://www.lemonde.fr/en/international/article/2025/07/12/israel-and-eu-reach-deal-for-slow-resumption-of-humanitarian-aid-in-gaza_6743307_4.html,Subscribers only,"  By Philippe Jacqué (Brussels, Europe bureau) and Lucas Minisini (Tel Aviv (Israel) special correspondent) ",https://img.lemde.fr/2025/07/10/0/0/6000/4000/360/0/95/0/cb24d34_ftp-import-images-1-3xfjcw3esaxr-0e196d055a544b1fae27d381414fcba7-2-7932695e3d284478b5d90688f836d2f9.jpg 2x,
"Srebrenica massacre commemoration: 30 years later, the enduring bitterness of grieving families",0,https://www.lemonde.fr/en/international/article/2025/07/12/srebrenica-massacre-commemoration-30-years-later-the-enduring-bitterness-of-grieving-families_6743301_4.html,Subscribers only, By Jean-Baptiste Chastand (Srebrenica (Bosnia) special correspondent) ,https://img.lemde.fr/2025/07/10/0/0/6000/4000/360/0/95/0/cb24d34_ftp-import-images-1-3xfjcw3esaxr-0e196d055a544b1fae27d381414fcba7-2-7932695e3d284478b5d90688f836d2f9.jpg 2x,
The ICC petitions to end Russia's plundering of Ukrainian museums,0,https://www.lemonde.fr/en/international/article/2025/07/12/the-icc-petitions-to-end-russia-s-plundering-of-ukrainian-museums_6743292_4.html,Subscribers only,  By Franck Johannès ,https://img.lemde.fr/2025/07/10/0/0/6000/4000/360/0/95/0/cb24d34_ftp-import-images-1-3xfjcw3esaxr-0e196d055a544b1fae27d381414fcba7-2-7932695e3d284478b5d90688f836d2f9.jpg 2x,
"New York, a political laboratory for Democrats",0,https://www.lemonde.fr/en/international/article/2025/07/11/new-york-a-political-laboratory-for-democrats_6743283_4.html,Subscribers only,  By Piotr Smolar (Washington (United States) correspondent) ,https://img.lemde.fr/2025/07/10/0/0/6000/4000/360/0/95/0/cb24d34_ftp-import-images-1-3xfjcw3esaxr-0e196d055a544b1fae27d381414fcba7-2-7932695e3d284478b5d90688f836d2f9.jpg 2x,
"Srebrenica massacre commemoration: 30 years later, the enduring bitterness of grieving families",0,https://www.lemonde.fr/en/international/article/2025/07/12/srebrenica-massacre-commemoration-30-years-later-the-enduring-bitterness-of-grieving-families_6743301_4.html,Subscribers only, By Jean-Baptiste Chastand (Srebrenica (Bosnia) special correspondent) ,https://img.lemde.fr/2025/07/10/0/0/6000/4000/360/0/95/0/cb24d34_ftp-import-images-1-3xfjcw3esaxr-0e196d055a544b1fae27d381414fcba7-2-7932695e3d284478b5d90688f836d2f9.jpg 2x,
International justice confronts the genocide of Srebrenica,0,https://www.lemonde.fr/en/international/article/2025/07/11/international-justice-confronts-the-genocide-of-srebrenica_6743275_4.html,Subscribers only,  By Stéphanie Maupas (The Hague (Netherlands) correspondent) ,https://img.lemde.fr/2025/07/10/0/0/6000/4000/360/0/95/0/cb24d34_ftp-import-images-1-3xfjcw3esaxr-0e196d055a544b1fae27d381414fcba7-2-7932695e3d284478b5d90688f836d2f9.jpg 2x,
"In Srebrenica, 30 years after the genocide, the 'vicious circle' of denial continues",0,https://www.lemonde.fr/en/international/article/2025/07/11/in-srebrenica-30-years-after-the-genocide-the-vicious-circle-of-denial-continues_6743270_4.html,Subscribers only," By Jean-Baptiste Chastand (Srebrenica [Bosnia and Herzegovina], special correspondent) ",https://img.lemde.fr/2025/07/10/0/0/6000/4000/360/0/95/0/cb24d34_ftp-import-images-1-3xfjcw3esaxr-0e196d055a544b1fae27d381414fcba7-2-7932695e3d284478b5d90688f836d2f9.jpg 2x,
London hopes for a shift in French immigration policy in the Channel,0,https://www.lemonde.fr/en/international/article/2025/07/09/london-hopes-for-a-shift-in-french-immigration-policy-in-the-english-channel_6743178_4.html,Subscribers only,"  By Cécile Ducourtieux (London, correspondent) and Julia Pascual ",https://img.lemde.fr/2025/07/10/0/0/6000/4000/360/0/95/0/cb24d34_ftp-import-images-1-3xfjcw3esaxr-0e196d055a544b1fae27d381414fcba7-2-7932695e3d284478b5d90688f836d2f9.jpg 2x,
Paris police deployed en masse ahead of PSG final and Bastille Day,0,https://www.lemonde.fr/en/france/article/2025/07/12/paris-police-deployed-en-masse-ahead-of-psg-final-and-bastille-day_6743311_7.html,Not premium,Le Monde with AFP,https://img.lemde.fr/2025/07/10/0/0/6000/4000/360/0/95/0/cb24d34_ftp-import-images-1-3xfjcw3esaxr-0e196d055a544b1fae27d381414fcba7-2-7932695e3d284478b5d90688f836d2f9.jpg 2x,
French police raid far-right RN party's HQ over suspected illegal campaign financing,0,https://www.lemonde.fr/en/france/article/2025/07/09/french-police-raid-far-right-rn-party-s-hq-over-suspected-illegal-campaign-financing_6743193_7.html,Subscribers only,  By Laura Motet and Clément Guillou ,https://img.lemde.fr/2025/07/10/0/0/6000/4000/360/0/95/0/cb24d34_ftp-import-images-1-3xfjcw3esaxr-0e196d055a544b1fae27d381414fcba7-2-7932695e3d284478b5d90688f836d2f9.jpg 2x,
Poverty and inequality in France reach highest levels in 30 years,0,https://www.lemonde.fr/en/france/article/2025/07/09/poverty-and-inequality-in-france-reach-highest-levels-in-30-years_6743177_7.html,Subscribers only,  By Claire Ané ,https://img.lemde.fr/2025/07/10/0/0/6000/4000/360/0/95/0/cb24d34_ftp-import-images-1-3xfjcw3esaxr-0e196d055a544b1fae27d381414fcba7-2-7932695e3d284478b5d90688f836d2f9.jpg 2x,
Man sentenced to life without parole for 2019 jihadist attack in French prison,0,https://www.lemonde.fr/en/france/article/2025/07/08/man-sentenced-to-life-without-parole-for-2019-jihadist-attack-in-french-prison_6743146_7.html,Subscribers only,  By Soren Seelow ,https://img.lemde.fr/2025/07/10/0/0/6000/4000/360/0/95/0/cb24d34_ftp-import-images-1-3xfjcw3esaxr-0e196d055a544b1fae27d381414fcba7-2-7932695e3d284478b5d90688f836d2f9.jpg 2x,
What is France's 'Black code' and why hasn't it been repealed?,0,https://www.lemonde.fr/en/videos/video/2025/05/31/what-is-france-s-black-code-and-why-hasn-t-it-been-repealed_6741860_108.html,Not premium,"  By Chloé Denis, Olivier Escher (motion design) and Diana Liu ",https://img.lemde.fr/2025/07/10/0/0/6000/4000/360/0/95/0/cb24d34_ftp-import-images-1-3xfjcw3esaxr-0e196d055a544b1fae27d381414fcba7-2-7932695e3d284478b5d90688f836d2f9.jpg 2x,
How was the European Union created?,0,https://www.lemonde.fr/en/videos/video/2025/05/29/how-was-the-european-union-created_6741795_108.html,Not premium,"  By Alexis Tromas, Robin Gasser (motion design) and Diana Liu ",https://img.lemde.fr/2025/07/10/0/0/6000/4000/360/0/95/0/cb24d34_ftp-import-images-1-3xfjcw3esaxr-0e196d055a544b1fae27d381414fcba7-2-7932695e3d284478b5d90688f836d2f9.jpg 2x,
Glide bombs: Russia's secret to making cheap weapons,0,https://www.lemonde.fr/en/videos/video/2025/05/25/glide-bombs-russia-s-secret-to-making-cheap-weapons_6741646_108.html,Subscribers only,"  By Thomas Eydoux, Marceau Bretonnier and Sinead McCausland ",https://img.lemde.fr/2025/07/10/0/0/6000/4000/360/0/95/0/cb24d34_ftp-import-images-1-3xfjcw3esaxr-0e196d055a544b1fae27d381414fcba7-2-7932695e3d284478b5d90688f836d2f9.jpg 2x,
How does the conclave pick the new pope?,0,https://www.lemonde.fr/en/videos/video/2025/05/07/how-does-the-conclave-pick-the-new-pope_6741005_108.html,Not premium,"  By Alexis Tromas, Félix Pommier (Motion design) and Diana Liu ",https://img.lemde.fr/2025/07/10/0/0/6000/4000/360/0/95/0/cb24d34_ftp-import-images-1-3xfjcw3esaxr-0e196d055a544b1fae27d381414fcba7-2-7932695e3d284478b5d90688f836d2f9.jpg 2x,
Thomas Piketty: 'The US's unprecedented financial fragility explains Trump's aggressiveness',0,https://www.lemonde.fr/en/opinion/article/2025/07/12/thomas-piketty-the-us-s-unprecedented-financial-fragility-explains-trump-s-aggressiveness_6743298_23.html,Subscribers only,Thomas Piketty,https://img.lemde.fr/2025/07/10/0/0/6000/4000/360/0/95/0/cb24d34_ftp-import-images-1-3xfjcw3esaxr-0e196d055a544b1fae27d381414fcba7-2-7932695e3d284478b5d90688f836d2f9.jpg 2x,
French budget: Wealthy pensioners must contribute,0,https://www.lemonde.fr/en/opinion/article/2025/07/12/french-budget-wealthy-pensioners-must-contribute_6743310_23.html,Not premium,Le Monde,https://img.lemde.fr/2025/07/10/0/0/6000/4000/360/0/95/0/cb24d34_ftp-import-images-1-3xfjcw3esaxr-0e196d055a544b1fae27d381414fcba7-2-7932695e3d284478b5d90688f836d2f9.jpg 2x,
"With Channel migration deal, France and UK show shared determination",0,https://www.lemonde.fr/en/opinion/article/2025/07/11/with-channel-migration-agreement-france-and-uk-show-shared-determination_6743272_23.html,Not premium,Le Monde,https://img.lemde.fr/2025/07/10/0/0/6000/4000/360/0/95/0/cb24d34_ftp-import-images-1-3xfjcw3esaxr-0e196d055a544b1fae27d381414fcba7-2-7932695e3d284478b5d90688f836d2f9.jpg 2x,
Support for Ukraine: 'Europeans still hope Trump will maintain his backing on intelligence',0,https://www.lemonde.fr/en/opinion/article/2025/07/11/support-for-ukraine-europeans-still-hope-trump-will-maintain-his-backing-on-intelligence_6743256_23.html,Subscribers only,Philippe Ricard,https://img.lemde.fr/2025/07/10/0/0/6000/4000/360/0/95/0/cb24d34_ftp-import-images-1-3xfjcw3esaxr-0e196d055a544b1fae27d381414fcba7-2-7932695e3d284478b5d90688f836d2f9.jpg 2x,
Nonprofit helps French festivals fight gender-based violence,0,https://www.lemonde.fr/en/m-le-mag/article/2025/07/11/nonprofit-helps-french-festivals-fight-gender-based-violence_6743284_117.html,Subscribers only,  By Christelle Murhula ,https://img.lemde.fr/2025/07/10/0/0/6000/4000/360/0/95/0/cb24d34_ftp-import-images-1-3xfjcw3esaxr-0e196d055a544b1fae27d381414fcba7-2-7932695e3d284478b5d90688f836d2f9.jpg 2x,
Spain's Costa Blanca bears the scars of a real estate frenzy,0,https://www.lemonde.fr/en/m-le-mag/article/2025/07/09/spain-s-costa-blanca-bears-the-scars-of-a-real-estate-frenzy_6743171_117.html,Subscribers only, By Sandrine Morel (Madrid (Spain) correspondent) ,https://img.lemde.fr/2025/07/10/0/0/6000/4000/360/0/95/0/cb24d34_ftp-import-images-1-3xfjcw3esaxr-0e196d055a544b1fae27d381414fcba7-2-7932695e3d284478b5d90688f836d2f9.jpg 2x,
In the jaws of the Jackal: How an informant orchestrated a policewoman's fall,0,https://www.lemonde.fr/en/m-le-mag/article/2025/07/06/in-the-jaws-of-the-jackal-how-an-informant-orchestrated-a-policewoman-s-fall_6743075_117.html,Subscribers only, By Raphaël Malkin ,https://img.lemde.fr/2025/07/10/0/0/6000/4000/360/0/95/0/cb24d34_ftp-import-images-1-3xfjcw3esaxr-0e196d055a544b1fae27d381414fcba7-2-7932695e3d284478b5d90688f836d2f9.jpg 2x,
"The arms dealer, the general's daughter and the speed demon: An inheritance battle",0,https://www.lemonde.fr/en/m-le-mag/article/2025/07/06/the-arms-dealer-the-general-s-daughter-and-the-speed-demon-an-inheritance-battle_6743074_117.html,Subscribers only, By François Krug ,https://img.lemde.fr/2025/07/10/0/0/6000/4000/360/0/95/0/cb24d34_ftp-import-images-1-3xfjcw3esaxr-0e196d055a544b1fae27d381414fcba7-2-7932695e3d284478b5d90688f836d2f9.jpg 2x,
"Avignon Festival: 'When I Saw the Sea', Ali Chahrour's peaceful and political work",0,https://www.lemonde.fr/en/culture/article/2025/07/10/avignon-festival-when-i-saw-the-sea-ali-chahrour-s-peaceful-and-political-work_6743233_30.html,Subscribers only,  By Rosita Boisseau (Avignon (France) special correspondent) ,https://img.lemde.fr/2025/07/10/0/0/6000/4000/360/0/95/0/cb24d34_ftp-import-images-1-3xfjcw3esaxr-0e196d055a544b1fae27d381414fcba7-2-7932695e3d284478b5d90688f836d2f9.jpg 2x,
Nice's Contemporary Art Biennale explores the city's unique relationship to the sea,0,https://www.lemonde.fr/en/culture/article/2025/07/06/nice-s-contemporary-art-biennale-explores-the-city-s-unique-relationship-to-the-sea_6743081_30.html,Subscribers only,  By Harry Bellet (Nice) ,https://img.lemde.fr/2025/07/10/0/0/6000/4000/360/0/95/0/cb24d34_ftp-import-images-1-3xfjcw3esaxr-0e196d055a544b1fae27d381414fcba7-2-7932695e3d284478b5d90688f836d2f9.jpg 2x,
"Dubuffet, Hokusai, Giacometti: 20 must-see exhibitions this summer, in Paris and beyond",0,https://www.lemonde.fr/en/culture/article/2025/06/28/20-must-see-exhibitions-this-summer-in-paris-and-beyond_6742801_30.html,Subscribers only,"  By Roxana Azimi, Harry Bellet, Philippe Dagen, Alexis Duval, Angèle Guicharnaud, Claire Guillot, Emmanuelle Jardonnet, Sylvie Kerviel and Emmanuelle Lequeux ",https://img.lemde.fr/2025/07/10/0/0/6000/4000/360/0/95/0/cb24d34_ftp-import-images-1-3xfjcw3esaxr-0e196d055a544b1fae27d381414fcba7-2-7932695e3d284478b5d90688f836d2f9.jpg 2x,
Five cultural outings to enjoy with a baby in Paris,0,https://www.lemonde.fr/en/intimacy/article/2025/06/27/five-cultural-outings-to-enjoy-in-paris-with-a-baby_6742762_310.html,Subscribers only,  By Tiphaine Thuillier ,https://img.lemde.fr/2025/07/10/0/0/6000/4000/360/0/95/0/cb24d34_ftp-import-images-1-3xfjcw3esaxr-0e196d055a544b1fae27d381414fcba7-2-7932695e3d284478b5d90688f836d2f9.jpg 2x,
"How Trump adapts his tariff threats for economic, diplomatic and ideological ends",The American president has threatened the European Union and Mexico with a 30% tariff starting August 1.,https://www.lemonde.fr/en/economy/article/2025/07/12/how-trump-adapts-his-tariff-threats-for-economic-diplomatic-and-ideological-ends_6743313_19.html,Subscribers only,  By Gilles Paris (Washington (United States) special correspondent) ,https://img.lemde.fr/2025/07/10/0/0/6000/4000/360/0/95/0/cb24d34_ftp-import-images-1-3xfjcw3esaxr-0e196d055a544b1fae27d381414fcba7-2-7932695e3d284478b5d90688f836d2f9.jpg 2x,
'State of New Caledonia' created in hard-won agreement  with French government,0,https://www.lemonde.fr/en/politics/article/2025/07/12/state-of-new-caledonia-created-in-hard-won-agreement-with-french-government_6743299_5.html,Subscribers only,  By Nathalie Guibert ,https://img.lemde.fr/2025/07/10/0/0/6000/4000/360/0/95/0/cb24d34_ftp-import-images-1-3xfjcw3esaxr-0e196d055a544b1fae27d381414fcba7-2-7932695e3d284478b5d90688f836d2f9.jpg 2x,
Paris police deployed en masse ahead of PSG final and Bastille Day,0,https://www.lemonde.fr/en/france/article/2025/07/12/paris-police-deployed-en-masse-ahead-of-psg-final-and-bastille-day_6743311_7.html,Not premium,Le Monde with AFP,https://img.lemde.fr/2025/07/10/0/0/6000/4000/360/0/95/0/cb24d34_ftp-import-images-1-3xfjcw3esaxr-0e196d055a544b1fae27d381414fcba7-2-7932695e3d284478b5d90688f836d2f9.jpg 2x,
Israel and EU reach deal for slow resumption of humanitarian aid in Gaza,"Under pressure from Europe, Israel says it will once again allow aid deliveries into the Palestinian enclave. However, on the ground, aid groups are struggling to see any tangible effects from the agreement.",https://www.lemonde.fr/en/international/article/2025/07/12/israel-and-eu-reach-deal-for-slow-resumption-of-humanitarian-aid-in-gaza_6743307_4.html,Subscribers only,"  By Philippe Jacqué (Brussels, Europe bureau) and Lucas Minisini (Tel Aviv (Israel) special correspondent) ",https://img.lemde.fr/2025/07/10/0/0/6000/4000/360/0/95/0/cb24d34_ftp-import-images-1-3xfjcw3esaxr-0e196d055a544b1fae27d381414fcba7-2-7932695e3d284478b5d90688f836d2f9.jpg 2x,
"Swiatek destroys Anisimova 6-0, 6-0 to win first Wimbledon title",The Polish eighth seed was in charge from the first point and wrapped up victory in just 57 minutes in a brutal display of precision hitting on Centre Court on Saturday.,https://www.lemonde.fr/en/sports/article/2025/07/12/swiatek-destroys-anisimova-6-0-6-0-to-win-first-wimbledon-title_6743314_9.html,Not premium,Le Monde with AFP,https://img.lemde.fr/2025/07/10/0/0/6000/4000/360/0/95/0/cb24d34_ftp-import-images-1-3xfjcw3esaxr-0e196d055a544b1fae27d381414fcba7-2-7932695e3d284478b5d90688f836d2f9.jpg 2x,
Tour de France: Jonathan Milan wins Stage 8 in sprint finish,Italy's Milan overtook Australian Kaden Groves on his left and held off Belgian rider Wout van Aert to beat him by about half a bike length on Saturday.,https://www.lemonde.fr/en/sports/article/2025/07/12/tour-de-france-jonathan-milan-wins-stage-8-in-sprint-finish_6743315_9.html,Not premium,Le Monde with AFP,https://img.lemde.fr/2025/07/10/0/0/6000/4000/360/0/95/0/cb24d34_ftp-import-images-1-3xfjcw3esaxr-0e196d055a544b1fae27d381414fcba7-2-7932695e3d284478b5d90688f836d2f9.jpg 2x,
"Capucine, 27, mergers and acquisitions analyst, €5,300 a month: 'We looked at the salaries and said we were going to live like royalty'","What does earning a good living mean? Capucine (name has been changed), a finance analyst at a major bank in London, exhausts herself at work during the week and spends her salary on housing, travel and outings on the weekends.",https://www.lemonde.fr/en/campus/article/2025/07/12/capucine-27-mergers-and-acquisitions-analyst-5-300-a-month-we-looked-at-the-salaries-and-said-we-were-going-to-live-like-royalty_6743312_11.html,Subscribers only,  By Diane Merveilleux ,https://img.lemde.fr/2025/07/10/0/0/6000/4000/360/0/95/0/cb24d34_ftp-import-images-1-3xfjcw3esaxr-0e196d055a544b1fae27d381414fcba7-2-7932695e3d284478b5d90688f836d2f9.jpg 2x,Your stories
Thomas Piketty: 'The US's unprecedented financial fragility explains Trump's aggressiveness',0,https://www.lemonde.fr/en/opinion/article/2025/07/12/thomas-piketty-the-us-s-unprecedented-financial-fragility-explains-trump-s-aggressiveness_6743298_23.html,Subscribers only,Thomas Piketty,https://img.lemde.fr/2025/07/10/0/0/6000/4000/360/0/95/0/cb24d34_ftp-import-images-1-3xfjcw3esaxr-0e196d055a544b1fae27d381414fcba7-2-7932695e3d284478b5d90688f836d2f9.jpg 2x,
Iran says willing to resume nuclear talks with US if guaranteed no further attacks,0,https://www.lemonde.fr/en/middle-east-crisis/article/2025/07/12/iran-says-willing-to-resume-nuclear-talks-with-us-if-guaranteed-no-further-attacks_6743309_368.html,Not premium,Le Monde with AP and AFP,https://img.lemde.fr/2025/07/10/0/0/6000/4000/360/0/95/0/cb24d34_ftp-import-images-1-3xfjcw3esaxr-0e196d055a544b1fae27d381414fcba7-2-7932695e3d284478b5d90688f836d2f9.jpg 2x,
"Air India plane crash: Report says engine fuel supply was cut off, confusion in cockpit",0,https://www.lemonde.fr/en/economy/article/2025/07/12/air-india-plane-crash-report-says-engine-fuel-supply-was-cut-off-confusion-in-cockpit_6743304_19.html,Subscribers only,  By Carole Dieterich (New Delhi (India) correspondent) ,https://img.lemde.fr/2025/07/10/0/0/6000/4000/360/0/95/0/cb24d34_ftp-import-images-1-3xfjcw3esaxr-0e196d055a544b1fae27d381414fcba7-2-7932695e3d284478b5d90688f836d2f9.jpg 2x,
"Srebrenica massacre commemoration: 30 years later, the enduring bitterness of grieving families",0,https://www.lemonde.fr/en/international/article/2025/07/12/srebrenica-massacre-commemoration-30-years-later-the-enduring-bitterness-of-grieving-families_6743301_4.html,Subscribers only, By Jean-Baptiste Chastand (Srebrenica (Bosnia) special correspondent) ,https://img.lemde.fr/2025/07/10/0/0/6000/4000/360/0/95/0/cb24d34_ftp-import-images-1-3xfjcw3esaxr-0e196d055a544b1fae27d381414fcba7-2-7932695e3d284478b5d90688f836d2f9.jpg 2x,
How AI is shaking up scientific publishing,0,https://www.lemonde.fr/en/science/article/2025/07/12/how-ai-is-shaking-up-scientific-publishing_6743308_10.html,Subscribers only,  By David Larousserie ,https://img.lemde.fr/2025/07/10/0/0/6000/4000/360/0/95/0/cb24d34_ftp-import-images-1-3xfjcw3esaxr-0e196d055a544b1fae27d381414fcba7-2-7932695e3d284478b5d90688f836d2f9.jpg 2x,
French army chief says Russia 'will pose a real threat before 2030',0,https://www.lemonde.fr/en/politics/article/2025/07/12/french-army-chief-says-russia-will-pose-a-real-threat-before-2030_6743302_5.html,Subscribers only,  By Elise Vincent ,https://img.lemde.fr/2025/07/10/0/0/6000/4000/360/0/95/0/cb24d34_ftp-import-images-1-3xfjcw3esaxr-0e196d055a544b1fae27d381414fcba7-2-7932695e3d284478b5d90688f836d2f9.jpg 2x,
Macron declares July 12 annual Dreyfus commemoration day,0,https://www.lemonde.fr/en/politics/article/2025/07/12/macron-declares-july-12-annual-dreyfus-commemoration-day_6743305_5.html,Not premium,Le Monde with AFP,https://img.lemde.fr/2025/07/10/0/0/6000/4000/360/0/95/0/cb24d34_ftp-import-images-1-3xfjcw3esaxr-0e196d055a544b1fae27d381414fcba7-2-7932695e3d284478b5d90688f836d2f9.jpg 2x,
All Blacks crush under-strength France 43-17,0,https://www.lemonde.fr/en/sports/article/2025/07/12/all-blacks-crush-under-strength-france-43-17_6743303_9.html,Not premium,Le Monde with AFP,https://img.lemde.fr/2025/07/10/0/0/6000/4000/360/0/95/0/cb24d34_ftp-import-images-1-3xfjcw3esaxr-0e196d055a544b1fae27d381414fcba7-2-7932695e3d284478b5d90688f836d2f9.jpg 2x,
The ICC petitions to end Russia's plundering of Ukrainian museums,0,https://www.lemonde.fr/en/international/article/2025/07/12/the-icc-petitions-to-end-russia-s-plundering-of-ukrainian-museums_6743292_4.html,Subscribers only,  By Franck Johannès ,https://img.lemde.fr/2025/07/10/0/0/6000/4000/360/0/95/0/cb24d34_ftp-import-images-1-3xfjcw3esaxr-0e196d055a544b1fae27d381414fcba7-2-7932695e3d284478b5d90688f836d2f9.jpg 2x,
Tracking neural implants that fool the immune system,0,https://www.lemonde.fr/en/science/article/2025/07/12/tracking-neural-implants-that-fool-the-immune-system_6743297_10.html,Subscribers only,  By Anaëlle Charlier ,https://img.lemde.fr/2025/07/10/0/0/6000/4000/360/0/95/0/cb24d34_ftp-import-images-1-3xfjcw3esaxr-0e196d055a544b1fae27d381414fcba7-2-7932695e3d284478b5d90688f836d2f9.jpg 2x,
Judge orders Trump administration to halt indiscriminate ICE arrests in California,0,https://www.lemonde.fr/en/global-issues/article/2025/07/12/judge-orders-trump-administration-to-halt-indiscriminate-ice-arrests-in-california_6743295_199.html,Not premium,Le Monde with AP,https://img.lemde.fr/2025/07/10/0/0/6000/4000/360/0/95/0/cb24d34_ftp-import-images-1-3xfjcw3esaxr-0e196d055a544b1fae27d381414fcba7-2-7932695e3d284478b5d90688f836d2f9.jpg 2x,
Belgium's migration minister advocates for 'the strictest policy ever implemented',0,https://www.lemonde.fr/en/global-issues/article/2025/07/12/in-belgium-the-migration-minister-is-advocating-for-the-strictest-policy-ever-implemented_6743289_199.html,Subscribers only,"  By Jean-Pierre Stroobants (Brussels, correspondent) ",https://img.lemde.fr/2025/07/10/0/0/6000/4000/360/0/95/0/cb24d34_ftp-import-images-1-3xfjcw3esaxr-0e196d055a544b1fae27d381414fcba7-2-7932695e3d284478b5d90688f836d2f9.jpg 2x,
Avignon Festival: Arabic makes a tentative entrance on stage,"Choreographers and poets from the Middle East and North Africa feature in the 79th edition's lineup, but playwrights remain few and far between.",https://www.lemonde.fr/en/culture/article/2025/07/12/avignon-festival-arabic-makes-a-tentative-entrance-on-stage_6743300_30.html,Subscribers only,  By Joëlle Gayot ,https://img.lemde.fr/2025/07/10/0/0/6000/4000/360/0/95/0/cb24d34_ftp-import-images-1-3xfjcw3esaxr-0e196d055a544b1fae27d381414fcba7-2-7932695e3d284478b5d90688f836d2f9.jpg 2x,Investigation
Nonprofit helps French festivals fight gender-based violence,"Founded in 2021 in the wake of the #MeToo movement, the Safer organization provides protection, support and guidance for victims of violence during music festivals.",https://www.lemonde.fr/en/m-le-mag/article/2025/07/11/nonprofit-helps-french-festivals-fight-gender-based-violence_6743284_117.html,Subscribers only,  By Christelle Murhula ,https://img.lemde.fr/2025/07/10/0/0/6000/4000/360/0/95/0/cb24d34_ftp-import-images-1-3xfjcw3esaxr-0e196d055a544b1fae27d381414fcba7-2-7932695e3d284478b5d90688f836d2f9.jpg 2x,Feature
"At Rencontres d'Arles, the artistic blur between AI and photographers remains unresolved",The issue of works being plundered to train generative artificial intelligence search engines remains unsettled. Negotiations between representatives of creators and generative AI systems to reach a licensing agreement appear to be stalling.,https://www.lemonde.fr/en/culture/article/2025/07/12/at-rencontres-d-arles-the-artistic-blur-between-ai-and-photographers-remains-unresolved_6743296_30.html,Subscribers only,"  By Nicole Vulser (Arles (Bouches-du-Rhône), special correspondent) ",https://img.lemde.fr/2025/07/10/0/0/6000/4000/360/0/95/0/cb24d34_ftp-import-images-1-3xfjcw3esaxr-0e196d055a544b1fae27d381414fcba7-2-7932695e3d284478b5d90688f836d2f9.jpg 2x,In Depth
French budget: Wealthy pensioners must contribute,0,https://www.lemonde.fr/en/opinion/article/2025/07/12/french-budget-wealthy-pensioners-must-contribute_6743310_23.html,Not premium,Le Monde,https://img.lemde.fr/2025/07/10/0/0/6000/4000/360/0/95/0/cb24d34_ftp-import-images-1-3xfjcw3esaxr-0e196d055a544b1fae27d381414fcba7-2-7932695e3d284478b5d90688f836d2f9.jpg 2x,Editorial
'The Hunger Games' in Gaza,0,https://www.lemonde.fr/en/opinion/article/2025/07/08/the-hunger-games-in-gaza_6743167_23.html,Subscribe,Jean-Pierre Filiu,https://img.lemde.fr/2025/07/10/0/0/6000/4000/360/0/95/0/cb24d34_ftp-import-images-1-3xfjcw3esaxr-0e196d055a544b1fae27d381414fcba7-2-7932695e3d284478b5d90688f836d2f9.jpg 2x,Column
"With Channel migration deal, France and UK show shared determination",0,https://www.lemonde.fr/en/opinion/article/2025/07/11/with-channel-migration-agreement-france-and-uk-show-shared-determination_6743272_23.html,Not premium,Le Monde,https://img.lemde.fr/2025/07/10/0/0/6000/4000/360/0/95/0/cb24d34_ftp-import-images-1-3xfjcw3esaxr-0e196d055a544b1fae27d381414fcba7-2-7932695e3d284478b5d90688f836d2f9.jpg 2x,Editorial
