title,subhead,url,suscription,byline,img_url,article_type
"In Ukraine, the challenges of holding an election during wartime",0,https://www.lemonde.fr/en/international/article/2025/12/13/in-ukraine-the-challenges-of-holding-an-election-during-wartime_6748445_4.html,Subscribers only,"  By Thomas d’Istria (Kyiv, correspondent) ",https://img.lemde.fr/2025/12/12/0/0/6000/4000/360/0/95/0/55c68fa_upload-1-yhnnkg4qudsw-259142.jpg 2x,
Russia's phantom gains in Ukraine,0,https://www.lemonde.fr/en/international/article/2025/12/12/russia-s-phantom-advances-in-ukraine_6748441_4.html,Subscribers only,"  By Chloé Hoorman, Benjamin Quénelle and Faustine Vincent ",https://img.lemde.fr/2025/12/12/0/0/6000/4000/360/0/95/0/55c68fa_upload-1-yhnnkg4qudsw-259142.jpg 2x,
West Bank Palestinian granted refugee status in France due to violence in occupied territory,0,https://www.lemonde.fr/en/international/article/2025/12/12/west-bank-palestinian-granted-refugee-status-in-france-due-to-violence-in-occupied-territory_6748426_4.html,Subscribers only,  By Julia Pascual ,https://img.lemde.fr/2025/12/12/0/0/6000/4000/360/0/95/0/55c68fa_upload-1-yhnnkg4qudsw-259142.jpg 2x,
The poignant testimonies of Russian soldiers returning from Ukraine,0,https://www.lemonde.fr/en/international/article/2025/12/12/the-poignant-testimonies-of-russian-soldiers-returning-from-ukraine_6748412_4.html,Subscribers only,  By Benjamin Quénelle ,https://img.lemde.fr/2025/12/12/0/0/6000/4000/360/0/95/0/55c68fa_upload-1-yhnnkg4qudsw-259142.jpg 2x,
'Trump's ideological challenge to Europe is more dangerous than the security one',0,https://www.lemonde.fr/en/opinion/article/2025/12/11/trump-s-ideological-challenge-to-europe-is-more-dangerous-than-the-security-one_6748393_23.html,Subscribers only,Sylvie Kauffmann,https://img.lemde.fr/2025/12/12/0/0/6000/4000/360/0/95/0/55c68fa_upload-1-yhnnkg4qudsw-259142.jpg 2x,
"Attacked by Trump, Europe wavers between denial and fear of reprisals",0,https://www.lemonde.fr/en/international/article/2025/12/11/attacked-by-trump-europe-wavers-between-denial-and-fear-of-reprisals_6748382_4.html,Subscribers only,"  By Philippe Jacqué (Brussels, Europe bureau) and Virginie Malingre (Brussels, Europe bureau) ",https://img.lemde.fr/2025/12/12/0/0/6000/4000/360/0/95/0/55c68fa_upload-1-yhnnkg4qudsw-259142.jpg 2x,
Bosnia and Herzegovina's Serb entity elects ally of  former leader Dodik,0,https://www.lemonde.fr/en/international/article/2025/11/24/bosnia-and-herzegovina-s-serb-entity-elects-ally-of-former-leader-dodik_6747765_4.html,Subscribers only,  By Rémy Ourdan (Banja Luka (Bosnia and Herzegovina) special correspondent) ,https://img.lemde.fr/2025/12/12/0/0/6000/4000/360/0/95/0/55c68fa_upload-1-yhnnkg4qudsw-259142.jpg 2x,
"In France's Somme, bagpipers keep the memory of the Great War alive",0,https://www.lemonde.fr/en/history/article/2025/11/11/in-france-s-somme-bagpipers-keep-the-memory-of-the-great-war-alive_6747347_157.html,Subscribers only," By Marie-Béatrice Baudet (Ovillers-la-Boisselle [Somme], special correspondent) ",https://img.lemde.fr/2025/12/12/0/0/6000/4000/360/0/95/0/55c68fa_upload-1-yhnnkg4qudsw-259142.jpg 2x,
The mysterious 'knocker' scaring elderly women in a Brittany town,0,https://www.lemonde.fr/en/france/article/2025/12/12/the-mysterious-knocker-scaring-elderly-women-in-a-brittany-town_6748408_7.html,Subscribers only, By Florence Aubenas ,https://img.lemde.fr/2025/12/12/0/0/6000/4000/360/0/95/0/55c68fa_upload-1-yhnnkg4qudsw-259142.jpg 2x,
The actor and rape accusations behind Brigitte Macron's 'stupid bitches' remark,0,https://www.lemonde.fr/en/france/article/2025/12/11/the-actor-and-rape-accusations-behind-brigitte-macron-s-stupid-bitches-remark_6748396_7.html,Subscribers only,  By Lorraine de Foucher  ,https://img.lemde.fr/2025/12/12/0/0/6000/4000/360/0/95/0/55c68fa_upload-1-yhnnkg4qudsw-259142.jpg 2x,
Top French court reviews France-UK migrant agreement,0,https://www.lemonde.fr/en/france/article/2025/12/11/top-french-court-reviews-france-uk-migrant-agreement_6748392_7.html,Subscribers only,  By Julia Pascual ,https://img.lemde.fr/2025/12/12/0/0/6000/4000/360/0/95/0/55c68fa_upload-1-yhnnkg4qudsw-259142.jpg 2x,
"French students have become better informed about secularism, but also more critical",0,https://www.lemonde.fr/en/france/article/2025/12/09/french-students-have-become-better-informed-about-secularism-but-also-more-critical_6748318_7.html,Subscribers only,  By Violaine Morin ,https://img.lemde.fr/2025/12/12/0/0/6000/4000/360/0/95/0/55c68fa_upload-1-yhnnkg4qudsw-259142.jpg 2x,
The French studio behind a viral Christmas ad,0,https://www.lemonde.fr/en/videos/video/2025/12/12/the-french-studio-behind-a-viral-christmas-ad_6748436_108.html,Not premium,"  By Le Monde's video desk, Antoine Apelbaum   and Sinead McCausland (Le Monde in English) ",https://img.lemde.fr/2025/12/12/0/0/6000/4000/360/0/95/0/55c68fa_upload-1-yhnnkg4qudsw-259142.jpg 2x,
"Israel's D9 bulldozer, a tool of destruction in Gaza",0,https://www.lemonde.fr/en/videos/video/2025/11/27/israel-s-d9-bulldozer-a-tool-of-destruction-in-gaza_6747870_108.html,Subscribers only,"  By Liselotte Mas, Elsa Longueville (motion design) and Sinead McCausland ",https://img.lemde.fr/2025/12/12/0/0/6000/4000/360/0/95/0/55c68fa_upload-1-yhnnkg4qudsw-259142.jpg 2x,
"Ukraine's Pokrovsk faces fierce fighting, footage analyzed by Le Monde reveals",0,https://www.lemonde.fr/en/videos/video/2025/11/21/ukraine-s-pokrovsk-faces-fierce-fighting-footage-analyzed-by-le-monde-reveals_6747708_108.html,Subscribers only,"  By Alexandre Horn, Gabriel Lecointre (edit), Elisa Bellanger (motion design) and Sinead McCausland ",https://img.lemde.fr/2025/12/12/0/0/6000/4000/360/0/95/0/55c68fa_upload-1-yhnnkg4qudsw-259142.jpg 2x,
Afghanistan: Relentless repression continues over four years into Taliban's rule,0,https://www.lemonde.fr/en/videos/video/2025/10/04/afghanistan-relentless-repression-continues-over-four-years-into-taliban-s-rule_6746092_108.html,Not premium,"  By Chloé Denis, Félix Pommier (Motion design) and Sinead McCausland ",https://img.lemde.fr/2025/12/12/0/0/6000/4000/360/0/95/0/55c68fa_upload-1-yhnnkg4qudsw-259142.jpg 2x,
How the Trumpist world is projecting its own obsession with decline onto Europe,0,https://www.lemonde.fr/en/opinion/article/2025/12/12/how-the-trumpist-world-is-projecting-its-own-obsession-with-decline-onto-europe_6748411_23.html,Subscribers only,Piotr Smolar,https://img.lemde.fr/2025/12/12/0/0/6000/4000/360/0/95/0/55c68fa_upload-1-yhnnkg4qudsw-259142.jpg 2x,
Who will dare to condemn the terror imposed by Israel in the West Bank?,0,https://www.lemonde.fr/en/opinion/article/2025/12/12/who-will-dare-to-condemn-the-terror-imposed-by-israel-in-the-west-bank_6748420_23.html,Not premium,Le Monde,https://img.lemde.fr/2025/12/12/0/0/6000/4000/360/0/95/0/55c68fa_upload-1-yhnnkg4qudsw-259142.jpg 2x,
Sarkozy casts himself as new Dreyfus in prison memoir,0,https://www.lemonde.fr/en/opinion/article/2025/12/12/sarkozy-casts-himself-as-new-dreyfus-in-prison-memoir_6748419_23.html,Subscribers only,  By Denis Cosnard ,https://img.lemde.fr/2025/12/12/0/0/6000/4000/360/0/95/0/55c68fa_upload-1-yhnnkg4qudsw-259142.jpg 2x,
'Trump's ideological challenge to Europe is more dangerous than the security one',0,https://www.lemonde.fr/en/opinion/article/2025/12/11/trump-s-ideological-challenge-to-europe-is-more-dangerous-than-the-security-one_6748393_23.html,Subscribers only,Sylvie Kauffmann,https://img.lemde.fr/2025/12/12/0/0/6000/4000/360/0/95/0/55c68fa_upload-1-yhnnkg4qudsw-259142.jpg 2x,
"'Am I Next?': In Los Angeles, a city targeted by ICE raids, an exhibition invites self-reflection",0,https://www.lemonde.fr/en/m-le-mag/article/2025/12/13/am-i-next-in-los-angeles-a-city-targeted-by-ice-raids-an-exhibition-invites-self-reflection_6748446_117.html,Subscribers only,  By Agnès Gautheron ,https://img.lemde.fr/2025/12/12/0/0/6000/4000/360/0/95/0/55c68fa_upload-1-yhnnkg4qudsw-259142.jpg 2x,
The lawyer suing far-right French mayors for setting up Nativity scenes,0,https://www.lemonde.fr/en/m-le-mag/article/2025/12/07/the-woman-suing-french-far-right-mayors-for-setting-up-nativity-scenes_6748246_117.html,Subscribers only,"  By Agathe Beaudouin (Nîmes (southern France), special correspondent) ",https://img.lemde.fr/2025/12/12/0/0/6000/4000/360/0/95/0/55c68fa_upload-1-yhnnkg4qudsw-259142.jpg 2x,
100 years of the photobooth: Meet the people keeping them alive,0,https://www.lemonde.fr/en/m-le-mag/article/2025/12/07/100-years-of-the-photobooth-meet-the-people-keeping-them-alive_6748232_117.html,Not premium,  By Sinead McCausland ,https://img.lemde.fr/2025/12/12/0/0/6000/4000/360/0/95/0/55c68fa_upload-1-yhnnkg4qudsw-259142.jpg 2x,
"Iran's independent cinema in full revolt: 'With Woman, Life, Freedom, a major barrier was broken'",0,https://www.lemonde.fr/en/m-le-mag/article/2025/12/04/iran-s-independent-cinema-in-full-revolt-with-woman-life-freedom-a-major-barrier-was-broken_6748162_117.html,Subscribers only, By Ghazal Golshiri ,https://img.lemde.fr/2025/12/12/0/0/6000/4000/360/0/95/0/55c68fa_upload-1-yhnnkg4qudsw-259142.jpg 2x,
Five creative craft workshops to enjoy doing in Paris with your child,0,https://www.lemonde.fr/en/intimacy/article/2025/12/13/in-paris-five-creative-craft-workshops-to-enjoy-doing-with-your-child_6748451_310.html,Subscribers only,  By Tiphaine Thuillier ,https://img.lemde.fr/2025/12/12/0/0/6000/4000/360/0/95/0/55c68fa_upload-1-yhnnkg4qudsw-259142.jpg 2x,
Jewels of power go on display in Paris,0,https://www.lemonde.fr/en/culture/article/2025/12/11/the-power-gems-on-display-in-paris_6748374_30.html,Not premium,  By Valentin Pérez   ,https://img.lemde.fr/2025/12/12/0/0/6000/4000/360/0/95/0/55c68fa_upload-1-yhnnkg4qudsw-259142.jpg 2x,
Five spots in Paris to enjoy a (great) plant-based sandwich,0,https://www.lemonde.fr/en/lifestyle/article/2025/12/04/in-paris-five-spots-to-enjoy-a-great-plant-based-sandwich_6748131_37.html,Subscribers only,  By Lucas Scaltritti ,https://img.lemde.fr/2025/12/12/0/0/6000/4000/360/0/95/0/55c68fa_upload-1-yhnnkg4qudsw-259142.jpg 2x,
"Bayonne's 'Little Louvre,' the Bonnat-Helleu Museum, reopens after 14 years",0,https://www.lemonde.fr/en/culture/article/2025/11/28/bayonne-s-little-louvre-the-bonnat-helleu-museum-reopens-after-14-years_6747913_30.html,Subscribers only,  By Roxana Azimi (Bayonne (France) special correspondent) ,https://img.lemde.fr/2025/12/12/0/0/6000/4000/360/0/95/0/55c68fa_upload-1-yhnnkg4qudsw-259142.jpg 2x,
"How French spies, police and military personnel are betrayed by advertising data","Using easily accessible advertising data, Le Monde was able to pinpoint the identities, home addresses and daily routines of several dozen people working for sensitive official entities.",https://www.lemonde.fr/en/pixels/article/2025/12/13/how-french-spies-police-and-military-personnel-are-betrayed-by-advertising-data_6748453_13.html,Subscribers only, By Martin Untersinger and Damien Leloup ,https://img.lemde.fr/2025/12/12/0/0/6000/4000/360/0/95/0/55c68fa_upload-1-yhnnkg4qudsw-259142.jpg 2x,
"In Ukraine, the challenges of holding an election during wartime",0,https://www.lemonde.fr/en/international/article/2025/12/13/in-ukraine-the-challenges-of-holding-an-election-during-wartime_6748445_4.html,Subscribers only,"  By Thomas d’Istria (Kyiv, correspondent) ",https://img.lemde.fr/2025/12/12/0/0/6000/4000/360/0/95/0/55c68fa_upload-1-yhnnkg4qudsw-259142.jpg 2x,
Cambodia says Thailand still bombing hours after Trump truce call,0,https://www.lemonde.fr/en/international/article/2025/12/13/cambodia-says-thailand-still-bombing-hours-after-trump-truce-call_6748452_4.html,Not premium,Le Monde with AFP,https://img.lemde.fr/2025/12/12/0/0/6000/4000/360/0/95/0/55c68fa_upload-1-yhnnkg4qudsw-259142.jpg 2x,
"'Am I Next?': In Los Angeles, a city targeted by ICE raids, an exhibition invites self-reflection","In response to raids by Immigration and Customs Enforcement (ICE) agents, the facades of several buildings across the California metropolis display the message 'Am I Next?' along with the photo of an ordinary citizen. This open-air campaign serves as both an act of resistance and a manifesto intended to alert the broader public.",https://www.lemonde.fr/en/m-le-mag/article/2025/12/13/am-i-next-in-los-angeles-a-city-targeted-by-ice-raids-an-exhibition-invites-self-reflection_6748446_117.html,Subscribers only,  By Agnès Gautheron ,https://img.lemde.fr/2025/12/12/0/0/6000/4000/360/0/95/0/55c68fa_upload-1-yhnnkg4qudsw-259142.jpg 2x,
"In 'Wake Up Dead Man: A Knives Out Mystery,' Daniel Craig grapples with metaphysics","The third installment of detective Benoît Blanc's investigations forces its protagonist to confront the murder of a priest, shaking his belief in rationalism.",https://www.lemonde.fr/en/culture/article/2025/12/13/in-wake-up-dead-man-a-knives-out-mystery-daniel-craig-grapples-with-metaphysics_6748450_30.html,Subscribers only,  By Thomas Sotinel ,https://img.lemde.fr/2025/12/12/0/0/6000/4000/360/0/95/0/55c68fa_upload-1-yhnnkg4qudsw-259142.jpg 2x,
Five creative craft workshops to enjoy doing in Paris with your child,"Birdhouses, cuddly toys or hair clips. Almost anything can be crafted together as a family. All you have to do is sign up for one of the fun workshops offered in the capital by passionate professionals, and you'll have an original Christmas gift idea.",https://www.lemonde.fr/en/intimacy/article/2025/12/13/in-paris-five-creative-craft-workshops-to-enjoy-doing-with-your-child_6748451_310.html,Subscribers only,  By Tiphaine Thuillier ,https://img.lemde.fr/2025/12/12/0/0/6000/4000/360/0/95/0/55c68fa_upload-1-yhnnkg4qudsw-259142.jpg 2x,
"Paris Agreement: Ten years later, key players look back on 'incredible alignment of stars'","Le Monde takes a look back at the the signing of the Paris Agreement in the French capital on December 12, 2015, a major geopolitical agreement reached after two weeks of intense negotiations that aimed to limit global warming to 'well below' 2°C and at 'pursuing efforts' to keep the temperature increase to 1.5°C.",https://www.lemonde.fr/en/environment/article/2025/12/12/paris-agreement-ten-years-later-key-players-look-back-on-incredible-alignment-of-stars_6748434_114.html,Subscribers only, By Matthieu Goar ,https://img.lemde.fr/2025/12/12/0/0/6000/4000/360/0/95/0/55c68fa_upload-1-yhnnkg4qudsw-259142.jpg 2x,News
Colombia's ELN guerrillas place communities in lockdown citing Trump 'intervention' threats,0,https://www.lemonde.fr/en/international/article/2025/12/13/colombia-s-eln-guerrillas-place-communities-in-lockdown-citing-trump-intervention-threats_6748447_4.html,Not premium,Le Monde with AFP,https://img.lemde.fr/2025/12/12/0/0/6000/4000/360/0/95/0/55c68fa_upload-1-yhnnkg4qudsw-259142.jpg 2x,
"In the Netherlands, McDonald's halts an advertising campaign that uses AI",0,https://www.lemonde.fr/en/economy/article/2025/12/13/in-the-netherlands-mcdonald-s-halts-an-advertising-campaign-that-uses-ai_6748448_19.html,Subscribers only,"  By Jean-Pierre Stroobants (Brussels, correspondent) ",https://img.lemde.fr/2025/12/12/0/0/6000/4000/360/0/95/0/55c68fa_upload-1-yhnnkg4qudsw-259142.jpg 2x,
Machado urges pressure so Maduro understands 'he has to go',0,https://www.lemonde.fr/en/international/article/2025/12/13/machado-urges-pressure-so-maduro-understands-he-has-to-go_6748449_4.html,Not premium,Le Monde with AFP,https://img.lemde.fr/2025/12/12/0/0/6000/4000/360/0/95/0/55c68fa_upload-1-yhnnkg4qudsw-259142.jpg 2x,
A Perrier plant shuts down after malfunction at its wastewater treatment facility,0,https://www.lemonde.fr/en/environment/article/2025/12/12/a-perrier-plant-shuts-down-after-malfunction-at-its-wastewater-treatment-facility_6748444_114.html,Subscribers only,  By Stéphane Mandard ,https://img.lemde.fr/2025/12/12/0/0/6000/4000/360/0/95/0/55c68fa_upload-1-yhnnkg4qudsw-259142.jpg 2x,
How the Trumpist world is projecting its own obsession with decline onto Europe,0,https://www.lemonde.fr/en/opinion/article/2025/12/12/how-the-trumpist-world-is-projecting-its-own-obsession-with-decline-onto-europe_6748411_23.html,Subscribers only,Piotr Smolar,https://img.lemde.fr/2025/12/12/0/0/6000/4000/360/0/95/0/55c68fa_upload-1-yhnnkg4qudsw-259142.jpg 2x,
Russia's phantom gains in Ukraine,0,https://www.lemonde.fr/en/international/article/2025/12/12/russia-s-phantom-advances-in-ukraine_6748441_4.html,Subscribers only,"  By Chloé Hoorman, Benjamin Quénelle and Faustine Vincent ",https://img.lemde.fr/2025/12/12/0/0/6000/4000/360/0/95/0/55c68fa_upload-1-yhnnkg4qudsw-259142.jpg 2x,
EU decides to impose €3 tax on small parcels to tackle Chinese imports,0,https://www.lemonde.fr/en/economy/article/2025/12/12/eu-decides-to-impose-3-tax-on-small-parcels-from-china_6748427_19.html,Not premium,Le Monde with AFP,https://img.lemde.fr/2025/12/12/0/0/6000/4000/360/0/95/0/55c68fa_upload-1-yhnnkg4qudsw-259142.jpg 2x,
France updates its 2050 carbon neutrality roadmap,0,https://www.lemonde.fr/en/environment/article/2025/12/12/france-updates-its-2050-carbon-neutrality-roadmap_6748435_114.html,Not premium,Le Monde with AFP,https://img.lemde.fr/2025/12/12/0/0/6000/4000/360/0/95/0/55c68fa_upload-1-yhnnkg4qudsw-259142.jpg 2x,
Democrats release new cache of Epstein photos,0,https://www.lemonde.fr/en/international/article/2025/12/12/democrats-release-new-cache-of-epstein-photos_6748442_4.html,Not premium,Le Monde with AFP,https://img.lemde.fr/2025/12/12/0/0/6000/4000/360/0/95/0/55c68fa_upload-1-yhnnkg4qudsw-259142.jpg 2x,
The French studio behind a viral Christmas ad,0,https://www.lemonde.fr/en/videos/video/2025/12/12/the-french-studio-behind-a-viral-christmas-ad_6748436_108.html,Not premium,"  By Le Monde's video desk, Antoine Apelbaum   and Sinead McCausland (Le Monde in English) ",https://img.lemde.fr/2025/12/12/0/0/6000/4000/360/0/95/0/55c68fa_upload-1-yhnnkg4qudsw-259142.jpg 2x,
"At the Grand Palais, a full house for Eva Jospin and Claire Tabouret",0,https://www.lemonde.fr/en/culture/article/2025/12/12/at-the-grand-palais-a-full-house-for-eva-jospin-and-claire-tabouret_6748407_30.html,Subscribers only,  By Emmanuelle Jardonnet ,https://img.lemde.fr/2025/12/12/0/0/6000/4000/360/0/95/0/55c68fa_upload-1-yhnnkg4qudsw-259142.jpg 2x,
Jewels of power go on display in Paris,0,https://www.lemonde.fr/en/culture/article/2025/12/11/the-power-gems-on-display-in-paris_6748374_30.html,Not premium,  By Valentin Pérez   ,https://img.lemde.fr/2025/12/12/0/0/6000/4000/360/0/95/0/55c68fa_upload-1-yhnnkg4qudsw-259142.jpg 2x,
The mysterious 'knocker' scaring elderly women in a Brittany town,"For more than two years, a prowler has been knocking on doors and shutters during the night in a village in Brittany, France, creating a climate of fear among his preferred targets: elderly women. Authorities were slow to take the case seriously.",https://www.lemonde.fr/en/france/article/2025/12/12/the-mysterious-knocker-scaring-elderly-women-in-a-brittany-town_6748408_7.html,Subscribers only, By Florence Aubenas ,https://img.lemde.fr/2025/12/12/0/0/6000/4000/360/0/95/0/55c68fa_upload-1-yhnnkg4qudsw-259142.jpg 2x,Feature
Ukraine ready to consider Donbas demilitarized zone in concession to end war,"Mykhailo Podolyak, an advisor to Ukrainian President Volodymyr Zelensky, tells Le Monde that the zone would require Ukrainian and Russian forces to both pull back from the front line.",https://www.lemonde.fr/en/international/article/2025/12/11/ukraine-ready-to-accept-donbas-demilitarized-zone-in-concession-to-end-war_6748397_4.html,Subscribers only,  By Philippe Ricard and Claire Gatinois ,https://img.lemde.fr/2025/12/12/0/0/6000/4000/360/0/95/0/55c68fa_upload-1-yhnnkg4qudsw-259142.jpg 2x,News
The actor and rape accusations behind Brigitte Macron's 'stupid bitches' remark,France's first lady made headlines with her comments about feminist activists who disrupted a performance of the comedian Ary Abittan. They were contesting the dropping of rape charges against him earlier this year. Le Monde reviewed the ruling and spoke to the plaintiff.,https://www.lemonde.fr/en/france/article/2025/12/11/the-actor-and-rape-accusations-behind-brigitte-macron-s-stupid-bitches-remark_6748396_7.html,Subscribers only,  By Lorraine de Foucher  ,https://img.lemde.fr/2025/12/12/0/0/6000/4000/360/0/95/0/55c68fa_upload-1-yhnnkg4qudsw-259142.jpg 2x,In Depth
Who will dare to condemn the terror imposed by Israel in the West Bank?,0,https://www.lemonde.fr/en/opinion/article/2025/12/12/who-will-dare-to-condemn-the-terror-imposed-by-israel-in-the-west-bank_6748420_23.html,Not premium,Le Monde,https://img.lemde.fr/2025/12/12/0/0/6000/4000/360/0/95/0/55c68fa_upload-1-yhnnkg4qudsw-259142.jpg 2x,Editorial
Sarkozy's astonishing about-face on the far right,0,https://www.lemonde.fr/en/opinion/article/2025/12/09/sarkozy-suggests-alliance-with-far-right-is-inevitable_6748307_23.html,Not premium,Le Monde,https://img.lemde.fr/2025/12/12/0/0/6000/4000/360/0/95/0/55c68fa_upload-1-yhnnkg4qudsw-259142.jpg 2x,Editorial
France's 1905 law separating churches and state: An irreplaceable compass,0,https://www.lemonde.fr/en/opinion/article/2025/12/08/france-s-1905-law-separating-churches-and-state-an-irreplaceable-compass_6748272_23.html,Not premium,Le Monde,https://img.lemde.fr/2025/12/12/0/0/6000/4000/360/0/95/0/55c68fa_upload-1-yhnnkg4qudsw-259142.jpg 2x,Editorial
