title,subhead,url,suscription,byline,img_url,article_type
Israel considers one-way exits for Gazans to Egypt,0,https://www.lemonde.fr/en/international/article/2025/12/04/israel-considers-one-way-exits-for-gazans-to-egypt_6748159_4.html,Subscribers only,  By Marie Jo Sader ,https://img.lemde.fr/2025/10/17/0/236/5028/3352/360/0/95/0/473a36a_ftp-import-images-1-jvlczba3ouuy-2025-10-17t065708z-424544770-rc2idhai5i5h-rtrmadp-3-israel-palestinians-aid-rafah.JPG 2x,
"Modi rolls out the red carpet for Putin, defying Western pressure",0,https://www.lemonde.fr/en/international/article/2025/12/04/modi-rolls-out-the-red-carpet-for-putin-defying-western-pressure_6748149_4.html,Subscribers only,"  By Carole Dieterich (New Delhi, India, correspondent) and Sophie Landrin (New Delhi, India, correspondent) ",https://img.lemde.fr/2025/10/17/0/236/5028/3352/360/0/95/0/473a36a_ftp-import-images-1-jvlczba3ouuy-2025-10-17t065708z-424544770-rc2idhai5i5h-rtrmadp-3-israel-palestinians-aid-rafah.JPG 2x,
Zelensky without Yermak: The story of a split at the top of Ukraine,0,https://www.lemonde.fr/en/international/article/2025/12/04/zelensky-without-yermak-the-story-of-a-split-at-the-top-of-ukraine_6748137_4.html,Subscribers only,"  By Ariane Chemin (Kyiv (Ukraine), special correspondent) and Thomas d’Istria (Kyiv (Ukraine), correspondent) ",https://img.lemde.fr/2025/10/17/0/236/5028/3352/360/0/95/0/473a36a_ftp-import-images-1-jvlczba3ouuy-2025-10-17t065708z-424544770-rc2idhai5i5h-rtrmadp-3-israel-palestinians-aid-rafah.JPG 2x,
'I am as afraid of the rain as I was of the war': How severe weather compounds the suffering of displaced Gazans,0,https://www.lemonde.fr/en/international/article/2025/12/04/i-am-as-afraid-of-the-rain-as-i-was-of-the-war-how-severe-weather-compounds-the-suffering-of-displaced-gazans_6748128_4.html,Subscribers only,  By Marie Jo Sader ,https://img.lemde.fr/2025/10/17/0/236/5028/3352/360/0/95/0/473a36a_ftp-import-images-1-jvlczba3ouuy-2025-10-17t065708z-424544770-rc2idhai5i5h-rtrmadp-3-israel-palestinians-aid-rafah.JPG 2x,
Bosnia and Herzegovina's Serb entity elects ally of  former leader Dodik,0,https://www.lemonde.fr/en/international/article/2025/11/24/bosnia-and-herzegovina-s-serb-entity-elects-ally-of-former-leader-dodik_6747765_4.html,Subscribers only,  By Rémy Ourdan (Banja Luka (Bosnia and Herzegovina) special correspondent) ,https://img.lemde.fr/2025/10/17/0/236/5028/3352/360/0/95/0/473a36a_ftp-import-images-1-jvlczba3ouuy-2025-10-17t065708z-424544770-rc2idhai5i5h-rtrmadp-3-israel-palestinians-aid-rafah.JPG 2x,
"In France's Somme, bagpipers keep the memory of the Great War alive",0,https://www.lemonde.fr/en/history/article/2025/11/11/in-france-s-somme-bagpipers-keep-the-memory-of-the-great-war-alive_6747347_157.html,Subscribers only," By Marie-Béatrice Baudet (Ovillers-la-Boisselle [Somme], special correspondent) ",https://img.lemde.fr/2025/10/17/0/236/5028/3352/360/0/95/0/473a36a_ftp-import-images-1-jvlczba3ouuy-2025-10-17t065708z-424544770-rc2idhai5i5h-rtrmadp-3-israel-palestinians-aid-rafah.JPG 2x,
Latvia: Public mobilization grows in support of treaty for preventing violence against women,0,https://www.lemonde.fr/en/international/article/2025/11/06/in-latvia-public-mobilization-continues-to-grow-in-support-of-the-istanbul-convention-for-preventing-violence-against-women_6747156_4.html,Subscribers only,  By Anne-Françoise Hivert (Malmö (Sweden) correspondent) ,https://img.lemde.fr/2025/10/17/0/236/5028/3352/360/0/95/0/473a36a_ftp-import-images-1-jvlczba3ouuy-2025-10-17t065708z-424544770-rc2idhai5i5h-rtrmadp-3-israel-palestinians-aid-rafah.JPG 2x,
"After Charlie Kirk's murder, Europe's far right swears allegiance to Trump's politics",0,https://www.lemonde.fr/en/les-decodeurs/article/2025/10/20/the-murder-of-charlie-kirk-how-europe-s-far-right-swore-allegiance-to-trump-s-politics_6746586_8.html,Subscribers only, By Allan Kaval (Rome (Italy) correspondent) and Manon Romain (with Clément Guillou and Le Monde correspondents in Europe) ,https://img.lemde.fr/2025/10/17/0/236/5028/3352/360/0/95/0/473a36a_ftp-import-images-1-jvlczba3ouuy-2025-10-17t065708z-424544770-rc2idhai5i5h-rtrmadp-3-israel-palestinians-aid-rafah.JPG 2x,
France delivers suspended sentence to student for defacing former justice minister's tomb,0,https://www.lemonde.fr/en/france/article/2025/12/03/france-sentences-student-for-defacing-tomb-of-guillotine-abolitionist_6748124_7.html,Not premium,Le Monde with AFP,https://img.lemde.fr/2025/10/17/0/236/5028/3352/360/0/95/0/473a36a_ftp-import-images-1-jvlczba3ouuy-2025-10-17t065708z-424544770-rc2idhai5i5h-rtrmadp-3-israel-palestinians-aid-rafah.JPG 2x,
French justice stalls as evidence of police violence during 2023 protest is overlooked,0,https://www.lemonde.fr/en/france/article/2025/12/04/french-justice-stalls-as-evidence-of-police-violence-during-2023-protest-is-overlooked_6748161_7.html,Subscribers only,  By Grégoire Biseau and Arthur Carpentier ,https://img.lemde.fr/2025/10/17/0/236/5028/3352/360/0/95/0/473a36a_ftp-import-images-1-jvlczba3ouuy-2025-10-17t065708z-424544770-rc2idhai5i5h-rtrmadp-3-israel-palestinians-aid-rafah.JPG 2x,
Marseille grapples with drug trafficking: 'They are so many and they have so much money',0,https://www.lemonde.fr/en/france/article/2025/12/02/marseille-grapples-with-drug-trafficking-they-are-so-many-and-they-have-so-much-money_6748047_7.html,Subscribers only, By Grégoire Biseau (Marseille (France) special correspondent) and Gilles Rof (Marseille (France) correspondent) ,https://img.lemde.fr/2025/10/17/0/236/5028/3352/360/0/95/0/473a36a_ftp-import-images-1-jvlczba3ouuy-2025-10-17t065708z-424544770-rc2idhai5i5h-rtrmadp-3-israel-palestinians-aid-rafah.JPG 2x,
Foreign interference: Why France is raising its voice and turning to the courts,0,https://www.lemonde.fr/en/france/article/2025/12/01/foreign-interference-why-france-is-raising-its-voice-and-turning-to-the-courts_6748034_7.html,Subscribers only,  By Jacques Follorou ,https://img.lemde.fr/2025/10/17/0/236/5028/3352/360/0/95/0/473a36a_ftp-import-images-1-jvlczba3ouuy-2025-10-17t065708z-424544770-rc2idhai5i5h-rtrmadp-3-israel-palestinians-aid-rafah.JPG 2x,
"Israel's D9 bulldozer, a tool of destruction in Gaza",0,https://www.lemonde.fr/en/videos/video/2025/11/27/israel-s-d9-bulldozer-a-tool-of-destruction-in-gaza_6747870_108.html,Subscribers only,"  By Liselotte Mas, Elsa Longueville (motion design) and Sinead McCausland ",https://img.lemde.fr/2025/10/17/0/236/5028/3352/360/0/95/0/473a36a_ftp-import-images-1-jvlczba3ouuy-2025-10-17t065708z-424544770-rc2idhai5i5h-rtrmadp-3-israel-palestinians-aid-rafah.JPG 2x,
"Ukraine's Pokrovsk faces fierce fighting, footage analyzed by Le Monde reveals",0,https://www.lemonde.fr/en/videos/video/2025/11/21/ukraine-s-pokrovsk-faces-fierce-fighting-footage-analyzed-by-le-monde-reveals_6747708_108.html,Subscribers only,"  By Alexandre Horn, Gabriel Lecointre (edit), Elisa Bellanger (motion design) and Sinead McCausland ",https://img.lemde.fr/2025/10/17/0/236/5028/3352/360/0/95/0/473a36a_ftp-import-images-1-jvlczba3ouuy-2025-10-17t065708z-424544770-rc2idhai5i5h-rtrmadp-3-israel-palestinians-aid-rafah.JPG 2x,
Afghanistan: Relentless repression continues over four years into Taliban's rule,0,https://www.lemonde.fr/en/videos/video/2025/10/04/afghanistan-relentless-repression-continues-over-four-years-into-taliban-s-rule_6746092_108.html,Not premium,"  By Chloé Denis, Félix Pommier (Motion design) and Sinead McCausland ",https://img.lemde.fr/2025/10/17/0/236/5028/3352/360/0/95/0/473a36a_ftp-import-images-1-jvlczba3ouuy-2025-10-17t065708z-424544770-rc2idhai5i5h-rtrmadp-3-israel-palestinians-aid-rafah.JPG 2x,
Watch: Hundreds of thousands march in France against budget cuts,0,https://www.lemonde.fr/en/videos/video/2025/09/19/french-strikes-watch-what-happened-as-hundreds-of-thousands-marched-against-budget-cuts_6745548_108.html,Not premium,  By Le Monde's video desk   ,https://img.lemde.fr/2025/10/17/0/236/5028/3352/360/0/95/0/473a36a_ftp-import-images-1-jvlczba3ouuy-2025-10-17t065708z-424544770-rc2idhai5i5h-rtrmadp-3-israel-palestinians-aid-rafah.JPG 2x,
France must prepare for its population decline,0,https://www.lemonde.fr/en/opinion/article/2025/12/04/france-must-prepare-for-its-population-decline_6748142_23.html,Not premium,Le Monde,https://img.lemde.fr/2025/10/17/0/236/5028/3352/360/0/95/0/473a36a_ftp-import-images-1-jvlczba3ouuy-2025-10-17t065708z-424544770-rc2idhai5i5h-rtrmadp-3-israel-palestinians-aid-rafah.JPG 2x,
French society's anti-Mafia awakening,0,https://www.lemonde.fr/en/opinion/article/2025/12/04/french-society-s-anti-mafia-awakening_6748153_23.html,Subscribers only,Jacques Follorou,https://img.lemde.fr/2025/10/17/0/236/5028/3352/360/0/95/0/473a36a_ftp-import-images-1-jvlczba3ouuy-2025-10-17t065708z-424544770-rc2idhai5i5h-rtrmadp-3-israel-palestinians-aid-rafah.JPG 2x,
'The quality of geopolitical relations with major economies has a significant impact on growth',0,https://www.lemonde.fr/en/opinion/article/2025/12/04/the-quality-of-geopolitical-relations-with-major-economies-has-a-significant-impact-on-growth_6748134_23.html,Subscribers only,Pauline Grosjean,https://img.lemde.fr/2025/10/17/0/236/5028/3352/360/0/95/0/473a36a_ftp-import-images-1-jvlczba3ouuy-2025-10-17t065708z-424544770-rc2idhai5i5h-rtrmadp-3-israel-palestinians-aid-rafah.JPG 2x,
'The fall of Assad marked a still uncertain close to a cycle of uprisings and crackdowns that began in Tunisia 15 years ago',0,https://www.lemonde.fr/en/opinion/article/2025/12/04/the-fall-of-assad-marked-a-still-uncertain-close-to-a-cycle-of-uprisings-and-crackdowns-that-began-in-tunisia-15-years-ago_6748132_23.html,Subscribers only,Gilles Paris,https://img.lemde.fr/2025/10/17/0/236/5028/3352/360/0/95/0/473a36a_ftp-import-images-1-jvlczba3ouuy-2025-10-17t065708z-424544770-rc2idhai5i5h-rtrmadp-3-israel-palestinians-aid-rafah.JPG 2x,
"Iran's independent cinema in full revolt: 'With Woman, Life, Freedom, a major barrier was broken'",0,https://www.lemonde.fr/en/m-le-mag/article/2025/12/04/iran-s-independent-cinema-in-full-revolt-with-woman-life-freedom-a-major-barrier-was-broken_6748162_117.html,Subscribers only, By Ghazal Golshiri ,https://img.lemde.fr/2025/10/17/0/236/5028/3352/360/0/95/0/473a36a_ftp-import-images-1-jvlczba3ouuy-2025-10-17t065708z-424544770-rc2idhai5i5h-rtrmadp-3-israel-palestinians-aid-rafah.JPG 2x,
The first time Le Monde wrote about Jeffrey Epstein,0,https://www.lemonde.fr/en/m-le-mag/article/2025/12/01/the-first-time-le-monde-wrote-about-jeffrey-epstein_6748001_117.html,Subscribers only,Gaspard Dhellemmes,https://img.lemde.fr/2025/10/17/0/236/5028/3352/360/0/95/0/473a36a_ftp-import-images-1-jvlczba3ouuy-2025-10-17t065708z-424544770-rc2idhai5i5h-rtrmadp-3-israel-palestinians-aid-rafah.JPG 2x,
The last-minute fight to save Gaza's ancient archaeological treasures,0,https://www.lemonde.fr/en/m-le-mag/article/2025/11/30/the-last-minute-fight-to-save-gaza-s-ancient-archaeological-treasures_6747984_117.html,Subscribers only, By Samuel Forey ,https://img.lemde.fr/2025/10/17/0/236/5028/3352/360/0/95/0/473a36a_ftp-import-images-1-jvlczba3ouuy-2025-10-17t065708z-424544770-rc2idhai5i5h-rtrmadp-3-israel-palestinians-aid-rafah.JPG 2x,
The art of being Oscar Wilde's grandson,0,https://www.lemonde.fr/en/m-le-mag/article/2025/11/30/the-art-of-being-oscar-wilde-s-grandson_6747977_117.html,Subscribers only,  By Clémentine Goldszal ,https://img.lemde.fr/2025/10/17/0/236/5028/3352/360/0/95/0/473a36a_ftp-import-images-1-jvlczba3ouuy-2025-10-17t065708z-424544770-rc2idhai5i5h-rtrmadp-3-israel-palestinians-aid-rafah.JPG 2x,
"In Paris, five spots to enjoy a (great) plant-based sandwich",0,https://www.lemonde.fr/en/lifestyle/article/2025/12/04/in-paris-five-spots-to-enjoy-a-great-plant-based-sandwich_6748131_37.html,Subscribers only,  By Lucas Scaltritti ,https://img.lemde.fr/2025/10/17/0/236/5028/3352/360/0/95/0/473a36a_ftp-import-images-1-jvlczba3ouuy-2025-10-17t065708z-424544770-rc2idhai5i5h-rtrmadp-3-israel-palestinians-aid-rafah.JPG 2x,
"Bayonne's 'Little Louvre,' the Bonnat-Helleu Museum, reopens after 14 years",0,https://www.lemonde.fr/en/culture/article/2025/11/28/bayonne-s-little-louvre-the-bonnat-helleu-museum-reopens-after-14-years_6747913_30.html,Subscribers only,  By Roxana Azimi (Bayonne (France) special correspondent) ,https://img.lemde.fr/2025/10/17/0/236/5028/3352/360/0/95/0/473a36a_ftp-import-images-1-jvlczba3ouuy-2025-10-17t065708z-424544770-rc2idhai5i5h-rtrmadp-3-israel-palestinians-aid-rafah.JPG 2x,
Victor Hugo's interior architecture on display in Paris,0,https://www.lemonde.fr/en/lifestyle/article/2025/11/23/victor-hugo-s-interior-architecture-on-display-in-paris_6747753_37.html,Subscribers only,  By Véronique Lorelle ,https://img.lemde.fr/2025/10/17/0/236/5028/3352/360/0/95/0/473a36a_ftp-import-images-1-jvlczba3ouuy-2025-10-17t065708z-424544770-rc2idhai5i5h-rtrmadp-3-israel-palestinians-aid-rafah.JPG 2x,
A stroll through Cachan: From a royal aqueduct to a panoramic garden,0,https://www.lemonde.fr/en/lifestyle/article/2025/11/22/a-stroll-through-cachan-from-a-royal-aqueduct-to-a-panoramic-garden_6747720_37.html,Subscribers only, By Delphine Le Feuvre ,https://img.lemde.fr/2025/10/17/0/236/5028/3352/360/0/95/0/473a36a_ftp-import-images-1-jvlczba3ouuy-2025-10-17t065708z-424544770-rc2idhai5i5h-rtrmadp-3-israel-palestinians-aid-rafah.JPG 2x,
French justice stalls as evidence of police violence during 2023 protest is overlooked,"The early November release of troubling video footage by Mediapart and 'Libération,' showing gendarmes confronting environmental activists protesting against mega-reservoirs in March 2023, has highlighted the legal system's inadequate response.",https://www.lemonde.fr/en/france/article/2025/12/04/french-justice-stalls-as-evidence-of-police-violence-during-2023-protest-is-overlooked_6748161_7.html,Subscribers only,  By Grégoire Biseau and Arthur Carpentier ,https://img.lemde.fr/2025/10/17/0/236/5028/3352/360/0/95/0/473a36a_ftp-import-images-1-jvlczba3ouuy-2025-10-17t065708z-424544770-rc2idhai5i5h-rtrmadp-3-israel-palestinians-aid-rafah.JPG 2x,
France faces legal action for failing to do its 'fair share' in reducing global greenhouse gas emissions,0,https://www.lemonde.fr/en/environment/article/2025/12/04/france-faces-legal-action-for-failing-to-do-its-fair-share-in-reducing-global-greenhouse-gas-emissions_6748150_114.html,Subscribers only,  By Audrey Garric ,https://img.lemde.fr/2025/10/17/0/236/5028/3352/360/0/95/0/473a36a_ftp-import-images-1-jvlczba3ouuy-2025-10-17t065708z-424544770-rc2idhai5i5h-rtrmadp-3-israel-palestinians-aid-rafah.JPG 2x,
Israel considers one-way exits for Gazans to Egypt,0,https://www.lemonde.fr/en/international/article/2025/12/04/israel-considers-one-way-exits-for-gazans-to-egypt_6748159_4.html,Subscribers only,  By Marie Jo Sader ,https://img.lemde.fr/2025/10/17/0/236/5028/3352/360/0/95/0/473a36a_ftp-import-images-1-jvlczba3ouuy-2025-10-17t065708z-424544770-rc2idhai5i5h-rtrmadp-3-israel-palestinians-aid-rafah.JPG 2x,
"Modi rolls out the red carpet for Putin, defying Western pressure","Russian President Vladimir Putin is making his first visit to India since the start of the war in Ukraine in February 2022, on December 4-5. Both sides have mutual economic interests.",https://www.lemonde.fr/en/international/article/2025/12/04/modi-rolls-out-the-red-carpet-for-putin-defying-western-pressure_6748149_4.html,Subscribers only,"  By Carole Dieterich (New Delhi, India, correspondent) and Sophie Landrin (New Delhi, India, correspondent) ",https://img.lemde.fr/2025/10/17/0/236/5028/3352/360/0/95/0/473a36a_ftp-import-images-1-jvlczba3ouuy-2025-10-17t065708z-424544770-rc2idhai5i5h-rtrmadp-3-israel-palestinians-aid-rafah.JPG 2x,
French swimmer Léon Marchand ventures into uncharted waters at the US Open,"The four-time Olympic swimming champion is set to compete in his first long-course event of the season in Austin, Texas, on Thursday. His schedule includes five races, most of which are unusual for him.",https://www.lemonde.fr/en/sports/article/2025/12/04/french-swimmer-leon-marchand-ventures-into-uncharted-waters-at-the-us-open_6748155_9.html,Subscribers only,  By Denis Ménétrier ,https://img.lemde.fr/2025/10/17/0/236/5028/3352/360/0/95/0/473a36a_ftp-import-images-1-jvlczba3ouuy-2025-10-17t065708z-424544770-rc2idhai5i5h-rtrmadp-3-israel-palestinians-aid-rafah.JPG 2x,
"Spain, Ireland and the Netherlands pull out of 2026 Eurovision over Israel's participation","The organizers of next year's Eurovision Song Contest announced they were allowing Israel to compete on Thursday, drawing quick announcements of withdrawals from European countries critical of the Israeli offensive in Gaza.",https://www.lemonde.fr/en/culture/article/2025/12/04/spain-ireland-and-the-netherlands-pull-out-of-2026-eurovision-over-israel-s-participation_6748160_30.html,Not premium,Le Monde with AP,https://img.lemde.fr/2025/10/17/0/236/5028/3352/360/0/95/0/473a36a_ftp-import-images-1-jvlczba3ouuy-2025-10-17t065708z-424544770-rc2idhai5i5h-rtrmadp-3-israel-palestinians-aid-rafah.JPG 2x,
"Iran's independent cinema in full revolt: 'With Woman, Life, Freedom, a major barrier was broken'","Galvanized by the movement that emerged after the death of Mahsa Amini in September 2022, more and more filmmakers are dating to shoot outside any official framework. In a country where film production is a state matter, their films, made and distributed clandestinely, show Iranian society as it really is.",https://www.lemonde.fr/en/m-le-mag/article/2025/12/04/iran-s-independent-cinema-in-full-revolt-with-woman-life-freedom-a-major-barrier-was-broken_6748162_117.html,Subscribers only, By Ghazal Golshiri ,https://img.lemde.fr/2025/10/17/0/236/5028/3352/360/0/95/0/473a36a_ftp-import-images-1-jvlczba3ouuy-2025-10-17t065708z-424544770-rc2idhai5i5h-rtrmadp-3-israel-palestinians-aid-rafah.JPG 2x,Investigation
Bernard Arnault denies involvement as Hermès heir sues LVMH over loss of six million shares,0,https://www.lemonde.fr/en/economy/article/2025/12/04/bernard-arnault-denies-involvement-as-hermes-heir-sues-lvmh-over-loss-of-six-million-shares_6748141_19.html,Subscribers only,  By Juliette Garnier ,https://img.lemde.fr/2025/10/17/0/236/5028/3352/360/0/95/0/473a36a_ftp-import-images-1-jvlczba3ouuy-2025-10-17t065708z-424544770-rc2idhai5i5h-rtrmadp-3-israel-palestinians-aid-rafah.JPG 2x,
French society's anti-Mafia awakening,0,https://www.lemonde.fr/en/opinion/article/2025/12/04/french-society-s-anti-mafia-awakening_6748153_23.html,Subscribers only,Jacques Follorou,https://img.lemde.fr/2025/10/17/0/236/5028/3352/360/0/95/0/473a36a_ftp-import-images-1-jvlczba3ouuy-2025-10-17t065708z-424544770-rc2idhai5i5h-rtrmadp-3-israel-palestinians-aid-rafah.JPG 2x,
"Rwanda and DRC leaders sign Trump-brokered peace deal, despite new violence",0,https://www.lemonde.fr/en/international/article/2025/12/04/rwanda-and-drc-leaders-sign-trump-brokered-peace-deal-despite-new-violence_6748163_4.html,Not premium,Le Monde with AFP,https://img.lemde.fr/2025/10/17/0/236/5028/3352/360/0/95/0/473a36a_ftp-import-images-1-jvlczba3ouuy-2025-10-17t065708z-424544770-rc2idhai5i5h-rtrmadp-3-israel-palestinians-aid-rafah.JPG 2x,
EU launches antitrust investigation into Meta's introduction of AI features in WhatsApp,0,https://www.lemonde.fr/en/pixels/article/2025/12/04/eu-launches-antitrust-investigation-into-meta-s-introduction-of-ai-features-in-whatsapp_6748143_13.html,Not premium,Le Monde with AFP,https://img.lemde.fr/2025/10/17/0/236/5028/3352/360/0/95/0/473a36a_ftp-import-images-1-jvlczba3ouuy-2025-10-17t065708z-424544770-rc2idhai5i5h-rtrmadp-3-israel-palestinians-aid-rafah.JPG 2x,
Former EU official Federica Mogherini resigns from College of Europe amid fraud probe,0,https://www.lemonde.fr/en/international/article/2025/12/04/former-eu-official-federica-mogherini-resigns-from-college-of-europe-amid-fraud-probe_6748154_4.html,Not premium,Le Monde with AFP,https://img.lemde.fr/2025/10/17/0/236/5028/3352/360/0/95/0/473a36a_ftp-import-images-1-jvlczba3ouuy-2025-10-17t065708z-424544770-rc2idhai5i5h-rtrmadp-3-israel-palestinians-aid-rafah.JPG 2x,
Algeria dashes hopes for release of French journalist Christophe Gleizes,0,https://www.lemonde.fr/en/le-monde-africa/article/2025/12/04/algeria-dashes-hopes-for-release-of-french-journalist-christophe-gleizes_6748139_124.html,Subscribers only,"  By Brice Laemle, Hamid Nasri and Simon Roger ",https://img.lemde.fr/2025/10/17/0/236/5028/3352/360/0/95/0/473a36a_ftp-import-images-1-jvlczba3ouuy-2025-10-17t065708z-424544770-rc2idhai5i5h-rtrmadp-3-israel-palestinians-aid-rafah.JPG 2x,
Versace announces departure of creative chief after less than nine months,0,https://www.lemonde.fr/en/economy/article/2025/12/04/versace-announces-departure-of-creative-chief-after-less-than-nine-months_6748158_19.html,Not premium,Le Monde with AFP,https://img.lemde.fr/2025/10/17/0/236/5028/3352/360/0/95/0/473a36a_ftp-import-images-1-jvlczba3ouuy-2025-10-17t065708z-424544770-rc2idhai5i5h-rtrmadp-3-israel-palestinians-aid-rafah.JPG 2x,
PFAS: Cereal-based foods also heavily contaminated,0,https://www.lemonde.fr/en/environment/article/2025/12/04/pfas-cereal-based-foods-also-heavily-contaminated_6748138_114.html,Subscribers only,  By Stéphane Mandard ,https://img.lemde.fr/2025/10/17/0/236/5028/3352/360/0/95/0/473a36a_ftp-import-images-1-jvlczba3ouuy-2025-10-17t065708z-424544770-rc2idhai5i5h-rtrmadp-3-israel-palestinians-aid-rafah.JPG 2x,
European Commission unveils plan to continue financial support for Ukraine after US aid ends,0,https://www.lemonde.fr/en/international/article/2025/12/04/the-european-commission-unveils-plan-to-continue-financial-support-for-ukraine-after-us-aid-ends_6748127_4.html,Subscribers only,"  By Virginie Malingre (Brussels, Europe bureau) and Philippe Jacqué (Brussels, Europe bureau) ",https://img.lemde.fr/2025/10/17/0/236/5028/3352/360/0/95/0/473a36a_ftp-import-images-1-jvlczba3ouuy-2025-10-17t065708z-424544770-rc2idhai5i5h-rtrmadp-3-israel-palestinians-aid-rafah.JPG 2x,
'New York Times' sues Pentagon over new restrictions on media outlets,0,https://www.lemonde.fr/en/international/article/2025/12/04/new-york-times-sues-pentagon-over-new-restrictions-on-media-outlets_6748152_4.html,Not premium,Le Monde with AFP,https://img.lemde.fr/2025/10/17/0/236/5028/3352/360/0/95/0/473a36a_ftp-import-images-1-jvlczba3ouuy-2025-10-17t065708z-424544770-rc2idhai5i5h-rtrmadp-3-israel-palestinians-aid-rafah.JPG 2x,
Zelensky without Yermak: The story of a split at the top of Ukraine,0,https://www.lemonde.fr/en/international/article/2025/12/04/zelensky-without-yermak-the-story-of-a-split-at-the-top-of-ukraine_6748137_4.html,Subscribers only,"  By Ariane Chemin (Kyiv (Ukraine), special correspondent) and Thomas d’Istria (Kyiv (Ukraine), correspondent) ",https://img.lemde.fr/2025/10/17/0/236/5028/3352/360/0/95/0/473a36a_ftp-import-images-1-jvlczba3ouuy-2025-10-17t065708z-424544770-rc2idhai5i5h-rtrmadp-3-israel-palestinians-aid-rafah.JPG 2x,
EU unveils plan to create market regulator to unify bloc's financial markets,0,https://www.lemonde.fr/en/economy/article/2025/12/04/eu-unveils-plan-to-create-market-regulator-to-unify-bloc-s-financial-markets_6748156_19.html,Not premium,Le Monde with AFP,https://img.lemde.fr/2025/10/17/0/236/5028/3352/360/0/95/0/473a36a_ftp-import-images-1-jvlczba3ouuy-2025-10-17t065708z-424544770-rc2idhai5i5h-rtrmadp-3-israel-palestinians-aid-rafah.JPG 2x,
"Behind Gaza's 'yellow line,' Israel's postwar laboratory","In the half of the Palestinian enclave kept under Israeli army control, several hundred members of anti-Hamas militias and criminal gangs have been brought together. Israeli authorities intend to rely on these groups to counter the Islamist movement.",https://www.lemonde.fr/en/international/article/2025/12/03/behind-gaza-s-yellow-line-israel-s-postwar-laboratory_6748121_4.html,Subscribers only,  By Louis Imbert and Marie Jo Sader ,https://img.lemde.fr/2025/10/17/0/236/5028/3352/360/0/95/0/473a36a_ftp-import-images-1-jvlczba3ouuy-2025-10-17t065708z-424544770-rc2idhai5i5h-rtrmadp-3-israel-palestinians-aid-rafah.JPG 2x,In Depth
Negotiating peace: A chaotic art with no established rules,"Donald Trump, casting himself as mediator in the Russia-Ukraine war, has been pushing Kyiv and European leaders to accept his 'peace plan,' drafted with Moscow. His seemingly erratic approach reveals a deeper issue: the absence of any standards governing peace processes.",https://www.lemonde.fr/en/international/article/2025/12/03/negotiating-peace-a-chaotic-art-with-no-established-rules_6748123_4.html,Subscribers only,  By Rémy Ourdan ,https://img.lemde.fr/2025/10/17/0/236/5028/3352/360/0/95/0/473a36a_ftp-import-images-1-jvlczba3ouuy-2025-10-17t065708z-424544770-rc2idhai5i5h-rtrmadp-3-israel-palestinians-aid-rafah.JPG 2x,In Depth
'Nighttime prohibition': Warsaw city center bans alcohol sales at night,"Nearly 180 municipalities in Poland have already opted to ban the sale of alcohol at night. On November 1, two central districts in Warsaw followed suit. The measure, which was initially intended to apply across the entire capital, has sparked heated debate.",https://www.lemonde.fr/en/international/article/2025/12/03/nighttime-prohibition-warsaw-city-center-bans-alcohol-sales-at-night_6748094_4.html,Subscribers only,  By Hélène Bienvenu (Warsaw (Poland) correspondent) ,https://img.lemde.fr/2025/10/17/0/236/5028/3352/360/0/95/0/473a36a_ftp-import-images-1-jvlczba3ouuy-2025-10-17t065708z-424544770-rc2idhai5i5h-rtrmadp-3-israel-palestinians-aid-rafah.JPG 2x,Letter from...
