title,subhead,url,suscription,byline,img_url,article_type
Israel-Iran conflict: Macron calls for a European-led diplomatic solution,0,https://www.lemonde.fr/en/international/article/2025/06/19/israel-iran-conflict-macron-calls-for-a-european-led-diplomatic-solution_6742497_4.html,Subscribers only,  By Claire Gatinois and Philippe Ricard ,https://img.lemde.fr/2025/06/19/0/0/5899/3933/360/0/95/0/6cbf92c_upload-1-kmov5sugjhpj-jmug250615007.jpg 2x,
"Putin offers minimal support to Tehran, seeks mediator role",0,https://www.lemonde.fr/en/international/article/2025/06/19/putin-offers-minimal-support-to-tehran-seeks-mediator-role_6742496_4.html,Subscribers only,"  By Benjamin Quénelle (Saint Petersburg, special correspondent) ",https://img.lemde.fr/2025/06/19/0/0/5899/3933/360/0/95/0/6cbf92c_upload-1-kmov5sugjhpj-jmug250615007.jpg 2x,
Poland is attracting foreign tourists on a quest for a cool summer escape,0,https://www.lemonde.fr/en/international/article/2025/06/19/poland-is-attracting-foreign-tourists-on-a-quest-for-a-cool-summer-escape_6742487_4.html,Subscribers only,  By Hélène Bienvenu (Warsaw (Poland) correspondent) ,https://img.lemde.fr/2025/06/19/0/0/5899/3933/360/0/95/0/6cbf92c_upload-1-kmov5sugjhpj-jmug250615007.jpg 2x,
"In the Donbas, firefighters operate under the constant threat of drones",0,https://www.lemonde.fr/en/international/article/2025/06/19/in-the-donbas-firefighters-operate-under-the-constant-threat-of-drones_6742482_4.html,Subscribers only," By Thomas d’Istria (Kyiv, special correspondent) ",https://img.lemde.fr/2025/06/19/0/0/5899/3933/360/0/95/0/6cbf92c_upload-1-kmov5sugjhpj-jmug250615007.jpg 2x,
EU lawmakers seek to end statute of limitations for child sex abuse cases,0,https://www.lemonde.fr/en/europe/article/2025/06/17/eu-lawmakers-seek-to-end-statute-of-limitations-for-child-sex-abuse-cases_6742434_143.html,Not premium,Le Monde,https://img.lemde.fr/2025/06/19/0/0/5899/3933/360/0/95/0/6cbf92c_upload-1-kmov5sugjhpj-jmug250615007.jpg 2x,
"Criticism is mounting in the Netherlands against Geert Wilders, who brought down the government",0,https://www.lemonde.fr/en/international/article/2025/06/04/in-the-netherlands-criticism-is-mounting-against-geert-wilders-who-triggered-the-fall-of-the-government_6741987_4.html,Subscribers only,  By Jean-Pierre Stroobants (The Hague (Netherlands) special correspondent) ,https://img.lemde.fr/2025/06/19/0/0/5899/3933/360/0/95/0/6cbf92c_upload-1-kmov5sugjhpj-jmug250615007.jpg 2x,
"Five years after Brexit, UK and EU aim for a fresh start",0,https://www.lemonde.fr/en/international/article/2025/05/19/five-years-after-brexit-uk-and-eu-aim-for-a-fresh-start_6741415_4.html,Subscribers only,"  By Philippe Jacqué (Brussels, Europe bureau) and Cécile Ducourtieux (London, correspondent) ",https://img.lemde.fr/2025/06/19/0/0/5899/3933/360/0/95/0/6cbf92c_upload-1-kmov5sugjhpj-jmug250615007.jpg 2x,
"In Lithuania, the fear of war with Russia lurks just around the corner",0,https://www.lemonde.fr/en/international/article/2025/05/18/in-lithuania-the-fear-of-war-with-russia-lurks-just-around-the-corner_6741400_4.html,Subscribers only," By Florent Georgesco (Kybartai, Lithuania, special correspondent) ",https://img.lemde.fr/2025/06/19/0/0/5899/3933/360/0/95/0/6cbf92c_upload-1-kmov5sugjhpj-jmug250615007.jpg 2x,
"Tolerance holding up in France despite hate speech, report on racism finds",0,https://www.lemonde.fr/en/france/article/2025/06/19/tolerance-holding-up-in-france-despite-hate-speech-finds-report-on-racism_6742488_7.html,Subscribers only,  By Louise Couvelaire ,https://img.lemde.fr/2025/06/19/0/0/5899/3933/360/0/95/0/6cbf92c_upload-1-kmov5sugjhpj-jmug250615007.jpg 2x,
"From Chenonceau to the Acropolis, heritage sites face the impacts of climate change",0,https://www.lemonde.fr/en/culture/article/2025/06/18/from-chenonceau-to-the-acropolis-heritage-sites-face-the-impacts-of-climate-change_6742474_30.html,Subscribers only,  By Roxana Azimi   ,https://img.lemde.fr/2025/06/19/0/0/5899/3933/360/0/95/0/6cbf92c_upload-1-kmov5sugjhpj-jmug250615007.jpg 2x,
Beloved black Corsican beaches threatened by nickel mining project,0,https://www.lemonde.fr/en/france/article/2025/06/17/beloved-black-corsican-beaches-threatened-by-nickel-mining-project_6742438_7.html,Subscribers only,  By Paul Ortoli (Ajaccio (France) correspondent) ,https://img.lemde.fr/2025/06/19/0/0/5899/3933/360/0/95/0/6cbf92c_upload-1-kmov5sugjhpj-jmug250615007.jpg 2x,
"The son's suicide, the father's murder and the tormented killer",0,https://www.lemonde.fr/en/france/article/2025/06/16/the-son-s-suicide-the-father-s-murder-and-the-tormented-killer_6742398_7.html,Subscribers only,  By Lorraine de Foucher  ,https://img.lemde.fr/2025/06/19/0/0/5899/3933/360/0/95/0/6cbf92c_upload-1-kmov5sugjhpj-jmug250615007.jpg 2x,
What is France's 'Black code' and why hasn't it been repealed?,0,https://www.lemonde.fr/en/videos/video/2025/05/31/what-is-france-s-black-code-and-why-hasn-t-it-been-repealed_6741860_108.html,Not premium,"  By Chloé Denis, Olivier Escher (motion design) and Diana Liu ",https://img.lemde.fr/2025/06/19/0/0/5899/3933/360/0/95/0/6cbf92c_upload-1-kmov5sugjhpj-jmug250615007.jpg 2x,
How was the European Union created?,0,https://www.lemonde.fr/en/videos/video/2025/05/29/how-was-the-european-union-created_6741795_108.html,Not premium,"  By Alexis Tromas, Robin Gasser (motion design) and Diana Liu ",https://img.lemde.fr/2025/06/19/0/0/5899/3933/360/0/95/0/6cbf92c_upload-1-kmov5sugjhpj-jmug250615007.jpg 2x,
Glide bombs: Russia's secret to making cheap weapons,0,https://www.lemonde.fr/en/videos/video/2025/05/25/glide-bombs-russia-s-secret-to-making-cheap-weapons_6741646_108.html,Subscribers only,"  By Thomas Eydoux, Marceau Bretonnier and Sinead McCausland ",https://img.lemde.fr/2025/06/19/0/0/5899/3933/360/0/95/0/6cbf92c_upload-1-kmov5sugjhpj-jmug250615007.jpg 2x,
How does the conclave pick the new pope?,0,https://www.lemonde.fr/en/videos/video/2025/05/07/how-does-the-conclave-pick-the-new-pope_6741005_108.html,Not premium,"  By Alexis Tromas, Félix Pommier (Motion design) and Diana Liu ",https://img.lemde.fr/2025/06/19/0/0/5899/3933/360/0/95/0/6cbf92c_upload-1-kmov5sugjhpj-jmug250615007.jpg 2x,
"'For the Iranian that I am, nothing justifies violating my country's territorial integrity'",0,https://www.lemonde.fr/en/opinion/article/2025/06/19/for-the-iranian-that-i-am-nothing-justifies-violating-my-country-s-territorial-integrity_6742483_23.html,Subscribers only,Anoush Ganjipour,https://img.lemde.fr/2025/06/19/0/0/5899/3933/360/0/95/0/6cbf92c_upload-1-kmov5sugjhpj-jmug250615007.jpg 2x,
Age-based employment discrimination must end,0,https://www.lemonde.fr/en/opinion/article/2025/06/19/age-based-employment-discrimination-must-end_6742498_23.html,Not premium,Le Monde,https://img.lemde.fr/2025/06/19/0/0/5899/3933/360/0/95/0/6cbf92c_upload-1-kmov5sugjhpj-jmug250615007.jpg 2x,
"Why Paris's Centre Pompidou, not even 50 years old, must close for five years",0,https://www.lemonde.fr/en/opinion/article/2025/06/19/why-the-centre-pompidou-not-even-50-years-old-must-close-for-five-years_6742490_23.html,Subscribers only,Isabelle Regnier,https://img.lemde.fr/2025/06/19/0/0/5899/3933/360/0/95/0/6cbf92c_upload-1-kmov5sugjhpj-jmug250615007.jpg 2x,
"Le Monde's cartoon of the day, by Herrmann",0,https://www.lemonde.fr/en/opinion/article/2025/06/18/le-monde-s-cartoon-of-the-day-by-herrmann_6742471_23.html,Not premium,Le Monde,https://img.lemde.fr/2025/06/19/0/0/5899/3933/360/0/95/0/6cbf92c_upload-1-kmov5sugjhpj-jmug250615007.jpg 2x,
"On the Canadian side of lake Ontario, a new identity emerges in the shadow of Trump",0,https://www.lemonde.fr/en/m-le-mag/article/2025/06/15/on-the-canadian-side-of-lake-ontario-a-new-identity-emerges-in-the-shadow-of-trump_6742361_117.html,Subscribers only," By Eliott Dumoulin (Montreal, Canada, correspondent) ",https://img.lemde.fr/2025/06/19/0/0/5899/3933/360/0/95/0/6cbf92c_upload-1-kmov5sugjhpj-jmug250615007.jpg 2x,
"Kazakhstan families search for clues about the 270,000 'missing soldiers' of the World War II Soviet Army",0,https://www.lemonde.fr/en/m-le-mag/article/2025/06/15/kazakhstan-families-search-for-clues-about-the-270-000-missing-soldiers-of-the-world-war-ii-soviet-army_6742352_117.html,Subscribers only,  By Emma Collet ,https://img.lemde.fr/2025/06/19/0/0/5899/3933/360/0/95/0/6cbf92c_upload-1-kmov5sugjhpj-jmug250615007.jpg 2x,
Maria Grazia Chiuri's final bow at home in Rome,0,https://www.lemonde.fr/en/m-le-mag/article/2025/06/13/in-rome-maria-grazia-chiuri-s-final-bow_6742321_117.html,Subscribers only, By Caroline Rousseau ,https://img.lemde.fr/2025/06/19/0/0/5899/3933/360/0/95/0/6cbf92c_upload-1-kmov5sugjhpj-jmug250615007.jpg 2x,
"The life and death of Julie, 21, swept up in the spiral of social media",0,https://www.lemonde.fr/en/m-le-mag/article/2025/06/11/the-life-and-death-of-julie-21-swept-up-in-the-spiral-of-social-media_6742255_117.html,Subscribers only, By Yann Bouchez ,https://img.lemde.fr/2025/06/19/0/0/5899/3933/360/0/95/0/6cbf92c_upload-1-kmov5sugjhpj-jmug250615007.jpg 2x,
"Why Paris's Centre Pompidou, not even 50 years old, must close for five years",0,https://www.lemonde.fr/en/opinion/article/2025/06/19/why-the-centre-pompidou-not-even-50-years-old-must-close-for-five-years_6742490_23.html,Subscribers only,Isabelle Regnier,https://img.lemde.fr/2025/06/19/0/0/5899/3933/360/0/95/0/6cbf92c_upload-1-kmov5sugjhpj-jmug250615007.jpg 2x,
Paris exhibition tries to answer the mystery of Cleopatra,0,https://www.lemonde.fr/en/culture/article/2025/06/12/paris-exhibition-tries-to-answer-the-mystery-of-cleopatra_6742287_30.html,Subscribers only,  By Philippe Dagen ,https://img.lemde.fr/2025/06/19/0/0/5899/3933/360/0/95/0/6cbf92c_upload-1-kmov5sugjhpj-jmug250615007.jpg 2x,
"Forget the jambon-beurre, try these five delicious banh mi sandwiches in Paris",0,https://www.lemonde.fr/en/lifestyle/article/2025/06/06/forget-the-jambon-beurre-try-these-five-delicious-banh-mi-sandwiches-in-paris_6742068_37.html,Subscribers only,  By Zazie Tavitian ,https://img.lemde.fr/2025/06/19/0/0/5899/3933/360/0/95/0/6cbf92c_upload-1-kmov5sugjhpj-jmug250615007.jpg 2x,
"Gabriele Münter, a framing prodigy, emerges from the shadows in new Paris show",0,https://www.lemonde.fr/en/culture/article/2025/06/04/at-the-musee-d-art-moderne-de-paris-gabriele-munter-a-framing-prodigy-has-emerged-from-the-shadows_6741982_30.html,Subscribers only,  By Harry Bellet ,https://img.lemde.fr/2025/06/19/0/0/5899/3933/360/0/95/0/6cbf92c_upload-1-kmov5sugjhpj-jmug250615007.jpg 2x,
Limiting global warming to 1.5°C is now impossible,"According to a group of scientists, the target set by the 2015 Paris Agreement can no longer be met due to the inability of countries to reduce greenhouse gas emissions.",https://www.lemonde.fr/en/environment/article/2025/06/19/limiting-global-warming-to-1-5-c-is-now-impossible_6742504_114.html,Subscribers only,  By Audrey Garric ,https://img.lemde.fr/2025/06/19/0/0/5899/3933/360/0/95/0/6cbf92c_upload-1-kmov5sugjhpj-jmug250615007.jpg 2x,
Netanyahu vows Iran will 'pay heavy price' after missile strike hits Israeli hospital,0,https://www.lemonde.fr/en/middle-east-crisis/article/2025/06/19/netanyahu-vows-iran-will-pay-heavy-price-after-missile-strike-hits-israeli-hospital_6742502_368.html,Not premium,Le Monde with AFP,https://img.lemde.fr/2025/06/19/0/0/5899/3933/360/0/95/0/6cbf92c_upload-1-kmov5sugjhpj-jmug250615007.jpg 2x,
How close is Iran to having nuclear weapons?,0,https://www.lemonde.fr/en/les-decodeurs/article/2025/06/19/how-close-is-iran-to-nuclear-weapons_6742494_8.html,Not premium,"  By Pierre Breteau, Zoé Multeau and Manon Romain ",https://img.lemde.fr/2025/06/19/0/0/5899/3933/360/0/95/0/6cbf92c_upload-1-kmov5sugjhpj-jmug250615007.jpg 2x,
"Hungary police ban Budapest Pride march, but mayor vows to hold it anyway","Citing a law against the promotion of homosexuality to minors, police have prohibited the June 28 event; Budapest's liberal Mayor Gergely Karacsony vowed to hold the gathering despite the interdiction.",https://www.lemonde.fr/en/hungary/article/2025/06/19/hungary-police-ban-budapest-pride-march-but-mayor-vows-to-hold-it-anyway_6742500_220.html,Not premium,Le Monde with AFP,https://img.lemde.fr/2025/06/19/0/0/5899/3933/360/0/95/0/6cbf92c_upload-1-kmov5sugjhpj-jmug250615007.jpg 2x,
"Tolerance holding up in France despite hate speech, report on racism finds","After a turbulent 2023 marked by the consequences of the terrorist attacks by Hamas, French people's acceptance of others again increased in 2024, according to the National Consultative Commission on Human Rights' annual study. But prejudice persists.",https://www.lemonde.fr/en/france/article/2025/06/19/tolerance-holding-up-in-france-despite-hate-speech-finds-report-on-racism_6742488_7.html,Subscribers only,  By Louise Couvelaire ,https://img.lemde.fr/2025/06/19/0/0/5899/3933/360/0/95/0/6cbf92c_upload-1-kmov5sugjhpj-jmug250615007.jpg 2x,
"The 2021 US withdrawal from Afghanistan, a solo decision","'The Transatlantic Divorce' (4/5). Initiated by Donald Trump in 2020 without consulting US allies, the American departure from Kabul unfolded the following year in apocalyptic conditions as the Taliban retook control of the country, wiping out the effects of two decades of Western intervention.",https://www.lemonde.fr/en/history/article/2025/06/19/the-2021-us-withdrawal-from-afghanistan-a-solo-decision_6742489_157.html,Subscribers only, By Sylvie Kauffmann (Columnist) ,https://img.lemde.fr/2025/06/19/0/0/5899/3933/360/0/95/0/6cbf92c_upload-1-kmov5sugjhpj-jmug250615007.jpg 2x,
"Why Paris's Centre Pompidou, not even 50 years old, must close for five years","The building designed by Renzo Piano and Richard Rogers is set to undergo major renovations until 2030 in order to reduce its energy consumption by 40%. Since its opening in 1977, the space has been in constant transformation.",https://www.lemonde.fr/en/opinion/article/2025/06/19/why-the-centre-pompidou-not-even-50-years-old-must-close-for-five-years_6742490_23.html,Subscribers only,Isabelle Regnier,https://img.lemde.fr/2025/06/19/0/0/5899/3933/360/0/95/0/6cbf92c_upload-1-kmov5sugjhpj-jmug250615007.jpg 2x,News analysis
Why the French economy is stuck in stagnation,0,https://www.lemonde.fr/en/economy/article/2025/06/19/why-the-french-economy-is-stuck-in-stagnation_6742493_19.html,Subscribers only,  By Béatrice Madeline   ,https://img.lemde.fr/2025/06/19/0/0/5899/3933/360/0/95/0/6cbf92c_upload-1-kmov5sugjhpj-jmug250615007.jpg 2x,
"Putin offers minimal support to Tehran, seeks mediator role",0,https://www.lemonde.fr/en/international/article/2025/06/19/putin-offers-minimal-support-to-tehran-seeks-mediator-role_6742496_4.html,Subscribers only,"  By Benjamin Quénelle (Saint Petersburg, special correspondent) ",https://img.lemde.fr/2025/06/19/0/0/5899/3933/360/0/95/0/6cbf92c_upload-1-kmov5sugjhpj-jmug250615007.jpg 2x,
Israel-Iran conflict: Macron calls for a European-led diplomatic solution,0,https://www.lemonde.fr/en/international/article/2025/06/19/israel-iran-conflict-macron-calls-for-a-european-led-diplomatic-solution_6742497_4.html,Subscribers only,  By Claire Gatinois and Philippe Ricard ,https://img.lemde.fr/2025/06/19/0/0/5899/3933/360/0/95/0/6cbf92c_upload-1-kmov5sugjhpj-jmug250615007.jpg 2x,
Poland is attracting foreign tourists on a quest for a cool summer escape,0,https://www.lemonde.fr/en/international/article/2025/06/19/poland-is-attracting-foreign-tourists-on-a-quest-for-a-cool-summer-escape_6742487_4.html,Subscribers only,  By Hélène Bienvenu (Warsaw (Poland) correspondent) ,https://img.lemde.fr/2025/06/19/0/0/5899/3933/360/0/95/0/6cbf92c_upload-1-kmov5sugjhpj-jmug250615007.jpg 2x,
"After French school supervisor stabbing, questions arise over social media ban for under-15s",0,https://www.lemonde.fr/en/pixels/article/2025/06/19/after-french-school-supervisor-stabbing-questions-arise-over-social-media-ban-for-under-15s_6742503_13.html,Subscribers only,  By Florian Reynaud and Damien Leloup ,https://img.lemde.fr/2025/06/19/0/0/5899/3933/360/0/95/0/6cbf92c_upload-1-kmov5sugjhpj-jmug250615007.jpg 2x,
"In the Donbas, firefighters operate under the constant threat of drones",0,https://www.lemonde.fr/en/international/article/2025/06/19/in-the-donbas-firefighters-operate-under-the-constant-threat-of-drones_6742482_4.html,Subscribers only," By Thomas d’Istria (Kyiv, special correspondent) ",https://img.lemde.fr/2025/06/19/0/0/5899/3933/360/0/95/0/6cbf92c_upload-1-kmov5sugjhpj-jmug250615007.jpg 2x,
"In Paris, the world's most attended cinema turns 30",0,https://www.lemonde.fr/en/culture/article/2025/06/18/in-paris-the-world-s-most-attended-cinema-turns-30_6742470_30.html,Subscribers only,  By Nicole Vulser ,https://img.lemde.fr/2025/06/19/0/0/5899/3933/360/0/95/0/6cbf92c_upload-1-kmov5sugjhpj-jmug250615007.jpg 2x,
US approves Gilead's twice-yearly injection to prevent HIV,0,https://www.lemonde.fr/en/science/article/2025/06/18/us-approves-gilead-s-twice-yearly-injection-to-prevent-hiv_6742480_10.html,Not premium,Le Monde with AFP,https://img.lemde.fr/2025/06/19/0/0/5899/3933/360/0/95/0/6cbf92c_upload-1-kmov5sugjhpj-jmug250615007.jpg 2x,
Putin to visit China for regional summit and WWII commemorations,0,https://www.lemonde.fr/en/russia/article/2025/06/19/putin-to-visit-china-for-regional-summit-and-wwii-commemorations_6742501_140.html,Not premium,Le Monde with AFP,https://img.lemde.fr/2025/06/19/0/0/5899/3933/360/0/95/0/6cbf92c_upload-1-kmov5sugjhpj-jmug250615007.jpg 2x,
"Trump on whether or not US will join Israeli strikes on Iran: 'I may do it, I may not do it'",0,https://www.lemonde.fr/en/international/article/2025/06/18/trump-on-iran-strikes-i-may-do-it-i-may-not-do-it_6742466_4.html,Not premium,Le Monde with AP and AFP,https://img.lemde.fr/2025/06/19/0/0/5899/3933/360/0/95/0/6cbf92c_upload-1-kmov5sugjhpj-jmug250615007.jpg 2x,
"In Lyon, public transport returns to the Saône River",0,https://www.lemonde.fr/en/economy/article/2025/06/19/in-lyon-public-transport-returns-to-the-saone-river_6742486_19.html,Subscribers only,  By Richard Schittly (Lyon (France) correspondent) ,https://img.lemde.fr/2025/06/19/0/0/5899/3933/360/0/95/0/6cbf92c_upload-1-kmov5sugjhpj-jmug250615007.jpg 2x,
US Fed keeps interest rates unchanged in face of Trump criticism,0,https://www.lemonde.fr/en/economy/article/2025/06/18/us-fed-keeps-interest-rates-unchanged-in-face-of-trump-criticism_6742479_19.html,Not premium,Le Monde with AFP,https://img.lemde.fr/2025/06/19/0/0/5899/3933/360/0/95/0/6cbf92c_upload-1-kmov5sugjhpj-jmug250615007.jpg 2x,
How Israel gained air superiority over Iran's sky,Israel has waged a long war against Iran and its 'axis of resistance' to control the air corridor leading to Tehran.,https://www.lemonde.fr/en/international/article/2025/06/18/israel-iran-conflict-how-israel-gained-air-superiority-over-tehran_6742475_4.html,Subscribers only,"  By Samuel Forey (Jerusalem, correspondent) ",https://img.lemde.fr/2025/06/19/0/0/5899/3933/360/0/95/0/6cbf92c_upload-1-kmov5sugjhpj-jmug250615007.jpg 2x,News
"Behind Trump and Macron's war of words, G7 reveals deep Western divisions","From Iran to Ukraine to trade disputes, tensions have escalated between the American president and his fellow G7 leaders. Donald Trump said on Tuesday that Emmanuel Macron 'always gets it wrong' and is 'publicity seeking.'",https://www.lemonde.fr/en/international/article/2025/06/18/behind-trump-and-macron-s-war-of-words-g7-reveals-deep-western-divisions_6742454_4.html,Subscribers only,  By Philippe Ricard ,https://img.lemde.fr/2025/06/19/0/0/5899/3933/360/0/95/0/6cbf92c_upload-1-kmov5sugjhpj-jmug250615007.jpg 2x,In Depth
"From Chenonceau to the Acropolis, heritage sites face the impacts of climate change","Extreme weather events are increasingly affecting historic monuments, in France and around the world.",https://www.lemonde.fr/en/culture/article/2025/06/18/from-chenonceau-to-the-acropolis-heritage-sites-face-the-impacts-of-climate-change_6742474_30.html,Subscribers only,  By Roxana Azimi   ,https://img.lemde.fr/2025/06/19/0/0/5899/3933/360/0/95/0/6cbf92c_upload-1-kmov5sugjhpj-jmug250615007.jpg 2x,In Depth
Age-based employment discrimination must end,0,https://www.lemonde.fr/en/opinion/article/2025/06/19/age-based-employment-discrimination-must-end_6742498_23.html,Not premium,Le Monde,https://img.lemde.fr/2025/06/19/0/0/5899/3933/360/0/95/0/6cbf92c_upload-1-kmov5sugjhpj-jmug250615007.jpg 2x,Editorial
"'For the Iranian that I am, nothing justifies violating my country's territorial integrity'",0,https://www.lemonde.fr/en/opinion/article/2025/06/19/for-the-iranian-that-i-am-nothing-justifies-violating-my-country-s-territorial-integrity_6742483_23.html,Subscribe,Anoush Ganjipour,https://img.lemde.fr/2025/06/19/0/0/5899/3933/360/0/95/0/6cbf92c_upload-1-kmov5sugjhpj-jmug250615007.jpg 2x,Op-Ed
International law and the lessons of history,0,https://www.lemonde.fr/en/opinion/article/2025/06/18/international-law-and-the-lessons-of-history_6742458_23.html,Not premium,Le Monde,https://img.lemde.fr/2025/06/19/0/0/5899/3933/360/0/95/0/6cbf92c_upload-1-kmov5sugjhpj-jmug250615007.jpg 2x,Editorial
