title,subhead,url,suscription,byline,img_url,article_type
"Federica Mogherini, former EU foreign policy chief, taken into police custody over suspected fraud",0,https://www.lemonde.fr/en/international/article/2025/12/02/federica-mogherini-former-eu-foreign-policy-chief-taken-into-police-custody-over-suspected-fraud_6748087_4.html,Subscribers only,"  By Philippe Jacqué (Brussels, Europe bureau) and Jean-Pierre Stroobants (Brussels, correspondent) ",https://img.lemde.fr/2018/02/26/0/105/3870/2580/360/0/95/0/573eb54_cb222ca48f224c7bafbe5a61d6eeb1c1-cb222ca48f224c7bafbe5a61d6eeb1c1-0.jpg 2x,
Zelensky urged to reform his leadership amid ongoing peace talks,0,https://www.lemonde.fr/en/international/article/2025/12/02/zelensky-urged-to-reform-his-leadership-amid-ongoing-peace-talks_6748086_4.html,Subscribers only," By Thomas d’Istria (Kyiv, correspondent) ",https://img.lemde.fr/2018/02/26/0/105/3870/2580/360/0/95/0/573eb54_cb222ca48f224c7bafbe5a61d6eeb1c1-cb222ca48f224c7bafbe5a61d6eeb1c1-0.jpg 2x,
Macron travels to China with slim hopes of swaying Beijing on Ukraine and trade,0,https://www.lemonde.fr/en/international/article/2025/12/02/macron-travels-to-china-with-slim-hopes-of-swaying-beijing-on-ukraine-and-trade_6748081_4.html,Subscribers only,  By Philippe Ricard (Beijing (China) special correspondent) and Harold Thibault (Beijing (China) correspondent) ,https://img.lemde.fr/2018/02/26/0/105/3870/2580/360/0/95/0/573eb54_cb222ca48f224c7bafbe5a61d6eeb1c1-cb222ca48f224c7bafbe5a61d6eeb1c1-0.jpg 2x,
Russia claims capture of key city Pokrovsk as Ukraine says fighting continues,0,https://www.lemonde.fr/en/international/video/2025/12/02/russia-claims-capture-of-key-city-pokrovsk-as-ukraine-says-fighting-continues_6748076_4.html,Not premium,  By Le Monde's video desk   ,https://img.lemde.fr/2018/02/26/0/105/3870/2580/360/0/95/0/573eb54_cb222ca48f224c7bafbe5a61d6eeb1c1-cb222ca48f224c7bafbe5a61d6eeb1c1-0.jpg 2x,
Bosnia and Herzegovina's Serb entity elects ally of  former leader Dodik,0,https://www.lemonde.fr/en/international/article/2025/11/24/bosnia-and-herzegovina-s-serb-entity-elects-ally-of-former-leader-dodik_6747765_4.html,Subscribers only,  By Rémy Ourdan (Banja Luka (Bosnia and Herzegovina) special correspondent) ,https://img.lemde.fr/2018/02/26/0/105/3870/2580/360/0/95/0/573eb54_cb222ca48f224c7bafbe5a61d6eeb1c1-cb222ca48f224c7bafbe5a61d6eeb1c1-0.jpg 2x,
"In France's Somme, bagpipers keep the memory of the Great War alive",0,https://www.lemonde.fr/en/history/article/2025/11/11/in-france-s-somme-bagpipers-keep-the-memory-of-the-great-war-alive_6747347_157.html,Subscribers only," By Marie-Béatrice Baudet (Ovillers-la-Boisselle [Somme], special correspondent) ",https://img.lemde.fr/2018/02/26/0/105/3870/2580/360/0/95/0/573eb54_cb222ca48f224c7bafbe5a61d6eeb1c1-cb222ca48f224c7bafbe5a61d6eeb1c1-0.jpg 2x,
Latvia: Public mobilization grows in support of treaty for preventing violence against women,0,https://www.lemonde.fr/en/international/article/2025/11/06/in-latvia-public-mobilization-continues-to-grow-in-support-of-the-istanbul-convention-for-preventing-violence-against-women_6747156_4.html,Subscribers only,  By Anne-Françoise Hivert (Malmö (Sweden) correspondent) ,https://img.lemde.fr/2018/02/26/0/105/3870/2580/360/0/95/0/573eb54_cb222ca48f224c7bafbe5a61d6eeb1c1-cb222ca48f224c7bafbe5a61d6eeb1c1-0.jpg 2x,
"After Charlie Kirk's murder, Europe's far right swears allegiance to Trump's politics",0,https://www.lemonde.fr/en/les-decodeurs/article/2025/10/20/the-murder-of-charlie-kirk-how-europe-s-far-right-swore-allegiance-to-trump-s-politics_6746586_8.html,Subscribers only, By Allan Kaval (Rome (Italy) correspondent) and Manon Romain (with Clément Guillou and Le Monde correspondents in Europe) ,https://img.lemde.fr/2018/02/26/0/105/3870/2580/360/0/95/0/573eb54_cb222ca48f224c7bafbe5a61d6eeb1c1-cb222ca48f224c7bafbe5a61d6eeb1c1-0.jpg 2x,
Marseille grapples with drug trafficking: 'They are so many and they have so much money',0,https://www.lemonde.fr/en/france/article/2025/12/02/marseille-grapples-with-drug-trafficking-they-are-so-many-and-they-have-so-much-money_6748047_7.html,Subscribers only, By Grégoire Biseau (Marseille (France) special correspondent) and Gilles Rof (Marseille (France) correspondent) ,https://img.lemde.fr/2018/02/26/0/105/3870/2580/360/0/95/0/573eb54_cb222ca48f224c7bafbe5a61d6eeb1c1-cb222ca48f224c7bafbe5a61d6eeb1c1-0.jpg 2x,
Foreign interference: Why France is raising its voice and turning to the courts,0,https://www.lemonde.fr/en/france/article/2025/12/01/foreign-interference-why-france-is-raising-its-voice-and-turning-to-the-courts_6748034_7.html,Subscribers only,  By Jacques Follorou ,https://img.lemde.fr/2018/02/26/0/105/3870/2580/360/0/95/0/573eb54_cb222ca48f224c7bafbe5a61d6eeb1c1-cb222ca48f224c7bafbe5a61d6eeb1c1-0.jpg 2x,
French mayor convicted and set to be incarcerated in sex-tape blackmail case,0,https://www.lemonde.fr/en/france/article/2025/12/01/french-mayor-convicted-and-set-to-be-incarcerated-in-sex-tape-blackmail-case_6748032_7.html,Subscribers only,  By Richard Schittly (Lyon (France) correspondent) ,https://img.lemde.fr/2018/02/26/0/105/3870/2580/360/0/95/0/573eb54_cb222ca48f224c7bafbe5a61d6eeb1c1-cb222ca48f224c7bafbe5a61d6eeb1c1-0.jpg 2x,
France adopts new interception rules for migrants crossing Channel,0,https://www.lemonde.fr/en/france/article/2025/12/01/france-adopts-new-interception-rules-for-migrants-crossing-channel_6748031_7.html,Subscribers only,  By Julia Pascual ,https://img.lemde.fr/2018/02/26/0/105/3870/2580/360/0/95/0/573eb54_cb222ca48f224c7bafbe5a61d6eeb1c1-cb222ca48f224c7bafbe5a61d6eeb1c1-0.jpg 2x,
"Israel's D9 bulldozer, a tool of destruction in Gaza",0,https://www.lemonde.fr/en/videos/video/2025/11/27/israel-s-d9-bulldozer-a-tool-of-destruction-in-gaza_6747870_108.html,Subscribers only,"  By Liselotte Mas, Elsa Longueville (motion design) and Sinead McCausland ",https://img.lemde.fr/2018/02/26/0/105/3870/2580/360/0/95/0/573eb54_cb222ca48f224c7bafbe5a61d6eeb1c1-cb222ca48f224c7bafbe5a61d6eeb1c1-0.jpg 2x,
"Ukraine's Pokrovsk faces fierce fighting, footage analyzed by Le Monde reveals",0,https://www.lemonde.fr/en/videos/video/2025/11/21/ukraine-s-pokrovsk-faces-fierce-fighting-footage-analyzed-by-le-monde-reveals_6747708_108.html,Subscribers only,"  By Alexandre Horn, Gabriel Lecointre (edit), Elisa Bellanger (motion design) and Sinead McCausland ",https://img.lemde.fr/2018/02/26/0/105/3870/2580/360/0/95/0/573eb54_cb222ca48f224c7bafbe5a61d6eeb1c1-cb222ca48f224c7bafbe5a61d6eeb1c1-0.jpg 2x,
Afghanistan: Relentless repression continues over four years into Taliban's rule,0,https://www.lemonde.fr/en/videos/video/2025/10/04/afghanistan-relentless-repression-continues-over-four-years-into-taliban-s-rule_6746092_108.html,Not premium,"  By Chloé Denis, Félix Pommier (Motion design) and Sinead McCausland ",https://img.lemde.fr/2018/02/26/0/105/3870/2580/360/0/95/0/573eb54_cb222ca48f224c7bafbe5a61d6eeb1c1-cb222ca48f224c7bafbe5a61d6eeb1c1-0.jpg 2x,
Watch: Hundreds of thousands march in France against budget cuts,0,https://www.lemonde.fr/en/videos/video/2025/09/19/french-strikes-watch-what-happened-as-hundreds-of-thousands-marched-against-budget-cuts_6745548_108.html,Not premium,  By Le Monde's video desk   ,https://img.lemde.fr/2018/02/26/0/105/3870/2580/360/0/95/0/573eb54_cb222ca48f224c7bafbe5a61d6eeb1c1-cb222ca48f224c7bafbe5a61d6eeb1c1-0.jpg 2x,
Donald Trump and the spread of impunity,0,https://www.lemonde.fr/en/opinion/article/2025/12/02/donald-trump-and-the-spread-of-impunity_6748066_23.html,Not premium,Le Monde,https://img.lemde.fr/2018/02/26/0/105/3870/2580/360/0/95/0/573eb54_cb222ca48f224c7bafbe5a61d6eeb1c1-cb222ca48f224c7bafbe5a61d6eeb1c1-0.jpg 2x,
French PM Lecornu's budget strategy is put to the test of Parliament,0,https://www.lemonde.fr/en/opinion/article/2025/12/02/french-pm-lecornu-s-budget-strategy-is-put-to-the-test-of-parliament_6748072_23.html,Subscribers only,Solenn de Royer,https://img.lemde.fr/2018/02/26/0/105/3870/2580/360/0/95/0/573eb54_cb222ca48f224c7bafbe5a61d6eeb1c1-cb222ca48f224c7bafbe5a61d6eeb1c1-0.jpg 2x,
"'Through his first trip, Pope Leo XIV asserts a diplomatic style that gives him the stature of an arbiter'",0,https://www.lemonde.fr/en/opinion/article/2025/12/02/francois-mabille-political-scientist-through-his-first-trip-pope-leo-xiv-asserts-a-diplomatic-style-that-gives-him-the-stature-of-an-arbiter_6748051_23.html,Subscribers only,François Mabille,https://img.lemde.fr/2018/02/26/0/105/3870/2580/360/0/95/0/573eb54_cb222ca48f224c7bafbe5a61d6eeb1c1-cb222ca48f224c7bafbe5a61d6eeb1c1-0.jpg 2x,
"'For Europe, catching up in the digital sector should not mean deregulating at every turn'",0,https://www.lemonde.fr/en/opinion/article/2025/12/01/for-europe-catching-up-in-the-digital-sector-should-not-mean-deregulating-at-every-turn_6748039_23.html,Subscribers only,Stéphane Lauer,https://img.lemde.fr/2018/02/26/0/105/3870/2580/360/0/95/0/573eb54_cb222ca48f224c7bafbe5a61d6eeb1c1-cb222ca48f224c7bafbe5a61d6eeb1c1-0.jpg 2x,
The first time Le Monde wrote about Jeffrey Epstein,0,https://www.lemonde.fr/en/m-le-mag/article/2025/12/01/the-first-time-le-monde-wrote-about-jeffrey-epstein_6748001_117.html,Subscribers only,Gaspard Dhellemmes,https://img.lemde.fr/2018/02/26/0/105/3870/2580/360/0/95/0/573eb54_cb222ca48f224c7bafbe5a61d6eeb1c1-cb222ca48f224c7bafbe5a61d6eeb1c1-0.jpg 2x,
The last-minute fight to save Gaza's ancient archaeological treasures,0,https://www.lemonde.fr/en/m-le-mag/article/2025/11/30/the-last-minute-fight-to-save-gaza-s-ancient-archaeological-treasures_6747984_117.html,Subscribers only, By Samuel Forey ,https://img.lemde.fr/2018/02/26/0/105/3870/2580/360/0/95/0/573eb54_cb222ca48f224c7bafbe5a61d6eeb1c1-cb222ca48f224c7bafbe5a61d6eeb1c1-0.jpg 2x,
The art of being Oscar Wilde's grandson,0,https://www.lemonde.fr/en/m-le-mag/article/2025/11/30/the-art-of-being-oscar-wilde-s-grandson_6747977_117.html,Subscribers only,  By Clémentine Goldszal ,https://img.lemde.fr/2018/02/26/0/105/3870/2580/360/0/95/0/573eb54_cb222ca48f224c7bafbe5a61d6eeb1c1-cb222ca48f224c7bafbe5a61d6eeb1c1-0.jpg 2x,
"Gay Talese, the last titan of the American press",0,https://www.lemonde.fr/en/m-le-mag/article/2025/11/29/gay-talese-the-last-titan-of-the-american-press_6747954_117.html,Subscribers only, By Clémentine Goldszal ,https://img.lemde.fr/2018/02/26/0/105/3870/2580/360/0/95/0/573eb54_cb222ca48f224c7bafbe5a61d6eeb1c1-cb222ca48f224c7bafbe5a61d6eeb1c1-0.jpg 2x,
"Bayonne's 'Little Louvre,' the Bonnat-Helleu Museum, reopens after 14 years",0,https://www.lemonde.fr/en/culture/article/2025/11/28/bayonne-s-little-louvre-the-bonnat-helleu-museum-reopens-after-14-years_6747913_30.html,Subscribers only,  By Roxana Azimi (Bayonne (France) special correspondent) ,https://img.lemde.fr/2018/02/26/0/105/3870/2580/360/0/95/0/573eb54_cb222ca48f224c7bafbe5a61d6eeb1c1-cb222ca48f224c7bafbe5a61d6eeb1c1-0.jpg 2x,
Victor Hugo's interior architecture on display in Paris,0,https://www.lemonde.fr/en/lifestyle/article/2025/11/23/victor-hugo-s-interior-architecture-on-display-in-paris_6747753_37.html,Subscribers only,  By Véronique Lorelle ,https://img.lemde.fr/2018/02/26/0/105/3870/2580/360/0/95/0/573eb54_cb222ca48f224c7bafbe5a61d6eeb1c1-cb222ca48f224c7bafbe5a61d6eeb1c1-0.jpg 2x,
A stroll through Cachan: From a royal aqueduct to a panoramic garden,0,https://www.lemonde.fr/en/lifestyle/article/2025/11/22/a-stroll-through-cachan-from-a-royal-aqueduct-to-a-panoramic-garden_6747720_37.html,Subscribers only, By Delphine Le Feuvre ,https://img.lemde.fr/2018/02/26/0/105/3870/2580/360/0/95/0/573eb54_cb222ca48f224c7bafbe5a61d6eeb1c1-cb222ca48f224c7bafbe5a61d6eeb1c1-0.jpg 2x,
Azzedine Alaïa's Dior collection on view in Paris,0,https://www.lemonde.fr/en/lifestyle/article/2025/11/21/azzedine-alaia-s-dior-collection-on-view-in-paris_6747679_37.html,Subscribers only,  By Elvire von Bardeleben ,https://img.lemde.fr/2018/02/26/0/105/3870/2580/360/0/95/0/573eb54_cb222ca48f224c7bafbe5a61d6eeb1c1-cb222ca48f224c7bafbe5a61d6eeb1c1-0.jpg 2x,
Zelensky urged to reform his leadership amid ongoing peace talks,"The resignation of his trusted aide and two of his ministers over corruption allegations has ignited debate over the Ukrainian president's leadership style, as calls grow for greater openness and transparency.",https://www.lemonde.fr/en/international/article/2025/12/02/zelensky-urged-to-reform-his-leadership-amid-ongoing-peace-talks_6748086_4.html,Subscribers only," By Thomas d’Istria (Kyiv, correspondent) ",https://img.lemde.fr/2018/02/26/0/105/3870/2580/360/0/95/0/573eb54_cb222ca48f224c7bafbe5a61d6eeb1c1-cb222ca48f224c7bafbe5a61d6eeb1c1-0.jpg 2x,
Macron travels to China with slim hopes of swaying Beijing on Ukraine and trade,0,https://www.lemonde.fr/en/international/article/2025/12/02/macron-travels-to-china-with-slim-hopes-of-swaying-beijing-on-ukraine-and-trade_6748081_4.html,Subscribers only,  By Philippe Ricard (Beijing (China) special correspondent) and Harold Thibault (Beijing (China) correspondent) ,https://img.lemde.fr/2018/02/26/0/105/3870/2580/360/0/95/0/573eb54_cb222ca48f224c7bafbe5a61d6eeb1c1-cb222ca48f224c7bafbe5a61d6eeb1c1-0.jpg 2x,
Francis Ford Coppola auctions his watches after  'Megalopolis' disaster,0,https://www.lemonde.fr/en/culture/article/2025/12/02/francis-ford-coppola-auctions-his-watches-after-megalopolis-disaster_6748080_30.html,Subscribers only,  By Arnaud Leparmentier (San Francisco (United States) correspondent) ,https://img.lemde.fr/2018/02/26/0/105/3870/2580/360/0/95/0/573eb54_cb222ca48f224c7bafbe5a61d6eeb1c1-cb222ca48f224c7bafbe5a61d6eeb1c1-0.jpg 2x,
"Trump administration targets foreigners, beyond undocumented migrants","Following the attack on two National Guard soldiers in Washington, US authorities have stepped up announcements aimed at immigrants, raising the prospect of a possible 'remigration.'",https://www.lemonde.fr/en/international/article/2025/12/02/trump-administration-targets-foreigners-beyond-undocumented-migrants_6748059_4.html,Subscribers only,  By Piotr Smolar (Washington (United States) correspondent) ,https://img.lemde.fr/2018/02/26/0/105/3870/2580/360/0/95/0/573eb54_cb222ca48f224c7bafbe5a61d6eeb1c1-cb222ca48f224c7bafbe5a61d6eeb1c1-0.jpg 2x,
Christophe Gleizes: The life on hold of a French journalist imprisoned in Algeria,"Aged 36, Christophe Gleizes has been held in Tizi Ouzou for more than five months. Arrested in Kabylie while reporting on a football club, he was sentenced in June to seven years in prison for 'glorifying terrorism.' His appeal trial opens on December 3.",https://www.lemonde.fr/en/le-monde-africa/article/2025/12/02/christophe-gleizes-the-life-on-hold-of-a-french-journalist-imprisoned-in-algeria_6748078_124.html,Subscribers only, By Brice Laemle and Simon Roger ,https://img.lemde.fr/2018/02/26/0/105/3870/2580/360/0/95/0/573eb54_cb222ca48f224c7bafbe5a61d6eeb1c1-cb222ca48f224c7bafbe5a61d6eeb1c1-0.jpg 2x,
Rare Fabergé 'Winter Egg' sells for record-breaking $30.2 million,"Crafted for Russia's imperial family in 1913, this crystal and diamond egg was described as 'the Mona Lisa for decorative arts' before it sold at auction in London on Tuesday.",https://www.lemonde.fr/en/culture/article/2025/12/02/rare-faberge-winter-egg-sells-for-record-breaking-30-2-million_6748085_30.html,Not premium,Le Monde with AP,https://img.lemde.fr/2018/02/26/0/105/3870/2580/360/0/95/0/573eb54_cb222ca48f224c7bafbe5a61d6eeb1c1-cb222ca48f224c7bafbe5a61d6eeb1c1-0.jpg 2x,
Leonardo DiCaprio and Paul Thomas Anderson: Two Hollywood stars in Paris after the battle,"Absent during the European promotion of the film 'One Battle After Another,' the American actor and director reunited in France to talk about Hollywood and their 30-year friendship.",https://www.lemonde.fr/en/culture/article/2025/12/02/leonardo-dicaprio-and-paul-thomas-anderson-two-hollywood-stars-in-paris-after-the-battle_6748084_30.html,Subscribers only,  By Mathieu Macheret ,https://img.lemde.fr/2018/02/26/0/105/3870/2580/360/0/95/0/573eb54_cb222ca48f224c7bafbe5a61d6eeb1c1-cb222ca48f224c7bafbe5a61d6eeb1c1-0.jpg 2x,Conversation
French PM Lecornu's budget strategy is put to the test of Parliament,0,https://www.lemonde.fr/en/opinion/article/2025/12/02/french-pm-lecornu-s-budget-strategy-is-put-to-the-test-of-parliament_6748072_23.html,Subscribers only,Solenn de Royer,https://img.lemde.fr/2018/02/26/0/105/3870/2580/360/0/95/0/573eb54_cb222ca48f224c7bafbe5a61d6eeb1c1-cb222ca48f224c7bafbe5a61d6eeb1c1-0.jpg 2x,
"Federica Mogherini, former EU foreign policy chief, taken into police custody over suspected fraud",0,https://www.lemonde.fr/en/international/article/2025/12/02/federica-mogherini-former-eu-foreign-policy-chief-taken-into-police-custody-over-suspected-fraud_6748087_4.html,Subscribers only,"  By Philippe Jacqué (Brussels, Europe bureau) and Jean-Pierre Stroobants (Brussels, correspondent) ",https://img.lemde.fr/2018/02/26/0/105/3870/2580/360/0/95/0/573eb54_cb222ca48f224c7bafbe5a61d6eeb1c1-cb222ca48f224c7bafbe5a61d6eeb1c1-0.jpg 2x,
Pope Leo calls for end to hostilities in Lebanon as he closes first foreign trip,0,https://www.lemonde.fr/en/international/article/2025/12/02/pope-leo-calls-for-end-to-hostilities-in-lebanon-as-he-ends-first-foreign-trip_6748074_4.html,Not premium,Le Monde with AFP,https://img.lemde.fr/2018/02/26/0/105/3870/2580/360/0/95/0/573eb54_cb222ca48f224c7bafbe5a61d6eeb1c1-cb222ca48f224c7bafbe5a61d6eeb1c1-0.jpg 2x,
Cyclone Ditwah devastates all of Sri Lanka in unprecedented disaster,0,https://www.lemonde.fr/en/environment/article/2025/12/02/cyclone-ditwah-devastates-all-of-sri-lanka-in-unprecedented-disaster_6748062_114.html,Subscribers only,"  By Sophie Landrin (New Delhi, India, correspondent) and Sandun Jayawardana (Colombo, Sri Lanka, special correspondent) ",https://img.lemde.fr/2018/02/26/0/105/3870/2580/360/0/95/0/573eb54_cb222ca48f224c7bafbe5a61d6eeb1c1-cb222ca48f224c7bafbe5a61d6eeb1c1-0.jpg 2x,
Macron denies 'ministry of truth' plan after attacks from far right,0,https://www.lemonde.fr/en/politics/article/2025/12/02/macron-denies-ministry-of-truth-plan-after-attacks-from-far-right_6748075_5.html,Not premium,Le Monde with AFP,https://img.lemde.fr/2018/02/26/0/105/3870/2580/360/0/95/0/573eb54_cb222ca48f224c7bafbe5a61d6eeb1c1-cb222ca48f224c7bafbe5a61d6eeb1c1-0.jpg 2x,
Honduran ex-president pardoned by Trump is released from US prison,0,https://www.lemonde.fr/en/international/article/2025/12/02/honduran-ex-president-receives-surprise-pardon-by-trump-released-from-us-prison_6748073_4.html,Not premium,Le Monde with AFP,https://img.lemde.fr/2018/02/26/0/105/3870/2580/360/0/95/0/573eb54_cb222ca48f224c7bafbe5a61d6eeb1c1-cb222ca48f224c7bafbe5a61d6eeb1c1-0.jpg 2x,
French authorities open investigation into 'aggravated assault' involving Nice football squad,0,https://www.lemonde.fr/en/sports/article/2025/12/02/french-authorities-open-investigation-into-aggravated-assault-involving-nice-football-squad_6748082_9.html,Not premium,Le Monde with AFP,https://img.lemde.fr/2018/02/26/0/105/3870/2580/360/0/95/0/573eb54_cb222ca48f224c7bafbe5a61d6eeb1c1-cb222ca48f224c7bafbe5a61d6eeb1c1-0.jpg 2x,
Torrential rains in Indonesia destroy villages and leave more than 600 dead,0,https://www.lemonde.fr/en/environment/article/2025/12/02/torrential-rains-in-indonesia-destroy-villages-and-leave-more-than-600-dead_6748061_114.html,Subscribers only, By Brice Pedroletti (Bangkok (Thailand) correspondent) ,https://img.lemde.fr/2018/02/26/0/105/3870/2580/360/0/95/0/573eb54_cb222ca48f224c7bafbe5a61d6eeb1c1-cb222ca48f224c7bafbe5a61d6eeb1c1-0.jpg 2x,
"Luigi Mangione, accused of killing a health insurance executive, leaves Americans divided",0,https://www.lemonde.fr/en/international/article/2025/12/02/luigi-mangione-accused-of-killing-a-health-insurance-executive-in-new-york-in-2024-leaves-americans-divided_6748045_4.html,Subscribers only,  By Nicolas Chapuis (New York (United States) correspondent) ,https://img.lemde.fr/2018/02/26/0/105/3870/2580/360/0/95/0/573eb54_cb222ca48f224c7bafbe5a61d6eeb1c1-cb222ca48f224c7bafbe5a61d6eeb1c1-0.jpg 2x,
Trump increases pressure on Maduro but stops short of action,0,https://www.lemonde.fr/en/international/article/2025/12/02/trump-increases-pressure-on-nicolas-maduro-but-stops-short-of-action_6748068_4.html,Subscribers only,"  By Marie Delcas (Bogota (Colombia), correspondent) ",https://img.lemde.fr/2018/02/26/0/105/3870/2580/360/0/95/0/573eb54_cb222ca48f224c7bafbe5a61d6eeb1c1-cb222ca48f224c7bafbe5a61d6eeb1c1-0.jpg 2x,
Raphaël Varane: 'Showing vulnerability does not mean you're weak',0,https://www.lemonde.fr/en/sports/article/2025/12/02/raphael-varane-showing-vulnerability-does-not-mean-you-re-weak_6748050_9.html,Not premium,  Interview by Denis Ménétrier ,https://img.lemde.fr/2018/02/26/0/105/3870/2580/360/0/95/0/573eb54_cb222ca48f224c7bafbe5a61d6eeb1c1-cb222ca48f224c7bafbe5a61d6eeb1c1-0.jpg 2x,
German army reports ammunition shipment stolen from delivery truck,0,https://www.lemonde.fr/en/international/article/2025/12/02/german-army-reports-ammunition-shipment-stolen-from-delivery-truck_6748077_4.html,Not premium,Le Monde with AFP,https://img.lemde.fr/2018/02/26/0/105/3870/2580/360/0/95/0/573eb54_cb222ca48f224c7bafbe5a61d6eeb1c1-cb222ca48f224c7bafbe5a61d6eeb1c1-0.jpg 2x,
Marseille grapples with drug trafficking: 'They are so many and they have so much money',"After the murder of Mehdi Kessaci, the brother of an activist against drug trafficking, Le Monde spoke with residents of housing projects, social workers, judges and police officers. They described a growing sense of powerlessness and danger.",https://www.lemonde.fr/en/france/article/2025/12/02/marseille-grapples-with-drug-trafficking-they-are-so-many-and-they-have-so-much-money_6748047_7.html,Subscribers only, By Grégoire Biseau (Marseille (France) special correspondent) and Gilles Rof (Marseille (France) correspondent) ,https://img.lemde.fr/2018/02/26/0/105/3870/2580/360/0/95/0/573eb54_cb222ca48f224c7bafbe5a61d6eeb1c1-cb222ca48f224c7bafbe5a61d6eeb1c1-0.jpg 2x,Long Read
When private anger turns into a social force,"In France, anger is everywhere: in the public sphere, in the media and at the ballot box. The majority of French people under the age of 35 say they have experienced it. From private feelings to collective outcries, they search for ways to channel this emotion.",https://www.lemonde.fr/en/politics/article/2025/12/01/when-private-anger-turns-into-a-social-force_6748003_5.html,Subscribers only,  By Adam Lebert ,https://img.lemde.fr/2018/02/26/0/105/3870/2580/360/0/95/0/573eb54_cb222ca48f224c7bafbe5a61d6eeb1c1-cb222ca48f224c7bafbe5a61d6eeb1c1-0.jpg 2x,Investigation
"Gay Talese, the last titan of the American press","He was a pioneer of New Journalism, a movement that transformed American journalism with a literary writing style. At 93, the author of the landmark 1966 profile 'Frank Sinatra Has a Cold,' finds his daily life increasingly constrained by old age.",https://www.lemonde.fr/en/m-le-mag/article/2025/11/29/gay-talese-the-last-titan-of-the-american-press_6747954_117.html,Subscribers only, By Clémentine Goldszal ,https://img.lemde.fr/2018/02/26/0/105/3870/2580/360/0/95/0/573eb54_cb222ca48f224c7bafbe5a61d6eeb1c1-cb222ca48f224c7bafbe5a61d6eeb1c1-0.jpg 2x,Profile
Donald Trump and the spread of impunity,0,https://www.lemonde.fr/en/opinion/article/2025/12/02/donald-trump-and-the-spread-of-impunity_6748066_23.html,Not premium,Le Monde,https://img.lemde.fr/2018/02/26/0/105/3870/2580/360/0/95/0/573eb54_cb222ca48f224c7bafbe5a61d6eeb1c1-cb222ca48f224c7bafbe5a61d6eeb1c1-0.jpg 2x,Editorial
"'Through his first trip, Pope Leo XIV asserts a diplomatic style that gives him the stature of an arbiter'",0,https://www.lemonde.fr/en/opinion/article/2025/12/02/francois-mabille-political-scientist-through-his-first-trip-pope-leo-xiv-asserts-a-diplomatic-style-that-gives-him-the-stature-of-an-arbiter_6748051_23.html,Subscribe,François Mabille,https://img.lemde.fr/2018/02/26/0/105/3870/2580/360/0/95/0/573eb54_cb222ca48f224c7bafbe5a61d6eeb1c1-cb222ca48f224c7bafbe5a61d6eeb1c1-0.jpg 2x,Op-Ed
Trump's very special Middle East envoys,0,https://www.lemonde.fr/en/opinion/article/2025/11/30/trump-s-very-special-middle-east-envoys_6747986_23.html,Subscribe,Jean-Pierre Filiu,https://img.lemde.fr/2018/02/26/0/105/3870/2580/360/0/95/0/573eb54_cb222ca48f224c7bafbe5a61d6eeb1c1-cb222ca48f224c7bafbe5a61d6eeb1c1-0.jpg 2x,Column
