title,subhead,url,suscription,byline,img_url,article_type
The US-Israeli war against Gaza,0,https://www.lemonde.fr/en/international/article/2025/09/14/the-us-israeli-war-against-gaza_6745377_4.html,Subscribers only,Jean-Pierre Filiu,https://img.lemde.fr/2025/08/19/0/0/4239/2826/360/0/95/0/473b349_ftp-import-images-1-rm7x3mtzpeoq-3d2068ffd882436487582e432b01c38b-0-ad60f7fdfd0a48d59e05639971866cda.jpg 2x,
Sushila Karki appointed as Nepal's prime minister with mission to preserve unity,0,https://www.lemonde.fr/en/international/article/2025/09/13/sushila-karki-appointed-as-nepal-s-prime-minister-with-mission-to-preserve-unity_6745361_4.html,Subscribers only,  By Sophie Landrin (Kathmandu (Nepal) special correspondent) ,https://img.lemde.fr/2025/08/19/0/0/4239/2826/360/0/95/0/473b349_ftp-import-images-1-rm7x3mtzpeoq-3d2068ffd882436487582e432b01c38b-0-ad60f7fdfd0a48d59e05639971866cda.jpg 2x,
Charlie Kirk assassination: The suspect's disconcerting profile,0,https://www.lemonde.fr/en/international/article/2025/09/13/charlie-kirk-assassination-the-suspect-s-disconcerting-profile_6745356_4.html,Subscribers only,"  By Arnaud Leparmentier (Saint George, (Utah) special correspondent) ",https://img.lemde.fr/2025/08/19/0/0/4239/2826/360/0/95/0/473b349_ftp-import-images-1-rm7x3mtzpeoq-3d2068ffd882436487582e432b01c38b-0-ad60f7fdfd0a48d59e05639971866cda.jpg 2x,
Charlie Kirk hailed as a 'martyr' by Europe's far right,0,https://www.lemonde.fr/en/international/article/2025/09/13/charlie-kirk-hailed-as-a-martyr-by-europe-s-far-right_6745355_4.html,Subscribers only,"  By Elsa Conesa (Berlin (Germany) correspondent), Anne-Françoise Hivert (Malmö (Sweden) correspondent), Allan Kaval (Rome (Italy) correspondent) and Corentin Lesueur ",https://img.lemde.fr/2025/08/19/0/0/4239/2826/360/0/95/0/473b349_ftp-import-images-1-rm7x3mtzpeoq-3d2068ffd882436487582e432b01c38b-0-ad60f7fdfd0a48d59e05639971866cda.jpg 2x,
France's political instability puts Franco-German alliance to the test,0,https://www.lemonde.fr/en/opinion/article/2025/08/30/france-s-political-instability-puts-franco-german-alliance-to-the-test_6744873_23.html,Not premium,Le Monde,https://img.lemde.fr/2025/08/19/0/0/4239/2826/360/0/95/0/473b349_ftp-import-images-1-rm7x3mtzpeoq-3d2068ffd882436487582e432b01c38b-0-ad60f7fdfd0a48d59e05639971866cda.jpg 2x,
France faces prospect of paying higher borrowing costs than Italy,0,https://www.lemonde.fr/en/economy/article/2025/08/19/france-faces-prospect-of-paying-higher-borrowing-costs-than-italy_6744519_19.html,Subscribers only,  By Denis Cosnard and Allan Kaval (Rome (Italy) correspondent) ,https://img.lemde.fr/2025/08/19/0/0/4239/2826/360/0/95/0/473b349_ftp-import-images-1-rm7x3mtzpeoq-3d2068ffd882436487582e432b01c38b-0-ad60f7fdfd0a48d59e05639971866cda.jpg 2x,
French man arrested in Slovenia for crimes committed in Croatia during 1991 war,0,https://www.lemonde.fr/en/international/article/2025/08/06/french-man-arrested-in-slovenia-for-crimes-committed-in-croatia-during-1991-war_6744113_4.html,Subscribers only,  By Stéphanie Maupas (The Hague (Netherlands) correspondent) and Richard Schittly (Lyon (France) correspondent) ,https://img.lemde.fr/2025/08/19/0/0/4239/2826/360/0/95/0/473b349_ftp-import-images-1-rm7x3mtzpeoq-3d2068ffd882436487582e432b01c38b-0-ad60f7fdfd0a48d59e05639971866cda.jpg 2x,
"30 years after the Bosnian War, its refugees still cannot return home",0,https://www.lemonde.fr/en/international/article/2025/08/03/thirty-years-after-the-bosnian-war-its-refugees-still-cannot-return-home_6744026_4.html,Subscribers only," By Jean-Baptiste Chastand (Visegrad, Bosnia and Herzegovina, special correspondent) ",https://img.lemde.fr/2025/08/19/0/0/4239/2826/360/0/95/0/473b349_ftp-import-images-1-rm7x3mtzpeoq-3d2068ffd882436487582e432b01c38b-0-ad60f7fdfd0a48d59e05639971866cda.jpg 2x,
What investigators know about destabilization actions in France,0,https://www.lemonde.fr/en/france/article/2025/09/13/what-investigators-know-about-destabilization-actions-in-france_6745366_7.html,Subscribers only,  By Christophe Ayad and Damien Leloup ,https://img.lemde.fr/2025/08/19/0/0/4239/2826/360/0/95/0/473b349_ftp-import-images-1-rm7x3mtzpeoq-3d2068ffd882436487582e432b01c38b-0-ad60f7fdfd0a48d59e05639971866cda.jpg 2x,
Undercover but never unmasked: The untold story of a KGB spy in France,0,https://www.lemonde.fr/en/international/article/2025/09/13/undercover-but-never-unmasked-the-untold-story-of-a-kgb-spy-in-france_6745351_4.html,Subscribers only, By Jacques Follorou ,https://img.lemde.fr/2025/08/19/0/0/4239/2826/360/0/95/0/473b349_ftp-import-images-1-rm7x3mtzpeoq-3d2068ffd882436487582e432b01c38b-0-ad60f7fdfd0a48d59e05639971866cda.jpg 2x,
'They want us to be big but without any fat': Plus-size models face return of thinness in the fashion industry,0,https://www.lemonde.fr/en/m-le-mag/article/2025/09/13/they-want-us-to-be-big-but-without-any-fat-plus-size-models-face-return-of-thinness-in-the-fashion-industry_6745350_117.html,Subscribers only,  By Juliette Guéron-Gabrielle ,https://img.lemde.fr/2025/08/19/0/0/4239/2826/360/0/95/0/473b349_ftp-import-images-1-rm7x3mtzpeoq-3d2068ffd882436487582e432b01c38b-0-ad60f7fdfd0a48d59e05639971866cda.jpg 2x,
"Stricter French requirements, fewer resources: Immigrants face new hurdles",0,https://www.lemonde.fr/en/france/article/2025/09/13/stricter-french-requirements-fewer-resources-immigrants-face-new-hurdles_6745349_7.html,Subscribers only,  By Julia Pascual ,https://img.lemde.fr/2025/08/19/0/0/4239/2826/360/0/95/0/473b349_ftp-import-images-1-rm7x3mtzpeoq-3d2068ffd882436487582e432b01c38b-0-ad60f7fdfd0a48d59e05639971866cda.jpg 2x,
"From 'influence peddling' to 'corruption,' what is French Culture Minister Rachida Dati accused of?",0,https://www.lemonde.fr/en/videos/video/2025/09/06/from-influence-peddling-to-corruption-what-is-french-culture-minister-rachida-dati-accused-of_6745094_108.html,Not premium,"  By Alexis Tromas, Arthur Navet (Motion design) and Sinead McCausland ",https://img.lemde.fr/2025/08/19/0/0/4239/2826/360/0/95/0/473b349_ftp-import-images-1-rm7x3mtzpeoq-3d2068ffd882436487582e432b01c38b-0-ad60f7fdfd0a48d59e05639971866cda.jpg 2x,
Watch: Tsunami warnings sound in Japan after 8.8 magnitude quake off Russian coast,0,https://www.lemonde.fr/en/videos/video/2025/07/30/watch-tsunami-warnings-sound-in-japan-after-8-8-magnitude-quake-off-russian-coast_6743900_108.html,Not premium,No byline,https://img.lemde.fr/2025/08/19/0/0/4239/2826/360/0/95/0/473b349_ftp-import-images-1-rm7x3mtzpeoq-3d2068ffd882436487582e432b01c38b-0-ad60f7fdfd0a48d59e05639971866cda.jpg 2x,
What is France's 'Black code' and why hasn't it been repealed?,0,https://www.lemonde.fr/en/videos/video/2025/05/31/what-is-france-s-black-code-and-why-hasn-t-it-been-repealed_6741860_108.html,Not premium,"  By Chloé Denis, Olivier Escher (motion design) and Diana Liu ",https://img.lemde.fr/2025/08/19/0/0/4239/2826/360/0/95/0/473b349_ftp-import-images-1-rm7x3mtzpeoq-3d2068ffd882436487582e432b01c38b-0-ad60f7fdfd0a48d59e05639971866cda.jpg 2x,
How was the European Union created?,0,https://www.lemonde.fr/en/videos/video/2025/05/29/how-was-the-european-union-created_6741795_108.html,Not premium,"  By Alexis Tromas, Robin Gasser (motion design) and Diana Liu ",https://img.lemde.fr/2025/08/19/0/0/4239/2826/360/0/95/0/473b349_ftp-import-images-1-rm7x3mtzpeoq-3d2068ffd882436487582e432b01c38b-0-ad60f7fdfd0a48d59e05639971866cda.jpg 2x,
Jair Bolsonaro's conviction: An exemplary verdict for democracy in Brazil,0,https://www.lemonde.fr/en/opinion/article/2025/09/13/brazil-an-exemplary-verdict-for-democracy_6745359_23.html,Not premium,Le Monde,https://img.lemde.fr/2025/08/19/0/0/4239/2826/360/0/95/0/473b349_ftp-import-images-1-rm7x3mtzpeoq-3d2068ffd882436487582e432b01c38b-0-ad60f7fdfd0a48d59e05639971866cda.jpg 2x,
Why French politics can't cope without an absolute majority,0,https://www.lemonde.fr/en/opinion/article/2025/09/14/why-french-politics-can-t-cope-without-an-absolute-majority_6745374_23.html,Subscribers only, By Anne Chemin ,https://img.lemde.fr/2025/08/19/0/0/4239/2826/360/0/95/0/473b349_ftp-import-images-1-rm7x3mtzpeoq-3d2068ffd882436487582e432b01c38b-0-ad60f7fdfd0a48d59e05639971866cda.jpg 2x,
Regulating TikTok and other social media is a necessity to protect minors,0,https://www.lemonde.fr/en/opinion/article/2025/09/12/regulating-tiktok-and-other-social-media-is-a-necessity-to-protect-minors_6745327_23.html,Not premium,Le Monde,https://img.lemde.fr/2025/08/19/0/0/4239/2826/360/0/95/0/473b349_ftp-import-images-1-rm7x3mtzpeoq-3d2068ffd882436487582e432b01c38b-0-ad60f7fdfd0a48d59e05639971866cda.jpg 2x,
'AI companies cannot avoid debates on regulating their tools',0,https://www.lemonde.fr/en/opinion/article/2025/09/12/ai-companies-cannot-avoid-debates-on-regulating-their-tools_6745303_23.html,Subscribers only,Alexandre Piquard,https://img.lemde.fr/2025/08/19/0/0/4239/2826/360/0/95/0/473b349_ftp-import-images-1-rm7x3mtzpeoq-3d2068ffd882436487582e432b01c38b-0-ad60f7fdfd0a48d59e05639971866cda.jpg 2x,
"Hôtel California, a family passion",0,https://www.lemonde.fr/en/m-le-mag/article/2025/09/14/hotel-california-a-family-passion_6745373_117.html,Subscribers only,M le magazine du Monde,https://img.lemde.fr/2025/08/19/0/0/4239/2826/360/0/95/0/473b349_ftp-import-images-1-rm7x3mtzpeoq-3d2068ffd882436487582e432b01c38b-0-ad60f7fdfd0a48d59e05639971866cda.jpg 2x,
'They want us to be big but without any fat': Plus-size models face return of thinness in the fashion industry,0,https://www.lemonde.fr/en/m-le-mag/article/2025/09/13/they-want-us-to-be-big-but-without-any-fat-plus-size-models-face-return-of-thinness-in-the-fashion-industry_6745350_117.html,Subscribers only,  By Juliette Guéron-Gabrielle ,https://img.lemde.fr/2025/08/19/0/0/4239/2826/360/0/95/0/473b349_ftp-import-images-1-rm7x3mtzpeoq-3d2068ffd882436487582e432b01c38b-0-ad60f7fdfd0a48d59e05639971866cda.jpg 2x,
Blessed with fortune: India's Hare Krishna mega-temple backed by a Ford heir,0,https://www.lemonde.fr/en/m-le-mag/article/2025/09/10/blessed-with-fortune-india-s-hare-krishna-mega-temple-backed-by-a-ford-heir_6745215_117.html,Subscribers only,"  By Sophie Landrin (Mayapur, India, special correspondent) ",https://img.lemde.fr/2025/08/19/0/0/4239/2826/360/0/95/0/473b349_ftp-import-images-1-rm7x3mtzpeoq-3d2068ffd882436487582e432b01c38b-0-ad60f7fdfd0a48d59e05639971866cda.jpg 2x,
Serbian women are leading the frontlines of country's anti-corruption movement,0,https://www.lemonde.fr/en/m-le-mag/article/2025/09/07/serbian-women-are-leading-the-frontlines-of-country-s-anti-corruption-movement_6745131_117.html,Subscribers only,"  By Jean-Baptiste Chastand (Belgrade, Serbia, special correspondent) ",https://img.lemde.fr/2025/08/19/0/0/4239/2826/360/0/95/0/473b349_ftp-import-images-1-rm7x3mtzpeoq-3d2068ffd882436487582e432b01c38b-0-ad60f7fdfd0a48d59e05639971866cda.jpg 2x,
Tradition done right: Five Paris restaurants reimagining the classics,0,https://www.lemonde.fr/en/lifestyle/article/2025/09/08/tradition-done-right-five-paris-restaurants-reimagining-the-classics_6745133_37.html,Subscribers only, By Léo Pajon ,https://img.lemde.fr/2025/08/19/0/0/4239/2826/360/0/95/0/473b349_ftp-import-images-1-rm7x3mtzpeoq-3d2068ffd882436487582e432b01c38b-0-ad60f7fdfd0a48d59e05639971866cda.jpg 2x,
Paris Design Week: A 15th edition marked by abundance,0,https://www.lemonde.fr/en/lifestyle/article/2025/09/05/paris-design-week-a-15th-edition-marked-by-abundance_6745060_37.html,Subscribers only,  By Véronique Lorelle ,https://img.lemde.fr/2025/08/19/0/0/4239/2826/360/0/95/0/473b349_ftp-import-images-1-rm7x3mtzpeoq-3d2068ffd882436487582e432b01c38b-0-ad60f7fdfd0a48d59e05639971866cda.jpg 2x,
It's pain suisse time! Five places in and around Paris to find this treat,0,https://www.lemonde.fr/en/lifestyle/article/2025/09/04/it-s-pain-suisse-time-five-places-in-the-paris-region-to-find-this-treat_6745022_37.html,Subscribers only,  By Zazie Tavitian ,https://img.lemde.fr/2025/08/19/0/0/4239/2826/360/0/95/0/473b349_ftp-import-images-1-rm7x3mtzpeoq-3d2068ffd882436487582e432b01c38b-0-ad60f7fdfd0a48d59e05639971866cda.jpg 2x,
"At Musée d'Orsay, a Courbet painting gets a new life before visitors' eyes",0,https://www.lemonde.fr/en/culture/article/2025/07/26/at-musee-d-orsay-a-courbet-painting-gets-a-new-life-before-visitors-eyes_6743744_30.html,Subscribers only,  By Max Blanc ,https://img.lemde.fr/2025/08/19/0/0/4239/2826/360/0/95/0/473b349_ftp-import-images-1-rm7x3mtzpeoq-3d2068ffd882436487582e432b01c38b-0-ad60f7fdfd0a48d59e05639971866cda.jpg 2x,
Why French politics can't cope without an absolute majority,"While most European countries have learned to manage their fragmented parliaments, France has failed to adapt. The 'fait majoritaire,' the political dominance of a president backed by a parliamentary majority, has so deeply shaped politics since 1962 that lawmakers have been unable to envision governments built on a base of negotiation and compromise.",https://www.lemonde.fr/en/opinion/article/2025/09/14/why-french-politics-can-t-cope-without-an-absolute-majority_6745374_23.html,Subscribers only, By Anne Chemin ,https://img.lemde.fr/2025/08/19/0/0/4239/2826/360/0/95/0/473b349_ftp-import-images-1-rm7x3mtzpeoq-3d2068ffd882436487582e432b01c38b-0-ad60f7fdfd0a48d59e05639971866cda.jpg 2x,
The US-Israeli war against Gaza,0,https://www.lemonde.fr/en/international/article/2025/09/14/the-us-israeli-war-against-gaza_6745377_4.html,Subscribers only,Jean-Pierre Filiu,https://img.lemde.fr/2025/08/19/0/0/4239/2826/360/0/95/0/473b349_ftp-import-images-1-rm7x3mtzpeoq-3d2068ffd882436487582e432b01c38b-0-ad60f7fdfd0a48d59e05639971866cda.jpg 2x,
Romania reports breach of airspace by Russian drone,0,https://www.lemonde.fr/en/international/article/2025/09/13/romania-poland-scramble-aircraft-as-drones-strike-ukraine_6745368_4.html,Not premium,Le Monde with AFP,https://img.lemde.fr/2025/08/19/0/0/4239/2826/360/0/95/0/473b349_ftp-import-images-1-rm7x3mtzpeoq-3d2068ffd882436487582e432b01c38b-0-ad60f7fdfd0a48d59e05639971866cda.jpg 2x,
French PM scraps proposal to cut two public holidays,The unpopular plan initially put forward by Sébastien Lecornu's predecessor was supposed to help reduce the public deficit.,https://www.lemonde.fr/en/politics/article/2025/09/14/french-pm-scraps-proposal-to-cut-two-public-holidays_6745376_5.html,Not premium,Le Monde with AFP,https://img.lemde.fr/2025/08/19/0/0/4239/2826/360/0/95/0/473b349_ftp-import-images-1-rm7x3mtzpeoq-3d2068ffd882436487582e432b01c38b-0-ad60f7fdfd0a48d59e05639971866cda.jpg 2x,
Charlie Kirk assassination: The suspect's disconcerting profile,"Tyler Robinson, arrested on Thursday night, is a 22-year-old White man who grew up in a conservative family in Utah and was a brilliant high school student. Nothing in his background supports the theory being propagated in MAGA circles that he is a far-left activist.",https://www.lemonde.fr/en/international/article/2025/09/13/charlie-kirk-assassination-the-suspect-s-disconcerting-profile_6745356_4.html,Subscribers only,"  By Arnaud Leparmentier (Saint George, (Utah) special correspondent) ",https://img.lemde.fr/2025/08/19/0/0/4239/2826/360/0/95/0/473b349_ftp-import-images-1-rm7x3mtzpeoq-3d2068ffd882436487582e432b01c38b-0-ad60f7fdfd0a48d59e05639971866cda.jpg 2x,
"Manae Feleu, France's not-so secret weapon at the Women's Rugby World Cup","The co-captain of Les Bleues is coming to terms with her newfound fame. She will lead her teammates in their quarterfinal against Ireland on Sunday in Exeter, England.",https://www.lemonde.fr/en/sports/article/2025/09/14/manae-feleu-france-s-not-so-secret-weapon-at-the-women-s-rugby-world-cup_6745378_9.html,Subscribers only,  By Valentin Moinard ,https://img.lemde.fr/2025/08/19/0/0/4239/2826/360/0/95/0/473b349_ftp-import-images-1-rm7x3mtzpeoq-3d2068ffd882436487582e432b01c38b-0-ad60f7fdfd0a48d59e05639971866cda.jpg 2x,
Sex workers on content platforms open up to their parents,"Since the Covid-19 pandemic, pornographic content platforms have been booming, attracting young creators – mainly women – who turn to sex work for the money and independence it offers. Some choose to speak to their parents about it. Those conversations can either produce distance or bring them closer together.",https://www.lemonde.fr/en/campus/article/2025/09/14/sex-workers-on-content-platforms-open-up-to-their-parents-the-day-i-said-the-words-pornographic-video-in-front-of-my-mother-a-long-silence-fell_6745372_11.html,Subscribers only, By Gabrielle Meulle ,https://img.lemde.fr/2025/08/19/0/0/4239/2826/360/0/95/0/473b349_ftp-import-images-1-rm7x3mtzpeoq-3d2068ffd882436487582e432b01c38b-0-ad60f7fdfd0a48d59e05639971866cda.jpg 2x,Your stories
What investigators know about destabilization actions in France,0,https://www.lemonde.fr/en/france/article/2025/09/13/what-investigators-know-about-destabilization-actions-in-france_6745366_7.html,Subscribers only,  By Christophe Ayad and Damien Leloup ,https://img.lemde.fr/2025/08/19/0/0/4239/2826/360/0/95/0/473b349_ftp-import-images-1-rm7x3mtzpeoq-3d2068ffd882436487582e432b01c38b-0-ad60f7fdfd0a48d59e05639971866cda.jpg 2x,
"Hôtel California, a family passion",0,https://www.lemonde.fr/en/m-le-mag/article/2025/09/14/hotel-california-a-family-passion_6745373_117.html,Subscribers only,M le magazine du Monde,https://img.lemde.fr/2025/08/19/0/0/4239/2826/360/0/95/0/473b349_ftp-import-images-1-rm7x3mtzpeoq-3d2068ffd882436487582e432b01c38b-0-ad60f7fdfd0a48d59e05639971866cda.jpg 2x,
Venezuela says US 'illegally' seized fishing boat as Trump increases patrols aimed at targeting drug cartels,0,https://www.lemonde.fr/en/international/article/2025/09/14/venezuela-says-us-illegally-seized-fishing-boat-as-trump-increases-patrols-aimed-at-targeting-drug-cartels_6745375_4.html,Not premium,Le Monde with AFP,https://img.lemde.fr/2025/08/19/0/0/4239/2826/360/0/95/0/473b349_ftp-import-images-1-rm7x3mtzpeoq-3d2068ffd882436487582e432b01c38b-0-ad60f7fdfd0a48d59e05639971866cda.jpg 2x,
"More than 110,000 people turn out for London far-right protest",0,https://www.lemonde.fr/en/international/article/2025/09/13/more-than-110-000-people-turn-out-for-london-far-right-protest_6745365_4.html,Not premium,Le Monde with AFP,https://img.lemde.fr/2025/08/19/0/0/4239/2826/360/0/95/0/473b349_ftp-import-images-1-rm7x3mtzpeoq-3d2068ffd882436487582e432b01c38b-0-ad60f7fdfd0a48d59e05639971866cda.jpg 2x,
"US, Saudi Arabia, UAE and Egypt call for Sudan truce, transition to civilian rule",0,https://www.lemonde.fr/en/international/article/2025/09/14/us-saudi-uae-egypt-call-for-sudan-truce-transition-to-civilian-rule_6745371_4.html,Not premium,Le Monde with AFP,https://img.lemde.fr/2025/08/19/0/0/4239/2826/360/0/95/0/473b349_ftp-import-images-1-rm7x3mtzpeoq-3d2068ffd882436487582e432b01c38b-0-ad60f7fdfd0a48d59e05639971866cda.jpg 2x,
Fitch strips France of its 'double A' rating,0,https://www.lemonde.fr/en/politics/article/2025/09/13/fitch-strips-france-of-its-double-a-rating_6745358_5.html,Subscribers only,  By Denis Cosnard ,https://img.lemde.fr/2025/08/19/0/0/4239/2826/360/0/95/0/473b349_ftp-import-images-1-rm7x3mtzpeoq-3d2068ffd882436487582e432b01c38b-0-ad60f7fdfd0a48d59e05639971866cda.jpg 2x,
'They want us to be big but without any fat': Plus-size models face return of thinness in the fashion industry,0,https://www.lemonde.fr/en/m-le-mag/article/2025/09/13/they-want-us-to-be-big-but-without-any-fat-plus-size-models-face-return-of-thinness-in-the-fashion-industry_6745350_117.html,Subscribers only,  By Juliette Guéron-Gabrielle ,https://img.lemde.fr/2025/08/19/0/0/4239/2826/360/0/95/0/473b349_ftp-import-images-1-rm7x3mtzpeoq-3d2068ffd882436487582e432b01c38b-0-ad60f7fdfd0a48d59e05639971866cda.jpg 2x,
The gentle power of dormant volcanoes in central France,0,https://www.lemonde.fr/en/summer-reads/article/2025/09/13/the-gentle-power-of-dormant-volcanoes-in-central-france_6745362_183.html,Subscribers only, By Guillaume Delacroix ,https://img.lemde.fr/2025/08/19/0/0/4239/2826/360/0/95/0/473b349_ftp-import-images-1-rm7x3mtzpeoq-3d2068ffd882436487582e432b01c38b-0-ad60f7fdfd0a48d59e05639971866cda.jpg 2x,
Nepal's new PM vows to comply with protesters' demands to 'end corruption',0,https://www.lemonde.fr/en/asia-and-pacific/article/2025/09/14/nepal-s-new-pm-vows-to-comply-with-protesters-demands-to-end-corruption_6745379_153.html,Not premium,Le Monde with AFP,https://img.lemde.fr/2025/08/19/0/0/4239/2826/360/0/95/0/473b349_ftp-import-images-1-rm7x3mtzpeoq-3d2068ffd882436487582e432b01c38b-0-ad60f7fdfd0a48d59e05639971866cda.jpg 2x,
RFK Jr's health plan leaves America's favorite junk foods off the hook,0,https://www.lemonde.fr/en/environment/article/2025/09/13/rfk-s-health-plan-leaves-america-s-favorite-junk-foods-off-the-hook_6745352_114.html,Subscribers only,  By Nicolas Chapuis (New York (United States) correspondent) ,https://img.lemde.fr/2025/08/19/0/0/4239/2826/360/0/95/0/473b349_ftp-import-images-1-rm7x3mtzpeoq-3d2068ffd882436487582e432b01c38b-0-ad60f7fdfd0a48d59e05639971866cda.jpg 2x,
"Audenge, home to Europe's largest seawater swimming pool",0,https://www.lemonde.fr/en/summer-reads/article/2025/09/14/audenge-home-to-europe-s-largest-seawater-swimming-pool_6745369_183.html,Subscribers only, By Hélène Brunet-Rivaillon ,https://img.lemde.fr/2025/08/19/0/0/4239/2826/360/0/95/0/473b349_ftp-import-images-1-rm7x3mtzpeoq-3d2068ffd882436487582e432b01c38b-0-ad60f7fdfd0a48d59e05639971866cda.jpg 2x,
Tasting clubs are discreetly shaping France's wine culture,0,https://www.lemonde.fr/en/food/article/2025/09/13/wine-clubs-are-discreetly-shaping-france-s-wine-culture_6745353_119.html,Subscribers only,  By Rémi Barroux ,https://img.lemde.fr/2025/08/19/0/0/4239/2826/360/0/95/0/473b349_ftp-import-images-1-rm7x3mtzpeoq-3d2068ffd882436487582e432b01c38b-0-ad60f7fdfd0a48d59e05639971866cda.jpg 2x,
Israeli intelligence admits Iran's nuclear program has not been destroyed,Israeli officials have recently provided French authorities with their own assessment of the airstrikes that targeted Tehran's nuclear arsenal in June. This information is particularly valuable to France after American intelligence agencies have halted all cooperation with their European partners regarding the Iranian nuclear program.,https://www.lemonde.fr/en/international/article/2025/09/13/israeli-intelligence-admits-iran-s-nuclear-program-has-not-been-destroyed_6745348_4.html,Subscribers only,  By Jacques Follorou ,https://img.lemde.fr/2025/08/19/0/0/4239/2826/360/0/95/0/473b349_ftp-import-images-1-rm7x3mtzpeoq-3d2068ffd882436487582e432b01c38b-0-ad60f7fdfd0a48d59e05639971866cda.jpg 2x,News
When everyday hatred turns to racist murder: 'I don't know why I lost it. I have no idea',"On May 31, Christophe Belgembe, a mechanic, fatally shot his neighbor Hichem Miraoui and tried to kill five other people in the southern French town of Puget-sur-Argens. Though he had made racist remarks for years, he struggled to explain his actions.",https://www.lemonde.fr/en/france/article/2025/09/12/when-everyday-hatred-turns-to-racist-murder-i-don-t-know-why-i-lost-it-i-have-no-idea_6745342_7.html,Subscribers only,  By Lorraine de Foucher  and Jérôme Lefilliâtre ,https://img.lemde.fr/2025/08/19/0/0/4239/2826/360/0/95/0/473b349_ftp-import-images-1-rm7x3mtzpeoq-3d2068ffd882436487582e432b01c38b-0-ad60f7fdfd0a48d59e05639971866cda.jpg 2x,In Depth
Economist Gabriel Zucman: 'France's new PM will have to address the proposed tax on the ultra-rich',"Zucman is the architect behind the proposal to tax the wealthiest individuals, a measure championed by the left. 'It will be very difficult to ask the French people to make sacrifices as long as billionaires pay so little in taxes,' he told Le Monde in an interview.",https://www.lemonde.fr/en/politics/article/2025/09/11/economist-gabriel-zucman-france-s-new-pm-will-have-to-address-the-proposed-tax-on-the-ultra-rich_6745268_5.html,Subscribers only,  Interview by Denis Cosnard and Pascal Riché ,https://img.lemde.fr/2025/08/19/0/0/4239/2826/360/0/95/0/473b349_ftp-import-images-1-rm7x3mtzpeoq-3d2068ffd882436487582e432b01c38b-0-ad60f7fdfd0a48d59e05639971866cda.jpg 2x,Interview
Jair Bolsonaro's conviction: An exemplary verdict for democracy in Brazil,0,https://www.lemonde.fr/en/opinion/article/2025/09/13/brazil-an-exemplary-verdict-for-democracy_6745359_23.html,Not premium,Le Monde,https://img.lemde.fr/2025/08/19/0/0/4239/2826/360/0/95/0/473b349_ftp-import-images-1-rm7x3mtzpeoq-3d2068ffd882436487582e432b01c38b-0-ad60f7fdfd0a48d59e05639971866cda.jpg 2x,Editorial
New French PM Sébastien Lecornu walks a tightrope,0,https://www.lemonde.fr/en/opinion/article/2025/09/11/new-french-pm-sebastien-lecornu-walks-a-tightrope_6745285_23.html,Not premium,Le Monde,https://img.lemde.fr/2025/08/19/0/0/4239/2826/360/0/95/0/473b349_ftp-import-images-1-rm7x3mtzpeoq-3d2068ffd882436487582e432b01c38b-0-ad60f7fdfd0a48d59e05639971866cda.jpg 2x,Editorial
"'While Putin rains fire down on Ukraine, Trump rants and grumbles'",0,https://www.lemonde.fr/en/opinion/article/2025/09/11/while-putin-rains-fire-down-on-ukraine-trump-rants-and-grumbles_6745288_23.html,Subscribe,Gilles Paris,https://img.lemde.fr/2025/08/19/0/0/4239/2826/360/0/95/0/473b349_ftp-import-images-1-rm7x3mtzpeoq-3d2068ffd882436487582e432b01c38b-0-ad60f7fdfd0a48d59e05639971866cda.jpg 2x,Column
