title,subhead,url,suscription,byline,img_url,article_type
Tehran residents flee Israeli bombings: 'Innocents are killed and it's going to get worse',0,https://www.lemonde.fr/en/international/article/2025/06/17/tehran-residents-flee-israeli-bombings-innocents-are-killed-and-it-s-going-to-get-worse_6742424_4.html,Subscribers only,  By Ghazal Golshiri ,https://img.lemde.fr/2025/06/16/0/0/8640/5760/360/0/95/0/d8d0de6_upload-1-qdvg31kljnnf-429595.jpg 2x,
"Trump hastily leaves G7, lashes out at Macron",0,https://www.lemonde.fr/en/international/article/2025/06/17/trump-hastily-leaves-g7-overshadowed-by-middle-east-and-ukraine-conflicts-lashes-out-at-macron_6742423_4.html,Subscribers only,"  By Philippe Ricard (Kananaskis [Canada], special correspondent) ",https://img.lemde.fr/2025/06/16/0/0/8640/5760/360/0/95/0/d8d0de6_upload-1-qdvg31kljnnf-429595.jpg 2x,
No radioactivity increase at Iranian nuclear site but 'radiological and chemical contamination' reported,0,https://www.lemonde.fr/en/international/article/2025/06/17/no-radioactivity-increase-at-iranian-nuclear-site-but-radiological-and-chemical-contamination-reported_6742419_4.html,Subscribers only,  By Perrine Mouterde ,https://img.lemde.fr/2025/06/16/0/0/8640/5760/360/0/95/0/d8d0de6_upload-1-qdvg31kljnnf-429595.jpg 2x,
Trump stays ambiguous on US goals in blazing Middle East,0,https://www.lemonde.fr/en/international/article/2025/06/17/trump-stays-ambiguous-on-us-goals-in-blazing-middle-east_6742417_4.html,Subscribers only,  By Piotr Smolar (Washington (United States) correspondent) ,https://img.lemde.fr/2025/06/16/0/0/8640/5760/360/0/95/0/d8d0de6_upload-1-qdvg31kljnnf-429595.jpg 2x,
How the US divided Europe to invade Iraq at any cost in 2003,0,https://www.lemonde.fr/en/history/article/2025/06/16/how-the-us-split-europe-to-invade-iraq-at-any-cost-in-2003_6742380_157.html,Subscribers only," By Sylvie Kauffmann (Vilnius, Tallinn, Berlin, special correspondent) ",https://img.lemde.fr/2025/06/16/0/0/8640/5760/360/0/95/0/d8d0de6_upload-1-qdvg31kljnnf-429595.jpg 2x,
"Criticism is mounting in the Netherlands against Geert Wilders, who brought down the government",0,https://www.lemonde.fr/en/international/article/2025/06/04/in-the-netherlands-criticism-is-mounting-against-geert-wilders-who-triggered-the-fall-of-the-government_6741987_4.html,Subscribers only,  By Jean-Pierre Stroobants (The Hague (Netherlands) special correspondent) ,https://img.lemde.fr/2025/06/16/0/0/8640/5760/360/0/95/0/d8d0de6_upload-1-qdvg31kljnnf-429595.jpg 2x,
"Five years after Brexit, UK and EU aim for a fresh start",0,https://www.lemonde.fr/en/international/article/2025/05/19/five-years-after-brexit-uk-and-eu-aim-for-a-fresh-start_6741415_4.html,Subscribers only,"  By Philippe Jacqué (Brussels, Europe bureau) and Cécile Ducourtieux (London, correspondent) ",https://img.lemde.fr/2025/06/16/0/0/8640/5760/360/0/95/0/d8d0de6_upload-1-qdvg31kljnnf-429595.jpg 2x,
"In Lithuania, the fear of war with Russia lurks just around the corner",0,https://www.lemonde.fr/en/international/article/2025/05/18/in-lithuania-the-fear-of-war-with-russia-lurks-just-around-the-corner_6741400_4.html,Subscribers only," By Florent Georgesco (Kybartai, Lithuania, special correspondent) ",https://img.lemde.fr/2025/06/16/0/0/8640/5760/360/0/95/0/d8d0de6_upload-1-qdvg31kljnnf-429595.jpg 2x,
"The son's suicide, the father's murder and the tormented killer",0,https://www.lemonde.fr/en/france/article/2025/06/16/the-son-s-suicide-the-father-s-murder-and-the-tormented-killer_6742398_7.html,Subscribers only,  By Lorraine de Foucher  ,https://img.lemde.fr/2025/06/16/0/0/8640/5760/360/0/95/0/d8d0de6_upload-1-qdvg31kljnnf-429595.jpg 2x,
Paris Air Show opens amid tense geopolitical context,0,https://www.lemonde.fr/en/economy/article/2025/06/16/paris-air-show-opens-amid-tense-geopolitical-context_6742379_19.html,Subscribers only,  By Olivier Pinaud ,https://img.lemde.fr/2025/06/16/0/0/8640/5760/360/0/95/0/d8d0de6_upload-1-qdvg31kljnnf-429595.jpg 2x,
"At Paris protest in support of Gaza, anger and fear run high",0,https://www.lemonde.fr/en/france/article/2025/06/15/at-paris-protest-in-support-of-gaza-anger-and-fear-run-high_6742365_7.html,Subscribers only,  By Louise Couvelaire ,https://img.lemde.fr/2025/06/16/0/0/8640/5760/360/0/95/0/d8d0de6_upload-1-qdvg31kljnnf-429595.jpg 2x,
Sarkozy stripped of Legion of Honor,0,https://www.lemonde.fr/en/france/article/2025/06/15/former-french-president-nicolas-sarkozy-stripped-of-the-legion-of-honor_6742357_7.html,Not premium,Le Monde,https://img.lemde.fr/2025/06/16/0/0/8640/5760/360/0/95/0/d8d0de6_upload-1-qdvg31kljnnf-429595.jpg 2x,
What is France's 'Black code' and why hasn't it been repealed?,0,https://www.lemonde.fr/en/videos/video/2025/05/31/what-is-france-s-black-code-and-why-hasn-t-it-been-repealed_6741860_108.html,Not premium,"  By Chloé Denis, Olivier Escher (motion design) and Diana Liu ",https://img.lemde.fr/2025/06/16/0/0/8640/5760/360/0/95/0/d8d0de6_upload-1-qdvg31kljnnf-429595.jpg 2x,
How was the European Union created?,0,https://www.lemonde.fr/en/videos/video/2025/05/29/how-was-the-european-union-created_6741795_108.html,Not premium,"  By Alexis Tromas, Robin Gasser (motion design) and Diana Liu ",https://img.lemde.fr/2025/06/16/0/0/8640/5760/360/0/95/0/d8d0de6_upload-1-qdvg31kljnnf-429595.jpg 2x,
Glide bombs: Russia's secret to making cheap weapons,0,https://www.lemonde.fr/en/videos/video/2025/05/25/glide-bombs-russia-s-secret-to-making-cheap-weapons_6741646_108.html,Subscribers only,"  By Thomas Eydoux, Marceau Bretonnier and Sinead McCausland ",https://img.lemde.fr/2025/06/16/0/0/8640/5760/360/0/95/0/d8d0de6_upload-1-qdvg31kljnnf-429595.jpg 2x,
How does the conclave pick the new pope?,0,https://www.lemonde.fr/en/videos/video/2025/05/07/how-does-the-conclave-pick-the-new-pope_6741005_108.html,Not premium,"  By Alexis Tromas, Félix Pommier (Motion design) and Diana Liu ",https://img.lemde.fr/2025/06/16/0/0/8640/5760/360/0/95/0/d8d0de6_upload-1-qdvg31kljnnf-429595.jpg 2x,
"'On the budget, Donald Trump's obsession consists of fulfilling impossible campaign promises'",0,https://www.lemonde.fr/en/opinion/article/2025/06/16/on-the-budget-donald-trump-s-obsession-consists-of-fulfilling-impossible-campaign-promises_6742401_23.html,Subscribers only,Stéphane Lauer,https://img.lemde.fr/2025/06/16/0/0/8640/5760/360/0/95/0/d8d0de6_upload-1-qdvg31kljnnf-429595.jpg 2x,
The French Socialists' show of impotence,0,https://www.lemonde.fr/en/opinion/article/2025/06/17/the-french-socialists-a-show-of-impotence_6742427_23.html,Not premium,Le Monde,https://img.lemde.fr/2025/06/16/0/0/8640/5760/360/0/95/0/d8d0de6_upload-1-qdvg31kljnnf-429595.jpg 2x,
Kurdish integration offers hope for Syria's reconstruction,0,https://www.lemonde.fr/en/opinion/article/2025/06/17/kurdish-integration-offers-hope-for-syria-s-reconstruction_6742411_23.html,Subscribers only,Hélène Sallon,https://img.lemde.fr/2025/06/16/0/0/8640/5760/360/0/95/0/d8d0de6_upload-1-qdvg31kljnnf-429595.jpg 2x,
Israel-Iran: 'This conflict poses a dire threat to the very foundations of human civilization',0,https://www.lemonde.fr/en/opinion/article/2025/06/16/israel-iran-this-conflict-poses-a-grave-threat-to-the-very-foundations-of-human-civilization_6742387_23.html,Subscribers only,Group letter,https://img.lemde.fr/2025/06/16/0/0/8640/5760/360/0/95/0/d8d0de6_upload-1-qdvg31kljnnf-429595.jpg 2x,
"On the Canadian side of lake Ontario, a new identity emerges in the shadow of Trump",0,https://www.lemonde.fr/en/m-le-mag/article/2025/06/15/on-the-canadian-side-of-lake-ontario-a-new-identity-emerges-in-the-shadow-of-trump_6742361_117.html,Subscribers only," By Eliott Dumoulin (Montreal, Canada, correspondent) ",https://img.lemde.fr/2025/06/16/0/0/8640/5760/360/0/95/0/d8d0de6_upload-1-qdvg31kljnnf-429595.jpg 2x,
"Kazakhstan families search for clues about the 270,000 'missing soldiers' of the World War II Soviet Army",0,https://www.lemonde.fr/en/m-le-mag/article/2025/06/15/kazakhstan-families-search-for-clues-about-the-270-000-missing-soldiers-of-the-world-war-ii-soviet-army_6742352_117.html,Subscribers only,  By Emma Collet ,https://img.lemde.fr/2025/06/16/0/0/8640/5760/360/0/95/0/d8d0de6_upload-1-qdvg31kljnnf-429595.jpg 2x,
Maria Grazia Chiuri's final bow at home in Rome,0,https://www.lemonde.fr/en/m-le-mag/article/2025/06/13/in-rome-maria-grazia-chiuri-s-final-bow_6742321_117.html,Subscribers only, By Caroline Rousseau ,https://img.lemde.fr/2025/06/16/0/0/8640/5760/360/0/95/0/d8d0de6_upload-1-qdvg31kljnnf-429595.jpg 2x,
"The life and death of Julie, 21, swept up in the spiral of social media",0,https://www.lemonde.fr/en/m-le-mag/article/2025/06/11/the-life-and-death-of-julie-21-swept-up-in-the-spiral-of-social-media_6742255_117.html,Subscribers only, By Yann Bouchez ,https://img.lemde.fr/2025/06/16/0/0/8640/5760/360/0/95/0/d8d0de6_upload-1-qdvg31kljnnf-429595.jpg 2x,
Paris exhibition tries to answer the mystery of Cleopatra,0,https://www.lemonde.fr/en/culture/article/2025/06/12/paris-exhibition-tries-to-answer-the-mystery-of-cleopatra_6742287_30.html,Subscribers only,  By Philippe Dagen ,https://img.lemde.fr/2025/06/16/0/0/8640/5760/360/0/95/0/d8d0de6_upload-1-qdvg31kljnnf-429595.jpg 2x,
"Forget the jambon-beurre, try these five delicious banh mi sandwiches in Paris",0,https://www.lemonde.fr/en/lifestyle/article/2025/06/06/forget-the-jambon-beurre-try-these-five-delicious-banh-mi-sandwiches-in-paris_6742068_37.html,Subscribers only,  By Zazie Tavitian ,https://img.lemde.fr/2025/06/16/0/0/8640/5760/360/0/95/0/d8d0de6_upload-1-qdvg31kljnnf-429595.jpg 2x,
"Gabriele Münter, a framing prodigy, emerges from the shadows in new Paris show",0,https://www.lemonde.fr/en/culture/article/2025/06/04/at-the-musee-d-art-moderne-de-paris-gabriele-munter-a-framing-prodigy-has-emerged-from-the-shadows_6741982_30.html,Subscribers only,  By Harry Bellet ,https://img.lemde.fr/2025/06/16/0/0/8640/5760/360/0/95/0/d8d0de6_upload-1-qdvg31kljnnf-429595.jpg 2x,
How artists dress: A work of art in itself,0,https://www.lemonde.fr/en/culture/article/2025/05/30/how-artists-dress-a-work-of-art-in-itself_6741825_30.html,Subscribers only, By Valentin Pérez ,https://img.lemde.fr/2025/06/16/0/0/8640/5760/360/0/95/0/d8d0de6_upload-1-qdvg31kljnnf-429595.jpg 2x,
"Trump hastily leaves G7, lashes out at Macron","The American president once again made clear his rejection of multilateralism amid escalating tensions between Israel and Iran. 'Emmanuel always gets it wrong,' he said of his French counterpart.",https://www.lemonde.fr/en/international/article/2025/06/17/trump-hastily-leaves-g7-overshadowed-by-middle-east-and-ukraine-conflicts-lashes-out-at-macron_6742423_4.html,Subscribers only,"  By Philippe Ricard (Kananaskis [Canada], special correspondent) ",https://img.lemde.fr/2025/06/16/0/0/8640/5760/360/0/95/0/d8d0de6_upload-1-qdvg31kljnnf-429595.jpg 2x,
Tehran residents flee Israeli bombings: 'Innocents are killed and it's going to get worse',0,https://www.lemonde.fr/en/international/article/2025/06/17/tehran-residents-flee-israeli-bombings-innocents-are-killed-and-it-s-going-to-get-worse_6742424_4.html,Subscribers only,  By Ghazal Golshiri ,https://img.lemde.fr/2025/06/16/0/0/8640/5760/360/0/95/0/d8d0de6_upload-1-qdvg31kljnnf-429595.jpg 2x,
Former French PM Fillon given suspended prison sentence for embezzlement of public funds,0,https://www.lemonde.fr/en/france/article/2025/06/17/former-pm-fillon-given-a-suspended-prison-sentence-over-his-wife-s-fake-job_6742426_7.html,Not premium,Le Monde with AFP,https://img.lemde.fr/2025/06/16/0/0/8640/5760/360/0/95/0/d8d0de6_upload-1-qdvg31kljnnf-429595.jpg 2x,
Russian strikes kill at least 14 in large attack on Kyiv,"Some 27 locations in Kyiv were hit, according to Ukrainian Interior Minister Igor Klymenko.",https://www.lemonde.fr/en/international/article/2025/06/17/russian-strikes-kill-14-in-horrific-attack-on-kyiv_6742415_4.html,Not premium,Le Monde with AFP,https://img.lemde.fr/2025/06/16/0/0/8640/5760/360/0/95/0/d8d0de6_upload-1-qdvg31kljnnf-429595.jpg 2x,
"In Belgium, the dual face of the kings of French fries","The global appetite for fries has enabled Belgian companies to build industrial empires, but often at the cost of deteriorating working conditions and significant environmental impact.",https://www.lemonde.fr/en/international/article/2025/06/17/in-belgium-the-dual-face-of-the-french-fry-champions_6742409_4.html,Subscribers only,"  By Jean-Pierre Stroobants (Brussels, special correspondent) ",https://img.lemde.fr/2025/06/16/0/0/8640/5760/360/0/95/0/d8d0de6_upload-1-qdvg31kljnnf-429595.jpg 2x,
The French students rethinking their US plans: 'Trump as president is just too unpredictable',"While France is not among the countries directly targeted by the American administration, many students are concerned about the climate of uncertainty created by Donald Trump's announcements.",https://www.lemonde.fr/en/campus/article/2025/06/17/the-french-students-rethinking-their-us-plans-trump-as-president-is-just-too-unpredictable_6742412_11.html,Subscribers only,  By Charlotte Bozonnet ,https://img.lemde.fr/2025/06/16/0/0/8640/5760/360/0/95/0/d8d0de6_upload-1-qdvg31kljnnf-429595.jpg 2x,
The failure of Obama's 'leading from behind' in Libya,"'The Transatlantic Divorce' (2/5). Elected on the promise of no longer sending American troops to the Middle East, President Barack Obama allowed France and the UK to lead the Libyan operation, which resulted in Muammar Gaddafi's fall. He emerged deeply frustrated by the shortcomings of his European allies.",https://www.lemonde.fr/en/history/article/2025/06/17/the-failure-of-obama-s-leading-from-behind-in-libya_6742410_157.html,Subscribers only, By Sylvie Kauffmann (Columnist) ,https://img.lemde.fr/2025/06/16/0/0/8640/5760/360/0/95/0/d8d0de6_upload-1-qdvg31kljnnf-429595.jpg 2x,Long Read
Gaza rescuers say Israel army kills at least 50 people near aid site,0,https://www.lemonde.fr/en/international/article/2025/06/17/gaza-rescuers-say-israel-army-kills-at-least-50-people-near-aid-site_6742422_4.html,Not premium,Le Monde with AFP,https://img.lemde.fr/2025/06/16/0/0/8640/5760/360/0/95/0/d8d0de6_upload-1-qdvg31kljnnf-429595.jpg 2x,
No radioactivity increase at Iranian nuclear site but 'radiological and chemical contamination' reported,0,https://www.lemonde.fr/en/international/article/2025/06/17/no-radioactivity-increase-at-iranian-nuclear-site-but-radiological-and-chemical-contamination-reported_6742419_4.html,Subscribers only,  By Perrine Mouterde ,https://img.lemde.fr/2025/06/16/0/0/8640/5760/360/0/95/0/d8d0de6_upload-1-qdvg31kljnnf-429595.jpg 2x,
UK government reverses course and launches national inquiry into 'grooming gangs',0,https://www.lemonde.fr/en/international/article/2025/06/17/in-the-united-kingdom-the-government-has-reversed-course-and-is-launching-a-national-inquiry-into-grooming-gangs_6742406_4.html,Subscribers only,"  By Cécile Ducourtieux (London, correspondent) ",https://img.lemde.fr/2025/06/16/0/0/8640/5760/360/0/95/0/d8d0de6_upload-1-qdvg31kljnnf-429595.jpg 2x,
When a giant Pikachu drops into a French formal garden at a 'Pokémon Go Fest',0,https://www.lemonde.fr/en/pixels/article/2025/06/17/when-a-giant-pikachu-drops-into-a-french-formal-garden-at-a-pokemon-go-fest_6742414_13.html,Subscribers only,  By Pierre Trouvé ,https://img.lemde.fr/2025/06/16/0/0/8640/5760/360/0/95/0/d8d0de6_upload-1-qdvg31kljnnf-429595.jpg 2x,
Closure of Israeli companies' booths at Paris Air Show heightens France-Israel tensions,0,https://www.lemonde.fr/en/economy/article/2025/06/17/closure-of-israeli-companies-booths-at-paris-air-show-heightens-france-israel-tensions_6742418_19.html,Subscribers only,  By Olivier Pinaud ,https://img.lemde.fr/2025/06/16/0/0/8640/5760/360/0/95/0/d8d0de6_upload-1-qdvg31kljnnf-429595.jpg 2x,
Luca de Meo takes the reins of Kering in crisis,0,https://www.lemonde.fr/en/economy/article/2025/06/17/a-luxury-of-challenges-for-luca-de-meo-at-kering_6742413_19.html,Subscribers only,  By Juliette Garnier ,https://img.lemde.fr/2025/06/16/0/0/8640/5760/360/0/95/0/d8d0de6_upload-1-qdvg31kljnnf-429595.jpg 2x,
"The son's suicide, the father's murder and the tormented killer",0,https://www.lemonde.fr/en/france/article/2025/06/16/the-son-s-suicide-the-father-s-murder-and-the-tormented-killer_6742398_7.html,Subscribers only,  By Lorraine de Foucher  ,https://img.lemde.fr/2025/06/16/0/0/8640/5760/360/0/95/0/d8d0de6_upload-1-qdvg31kljnnf-429595.jpg 2x,
Kurdish integration offers hope for Syria's reconstruction,0,https://www.lemonde.fr/en/opinion/article/2025/06/17/kurdish-integration-offers-hope-for-syria-s-reconstruction_6742411_23.html,Subscribers only,Hélène Sallon,https://img.lemde.fr/2025/06/16/0/0/8640/5760/360/0/95/0/d8d0de6_upload-1-qdvg31kljnnf-429595.jpg 2x,
"At the Paris Air Show, Airbus secures a wave of Saudi orders",0,https://www.lemonde.fr/en/economy/article/2025/06/17/at-the-paris-air-show-airbus-secures-a-wave-of-saudi-orders_6742405_19.html,Subscribers only,  By Guy Dutheil ,https://img.lemde.fr/2025/06/16/0/0/8640/5760/360/0/95/0/d8d0de6_upload-1-qdvg31kljnnf-429595.jpg 2x,
Vaccine experts fired by Trump administration 'deeply concerned' by Robert F. Kennedy Jr,0,https://www.lemonde.fr/en/health/article/2025/06/17/vaccine-experts-fired-by-trump-administration-deeply-concerned-by-robert-f-kennedy-jr_6742408_14.html,Not premium,Le Monde with AFP,https://img.lemde.fr/2025/06/16/0/0/8640/5760/360/0/95/0/d8d0de6_upload-1-qdvg31kljnnf-429595.jpg 2x,
The young professionals taking their parents' experiences to heart and changing how they work,0,https://www.lemonde.fr/en/campus/article/2025/06/16/the-young-professionals-taking-their-parents-experiences-to-heart-and-changing-how-they-work_6742373_11.html,Subscribers only,  By Alice Raybaud ,https://img.lemde.fr/2025/06/16/0/0/8640/5760/360/0/95/0/d8d0de6_upload-1-qdvg31kljnnf-429595.jpg 2x,
Poland delivers Trump his first electoral victory in Europe,0,https://www.lemonde.fr/en/opinion/article/2025/06/16/poland-delivers-trump-his-first-electoral-victory-in-europe_6742374_23.html,Subscribers only,Isabelle Mandraud,https://img.lemde.fr/2025/06/16/0/0/8640/5760/360/0/95/0/d8d0de6_upload-1-qdvg31kljnnf-429595.jpg 2x,
Artificial intelligence consumes massive amounts of energy. Here's why,"From developing models to their everyday use, generative AI has proven to be extremely energy-hungry. Le Monde breaks down the reasons behind this voracious demand, as their user base continues to expand.",https://www.lemonde.fr/en/les-decodeurs/article/2025/06/14/artificial-intelligence-consumes-massive-amounts-of-energy-here-s-why_6742347_8.html,Subscribers only, By  Léa Prati and Romain Geoffroy ,https://img.lemde.fr/2025/06/16/0/0/8640/5760/360/0/95/0/d8d0de6_upload-1-qdvg31kljnnf-429595.jpg 2x,Long Read
"'On the budget, Donald Trump's obsession consists of fulfilling impossible campaign promises'","After 150 days in office, doubts about the US economic policy are mounting. Widespread uncertainty, serious damage to the country's credibility, and the rising deficit threaten the international financial system's stability, writes Le Monde columnist Stéphane Lauer.",https://www.lemonde.fr/en/opinion/article/2025/06/16/on-the-budget-donald-trump-s-obsession-consists-of-fulfilling-impossible-campaign-promises_6742401_23.html,Subscribers only,Stéphane Lauer,https://img.lemde.fr/2025/06/16/0/0/8640/5760/360/0/95/0/d8d0de6_upload-1-qdvg31kljnnf-429595.jpg 2x,Column
How the US divided Europe to invade Iraq at any cost in 2003,"'The Transatlantic Divorce' (1/5). In the aftermath of September 11, American neoconservatives made plans to attack Iraq, despite opposition from France and Germany. From then on, to achieve its aims, the White House relied on its allies in Eastern Europe, dividing the European family for years to come.",https://www.lemonde.fr/en/history/article/2025/06/16/how-the-us-split-europe-to-invade-iraq-at-any-cost-in-2003_6742380_157.html,Subscribers only," By Sylvie Kauffmann (Vilnius, Tallinn, Berlin, special correspondent) ",https://img.lemde.fr/2025/06/16/0/0/8640/5760/360/0/95/0/d8d0de6_upload-1-qdvg31kljnnf-429595.jpg 2x,Investigation
The French Socialists' show of impotence,0,https://www.lemonde.fr/en/opinion/article/2025/06/17/the-french-socialists-a-show-of-impotence_6742427_23.html,Not premium,Le Monde,https://img.lemde.fr/2025/06/16/0/0/8640/5760/360/0/95/0/d8d0de6_upload-1-qdvg31kljnnf-429595.jpg 2x,Editorial
'Closing or permanently diminishing the Palais de la Découverte would be a loss for the global community',0,https://www.lemonde.fr/en/science/article/2025/06/17/closing-or-permanently-diminishing-the-palais-de-la-decouverte-would-be-a-loss-for-the-global-community_6742416_10.html,Subscribe,No byline,https://img.lemde.fr/2025/06/16/0/0/8640/5760/360/0/95/0/d8d0de6_upload-1-qdvg31kljnnf-429595.jpg 2x,Op-Ed
Trump's messianic allies lead the charge against Gaza,0,https://www.lemonde.fr/en/international/article/2025/06/16/trump-s-messianic-allies-lead-the-charge-against-gaza_6742393_4.html,Subscribe,Jean-Pierre Filiu,https://img.lemde.fr/2025/06/16/0/0/8640/5760/360/0/95/0/d8d0de6_upload-1-qdvg31kljnnf-429595.jpg 2x,Column
