title,subhead,url,suscription,byline,img_url,article_type
Russia is facing a labor shortage,0,https://www.lemonde.fr/en/international/article/2025/07/16/russia-is-facing-a-labor-shortage_6743443_4.html,Subscribers only,  By Marie Jégo ,https://img.lemde.fr/2025/07/16/0/0/1999/1333/360/0/95/0/4eb17c6_upload-1-7v1mltitgpsp-000-33nl9bw.jpg 2x,
Gaza: Video verified by Le Monde shows gunfire near food distribution center,0,https://www.lemonde.fr/en/international/video/2025/07/16/gaza-video-verified-by-le-monde-shows-gunfire-near-food-distribution-center_6743431_4.html,Not premium,"  By Juliette Prigent, Asia Balluffier, Elisa Bellanger and Julian Mathews ",https://img.lemde.fr/2025/07/16/0/0/1999/1333/360/0/95/0/4eb17c6_upload-1-7v1mltitgpsp-000-33nl9bw.jpg 2x,
Israel drives Syrian government forces out of Druze stronghold of Sweida,0,https://www.lemonde.fr/en/international/article/2025/07/16/israel-drives-syrian-government-forces-out-of-druze-stronghold-of-sweida_6743426_4.html,Subscribers only," By Hélène Sallon (al-Mazra'a, Syria, special correspondent) ",https://img.lemde.fr/2025/07/16/0/0/1999/1333/360/0/95/0/4eb17c6_upload-1-7v1mltitgpsp-000-33nl9bw.jpg 2x,
"Xi: The father, the son and the party",0,https://www.lemonde.fr/en/international/article/2025/07/16/xi-the-father-the-son-and-the-party_6743412_4.html,Subscribers only,  By Harold Thibault (Beijing (China) correspondent) ,https://img.lemde.fr/2025/07/16/0/0/1999/1333/360/0/95/0/4eb17c6_upload-1-7v1mltitgpsp-000-33nl9bw.jpg 2x,
"Srebrenica massacre commemoration: 30 years later, the enduring bitterness of grieving families",0,https://www.lemonde.fr/en/international/article/2025/07/12/srebrenica-massacre-commemoration-30-years-later-the-enduring-bitterness-of-grieving-families_6743301_4.html,Subscribers only, By Jean-Baptiste Chastand (Srebrenica (Bosnia) special correspondent) ,https://img.lemde.fr/2025/07/16/0/0/1999/1333/360/0/95/0/4eb17c6_upload-1-7v1mltitgpsp-000-33nl9bw.jpg 2x,
International justice confronts the genocide of Srebrenica,0,https://www.lemonde.fr/en/international/article/2025/07/11/international-justice-confronts-the-genocide-of-srebrenica_6743275_4.html,Subscribers only,  By Stéphanie Maupas (The Hague (Netherlands) correspondent) ,https://img.lemde.fr/2025/07/16/0/0/1999/1333/360/0/95/0/4eb17c6_upload-1-7v1mltitgpsp-000-33nl9bw.jpg 2x,
"In Srebrenica, 30 years after the genocide, the 'vicious circle' of denial continues",0,https://www.lemonde.fr/en/international/article/2025/07/11/in-srebrenica-30-years-after-the-genocide-the-vicious-circle-of-denial-continues_6743270_4.html,Subscribers only," By Jean-Baptiste Chastand (Srebrenica [Bosnia and Herzegovina], special correspondent) ",https://img.lemde.fr/2025/07/16/0/0/1999/1333/360/0/95/0/4eb17c6_upload-1-7v1mltitgpsp-000-33nl9bw.jpg 2x,
London hopes for a shift in French immigration policy in the Channel,0,https://www.lemonde.fr/en/international/article/2025/07/09/london-hopes-for-a-shift-in-french-immigration-policy-in-the-english-channel_6743178_4.html,Subscribers only,"  By Cécile Ducourtieux (London, correspondent) and Julia Pascual ",https://img.lemde.fr/2025/07/16/0/0/1999/1333/360/0/95/0/4eb17c6_upload-1-7v1mltitgpsp-000-33nl9bw.jpg 2x,
France's 2026 budget plan includes €5 billion in healthcare cuts,0,https://www.lemonde.fr/en/france/article/2025/07/16/the-2026-controversial-french-budget-includes-5-billion-in-healthcare-cuts_6743415_7.html,Subscribers only,  By Mattea Battaglia and Camille Stromboni ,https://img.lemde.fr/2025/07/16/0/0/1999/1333/360/0/95/0/4eb17c6_upload-1-7v1mltitgpsp-000-33nl9bw.jpg 2x,
Bastille Day: Pictures of a parade designed as a 'true military operation',0,https://www.lemonde.fr/en/international/article/2025/07/15/bastille-day-striking-footage-from-a-parade-designed-as-a-true-military-operation_6743370_4.html,Subscribers only, By Allison Ferrera and Photography desk ,https://img.lemde.fr/2025/07/16/0/0/1999/1333/360/0/95/0/4eb17c6_upload-1-7v1mltitgpsp-000-33nl9bw.jpg 2x,
Macron sounds alarm over growing threats and calls for new boost in military budget 'to remain free',0,https://www.lemonde.fr/en/france/article/2025/07/14/macron-sounds-alarm-over-growing-threats-and-calls-for-new-boost-in-military-budget-to-remain-free_6743353_7.html,Subscribers only,  By Elise Vincent ,https://img.lemde.fr/2025/07/16/0/0/1999/1333/360/0/95/0/4eb17c6_upload-1-7v1mltitgpsp-000-33nl9bw.jpg 2x,
French prisoner who escaped in released cellmate's laundry bag arrested near Lyon,0,https://www.lemonde.fr/en/france/article/2025/07/14/french-prisoner-who-escaped-in-inmate-s-laundry-bag-arrested-near-lyon_6743349_7.html,Subscribers only,  By Richard Schittly (Lyon (France) correspondent) ,https://img.lemde.fr/2025/07/16/0/0/1999/1333/360/0/95/0/4eb17c6_upload-1-7v1mltitgpsp-000-33nl9bw.jpg 2x,
What is France's 'Black code' and why hasn't it been repealed?,0,https://www.lemonde.fr/en/videos/video/2025/05/31/what-is-france-s-black-code-and-why-hasn-t-it-been-repealed_6741860_108.html,Not premium,"  By Chloé Denis, Olivier Escher (motion design) and Diana Liu ",https://img.lemde.fr/2025/07/16/0/0/1999/1333/360/0/95/0/4eb17c6_upload-1-7v1mltitgpsp-000-33nl9bw.jpg 2x,
How was the European Union created?,0,https://www.lemonde.fr/en/videos/video/2025/05/29/how-was-the-european-union-created_6741795_108.html,Not premium,"  By Alexis Tromas, Robin Gasser (motion design) and Diana Liu ",https://img.lemde.fr/2025/07/16/0/0/1999/1333/360/0/95/0/4eb17c6_upload-1-7v1mltitgpsp-000-33nl9bw.jpg 2x,
Glide bombs: Russia's secret to making cheap weapons,0,https://www.lemonde.fr/en/videos/video/2025/05/25/glide-bombs-russia-s-secret-to-making-cheap-weapons_6741646_108.html,Subscribers only,"  By Thomas Eydoux, Marceau Bretonnier and Sinead McCausland ",https://img.lemde.fr/2025/07/16/0/0/1999/1333/360/0/95/0/4eb17c6_upload-1-7v1mltitgpsp-000-33nl9bw.jpg 2x,
How does the conclave pick the new pope?,0,https://www.lemonde.fr/en/videos/video/2025/05/07/how-does-the-conclave-pick-the-new-pope_6741005_108.html,Not premium,"  By Alexis Tromas, Félix Pommier (Motion design) and Diana Liu ",https://img.lemde.fr/2025/07/16/0/0/1999/1333/360/0/95/0/4eb17c6_upload-1-7v1mltitgpsp-000-33nl9bw.jpg 2x,
'Europe must coordinate its response to Trump's tariff threats',0,https://www.lemonde.fr/en/opinion/article/2025/07/16/europe-must-coordinate-its-response-to-trump-s-tariff-threats_6743414_23.html,Subscribers only,Alain Trannoy,https://img.lemde.fr/2025/07/16/0/0/1999/1333/360/0/95/0/4eb17c6_upload-1-7v1mltitgpsp-000-33nl9bw.jpg 2x,
French PM Bayrou prescribes a bitter pill for 2026 budget,0,https://www.lemonde.fr/en/opinion/article/2025/07/16/french-pm-bayrou-prescribes-a-bitter-pill-for-2026-budget_6743429_23.html,Not premium,Le Monde,https://img.lemde.fr/2025/07/16/0/0/1999/1333/360/0/95/0/4eb17c6_upload-1-7v1mltitgpsp-000-33nl9bw.jpg 2x,
'Europe is under the double grip of America',0,https://www.lemonde.fr/en/opinion/article/2025/07/15/europe-is-under-the-double-grip-of-america_6743378_23.html,Subscribers only,Pierre Buhler,https://img.lemde.fr/2025/07/16/0/0/1999/1333/360/0/95/0/4eb17c6_upload-1-7v1mltitgpsp-000-33nl9bw.jpg 2x,
France: When defense imperatives meet budgetary realities,0,https://www.lemonde.fr/en/opinion/article/2025/07/14/france-when-defense-imperatives-meet-budgetary-realities_6743357_23.html,Not premium,Le Monde,https://img.lemde.fr/2025/07/16/0/0/1999/1333/360/0/95/0/4eb17c6_upload-1-7v1mltitgpsp-000-33nl9bw.jpg 2x,
"In Angers, you can find world-class fries",0,https://www.lemonde.fr/en/m-le-mag/article/2025/07/15/in-angers-you-can-find-world-class-fries_6743373_117.html,Subscribers only,Frédéric Potet,https://img.lemde.fr/2025/07/16/0/0/1999/1333/360/0/95/0/4eb17c6_upload-1-7v1mltitgpsp-000-33nl9bw.jpg 2x,
"In China, Beijing cyclists take to the streets at night",0,https://www.lemonde.fr/en/m-le-mag/article/2025/07/13/in-china-beijing-cyclists-take-to-the-streets-at-night_6743319_117.html,Subscribers only,"  By Jordan Pouille (Beijing (China), correspondent) ",https://img.lemde.fr/2025/07/16/0/0/1999/1333/360/0/95/0/4eb17c6_upload-1-7v1mltitgpsp-000-33nl9bw.jpg 2x,
Nonprofit helps French festivals fight gender-based violence,0,https://www.lemonde.fr/en/m-le-mag/article/2025/07/11/nonprofit-helps-french-festivals-fight-gender-based-violence_6743284_117.html,Subscribers only,  By Christelle Murhula ,https://img.lemde.fr/2025/07/16/0/0/1999/1333/360/0/95/0/4eb17c6_upload-1-7v1mltitgpsp-000-33nl9bw.jpg 2x,
Spain's Costa Blanca bears the scars of a real estate frenzy,0,https://www.lemonde.fr/en/m-le-mag/article/2025/07/09/spain-s-costa-blanca-bears-the-scars-of-a-real-estate-frenzy_6743171_117.html,Subscribers only, By Sandrine Morel (Madrid (Spain) correspondent) ,https://img.lemde.fr/2025/07/16/0/0/1999/1333/360/0/95/0/4eb17c6_upload-1-7v1mltitgpsp-000-33nl9bw.jpg 2x,
'Paris l'Eté': Summer performing arts festival explores new venues around French capital,0,https://www.lemonde.fr/en/culture/article/2025/07/16/paris-l-ete-summer-performing-arts-festival-explores-new-venues-around-french-capital_6743418_30.html,Subscribers only,  By Rosita Boisseau ,https://img.lemde.fr/2025/07/16/0/0/1999/1333/360/0/95/0/4eb17c6_upload-1-7v1mltitgpsp-000-33nl9bw.jpg 2x,
"Avignon Festival: 'When I Saw the Sea', Ali Chahrour's peaceful and political work",0,https://www.lemonde.fr/en/culture/article/2025/07/10/avignon-festival-when-i-saw-the-sea-ali-chahrour-s-peaceful-and-political-work_6743233_30.html,Subscribers only,  By Rosita Boisseau (Avignon (France) special correspondent) ,https://img.lemde.fr/2025/07/16/0/0/1999/1333/360/0/95/0/4eb17c6_upload-1-7v1mltitgpsp-000-33nl9bw.jpg 2x,
Nice's Contemporary Art Biennale explores the city's unique relationship to the sea,0,https://www.lemonde.fr/en/culture/article/2025/07/06/nice-s-contemporary-art-biennale-explores-the-city-s-unique-relationship-to-the-sea_6743081_30.html,Subscribers only,  By Harry Bellet (Nice) ,https://img.lemde.fr/2025/07/16/0/0/1999/1333/360/0/95/0/4eb17c6_upload-1-7v1mltitgpsp-000-33nl9bw.jpg 2x,
"Dubuffet, Hokusai, Giacometti: 20 must-see exhibitions this summer, in Paris and beyond",0,https://www.lemonde.fr/en/culture/article/2025/06/28/20-must-see-exhibitions-this-summer-in-paris-and-beyond_6742801_30.html,Subscribers only,"  By Roxana Azimi, Harry Bellet, Philippe Dagen, Alexis Duval, Angèle Guicharnaud, Claire Guillot, Emmanuelle Jardonnet, Sylvie Kerviel and Emmanuelle Lequeux ",https://img.lemde.fr/2025/07/16/0/0/1999/1333/360/0/95/0/4eb17c6_upload-1-7v1mltitgpsp-000-33nl9bw.jpg 2x,
"French PM's planned 2026 budget cuts could slow growth, experts say","Prime Minister François Bayrou's proposed €43.8 billion in budget cuts, aiming to reduce the public deficit to 4.6% of GDP, could undermine household consumption, stifling growth during a trade war and worsening inequality.",https://www.lemonde.fr/en/politics/article/2025/07/16/french-pm-s-planned-2026-budget-cuts-could-slow-growth-experts-say_6743435_5.html,Subscribers only,  By Béatrice Madeline   ,https://img.lemde.fr/2025/07/16/0/0/1999/1333/360/0/95/0/4eb17c6_upload-1-7v1mltitgpsp-000-33nl9bw.jpg 2x,
Gaza: Video verified by Le Monde shows gunfire near food distribution center,0,https://www.lemonde.fr/en/international/video/2025/07/16/gaza-video-verified-by-le-monde-shows-gunfire-near-food-distribution-center_6743431_4.html,Not premium,"  By Juliette Prigent, Asia Balluffier, Elisa Bellanger and Julian Mathews ",https://img.lemde.fr/2025/07/16/0/0/1999/1333/360/0/95/0/4eb17c6_upload-1-7v1mltitgpsp-000-33nl9bw.jpg 2x,
Syria says pulling troops from Druze heartland after US request,0,https://www.lemonde.fr/en/international/article/2025/07/16/syria-says-pulling-troops-from-druze-heartland-after-us-request_6743442_4.html,Not premium,Le Monde with AFP,https://img.lemde.fr/2025/07/16/0/0/1999/1333/360/0/95/0/4eb17c6_upload-1-7v1mltitgpsp-000-33nl9bw.jpg 2x,
"'Soldiers found us and told us to undress': In Ethiopia, silence shrouds Tigray war's mass rapes","During the war in Tigray, in Ethiopia, 120,000 women were victims of rape. More than two and a half years since the end of the conflict, many survivors are still trying to overcome their trauma, with justice yet to be served.",https://www.lemonde.fr/en/le-monde-africa/article/2025/07/16/soldiers-found-us-and-told-us-to-undress-in-ethiopia-silence-surrounds-tigray-war-s-mass-rapes_6743416_124.html,Subscribers only," By Marlène Panara (Mekele (Ethiopia), special correspondent) ",https://img.lemde.fr/2025/07/16/0/0/1999/1333/360/0/95/0/4eb17c6_upload-1-7v1mltitgpsp-000-33nl9bw.jpg 2x,
Trump hosts Gulf leaders at White House amid bursts of violence in the Middle East,"Donald Trump hosted Bahrain's crown prince and is set to have dinner with Qatar's prime minister on Wednesday. Despite the US president's pledge to impose peace throughout the Middle East, scant progress has been made to curtail Israel's attacks on Gaza, while recent violence between Israel and Syria has only renewed doubts.",https://www.lemonde.fr/en/international/article/2025/07/16/trump-hosts-gulf-leaders-at-white-house-amid-bursts-of-violence-in-the-middle-east_6743440_4.html,Not premium,Le Monde with AP,https://img.lemde.fr/2025/07/16/0/0/1999/1333/360/0/95/0/4eb17c6_upload-1-7v1mltitgpsp-000-33nl9bw.jpg 2x,
Kendrick Lamar and SZA deliver three-hour tour de force at Paris concert,"The two leading figures of contemporary American rap and R&B have crafted a joint three-hour show for their Grand National Tour, which is stopping in Paris for two nights.",https://www.lemonde.fr/en/culture/article/2025/07/16/kendrick-lamar-and-sza-deliver-three-hour-tour-de-force-at-paris-concert_6743425_30.html,Subscribers only,  By Stéphanie Binet ,https://img.lemde.fr/2025/07/16/0/0/1999/1333/360/0/95/0/4eb17c6_upload-1-7v1mltitgpsp-000-33nl9bw.jpg 2x,
"'His return was a miracle, but he had changed': The first free summer of Lyon's Holocaust survivors","'The Summer of 1945' (3/6). As Lyon celebrated the Liberation, survivors of the death camps tried to reconnect with daily life, despite hardship, silence, and widespread incomprehension.",https://www.lemonde.fr/en/summer-reads/article/2025/07/16/his-return-was-a-miracle-but-he-had-changed-the-first-free-summer-of-lyon-s-holocaust-survivors_6743438_183.html,Subscribers only, By Raphaëlle Rérolle ,https://img.lemde.fr/2025/07/16/0/0/1999/1333/360/0/95/0/4eb17c6_upload-1-7v1mltitgpsp-000-33nl9bw.jpg 2x,Series
EU $2.3-trillion mega budget hits immediate German opposition,0,https://www.lemonde.fr/en/international/article/2025/07/16/eu-unveils-plan-for-2-trillion-long-term-budget_6743434_4.html,Not premium,Le Monde with AFP,https://img.lemde.fr/2025/07/16/0/0/1999/1333/360/0/95/0/4eb17c6_upload-1-7v1mltitgpsp-000-33nl9bw.jpg 2x,
Stellantis withdrawal puts the French hydrogen industry at risk,0,https://www.lemonde.fr/en/economy/article/2025/07/17/stellantis-withdrawal-puts-the-french-hydrogen-industry-at-risk_6743444_19.html,Subscribers only,  By Sophie Fay ,https://img.lemde.fr/2025/07/16/0/0/1999/1333/360/0/95/0/4eb17c6_upload-1-7v1mltitgpsp-000-33nl9bw.jpg 2x,
Russia is facing a labor shortage,0,https://www.lemonde.fr/en/international/article/2025/07/16/russia-is-facing-a-labor-shortage_6743443_4.html,Subscribers only,  By Marie Jégo ,https://img.lemde.fr/2025/07/16/0/0/1999/1333/360/0/95/0/4eb17c6_upload-1-7v1mltitgpsp-000-33nl9bw.jpg 2x,
Israel bombs Syrian army headquarters in Damascus,0,https://www.lemonde.fr/en/international/article/2025/07/16/israel-bombs-syrian-army-headquarters-in-damascus_6743428_4.html,Not premium,Le Monde with AFP,https://img.lemde.fr/2025/07/16/0/0/1999/1333/360/0/95/0/4eb17c6_upload-1-7v1mltitgpsp-000-33nl9bw.jpg 2x,
Trump lashes out at 'foolish' Republicans over Epstein case backlash,0,https://www.lemonde.fr/en/international/article/2025/07/16/trump-lashes-out-at-foolish-republicans-over-epstein-case-backlash_6743439_4.html,Not premium,Le Monde with AFP,https://img.lemde.fr/2025/07/16/0/0/1999/1333/360/0/95/0/4eb17c6_upload-1-7v1mltitgpsp-000-33nl9bw.jpg 2x,
Oppositions threaten to topple French government after 2026 budget cuts unveiled,0,https://www.lemonde.fr/en/politics/article/2025/07/16/oppositions-threaten-to-topple-french-governement-after-2026-budget-cuts-unveiled_6743424_5.html,Subscribers only,"  By Alexandre Pedro, Sandrine Cassini and Corentin Lesueur ",https://img.lemde.fr/2025/07/16/0/0/1999/1333/360/0/95/0/4eb17c6_upload-1-7v1mltitgpsp-000-33nl9bw.jpg 2x,
French prosecutors demand Fiat face trial in diesel scandal,0,https://www.lemonde.fr/en/france/article/2025/07/16/french-prosecutors-demand-fiat-face-trial-in-diesel-scandal_6743441_7.html,Not premium,Le Monde with AFP,https://img.lemde.fr/2025/07/16/0/0/1999/1333/360/0/95/0/4eb17c6_upload-1-7v1mltitgpsp-000-33nl9bw.jpg 2x,
Netanyahu loses majority as second ultra-Orthodox party quits coalition,0,https://www.lemonde.fr/en/international/article/2025/07/16/netanyahu-loses-majority-as-second-ultra-orthodox-party-quit-coalition_6743436_4.html,Not premium,Le Monde with AP,https://img.lemde.fr/2025/07/16/0/0/1999/1333/360/0/95/0/4eb17c6_upload-1-7v1mltitgpsp-000-33nl9bw.jpg 2x,
Abrahamsen wins Tour de France stage 11 as Pogacar crashes near finish,0,https://www.lemonde.fr/en/sports/article/2025/07/16/abrahamsen-wins-tour-de-france-stage-11-as-pogacar-crashes-near-finish_6743437_9.html,Not premium,Le Monde with AFP,https://img.lemde.fr/2025/07/16/0/0/1999/1333/360/0/95/0/4eb17c6_upload-1-7v1mltitgpsp-000-33nl9bw.jpg 2x,
'Paris l'Eté': Summer performing arts festival explores new venues around French capital,0,https://www.lemonde.fr/en/culture/article/2025/07/16/paris-l-ete-summer-performing-arts-festival-explores-new-venues-around-french-capital_6743418_30.html,Subscribers only,  By Rosita Boisseau ,https://img.lemde.fr/2025/07/16/0/0/1999/1333/360/0/95/0/4eb17c6_upload-1-7v1mltitgpsp-000-33nl9bw.jpg 2x,
EU court rejects Le Pen heirs' appeal in expenses scandal,0,https://www.lemonde.fr/en/europe/article/2025/07/16/eu-court-rejects-le-pen-family-appeal-in-expenses-scandal_6743423_143.html,Not premium,Le Monde with AFP,https://img.lemde.fr/2025/07/16/0/0/1999/1333/360/0/95/0/4eb17c6_upload-1-7v1mltitgpsp-000-33nl9bw.jpg 2x,
Belgian company unveils breakthrough process to decontaminate soil,0,https://www.lemonde.fr/en/economy/article/2025/07/16/belgian-company-unveils-breakthrough-process-to-decontaminate-soil_6743419_19.html,Subscribers only,"  By Jean-Pierre Stroobants (Brussels, correspondent) ",https://img.lemde.fr/2025/07/16/0/0/1999/1333/360/0/95/0/4eb17c6_upload-1-7v1mltitgpsp-000-33nl9bw.jpg 2x,
"Xi: The father, the son and the party","Given that Xi Jinping's father was a reformer, should his son not have been one as well? In the first English-language biography of the Chinese president's father, the author sees within the current leader's conservatism the cultural mark of absolute devotion to the Chinese Communist Party.",https://www.lemonde.fr/en/international/article/2025/07/16/xi-the-father-the-son-and-the-party_6743412_4.html,Subscribers only,  By Harold Thibault (Beijing (China) correspondent) ,https://img.lemde.fr/2025/07/16/0/0/1999/1333/360/0/95/0/4eb17c6_upload-1-7v1mltitgpsp-000-33nl9bw.jpg 2x,Letter from...
"Photography, politics and protest collide at Rencontres d'Arles","The 56th Rencontres d'Arles opened with a 15% rise in attendance. But behind the packed halls and sold-out screenings, tensions flared over cries of cultural gentrification, uneven art shows and political protests.",https://www.lemonde.fr/en/culture/article/2025/07/15/photography-politics-and-protest-collide-at-rencontres-d-arles_6743384_30.html,Subscribers only,  By Claire Guillot ,https://img.lemde.fr/2025/07/16/0/0/1999/1333/360/0/95/0/4eb17c6_upload-1-7v1mltitgpsp-000-33nl9bw.jpg 2x,Feature
French PM bets on national effort against 'curse' of debt,"On Tuesday, Prime Minister François Bayrou outlined the main strategies chosen to reach €43.8 billion in savings in the 2026 budget, all while carefully avoiding conflict with both his allies and the Socialists, on whom his survival depends.",https://www.lemonde.fr/en/politics/article/2025/07/16/french-pm-bets-on-national-effort-against-curse-of-debt_6743422_5.html,Subscribers only,  By Nathalie Segaunes ,https://img.lemde.fr/2025/07/16/0/0/1999/1333/360/0/95/0/4eb17c6_upload-1-7v1mltitgpsp-000-33nl9bw.jpg 2x,In Depth
French PM Bayrou prescribes a bitter pill for 2026 budget,0,https://www.lemonde.fr/en/opinion/article/2025/07/16/french-pm-bayrou-prescribes-a-bitter-pill-for-2026-budget_6743429_23.html,Not premium,Le Monde,https://img.lemde.fr/2025/07/16/0/0/1999/1333/360/0/95/0/4eb17c6_upload-1-7v1mltitgpsp-000-33nl9bw.jpg 2x,Editorial
New Caledonia: A lesson in responsibility,0,https://www.lemonde.fr/en/opinion/article/2025/07/13/new-caledonia-a-lesson-in-responsibility_6743332_23.html,Not premium,Le Monde,https://img.lemde.fr/2025/07/16/0/0/1999/1333/360/0/95/0/4eb17c6_upload-1-7v1mltitgpsp-000-33nl9bw.jpg 2x,Editorial
France: When defense imperatives meet budgetary realities,0,https://www.lemonde.fr/en/opinion/article/2025/07/14/france-when-defense-imperatives-meet-budgetary-realities_6743357_23.html,Not premium,Le Monde,https://img.lemde.fr/2025/07/16/0/0/1999/1333/360/0/95/0/4eb17c6_upload-1-7v1mltitgpsp-000-33nl9bw.jpg 2x,Editorial
