title,subhead,url,suscription,byline,img_url,article_type
Russians are evading sanctions with fake Romanian documents,0,https://www.lemonde.fr/en/international/article/2025/12/26/russians-are-evading-sanctions-with-fake-romanian-documents_6748839_4.html,Subscribers only,"  By Marine Leduc (Bucharest, Romania, correspondent) ",https://img.lemde.fr/2025/12/22/0/0/8024/5349/360/0/95/0/825ef1c_upload-1-ruexxmmbk064-000-34tr872.jpg 2x,
Escaping New York's winter and its 'communist' mayor for Miami,0,https://www.lemonde.fr/en/international/article/2025/12/25/escaping-new-york-s-winter-and-its-communist-mayor-for-miami_6748833_4.html,Subscribers only,  By Georgia Husson ,https://img.lemde.fr/2025/12/22/0/0/8024/5349/360/0/95/0/825ef1c_upload-1-ruexxmmbk064-000-34tr872.jpg 2x,
Bethlehem celebrates Christmas in climate of 'fear and uncertainty',0,https://www.lemonde.fr/en/international/article/2025/12/25/bethlehem-celebrates-christmas-in-climate-of-fear-and-uncertainty_6748826_4.html,Subscribers only," By Samuel Forey (Bethlehem, West Bank, special correspondent) ",https://img.lemde.fr/2025/12/22/0/0/8024/5349/360/0/95/0/825ef1c_upload-1-ruexxmmbk064-000-34tr872.jpg 2x,
"In Turkey, the fall of a star television presenter exposes internal power struggles",0,https://www.lemonde.fr/en/international/article/2025/12/25/in-turkey-the-fall-of-a-star-television-presenter-exposes-internal-power-struggles_6748825_4.html,Subscribers only,  By Nicolas Bourcier (Istanbul (Turkey) correspondent) ,https://img.lemde.fr/2025/12/22/0/0/8024/5349/360/0/95/0/825ef1c_upload-1-ruexxmmbk064-000-34tr872.jpg 2x,
'Trump's ideological challenge to Europe is more dangerous than the security one',0,https://www.lemonde.fr/en/opinion/article/2025/12/11/trump-s-ideological-challenge-to-europe-is-more-dangerous-than-the-security-one_6748393_23.html,Subscribers only,Sylvie Kauffmann,https://img.lemde.fr/2025/12/22/0/0/8024/5349/360/0/95/0/825ef1c_upload-1-ruexxmmbk064-000-34tr872.jpg 2x,
"Attacked by Trump, Europe wavers between denial and fear of reprisals",0,https://www.lemonde.fr/en/international/article/2025/12/11/attacked-by-trump-europe-wavers-between-denial-and-fear-of-reprisals_6748382_4.html,Subscribers only,"  By Philippe Jacqué (Brussels, Europe bureau) and Virginie Malingre (Brussels, Europe bureau) ",https://img.lemde.fr/2025/12/22/0/0/8024/5349/360/0/95/0/825ef1c_upload-1-ruexxmmbk064-000-34tr872.jpg 2x,
Bosnia and Herzegovina's Serb entity elects ally of  former leader Dodik,0,https://www.lemonde.fr/en/international/article/2025/11/24/bosnia-and-herzegovina-s-serb-entity-elects-ally-of-former-leader-dodik_6747765_4.html,Subscribers only,  By Rémy Ourdan (Banja Luka (Bosnia and Herzegovina) special correspondent) ,https://img.lemde.fr/2025/12/22/0/0/8024/5349/360/0/95/0/825ef1c_upload-1-ruexxmmbk064-000-34tr872.jpg 2x,
"In France's Somme, bagpipers keep the memory of the Great War alive",0,https://www.lemonde.fr/en/history/article/2025/11/11/in-france-s-somme-bagpipers-keep-the-memory-of-the-great-war-alive_6747347_157.html,Subscribers only," By Marie-Béatrice Baudet (Ovillers-la-Boisselle [Somme], special correspondent) ",https://img.lemde.fr/2025/12/22/0/0/8024/5349/360/0/95/0/825ef1c_upload-1-ruexxmmbk064-000-34tr872.jpg 2x,
Why more young people are turning to religion,0,https://www.lemonde.fr/en/france/article/2025/12/25/why-more-young-people-are-turning-to-religion_6748827_7.html,Subscribers only,  By Sarah Belouezzane ,https://img.lemde.fr/2025/12/22/0/0/8024/5349/360/0/95/0/825ef1c_upload-1-ruexxmmbk064-000-34tr872.jpg 2x,
French biathlon team races ahead on the unpredictable road to the Olympics,0,https://www.lemonde.fr/en/sports/article/2025/12/25/french-biathlon-team-races-ahead-on-the-unpredictable-road-to-the-olympics_6748823_9.html,Subscribers only,"  By Thomas Saintourens (Le Grand-Bornand (France), special correspondent) ",https://img.lemde.fr/2025/12/22/0/0/8024/5349/360/0/95/0/825ef1c_upload-1-ruexxmmbk064-000-34tr872.jpg 2x,
"'Knowing they will all be together without me is hard': Christmas, a lonely time for many struggling students",0,https://www.lemonde.fr/en/france/article/2025/12/24/knowing-they-will-all-be-together-without-me-is-hard-christmas-a-time-of-loneliness-for-many-struggling-students_6748800_7.html,Subscribers only,  By Jeanne Boyer ,https://img.lemde.fr/2025/12/22/0/0/8024/5349/360/0/95/0/825ef1c_upload-1-ruexxmmbk064-000-34tr872.jpg 2x,
French anesthesiologist sentenced to life imprisonment after poisoning 30 patients,0,https://www.lemonde.fr/en/france/article/2025/12/24/french-anesthesiologist-sentenced-to-life-imprisonment-after-poisoning-30-patients_6748795_7.html,Subscribers only,  By Willy Graff ,https://img.lemde.fr/2025/12/22/0/0/8024/5349/360/0/95/0/825ef1c_upload-1-ruexxmmbk064-000-34tr872.jpg 2x,
The French studio behind a viral Christmas ad,0,https://www.lemonde.fr/en/videos/video/2025/12/12/the-french-studio-behind-a-viral-christmas-ad_6748436_108.html,Not premium,"  By Le Monde's video desk, Antoine Apelbaum   and Sinead McCausland (Le Monde in English) ",https://img.lemde.fr/2025/12/22/0/0/8024/5349/360/0/95/0/825ef1c_upload-1-ruexxmmbk064-000-34tr872.jpg 2x,
"Israel's D9 bulldozer, a tool of destruction in Gaza",0,https://www.lemonde.fr/en/videos/video/2025/11/27/israel-s-d9-bulldozer-a-tool-of-destruction-in-gaza_6747870_108.html,Subscribers only,"  By Liselotte Mas, Elsa Longueville (motion design) and Sinead McCausland ",https://img.lemde.fr/2025/12/22/0/0/8024/5349/360/0/95/0/825ef1c_upload-1-ruexxmmbk064-000-34tr872.jpg 2x,
"Ukraine's Pokrovsk faces fierce fighting, footage analyzed by Le Monde reveals",0,https://www.lemonde.fr/en/videos/video/2025/11/21/ukraine-s-pokrovsk-faces-fierce-fighting-footage-analyzed-by-le-monde-reveals_6747708_108.html,Subscribers only,"  By Alexandre Horn, Gabriel Lecointre (edit), Elisa Bellanger (motion design) and Sinead McCausland ",https://img.lemde.fr/2025/12/22/0/0/8024/5349/360/0/95/0/825ef1c_upload-1-ruexxmmbk064-000-34tr872.jpg 2x,
Afghanistan: Relentless repression continues over four years into Taliban's rule,0,https://www.lemonde.fr/en/videos/video/2025/10/04/afghanistan-relentless-repression-continues-over-four-years-into-taliban-s-rule_6746092_108.html,Not premium,"  By Chloé Denis, Félix Pommier (Motion design) and Sinead McCausland ",https://img.lemde.fr/2025/12/22/0/0/8024/5349/360/0/95/0/825ef1c_upload-1-ruexxmmbk064-000-34tr872.jpg 2x,
'Trump is coming to terms with his own planned obsolescence',0,https://www.lemonde.fr/en/opinion/article/2025/12/26/trump-is-coming-to-terms-with-his-own-planned-obsolescence_6748840_23.html,Subscribers only,Gilles Paris,https://img.lemde.fr/2025/12/22/0/0/8024/5349/360/0/95/0/825ef1c_upload-1-ruexxmmbk064-000-34tr872.jpg 2x,
2026 budget: The risk of deadlock,0,https://www.lemonde.fr/en/opinion/article/2025/12/24/2026-budget-the-risk-of-deadlock_6748812_23.html,Not premium,Le Monde,https://img.lemde.fr/2025/12/22/0/0/8024/5349/360/0/95/0/825ef1c_upload-1-ruexxmmbk064-000-34tr872.jpg 2x,
Cambodia-Thailand conflict: The poison of nationalism,0,https://www.lemonde.fr/en/opinion/article/2025/12/23/cambodia-thailand-conflict-the-poison-of-nationalism_6748780_23.html,Not premium,Le Monde,https://img.lemde.fr/2025/12/22/0/0/8024/5349/360/0/95/0/825ef1c_upload-1-ruexxmmbk064-000-34tr872.jpg 2x,
The geopolitics of microprocessors: A harsh lesson for Europeans,0,https://www.lemonde.fr/en/opinion/article/2025/12/22/the-geopolitics-of-microprocessors-a-harsh-lesson-for-europeans_6748750_23.html,Not premium,Le Monde,https://img.lemde.fr/2025/12/22/0/0/8024/5349/360/0/95/0/825ef1c_upload-1-ruexxmmbk064-000-34tr872.jpg 2x,
Disneyland Paris at 40: When Mickey Mouse said 'bonjour' to Paris,0,https://www.lemonde.fr/en/m-le-mag/article/2025/12/22/disneyland-paris-at-40-when-mickey-mouse-said-bonjour-to-paris_6748740_117.html,Subscribers only, By Michaël Moreau ,https://img.lemde.fr/2025/12/22/0/0/8024/5349/360/0/95/0/825ef1c_upload-1-ruexxmmbk064-000-34tr872.jpg 2x,
Madagascar's metalheads lead charge of anger: 'It's easier to make yourself heard when you scream',0,https://www.lemonde.fr/en/m-le-mag/article/2025/12/21/madagascar-s-metalheads-lead-charge-of-anger-it-s-easier-to-make-yourself-heard-when-you-scream_6748730_117.html,Subscribers only," By Jean-Philippe Rémy (Antananarivo, Madagascar, special correspondent) ",https://img.lemde.fr/2025/12/22/0/0/8024/5349/360/0/95/0/825ef1c_upload-1-ruexxmmbk064-000-34tr872.jpg 2x,
Da Vinci's secret tunnels at Milan's Sforza Castle appear to be nothing more than sewers,0,https://www.lemonde.fr/en/m-le-mag/article/2025/12/21/da-vinci-s-secret-tunnels-at-milan-s-sforza-castle-appear-to-be-nothing-more-than-sewers_6748712_117.html,Subscribers only,  By Allan Kaval (Rome (Italy) correspondent) ,https://img.lemde.fr/2025/12/22/0/0/8024/5349/360/0/95/0/825ef1c_upload-1-ruexxmmbk064-000-34tr872.jpg 2x,
Trump and the 'derangement syndrome' driving people crazy,0,https://www.lemonde.fr/en/m-le-mag/article/2025/12/20/trump-and-the-derangement-syndrome-driving-people-crazy_6748696_117.html,Subscribers only,  By Clément Ghys ,https://img.lemde.fr/2025/12/22/0/0/8024/5349/360/0/95/0/825ef1c_upload-1-ruexxmmbk064-000-34tr872.jpg 2x,
Five creative craft workshops to enjoy doing in Paris with your child,0,https://www.lemonde.fr/en/intimacy/article/2025/12/13/in-paris-five-creative-craft-workshops-to-enjoy-doing-with-your-child_6748451_310.html,Subscribers only,  By Tiphaine Thuillier ,https://img.lemde.fr/2025/12/22/0/0/8024/5349/360/0/95/0/825ef1c_upload-1-ruexxmmbk064-000-34tr872.jpg 2x,
Jewels of power go on display in Paris,0,https://www.lemonde.fr/en/culture/article/2025/12/11/the-power-gems-on-display-in-paris_6748374_30.html,Not premium,  By Valentin Pérez   ,https://img.lemde.fr/2025/12/22/0/0/8024/5349/360/0/95/0/825ef1c_upload-1-ruexxmmbk064-000-34tr872.jpg 2x,
Five spots in Paris to enjoy a (great) plant-based sandwich,0,https://www.lemonde.fr/en/lifestyle/article/2025/12/04/in-paris-five-spots-to-enjoy-a-great-plant-based-sandwich_6748131_37.html,Subscribers only,  By Lucas Scaltritti ,https://img.lemde.fr/2025/12/22/0/0/8024/5349/360/0/95/0/825ef1c_upload-1-ruexxmmbk064-000-34tr872.jpg 2x,
"Bayonne's 'Little Louvre,' the Bonnat-Helleu Museum, reopens after 14 years",0,https://www.lemonde.fr/en/culture/article/2025/11/28/bayonne-s-little-louvre-the-bonnat-helleu-museum-reopens-after-14-years_6747913_30.html,Subscribers only,  By Roxana Azimi (Bayonne (France) special correspondent) ,https://img.lemde.fr/2025/12/22/0/0/8024/5349/360/0/95/0/825ef1c_upload-1-ruexxmmbk064-000-34tr872.jpg 2x,
Russians are evading sanctions with fake Romanian documents,"Since Russia's invasion of Ukraine, hundreds of Russian citizens have reportedly obtained Romanian citizenship through fraudulent means, allowing them to circumvent sanctions or settle in the European Union.",https://www.lemonde.fr/en/international/article/2025/12/26/russians-are-evading-sanctions-with-fake-romanian-documents_6748839_4.html,Subscribers only,"  By Marine Leduc (Bucharest, Romania, correspondent) ",https://img.lemde.fr/2025/12/22/0/0/8024/5349/360/0/95/0/825ef1c_upload-1-ruexxmmbk064-000-34tr872.jpg 2x,
US launches deadly strikes on Islamic State targets in Nigeria,0,https://www.lemonde.fr/en/international/article/2025/12/26/trump-says-us-launched-deadly-strikes-on-islamic-state-in-nigeria_6748837_4.html,Not premium,Le Monde with AFP,https://img.lemde.fr/2025/12/22/0/0/8024/5349/360/0/95/0/825ef1c_upload-1-ruexxmmbk064-000-34tr872.jpg 2x,
Zelensky says he held talks on Ukraine with US envoys,0,https://www.lemonde.fr/en/international/article/2025/12/25/zelensky-says-has-had-talks-on-ukraine-with-us-envoys_6748830_4.html,Not premium,Le Monde with AFP,https://img.lemde.fr/2025/12/22/0/0/8024/5349/360/0/95/0/825ef1c_upload-1-ruexxmmbk064-000-34tr872.jpg 2x,
"Semiconductors: ASML, the tech giant at the center of the US-China conflict in the race for AI","'Microchips: The Oil of the 21st Century' (4/5). ASML's ultra-advanced lithography machines are used to etch the most cutting-edge microprocessors, which are crucial for artificial intelligence – a major strategic issue.",https://www.lemonde.fr/en/economy/article/2025/12/26/semiconductors-asml-the-tech-giant-at-the-center-of-the-us-china-conflict-in-the-race-for-ai_6748844_19.html,Subscribers only,"  By Jean-Pierre Stroobants (Brussels, correspondent) ",https://img.lemde.fr/2025/12/22/0/0/8024/5349/360/0/95/0/825ef1c_upload-1-ruexxmmbk064-000-34tr872.jpg 2x,
North Korea's Kim Jong Un orders factories to make more missiles in 2026,"In a visit to munitions factories accompanied by top officials, the state-run Korean Central News Agency (KCNA) said the North Korean leader had ordered the factories to prepare for a busy year ahead.",https://www.lemonde.fr/en/international/article/2025/12/26/north-korea-s-kim-jong-un-orders-factories-to-make-more-missiles-in-2026_6748838_4.html,Not premium,Le Monde with AFP,https://img.lemde.fr/2025/12/22/0/0/8024/5349/360/0/95/0/825ef1c_upload-1-ruexxmmbk064-000-34tr872.jpg 2x,
Pop goes the cocktail! Five champagne cocktail recipes for the end-of-year festivities,"While the idea may offend some purists, champagne features prominently in many cocktail recipes. Five bartenders share their personal creations, all featuring prestigious and sublime bubbly.",https://www.lemonde.fr/en/lifestyle/article/2025/12/26/pop-goes-the-cocktail-five-champagne-cocktail-recipes-for-the-end-of-year-festivities_6748836_37.html,Subscribers only,  By Laure Gasparotto ,https://img.lemde.fr/2025/12/22/0/0/8024/5349/360/0/95/0/825ef1c_upload-1-ruexxmmbk064-000-34tr872.jpg 2x,
"Arthur Hadade, the chameleon who launched the 'Spotify of contemporary art'","With Cur8, his app dedicated to navigating the contemporary art world, the 35-year-old entrepreneur aims to challenge stereotypes surrounding a field often perceived as highly codified and inaccessible.",https://www.lemonde.fr/en/campus/article/2025/12/26/arthur-hadade-the-chameleon-who-launched-the-spotify-of-contemporary-art_6748841_11.html,Subscribers only,  By Elisabeth Pineau ,https://img.lemde.fr/2025/12/22/0/0/8024/5349/360/0/95/0/825ef1c_upload-1-ruexxmmbk064-000-34tr872.jpg 2x,Profile
Turkey detains dozens of IS suspects planning attacks on Christmas and New Year's celebrations,0,https://www.lemonde.fr/en/international/article/2025/12/26/turkey-detains-dozens-of-is-suspects-planning-attacks-on-christmas-and-new-year-s-celebrations_6748834_4.html,Not premium,Le Monde with AP and AFP,https://img.lemde.fr/2025/12/22/0/0/8024/5349/360/0/95/0/825ef1c_upload-1-ruexxmmbk064-000-34tr872.jpg 2x,
'Tyranny is booming': Kimmel warns of rising fascism in Christmas message to UK viewers,0,https://www.lemonde.fr/en/culture/article/2025/12/26/tyranny-is-booming-kimmel-warns-of-rising-fascism-in-christmas-message-to-uk-viewers_6748835_30.html,Not premium,Le Monde with AP and AFP,https://img.lemde.fr/2025/12/22/0/0/8024/5349/360/0/95/0/825ef1c_upload-1-ruexxmmbk064-000-34tr872.jpg 2x,
Syria says detained senior IS jihadist in Damascus,0,https://www.lemonde.fr/en/international/article/2025/12/24/syria-says-detained-senior-is-jihadist-in-damascus_6748818_4.html,Not premium,Le Monde with AFP,https://img.lemde.fr/2025/12/22/0/0/8024/5349/360/0/95/0/825ef1c_upload-1-ruexxmmbk064-000-34tr872.jpg 2x,
Escaping New York's winter and its 'communist' mayor for Miami,0,https://www.lemonde.fr/en/international/article/2025/12/25/escaping-new-york-s-winter-and-its-communist-mayor-for-miami_6748833_4.html,Subscribers only,  By Georgia Husson ,https://img.lemde.fr/2025/12/22/0/0/8024/5349/360/0/95/0/825ef1c_upload-1-ruexxmmbk064-000-34tr872.jpg 2x,
Bethlehem celebrates Christmas in climate of 'fear and uncertainty',0,https://www.lemonde.fr/en/international/article/2025/12/25/bethlehem-celebrates-christmas-in-climate-of-fear-and-uncertainty_6748826_4.html,Subscribers only," By Samuel Forey (Bethlehem, West Bank, special correspondent) ",https://img.lemde.fr/2025/12/22/0/0/8024/5349/360/0/95/0/825ef1c_upload-1-ruexxmmbk064-000-34tr872.jpg 2x,
Europe's relentless semiconductor decline,0,https://www.lemonde.fr/en/economy/article/2025/12/25/europe-s-relentless-semiconductor-decline_6748832_19.html,Subscribers only," By Virginie Malingre (Brussels, Europe bureau) ",https://img.lemde.fr/2025/12/22/0/0/8024/5349/360/0/95/0/825ef1c_upload-1-ruexxmmbk064-000-34tr872.jpg 2x,
"Pope urges Russia, Ukraine dialogue in Christmas blessing",0,https://www.lemonde.fr/en/international/article/2025/12/25/pope-urges-russia-ukraine-dialogue-in-christmas-blessing_6748829_4.html,Not premium,Le Monde with AFP,https://img.lemde.fr/2025/12/22/0/0/8024/5349/360/0/95/0/825ef1c_upload-1-ruexxmmbk064-000-34tr872.jpg 2x,
French biathlon team races ahead on the unpredictable road to the Olympics,0,https://www.lemonde.fr/en/sports/article/2025/12/25/french-biathlon-team-races-ahead-on-the-unpredictable-road-to-the-olympics_6748823_9.html,Subscribers only,"  By Thomas Saintourens (Le Grand-Bornand (France), special correspondent) ",https://img.lemde.fr/2025/12/22/0/0/8024/5349/360/0/95/0/825ef1c_upload-1-ruexxmmbk064-000-34tr872.jpg 2x,
Explosion at Nigerian mosque kills five,0,https://www.lemonde.fr/en/international/article/2025/12/25/explosion-at-nigerian-mosque-kills-at-least-seven_6748820_4.html,Not premium,Le Monde with AP and AFP,https://img.lemde.fr/2025/12/22/0/0/8024/5349/360/0/95/0/825ef1c_upload-1-ruexxmmbk064-000-34tr872.jpg 2x,
"In Turkey, the fall of a star television presenter exposes internal power struggles",0,https://www.lemonde.fr/en/international/article/2025/12/25/in-turkey-the-fall-of-a-star-television-presenter-exposes-internal-power-struggles_6748825_4.html,Subscribers only,  By Nicolas Bourcier (Istanbul (Turkey) correspondent) ,https://img.lemde.fr/2025/12/22/0/0/8024/5349/360/0/95/0/825ef1c_upload-1-ruexxmmbk064-000-34tr872.jpg 2x,
'Taylor Swift: The End of an Era' on Disney+: Behind the scenes of a record-breaking tour,0,https://www.lemonde.fr/en/culture/article/2025/12/25/taylor-swift-the-end-of-an-era-on-disney-behind-the-scenes-of-a-record-breaking-tour_6748824_30.html,Subscribers only,  By Catherine Pacary ,https://img.lemde.fr/2025/12/22/0/0/8024/5349/360/0/95/0/825ef1c_upload-1-ruexxmmbk064-000-34tr872.jpg 2x,
Algeria demands 'apologies' and 'reparations' from France for its colonial past,0,https://www.lemonde.fr/en/international/article/2025/12/24/algeria-demands-apologies-and-reparations-from-france-for-its-colonial-past_6748813_4.html,Subscribers only,"  By Frédéric Bobin and Hamid Nasri (Algiers, Algeria, correspondent) ",https://img.lemde.fr/2025/12/22/0/0/8024/5349/360/0/95/0/825ef1c_upload-1-ruexxmmbk064-000-34tr872.jpg 2x,
Why more young people are turning to religion,"Many researchers have observed a resurgence of religious commitment among young people in France, often accompanied by a certain rigorism. This renewed spiritual quest is linked both to the anxieties of our era and, at times, a search for identity.",https://www.lemonde.fr/en/france/article/2025/12/25/why-more-young-people-are-turning-to-religion_6748827_7.html,Subscribers only,  By Sarah Belouezzane ,https://img.lemde.fr/2025/12/22/0/0/8024/5349/360/0/95/0/825ef1c_upload-1-ruexxmmbk064-000-34tr872.jpg 2x,In Depth
Giorgia Meloni: Neo-fascist or far right? Why Italian PM's tenure raises questions among political experts,"The Italian prime minister has been in power now for three years. Italy's political experts question the normalization of this leader, who comes from a neo-fascist background. Has her tenure really been accompanied by a moderation of her political views?",https://www.lemonde.fr/en/opinion/article/2025/12/21/giorgia-meloni-neo-fascist-or-far-right-why-italian-pm-s-tenure-raises-questions-among-political-experts_6748728_23.html,Subscribers only, By Allan Kaval (Rome (Italy) correspondent) ,https://img.lemde.fr/2025/12/22/0/0/8024/5349/360/0/95/0/825ef1c_upload-1-ruexxmmbk064-000-34tr872.jpg 2x,Investigation
Celebrate the season with Le Monde in English's most beloved holiday movies,"We rounded up our favorite flicks to return to every December, from Christmas classics like 'Elf' and 'The Muppet Christmas Carol' to more unexpected picks such as 'E.T.' and 'Cool Runnings.'",https://www.lemonde.fr/en/culture/article/2025/12/22/celebrate-the-season-with-le-monde-in-english-s-most-beloved-holiday-movies_6748748_30.html,Not premium,"  By Hannah Steinkopf-Frank, Liz Walsh, Zorro Maplestone, Pierre-Paul Bermingham, Tom Nouvian, Julian Mathews, Sophie Sassi-Gorman, Sinead McCausland and Diana Liu ",https://img.lemde.fr/2025/12/22/0/0/8024/5349/360/0/95/0/825ef1c_upload-1-ruexxmmbk064-000-34tr872.jpg 2x,Selection
"'Private geoengineering comes at a cost, and that cost is public'",0,https://www.lemonde.fr/en/opinion/article/2025/12/19/private-geoengineering-comes-at-a-cost-and-that-cost-is-public_6748677_23.html,Subscribe,Janos Pasztor,https://img.lemde.fr/2025/12/22/0/0/8024/5349/360/0/95/0/825ef1c_upload-1-ruexxmmbk064-000-34tr872.jpg 2x,Op-Ed
Trump and the risks of adventurism in Venezuela,0,https://www.lemonde.fr/en/opinion/article/2025/12/19/trump-and-the-risks-of-adventurism-in-venezuela_6748678_23.html,Not premium,Le Monde,https://img.lemde.fr/2025/12/22/0/0/8024/5349/360/0/95/0/825ef1c_upload-1-ruexxmmbk064-000-34tr872.jpg 2x,Editorial
'Ocean Viking migrant rescue ship stands as the last guardian of the law in international waters',0,https://www.lemonde.fr/en/opinion/article/2025/12/21/ocean-viking-migrant-rescue-ship-stands-as-the-last-guardian-of-the-law-in-international-waters_6748713_23.html,Subscribe,Collective,https://img.lemde.fr/2025/12/22/0/0/8024/5349/360/0/95/0/825ef1c_upload-1-ruexxmmbk064-000-34tr872.jpg 2x,Op-Ed
