title,subhead,url,suscription,byline,img_url,article_type
Syrian commission of inquiry releases report on mass killings in Alawite regions,0,https://www.lemonde.fr/en/international/article/2025/07/24/syrian-commission-of-inquiry-releases-report-on-mass-killings-in-alawite-regions_6743665_4.html,Subscribers only,"  By Hélène Sallon (Damascus (Syria), special correspondent) ",https://img.lemde.fr/2025/07/24/0/0/6000/4000/360/0/95/0/53af9a8_upload-1-kdn4nlhjobve-cbi1267040.jpg 2x,
Jihadists are intensifying drone attacks in the Sahel,0,https://www.lemonde.fr/en/international/article/2025/07/24/jihadists-are-intensifying-drone-attacks-in-the-sahel_6743662_4.html,Subscribers only,  By Seydou Nomoko ,https://img.lemde.fr/2025/07/24/0/0/6000/4000/360/0/95/0/53af9a8_upload-1-kdn4nlhjobve-cbi1267040.jpg 2x,
"Russia, Ukraine hold third round of talks in Istanbul",0,https://www.lemonde.fr/en/international/article/2025/07/24/russia-ukraine-begin-third-round-of-talks-in-istanbul_6743654_4.html,Not premium,Le Monde,https://img.lemde.fr/2025/07/24/0/0/6000/4000/360/0/95/0/53af9a8_upload-1-kdn4nlhjobve-cbi1267040.jpg 2x,
Dutch far-right voters waver between doubt and conviction ahead of October elections,0,https://www.lemonde.fr/en/international/article/2025/07/23/dutch-far-right-voters-waver-between-doubt-and-conviction-ahead-of-october-elections_6743653_4.html,Subscribers only," By Jean-Pierre Stroobants (Spijkenisse, the Netherlands, special correspondent) ",https://img.lemde.fr/2025/07/24/0/0/6000/4000/360/0/95/0/53af9a8_upload-1-kdn4nlhjobve-cbi1267040.jpg 2x,
Early and intense wildfire season has arrived around the Mediterranean,0,https://www.lemonde.fr/en/europe/article/2025/07/17/wildfire-season-arrives-early-and-intense-around-the-mediterranean_6743466_143.html,Subscribers only,"  By Maryline Baumard, Olivier Bonnel (Rome, correspondent), Nicolas Bourcier (Istanbul (Turkey) correspondent), Isabelle Piquer (Madrid (Spain) correspondent), Marina Rafenberg (Athens (Greece) correspondent) and Hélène Sallon (Beirut (Lebanon) correspondent) ",https://img.lemde.fr/2025/07/24/0/0/6000/4000/360/0/95/0/53af9a8_upload-1-kdn4nlhjobve-cbi1267040.jpg 2x,
"Srebrenica massacre commemoration: 30 years later, the enduring bitterness of grieving families",0,https://www.lemonde.fr/en/international/article/2025/07/12/srebrenica-massacre-commemoration-30-years-later-the-enduring-bitterness-of-grieving-families_6743301_4.html,Subscribers only, By Jean-Baptiste Chastand (Srebrenica (Bosnia) special correspondent) ,https://img.lemde.fr/2025/07/24/0/0/6000/4000/360/0/95/0/53af9a8_upload-1-kdn4nlhjobve-cbi1267040.jpg 2x,
International justice confronts the genocide of Srebrenica,0,https://www.lemonde.fr/en/international/article/2025/07/11/international-justice-confronts-the-genocide-of-srebrenica_6743275_4.html,Subscribers only,  By Stéphanie Maupas (The Hague (Netherlands) correspondent) ,https://img.lemde.fr/2025/07/24/0/0/6000/4000/360/0/95/0/53af9a8_upload-1-kdn4nlhjobve-cbi1267040.jpg 2x,
"In Srebrenica, 30 years after the genocide, the 'vicious circle' of denial continues",0,https://www.lemonde.fr/en/international/article/2025/07/11/in-srebrenica-30-years-after-the-genocide-the-vicious-circle-of-denial-continues_6743270_4.html,Subscribers only," By Jean-Baptiste Chastand (Srebrenica [Bosnia and Herzegovina], special correspondent) ",https://img.lemde.fr/2025/07/24/0/0/6000/4000/360/0/95/0/53af9a8_upload-1-kdn4nlhjobve-cbi1267040.jpg 2x,
French culture minister and former Renault CEO will be tried for corruption,0,https://www.lemonde.fr/en/france/article/2025/07/22/french-culture-minister-and-former-renault-ceo-will-be-tried-for-corruption_6743616_7.html,Subscribers only,  By Rémi Dupré ,https://img.lemde.fr/2025/07/24/0/0/6000/4000/360/0/95/0/53af9a8_upload-1-kdn4nlhjobve-cbi1267040.jpg 2x,
A day off or not? Making sense of France's public holidays,0,https://www.lemonde.fr/en/france/article/2025/07/19/a-day-off-or-not-making-sense-of-france-s-public-holidays_6743515_7.html,Subscribers only,"  By Romain Geoffroy, Romain Imbach, Pierre Breteau and Manon Romain ",https://img.lemde.fr/2025/07/24/0/0/6000/4000/360/0/95/0/53af9a8_upload-1-kdn4nlhjobve-cbi1267040.jpg 2x,
Lebanese militant Georges Ibrahim Abdallah to be released after 40 years in French prison,0,https://www.lemonde.fr/en/france/article/2025/07/17/lebanese-militant-georges-ibrahim-abdallah-to-be-released-after-40-years-in-french-prison_6743454_7.html,Subscribers only,  By Christophe Ayad ,https://img.lemde.fr/2025/07/24/0/0/6000/4000/360/0/95/0/53af9a8_upload-1-kdn4nlhjobve-cbi1267040.jpg 2x,
France's 2026 budget plan includes €5 billion in healthcare cuts,0,https://www.lemonde.fr/en/france/article/2025/07/16/the-2026-controversial-french-budget-includes-5-billion-in-healthcare-cuts_6743415_7.html,Subscribers only,  By Mattea Battaglia and Camille Stromboni ,https://img.lemde.fr/2025/07/24/0/0/6000/4000/360/0/95/0/53af9a8_upload-1-kdn4nlhjobve-cbi1267040.jpg 2x,
What is France's 'Black code' and why hasn't it been repealed?,0,https://www.lemonde.fr/en/videos/video/2025/05/31/what-is-france-s-black-code-and-why-hasn-t-it-been-repealed_6741860_108.html,Not premium,"  By Chloé Denis, Olivier Escher (motion design) and Diana Liu ",https://img.lemde.fr/2025/07/24/0/0/6000/4000/360/0/95/0/53af9a8_upload-1-kdn4nlhjobve-cbi1267040.jpg 2x,
How was the European Union created?,0,https://www.lemonde.fr/en/videos/video/2025/05/29/how-was-the-european-union-created_6741795_108.html,Not premium,"  By Alexis Tromas, Robin Gasser (motion design) and Diana Liu ",https://img.lemde.fr/2025/07/24/0/0/6000/4000/360/0/95/0/53af9a8_upload-1-kdn4nlhjobve-cbi1267040.jpg 2x,
Glide bombs: Russia's secret to making cheap weapons,0,https://www.lemonde.fr/en/videos/video/2025/05/25/glide-bombs-russia-s-secret-to-making-cheap-weapons_6741646_108.html,Subscribers only,"  By Thomas Eydoux, Marceau Bretonnier and Sinead McCausland ",https://img.lemde.fr/2025/07/24/0/0/6000/4000/360/0/95/0/53af9a8_upload-1-kdn4nlhjobve-cbi1267040.jpg 2x,
How does the conclave pick the new pope?,0,https://www.lemonde.fr/en/videos/video/2025/05/07/how-does-the-conclave-pick-the-new-pope_6741005_108.html,Not premium,"  By Alexis Tromas, Félix Pommier (Motion design) and Diana Liu ",https://img.lemde.fr/2025/07/24/0/0/6000/4000/360/0/95/0/53af9a8_upload-1-kdn4nlhjobve-cbi1267040.jpg 2x,
"In the US, the relentless engine of conspiracy theories",0,https://www.lemonde.fr/en/opinion/article/2025/07/23/in-the-us-the-relentless-engine-of-conspiracy-theories_6743637_23.html,Not premium,Le Monde,https://img.lemde.fr/2025/07/24/0/0/6000/4000/360/0/95/0/53af9a8_upload-1-kdn4nlhjobve-cbi1267040.jpg 2x,
"'We, Russian political prisoners, have not lost our voice'",0,https://www.lemonde.fr/en/opinion/article/2025/07/23/we-russian-political-prisoners-have-not-lost-our-voice_6743626_23.html,Subscribers only,Collectif,https://img.lemde.fr/2025/07/24/0/0/6000/4000/360/0/95/0/53af9a8_upload-1-kdn4nlhjobve-cbi1267040.jpg 2x,
'The passage of Trump's budget bill highlights persistent  political tensions within the American right',0,https://www.lemonde.fr/en/opinion/article/2025/07/22/the-passage-of-trump-s-budget-bill-highlights-persistent-political-tensions-within-the-american-right_6743606_23.html,Subscribers only,Laura K. Field,https://img.lemde.fr/2025/07/24/0/0/6000/4000/360/0/95/0/53af9a8_upload-1-kdn4nlhjobve-cbi1267040.jpg 2x,
Anti-pesticide petition: An unprecedented grassroots movement,0,https://www.lemonde.fr/en/opinion/article/2025/07/22/anti-pesticide-petition-an-unprecedented-grassroots-movement_6743605_23.html,Not premium,Le Monde,https://img.lemde.fr/2025/07/24/0/0/6000/4000/360/0/95/0/53af9a8_upload-1-kdn4nlhjobve-cbi1267040.jpg 2x,
Three erotic experiences inspired by… your wardrobe,0,https://www.lemonde.fr/en/m-le-mag/article/2025/07/22/three-erotic-experiences-inspired-by-your-wardrobe_6743593_117.html,Subscribers only,Maïa Mazaurette,https://img.lemde.fr/2025/07/24/0/0/6000/4000/360/0/95/0/53af9a8_upload-1-kdn4nlhjobve-cbi1267040.jpg 2x,
The unshakable friendship of Nan Goldin and David Armstrong,0,https://www.lemonde.fr/en/m-le-mag/article/2025/07/20/the-unshakable-friendship-of-nan-goldin-and-david-armstrong_6743545_117.html,Subscribers only, By Clément Ghys ,https://img.lemde.fr/2025/07/24/0/0/6000/4000/360/0/95/0/53af9a8_upload-1-kdn4nlhjobve-cbi1267040.jpg 2x,
"Lucy Duff Gordon, a free-spirited couturière erased by history",0,https://www.lemonde.fr/en/m-le-mag/article/2025/07/20/lucy-duff-gordon-a-free-spirited-couturiere-erased-by-history_6743543_117.html,Subscribers only, By Valentin Pérez ,https://img.lemde.fr/2025/07/24/0/0/6000/4000/360/0/95/0/53af9a8_upload-1-kdn4nlhjobve-cbi1267040.jpg 2x,
"At Paris Museum of Decorative Arts, fashion designer Paul Poiret is king of the image",0,https://www.lemonde.fr/en/m-le-mag/article/2025/07/20/at-paris-museum-of-decorative-arts-fashion-designer-paul-poiret-is-crowned-king-of-the-image_6743540_117.html,Subscribers only,  By Sophie Abriat ,https://img.lemde.fr/2025/07/24/0/0/6000/4000/360/0/95/0/53af9a8_upload-1-kdn4nlhjobve-cbi1267040.jpg 2x,
The challenge of surtitling at the Avignon Festival,0,https://www.lemonde.fr/en/culture/article/2025/07/20/the-challenge-of-surtitling-at-the-avignon-festival_6743560_30.html,Subscribers only,  By Calypso Joyeux ,https://img.lemde.fr/2025/07/24/0/0/6000/4000/360/0/95/0/53af9a8_upload-1-kdn4nlhjobve-cbi1267040.jpg 2x,
"In Arles, Fragonard's Museum of Fashion and Costume gracefully unveils treasures",0,https://www.lemonde.fr/en/m-le-mag/article/2025/07/17/in-arles-fragonard-s-museum-of-fashion-and-costume-gracefully-unveils-treasures_6743450_117.html,Subscribers only, By Litza Georgopoulos ,https://img.lemde.fr/2025/07/24/0/0/6000/4000/360/0/95/0/53af9a8_upload-1-kdn4nlhjobve-cbi1267040.jpg 2x,
'Paris l'Eté': Summer performing arts festival explores new venues around French capital,0,https://www.lemonde.fr/en/culture/article/2025/07/16/paris-l-ete-summer-performing-arts-festival-explores-new-venues-around-french-capital_6743418_30.html,Subscribers only,  By Rosita Boisseau ,https://img.lemde.fr/2025/07/24/0/0/6000/4000/360/0/95/0/53af9a8_upload-1-kdn4nlhjobve-cbi1267040.jpg 2x,
"Avignon Festival: 'When I Saw the Sea', Ali Chahrour's peaceful and political work",0,https://www.lemonde.fr/en/culture/article/2025/07/10/avignon-festival-when-i-saw-the-sea-ali-chahrour-s-peaceful-and-political-work_6743233_30.html,Subscribers only,  By Rosita Boisseau (Avignon (France) special correspondent) ,https://img.lemde.fr/2025/07/24/0/0/6000/4000/360/0/95/0/53af9a8_upload-1-kdn4nlhjobve-cbi1267040.jpg 2x,
Surge in AI-generated child sexual abuse images alarms advocacy groups and investigators,"The number of images created by artificial intelligence is proliferating, presenting unprecedented challenges for law enforcement agencies.",https://www.lemonde.fr/en/pixels/article/2025/07/24/surge-in-ai-generated-child-sexual-abuse-images-alarms-advocacy-groups-and-investigators_6743661_13.html,Subscribers only, By Morgane Tual ,https://img.lemde.fr/2025/07/24/0/0/6000/4000/360/0/95/0/53af9a8_upload-1-kdn4nlhjobve-cbi1267040.jpg 2x,
World's top court paves way for climate reparations,0,https://www.lemonde.fr/en/international/article/2025/07/23/icj-opinion-says-states-are-legally-obligated-to-tackle-climate-change_6743648_4.html,Not premium,Le Monde with AFP,https://img.lemde.fr/2025/07/24/0/0/6000/4000/360/0/95/0/53af9a8_upload-1-kdn4nlhjobve-cbi1267040.jpg 2x,
Syrian commission of inquiry releases report on mass killings in Alawite regions,0,https://www.lemonde.fr/en/international/article/2025/07/24/syrian-commission-of-inquiry-releases-report-on-mass-killings-in-alawite-regions_6743665_4.html,Subscribers only,"  By Hélène Sallon (Damascus (Syria), special correspondent) ",https://img.lemde.fr/2025/07/24/0/0/6000/4000/360/0/95/0/53af9a8_upload-1-kdn4nlhjobve-cbi1267040.jpg 2x,
Jihadists are intensifying drone attacks in the Sahel,"The Sahelian branch of Al-Qaeda, primarily active in Mali and Burkina Faso, has acquired the capacity to arm low-cost devices. This recent expertise has inflicted heavy losses on national armies.",https://www.lemonde.fr/en/international/article/2025/07/24/jihadists-are-intensifying-drone-attacks-in-the-sahel_6743662_4.html,Subscribers only,  By Seydou Nomoko ,https://img.lemde.fr/2025/07/24/0/0/6000/4000/360/0/95/0/53af9a8_upload-1-kdn4nlhjobve-cbi1267040.jpg 2x,
Why Japan is accepting a 15% tax rate with the US,"As Donald Trump had previously threatened to impose a 25% tariff on Japanese imports, this new agreement comes as a relative relief for Japan's automotive sector, which accounts for 8% of all jobs in the country.",https://www.lemonde.fr/en/economy/article/2025/07/24/why-japan-is-accepting-a-15-tax-rate-with-the-us_6743655_19.html,Subscribers only,  By Julien Bouissou ,https://img.lemde.fr/2025/07/24/0/0/6000/4000/360/0/95/0/53af9a8_upload-1-kdn4nlhjobve-cbi1267040.jpg 2x,
"'Sorry, Baby,' Eva Victor's fragmented portrait of a young woman grappling with trauma","The American director's debut feature film embraces its own uniqueness, as does its queer main character, who is in constant search of comfort.",https://www.lemonde.fr/en/culture/article/2025/07/24/in-sorry-baby-actor-and-director-eva-victor-puts-herself-center-stage-with-a-fragmented-portrait-of-a-young-woman-grappling-with-trauma_6743657_30.html,Subscribers only,  By Boris Bastide ,https://img.lemde.fr/2025/07/24/0/0/6000/4000/360/0/95/0/53af9a8_upload-1-kdn4nlhjobve-cbi1267040.jpg 2x,
Montmartre residents denounce the Paris neighborhood's 'Disneyfication',"Rising numbers of tourists and increasingly exasperated residents have made coexistence difficult in Paris' 18th arrondissement, where the effects of overtourism are becoming ever more visible.",https://www.lemonde.fr/en/economy/article/2025/07/24/montmartre-residents-denounce-the-paris-neighborhood-s-disneyfication_6743663_19.html,Subscribers only, By Jessica Gourdon ,https://img.lemde.fr/2025/07/24/0/0/6000/4000/360/0/95/0/53af9a8_upload-1-kdn4nlhjobve-cbi1267040.jpg 2x,Feature
House subcommittee votes to subpoena Justice Department for Epstein files,0,https://www.lemonde.fr/en/international/article/2025/07/24/house-subcommittee-votes-to-subpoena-justice-department-for-epstein-files_6743656_4.html,Not premium,Le Monde with AP and AFP,https://img.lemde.fr/2025/07/24/0/0/6000/4000/360/0/95/0/53af9a8_upload-1-kdn4nlhjobve-cbi1267040.jpg 2x,
"Russia, Ukraine hold third round of talks in Istanbul",0,https://www.lemonde.fr/en/international/article/2025/07/24/russia-ukraine-begin-third-round-of-talks-in-istanbul_6743654_4.html,Not premium,Le Monde,https://img.lemde.fr/2025/07/24/0/0/6000/4000/360/0/95/0/53af9a8_upload-1-kdn4nlhjobve-cbi1267040.jpg 2x,
Dutch far-right voters waver between doubt and conviction ahead of October elections,0,https://www.lemonde.fr/en/international/article/2025/07/23/dutch-far-right-voters-waver-between-doubt-and-conviction-ahead-of-october-elections_6743653_4.html,Subscribers only," By Jean-Pierre Stroobants (Spijkenisse, the Netherlands, special correspondent) ",https://img.lemde.fr/2025/07/24/0/0/6000/4000/360/0/95/0/53af9a8_upload-1-kdn4nlhjobve-cbi1267040.jpg 2x,
Thailand and Cambodia exchange air strikes in escalating border dispute,0,https://www.lemonde.fr/en/international/article/2025/07/24/thailand-and-cambodia-exchange-air-strikes-in-escalating-border-dispute_6743664_4.html,Not premium,Le Monde with AFP,https://img.lemde.fr/2025/07/24/0/0/6000/4000/360/0/95/0/53af9a8_upload-1-kdn4nlhjobve-cbi1267040.jpg 2x,
Columbia University to pay $200 million in settlement with Trump administration,0,https://www.lemonde.fr/en/international/article/2025/07/24/columbia-university-to-pay-200-mn-in-clash-with-trump_6743660_4.html,Not premium,Le Monde with AFP,https://img.lemde.fr/2025/07/24/0/0/6000/4000/360/0/95/0/53af9a8_upload-1-kdn4nlhjobve-cbi1267040.jpg 2x,
Hamas confirms it has responded to Israel's latest Gaza truce proposal,0,https://www.lemonde.fr/en/international/article/2025/07/24/hamas-confirms-it-has-responded-to-israel-s-latest-gaza-truce-proposal_6743659_4.html,Not premium,Le Monde with AFP,https://img.lemde.fr/2025/07/24/0/0/6000/4000/360/0/95/0/53af9a8_upload-1-kdn4nlhjobve-cbi1267040.jpg 2x,
Merz and Macron discuss NATO and EU-US trade issues,0,https://www.lemonde.fr/en/international/article/2025/07/23/merz-and-macron-discuss-nato-and-eu-us-trade-issues_6743652_4.html,Not premium,Le Monde with AFP,https://img.lemde.fr/2025/07/24/0/0/6000/4000/360/0/95/0/53af9a8_upload-1-kdn4nlhjobve-cbi1267040.jpg 2x,
Macrons file defamation suit against right-wing US podcaster,0,https://www.lemonde.fr/en/international/article/2025/07/24/macrons-file-defamation-suit-against-right-wing-us-podcaster_6743658_4.html,Not premium,Le Monde with AFP,https://img.lemde.fr/2025/07/24/0/0/6000/4000/360/0/95/0/53af9a8_upload-1-kdn4nlhjobve-cbi1267040.jpg 2x,
"From Mark Zuckerberg to Elon Musk, the Palo Alto 'boys' club'",0,https://www.lemonde.fr/en/summer-reads/article/2025/07/23/from-mark-zuckerberg-to-elon-musk-the-palo-alto-boys-club_6743649_183.html,Subscribers only," By Raphaëlle Bacqué (San Francisco, special correspondent), Damien Leloup and Alexandre Piquard ",https://img.lemde.fr/2025/07/24/0/0/6000/4000/360/0/95/0/53af9a8_upload-1-kdn4nlhjobve-cbi1267040.jpg 2x,
EU-China trade summit will begin amid discord,0,https://www.lemonde.fr/en/international/article/2025/07/23/eu-china-trade-summit-begins-amid-discord_6743651_4.html,Subscribers only,"  By Virginie Malingre (Brussels, Europe bureau) and Harold Thibault (Beijing (China) correspondent) ",https://img.lemde.fr/2025/07/24/0/0/6000/4000/360/0/95/0/53af9a8_upload-1-kdn4nlhjobve-cbi1267040.jpg 2x,
'We're dying in front of the world': Palestinian journalist describes daily famine in Gaza to Le Monde,0,https://www.lemonde.fr/en/international/video/2025/07/23/we-re-dying-in-front-of-the-world-palestinian-journalist-describes-daily-famine-in-gaza-to-le-monde_6743640_4.html,Not premium,"  By Constance Derouin, Elisa Bellanger and Sinead McCausland ",https://img.lemde.fr/2025/07/24/0/0/6000/4000/360/0/95/0/53af9a8_upload-1-kdn4nlhjobve-cbi1267040.jpg 2x,
"At the Avignon 'Off' Festival, Taiwanese artists give voice to their island",0,https://www.lemonde.fr/en/culture/article/2025/07/23/at-the-avignon-off-festival-taiwanese-artists-give-voice-to-their-island_6743646_30.html,Subscribers only,  By Diana Liu (Taipei) ,https://img.lemde.fr/2025/07/24/0/0/6000/4000/360/0/95/0/53af9a8_upload-1-kdn4nlhjobve-cbi1267040.jpg 2x,
How China has relocated its most polluting mines to war-torn Myanmar,"Rare earth elements, essential to various industries, are a growing source of tension between Beijing and the EU, which are set to hold a summit on Thursday, July 24. For decades, their extraction polluted the soil of Jiangxi, a province in southern China. Now, China is exploiting mines in neighboring Myanmar.",https://www.lemonde.fr/en/economy/article/2025/07/23/how-china-has-relocated-its-most-polluting-mines-to-war-torn-myanmar_6743650_19.html,Subscribers only, By Harold Thibault (Ganzhou (China) special correspondent) ,https://img.lemde.fr/2025/07/24/0/0/6000/4000/360/0/95/0/53af9a8_upload-1-kdn4nlhjobve-cbi1267040.jpg 2x,Feature
French ski coach faces sexual assault complaint involving a minor and new accusations,"Following Le Monde's initial revelations about allegations of sexual harassment of minors against Joël Chenal, a former Olympic ski silver medalist, five young women have come forward with new accounts.",https://www.lemonde.fr/en/sports/article/2025/07/23/french-ski-coach-faces-sexual-assault-complaint-involving-a-minor-and-new-accusations_6743633_9.html,Subscribers only,  By Patricia Oudit ,https://img.lemde.fr/2025/07/24/0/0/6000/4000/360/0/95/0/53af9a8_upload-1-kdn4nlhjobve-cbi1267040.jpg 2x,Investigation
US announces its withdrawal from UNESCO,"The US State Department announced in a statement on Tuesday that the country will leave the United Nations Educational, Scientific and Cultural Organization (UNESCO) in December 2026.",https://www.lemonde.fr/en/culture/article/2025/07/23/us-announces-its-withdrawal-from-unesco_6743621_30.html,Subscribers only,  By Roxana Azimi   ,https://img.lemde.fr/2025/07/24/0/0/6000/4000/360/0/95/0/53af9a8_upload-1-kdn4nlhjobve-cbi1267040.jpg 2x,News
"In the US, the relentless engine of conspiracy theories",0,https://www.lemonde.fr/en/opinion/article/2025/07/23/in-the-us-the-relentless-engine-of-conspiracy-theories_6743637_23.html,Not premium,Le Monde,https://img.lemde.fr/2025/07/24/0/0/6000/4000/360/0/95/0/53af9a8_upload-1-kdn4nlhjobve-cbi1267040.jpg 2x,Editorial
French defense industry faces challenge of ramping up production,0,https://www.lemonde.fr/en/opinion/article/2025/07/21/french-defense-industry-faces-challenge-of-ramping-up-production_6743575_23.html,Not premium,Le Monde,https://img.lemde.fr/2025/07/24/0/0/6000/4000/360/0/95/0/53af9a8_upload-1-kdn4nlhjobve-cbi1267040.jpg 2x,Editorial
"'We, Russian political prisoners, have not lost our voice'",0,https://www.lemonde.fr/en/opinion/article/2025/07/23/we-russian-political-prisoners-have-not-lost-our-voice_6743626_23.html,Subscribe,Collectif,https://img.lemde.fr/2025/07/24/0/0/6000/4000/360/0/95/0/53af9a8_upload-1-kdn4nlhjobve-cbi1267040.jpg 2x,Op-Ed
