title,subhead,url,suscription,byline,img_url,article_type
"Trump changes strategy on Epstein affair, attempts counterattack",0,https://www.lemonde.fr/en/international/article/2025/11/18/trump-changes-strategy-on-epstein-affair-attempts-counterattack_6747561_4.html,Subscribers only,  By Piotr Smolar (Washington (United States) correspondent) ,https://img.lemde.fr/2025/11/17/0/0/5014/3342/360/0/95/0/d5b1b60_upload-1-s67plzae5elk-803758.jpg 2x,
Trump secures a victory as UN backs his Gaza peace plan,0,https://www.lemonde.fr/en/international/article/2025/11/18/trump-secures-a-victory-at-the-un-which-is-backing-his-gaza-peace-plan_6747560_4.html,Subscribers only,  By Claire Gatinois ,https://img.lemde.fr/2025/11/17/0/0/5014/3342/360/0/95/0/d5b1b60_upload-1-s67plzae5elk-803758.jpg 2x,
Tough times for Swiss cattle,0,https://www.lemonde.fr/en/international/article/2025/11/18/tough-times-for-swiss-cattle_6747555_4.html,Subscribers only,  By Serge Enderlin (Geneva (Switzerland) correspondent) ,https://img.lemde.fr/2025/11/17/0/0/5014/3342/360/0/95/0/d5b1b60_upload-1-s67plzae5elk-803758.jpg 2x,
France and Ukraine step up defense cooperation at a critical moment for Kyiv,0,https://www.lemonde.fr/en/international/article/2025/11/18/france-and-ukraine-step-up-defense-cooperation-at-a-critical-moment-for-kyiv_6747552_4.html,Subscribers only,"  By Olivier Pinaud, Philippe Ricard and Elise Vincent ",https://img.lemde.fr/2025/11/17/0/0/5014/3342/360/0/95/0/d5b1b60_upload-1-s67plzae5elk-803758.jpg 2x,
"In France's Somme, bagpipers keep the memory of the Great War alive",0,https://www.lemonde.fr/en/history/article/2025/11/11/in-france-s-somme-bagpipers-keep-the-memory-of-the-great-war-alive_6747347_157.html,Subscribers only," By Marie-Béatrice Baudet (Ovillers-la-Boisselle [Somme], special correspondent) ",https://img.lemde.fr/2025/11/17/0/0/5014/3342/360/0/95/0/d5b1b60_upload-1-s67plzae5elk-803758.jpg 2x,
Latvia: Public mobilization grows in support of treaty for preventing violence against women,0,https://www.lemonde.fr/en/international/article/2025/11/06/in-latvia-public-mobilization-continues-to-grow-in-support-of-the-istanbul-convention-for-preventing-violence-against-women_6747156_4.html,Subscribers only,  By Anne-Françoise Hivert (Malmö (Sweden) correspondent) ,https://img.lemde.fr/2025/11/17/0/0/5014/3342/360/0/95/0/d5b1b60_upload-1-s67plzae5elk-803758.jpg 2x,
"After Charlie Kirk's murder, Europe's far right swears allegiance to Trump's politics",0,https://www.lemonde.fr/en/les-decodeurs/article/2025/10/20/the-murder-of-charlie-kirk-how-europe-s-far-right-swore-allegiance-to-trump-s-politics_6746586_8.html,Subscribers only, By Allan Kaval (Rome (Italy) correspondent) and Manon Romain (with Clément Guillou and Le Monde correspondents in Europe) ,https://img.lemde.fr/2025/11/17/0/0/5014/3342/360/0/95/0/d5b1b60_upload-1-s67plzae5elk-803758.jpg 2x,
Sanctions against Russia spark rift between US and Europe over China,0,https://www.lemonde.fr/en/international/article/2025/09/15/sanctions-against-russia-spark-rift-between-us-and-europe-over-china_6745411_4.html,Subscribers only,"  By Philippe Jacqué (Brussels, Europe bureau), Philippe Ricard and Harold Thibault (Beijing (China) correspondent) ",https://img.lemde.fr/2025/11/17/0/0/5014/3342/360/0/95/0/d5b1b60_upload-1-s67plzae5elk-803758.jpg 2x,
"Grok, Elon Musk's AI, spreads far-right falsehoods about 2015 Paris attacks",0,https://www.lemonde.fr/en/france/article/2025/11/17/grok-elon-musk-s-ai-spreads-far-right-falsehoods-about-2015-paris-attacks_6747550_7.html,Subscribers only,  By Soren Seelow ,https://img.lemde.fr/2025/11/17/0/0/5014/3342/360/0/95/0/d5b1b60_upload-1-s67plzae5elk-803758.jpg 2x,
"'No one ever called us': Retired French police officer stunned to learn of his daughter's death online, three months after her burial",0,https://www.lemonde.fr/en/france/article/2025/11/18/no-one-ever-called-us-retired-french-police-officer-stunned-to-learn-of-his-daughter-s-death-online-three-months-after-her-burial_6747570_7.html,Subscribers only, By Richard Schittly (Lyon (France) correspondent) ,https://img.lemde.fr/2025/11/17/0/0/5014/3342/360/0/95/0/d5b1b60_upload-1-s67plzae5elk-803758.jpg 2x,
Photographer documents Bataclan's slow rebirth after 2015 Paris attacks,0,https://www.lemonde.fr/en/france/article/2025/11/17/photographer-documents-the-bataclan-s-slow-rebirth-after-the-2015-paris-attacks_6747515_7.html,Subscribers only, By Vassili Feodoroff ,https://img.lemde.fr/2025/11/17/0/0/5014/3342/360/0/95/0/d5b1b60_upload-1-s67plzae5elk-803758.jpg 2x,
Did the 2015 Paris attacks give rise to a 'Bataclan generation' within the far right?,0,https://www.lemonde.fr/en/france/article/2025/11/15/did-the-2015-paris-attacks-give-rise-to-a-bataclan-generation-within-the-far-right_6747489_7.html,Subscribers only,  By Christophe Ayad ,https://img.lemde.fr/2025/11/17/0/0/5014/3342/360/0/95/0/d5b1b60_upload-1-s67plzae5elk-803758.jpg 2x,
Afghanistan: Relentless repression continues over four years into Taliban's rule,0,https://www.lemonde.fr/en/videos/video/2025/10/04/afghanistan-relentless-repression-continues-over-four-years-into-taliban-s-rule_6746092_108.html,Not premium,"  By Chloé Denis, Félix Pommier (Motion design) and Sinead McCausland ",https://img.lemde.fr/2025/11/17/0/0/5014/3342/360/0/95/0/d5b1b60_upload-1-s67plzae5elk-803758.jpg 2x,
Watch: Hundreds of thousands march in France against budget cuts,0,https://www.lemonde.fr/en/videos/video/2025/09/19/french-strikes-watch-what-happened-as-hundreds-of-thousands-marched-against-budget-cuts_6745548_108.html,Not premium,  By Le Monde's video desk   ,https://img.lemde.fr/2025/11/17/0/0/5014/3342/360/0/95/0/d5b1b60_upload-1-s67plzae5elk-803758.jpg 2x,
Emmys 2025: 'Adolescence' star Owen Cooper becomes youngest winner for best supporting actor,0,https://www.lemonde.fr/en/videos/video/2025/09/15/emmys-2025-adolescence-star-owen-cooper-becomes-youngest-winner-for-best-supporting-actor_6745427_108.html,Not premium,  By Le Monde's video desk   ,https://img.lemde.fr/2025/11/17/0/0/5014/3342/360/0/95/0/d5b1b60_upload-1-s67plzae5elk-803758.jpg 2x,
"From 'influence peddling' to 'corruption,' what is French Culture Minister Rachida Dati accused of?",0,https://www.lemonde.fr/en/videos/video/2025/09/06/from-influence-peddling-to-corruption-what-is-french-culture-minister-rachida-dati-accused-of_6745094_108.html,Not premium,"  By Alexis Tromas, Arthur Navet  and Sinead McCausland ",https://img.lemde.fr/2025/11/17/0/0/5014/3342/360/0/95/0/d5b1b60_upload-1-s67plzae5elk-803758.jpg 2x,
"'According to Bill Gates, the best antidote to global warming is development'",0,https://www.lemonde.fr/en/opinion/article/2025/11/18/for-bill-gates-the-best-antidote-to-global-warming-is-development_6747556_23.html,Subscribers only,Arnaud Leparmentier,https://img.lemde.fr/2025/11/17/0/0/5014/3342/360/0/95/0/d5b1b60_upload-1-s67plzae5elk-803758.jpg 2x,
Reindustrializing France requires greater coherence,0,https://www.lemonde.fr/en/opinion/article/2025/11/18/reindustrializing-france-requires-greater-coherence_6747571_23.html,Not premium,Le Monde,https://img.lemde.fr/2025/11/17/0/0/5014/3342/360/0/95/0/d5b1b60_upload-1-s67plzae5elk-803758.jpg 2x,
"Alaa Busati, lawyer: 'The war in Sudan is fueled by the insatiable greed of those who profit from it'",0,https://www.lemonde.fr/en/opinion/article/2025/11/18/alaa-busati-lawyer-the-war-in-sudan-is-fueled-by-the-insatiable-greed-of-those-who-profit-from-it_6747564_23.html,Subscribers only,Alaa Busati,https://img.lemde.fr/2025/11/17/0/0/5014/3342/360/0/95/0/d5b1b60_upload-1-s67plzae5elk-803758.jpg 2x,
"Le Monde's cartoon of the day, by Niels Bo Bojesen",0,https://www.lemonde.fr/en/opinion/article/2025/11/17/le-monde-s-cartoon-of-the-day-by-niels-bo-bojesen_6747540_23.html,Not premium,No byline,https://img.lemde.fr/2025/11/17/0/0/5014/3342/360/0/95/0/d5b1b60_upload-1-s67plzae5elk-803758.jpg 2x,
London's 'mudlarks' scour the Thames for treasure,0,https://www.lemonde.fr/en/m-le-mag/article/2025/11/17/london-s-mudlarks-scour-the-thames-for-treasure_6747519_117.html,Subscribers only, By Cécile Ducourtieux (London correspondent) ,https://img.lemde.fr/2025/11/17/0/0/5014/3342/360/0/95/0/d5b1b60_upload-1-s67plzae5elk-803758.jpg 2x,
"At Paris Photo, British photographer Jack Davison's portrait marathon",0,https://www.lemonde.fr/en/m-le-mag/article/2025/11/16/at-paris-photo-british-photographer-jack-davison-s-portrait-marathon_6747506_117.html,Subscribers only,  By Emmanuelle Lequeux ,https://img.lemde.fr/2025/11/17/0/0/5014/3342/360/0/95/0/d5b1b60_upload-1-s67plzae5elk-803758.jpg 2x,
Designer Pieter Mulier writes a new chapter in Alaïa's history,0,https://www.lemonde.fr/en/m-le-mag/article/2025/11/16/designer-pieter-mulier-writes-a-new-chapter-in-alaia-s-history_6747501_117.html,Subscribers only, By Elvire von Bardeleben ,https://img.lemde.fr/2025/11/17/0/0/5014/3342/360/0/95/0/d5b1b60_upload-1-s67plzae5elk-803758.jpg 2x,
'Jewelry is easy to steal and circulate': When gems vanish without a trace,0,https://www.lemonde.fr/en/m-le-mag/article/2025/11/15/jewelry-is-easy-to-steal-and-circulate-when-gems-vanish-without-a-trace_6747478_117.html,Subscribers only, By Gaspard Dhellemmes ,https://img.lemde.fr/2025/11/17/0/0/5014/3342/360/0/95/0/d5b1b60_upload-1-s67plzae5elk-803758.jpg 2x,
"At the Opéra Bastille, Wagner's 'Valkyries' shines thanks to its singers",0,https://www.lemonde.fr/en/culture/article/2025/11/15/at-the-opera-bastille-wagner-s-valkyries-shines-thanks-to-its-singers_6747475_30.html,Subscribers only,  By Marie-Aude Roux ,https://img.lemde.fr/2025/11/17/0/0/5014/3342/360/0/95/0/d5b1b60_upload-1-s67plzae5elk-803758.jpg 2x,
Sophie Ristelhueber's coronation at Paris Photo,0,https://www.lemonde.fr/en/m-le-mag/article/2025/11/14/sophie-ristelhueber-s-coronation-at-paris-photo_6747465_117.html,Subscribers only, By Michel Guerrin (Columnist) ,https://img.lemde.fr/2025/11/17/0/0/5014/3342/360/0/95/0/d5b1b60_upload-1-s67plzae5elk-803758.jpg 2x,
Le Creuset turns 100: 'We are lucky to have a fanbase that loves to show off their Dutch ovens',0,https://www.lemonde.fr/en/lifestyle/article/2025/11/13/le-creuset-turns-100-we-are-lucky-to-have-a-fanbase-that-loves-to-show-off-their-dutch-ovens_6747421_37.html,Subscribers only, By Léa Outier ,https://img.lemde.fr/2025/11/17/0/0/5014/3342/360/0/95/0/d5b1b60_upload-1-s67plzae5elk-803758.jpg 2x,
Russian and Ukrainian artists in Paris attempt to present united front against war,0,https://www.lemonde.fr/en/m-le-mag/article/2025/11/12/russian-and-ukrainian-artists-in-paris-attempt-to-present-united-front-against-war_6747398_117.html,Subscribers only,  By Benjamin Quénelle ,https://img.lemde.fr/2025/11/17/0/0/5014/3342/360/0/95/0/d5b1b60_upload-1-s67plzae5elk-803758.jpg 2x,
TotalEnergies accused of 'complicity in war crimes' in Mozambique,"In the summer of 2021, Mozambican civilians were detained and tortured by soldiers guarding TotalEnergies's gas site. A non-governmental organization is challenging the responsibility of the French multinational company.",https://www.lemonde.fr/en/les-decodeurs/article/2025/11/18/totalenergies-accused-of-complicity-in-war-crimes-in-mozambique_6747568_8.html,Subscribers only,  By Anne Michel ,https://img.lemde.fr/2025/11/17/0/0/5014/3342/360/0/95/0/d5b1b60_upload-1-s67plzae5elk-803758.jpg 2x,
France and Ukraine step up defense cooperation at a critical moment for Kyiv,0,https://www.lemonde.fr/en/international/article/2025/11/18/france-and-ukraine-step-up-defense-cooperation-at-a-critical-moment-for-kyiv_6747552_4.html,Subscribers only,"  By Olivier Pinaud, Philippe Ricard and Elise Vincent ",https://img.lemde.fr/2025/11/17/0/0/5014/3342/360/0/95/0/d5b1b60_upload-1-s67plzae5elk-803758.jpg 2x,
"Trump changes strategy on Epstein affair, attempts counterattack",0,https://www.lemonde.fr/en/international/article/2025/11/18/trump-changes-strategy-on-epstein-affair-attempts-counterattack_6747561_4.html,Subscribers only,  By Piotr Smolar (Washington (United States) correspondent) ,https://img.lemde.fr/2025/11/17/0/0/5014/3342/360/0/95/0/d5b1b60_upload-1-s67plzae5elk-803758.jpg 2x,
Senegal's ruling duo splinters,"President Bassirou Diomaye Faye and his prime minister, Ousmane Sonko, who came to power on promises of a political break, are now increasingly airing their differences in public.",https://www.lemonde.fr/en/le-monde-africa/article/2025/11/18/senegal-s-ruling-duo-splinters_6747574_124.html,Subscribers only,"  By Jules Crétois (Dakar (Senegal), correspondent) ",https://img.lemde.fr/2025/11/17/0/0/5014/3342/360/0/95/0/d5b1b60_upload-1-s67plzae5elk-803758.jpg 2x,
Captain Alfred Dreyfus receives posthumous promotion 130 years after scandal,The former Jewish French army officer who was wrongfully convicted of espionage amid widespread antisemitism in the early 20th century was promoted to brigadier general as an act of reparation.,https://www.lemonde.fr/en/politics/article/2025/11/18/captain-alfred-dreyfus-receives-posthumous-promotion-130-years-after-scandal_6747575_5.html,Not premium,Le Monde with AFP,https://img.lemde.fr/2025/11/17/0/0/5014/3342/360/0/95/0/d5b1b60_upload-1-s67plzae5elk-803758.jpg 2x,
Trump secures a victory as UN backs his Gaza peace plan,"The US resolution aimed at ensuring a permanent ceasefire in the Palestinian enclave won a majority of votes at the United Nations Security Council on November 17, provoking Israel's anger.",https://www.lemonde.fr/en/international/article/2025/11/18/trump-secures-a-victory-at-the-un-which-is-backing-his-gaza-peace-plan_6747560_4.html,Subscribers only,  By Claire Gatinois ,https://img.lemde.fr/2025/11/17/0/0/5014/3342/360/0/95/0/d5b1b60_upload-1-s67plzae5elk-803758.jpg 2x,
"'No one ever called us': Retired French police officer stunned to learn of his daughter's death online, three months after her burial","Jean Forest discovered this summer that his daughter Marjolaine, a university scholar, had been buried in the spring. He investigated why his family was not informed and denounces the administrative and social indifference he encountered.",https://www.lemonde.fr/en/france/article/2025/11/18/no-one-ever-called-us-retired-french-police-officer-stunned-to-learn-of-his-daughter-s-death-online-three-months-after-her-burial_6747570_7.html,Subscribers only, By Richard Schittly (Lyon (France) correspondent) ,https://img.lemde.fr/2025/11/17/0/0/5014/3342/360/0/95/0/d5b1b60_upload-1-s67plzae5elk-803758.jpg 2x,Long Read
Canada avoids snap election as parliament narrowly passes budget,0,https://www.lemonde.fr/en/international/article/2025/11/18/canada-avoids-snap-election-as-parliament-narrowly-passes-budget_6747554_4.html,Not premium,Le Monde with AFP,https://img.lemde.fr/2025/11/17/0/0/5014/3342/360/0/95/0/d5b1b60_upload-1-s67plzae5elk-803758.jpg 2x,
Tough times for Swiss cattle,0,https://www.lemonde.fr/en/international/article/2025/11/18/tough-times-for-swiss-cattle_6747555_4.html,Subscribers only,  By Serge Enderlin (Geneva (Switzerland) correspondent) ,https://img.lemde.fr/2025/11/17/0/0/5014/3342/360/0/95/0/d5b1b60_upload-1-s67plzae5elk-803758.jpg 2x,
Concerts to catch in France before the end of 2025,0,https://www.lemonde.fr/en/culture/article/2025/11/18/concerts-to-catch-before-the-end-of-2025_6747557_30.html,Subscribers only,"  By Stéphanie Binet, Franck Colombani, Romain Geoffroy and Pierre Gervasoni ",https://img.lemde.fr/2025/11/17/0/0/5014/3342/360/0/95/0/d5b1b60_upload-1-s67plzae5elk-803758.jpg 2x,
Le Pen stand-in Bardella's presidential bid takes shape,0,https://www.lemonde.fr/en/politics/article/2025/11/18/le-pen-stand-in-bardella-s-presidential-bid-takes-shape_6747559_5.html,Subscribers only,  By Clément Guillou (Perpignan (France) special correspondent) and Corentin Lesueur ,https://img.lemde.fr/2025/11/17/0/0/5014/3342/360/0/95/0/d5b1b60_upload-1-s67plzae5elk-803758.jpg 2x,
"'According to Bill Gates, the best antidote to global warming is development'",0,https://www.lemonde.fr/en/opinion/article/2025/11/18/for-bill-gates-the-best-antidote-to-global-warming-is-development_6747556_23.html,Subscribers only,Arnaud Leparmentier,https://img.lemde.fr/2025/11/17/0/0/5014/3342/360/0/95/0/d5b1b60_upload-1-s67plzae5elk-803758.jpg 2x,
"Xu Yangtian, the invisible self-made man behind Shein",0,https://www.lemonde.fr/en/economy/article/2025/11/18/xu-yangtian-the-invisible-self-made-man-behind-shein_6747553_19.html,Subscribers only,"  By Jordan Pouille (Beijing (China), correspondent) ",https://img.lemde.fr/2025/11/17/0/0/5014/3342/360/0/95/0/d5b1b60_upload-1-s67plzae5elk-803758.jpg 2x,
Polish PM confirms 'act of sabotage' on key Ukraine supply train line,0,https://www.lemonde.fr/en/international/article/2025/11/17/polish-pm-confirms-act-of-sabotage-on-key-ukraine-supply-train-line_6747536_4.html,Not premium,Le Monde with AFP,https://img.lemde.fr/2025/11/17/0/0/5014/3342/360/0/95/0/d5b1b60_upload-1-s67plzae5elk-803758.jpg 2x,
Mbappé and PSG trade countersuits worth hundreds of millions,0,https://www.lemonde.fr/en/football/article/2025/11/17/mbappe-psg-trade-countersuits-worth-hundreds-of-millions_6747547_130.html,Not premium,Le Monde with AFP,https://img.lemde.fr/2025/11/17/0/0/5014/3342/360/0/95/0/d5b1b60_upload-1-s67plzae5elk-803758.jpg 2x,
Fears of French industrial crisis persist despite €30 billion in investments,0,https://www.lemonde.fr/en/economy/article/2025/11/17/fears-of-french-industrial-crisis-persist-despite-30-billion-in-investments_6747539_19.html,Subscribers only,  By Bastien Bonnefous ,https://img.lemde.fr/2025/11/17/0/0/5014/3342/360/0/95/0/d5b1b60_upload-1-s67plzae5elk-803758.jpg 2x,
"Philippe Taquet, dinosaur hunter and former director of French National Museum of Natural History, has died",0,https://www.lemonde.fr/en/obituaries/article/2025/11/17/philippe-taquet-dinosaur-hunter-and-former-director-of-french-national-museum-of-natural-history-has-died_6747541_15.html,Subscribers only,  By Pierre Barthélémy ,https://img.lemde.fr/2025/11/17/0/0/5014/3342/360/0/95/0/d5b1b60_upload-1-s67plzae5elk-803758.jpg 2x,
Two newly discovered Bach organ works revealed in Germany,0,https://www.lemonde.fr/en/germany/article/2025/11/17/two-newly-discovered-bach-organ-works-revealed-in-germany_6747545_146.html,Not premium,Le Monde with AFP,https://img.lemde.fr/2025/11/17/0/0/5014/3342/360/0/95/0/d5b1b60_upload-1-s67plzae5elk-803758.jpg 2x,
What is Europe's 'fair share' of climate action compared to other countries?,0,https://www.lemonde.fr/en/environment/article/2025/11/17/how-europe-s-fair-share-of-climate-action-compares-with-other-countries_6747517_114.html,Subscribers only,  By Audrey Garric ,https://img.lemde.fr/2025/11/17/0/0/5014/3342/360/0/95/0/d5b1b60_upload-1-s67plzae5elk-803758.jpg 2x,
"Grok, Elon Musk's AI, spreads far-right falsehoods about 2015 Paris attacks","A false rumor that acts of torture were committed during the attack on the Bataclan hall venue was revived by the French far right and confirmed by Grok, which invented victim testimonies.",https://www.lemonde.fr/en/france/article/2025/11/17/grok-elon-musk-s-ai-spreads-far-right-falsehoods-about-2015-paris-attacks_6747550_7.html,Subscribers only,  By Soren Seelow ,https://img.lemde.fr/2025/11/17/0/0/5014/3342/360/0/95/0/d5b1b60_upload-1-s67plzae5elk-803758.jpg 2x,In Depth
"Glenn Lowry, former director of MoMA: 'We must not return to a narrow history of art'","The historian who revitalized the revered New York institution is set to lead the Louvre Chair from November 17 to December 1, delivering a series of lectures on the theme of the museum of tomorrow.",https://www.lemonde.fr/en/culture/article/2025/11/17/glenn-lowry-former-director-of-moma-we-must-not-return-to-a-narrow-history-of-art_6747549_30.html,Subscribers only,  Interview by Roxana Azimi   ,https://img.lemde.fr/2025/11/17/0/0/5014/3342/360/0/95/0/d5b1b60_upload-1-s67plzae5elk-803758.jpg 2x,Interview
"Euroclear, the Belgian institution managing frozen Russian assets that will 'not rule out' suing the EU","Euroclear, a little-known but central player in Europe's financial system, holds €193 billion in frozen Russian assets that, since the invasion of Ukraine, have drawn intense scrutiny. Its director general, Valérie Urbain, warns that confiscation – illegal under international law – would weaken Europe's position.",https://www.lemonde.fr/en/economy/article/2025/11/15/euroclear-the-belgian-institution-managing-frozen-russian-assets-that-will-not-rule-out-suing-the-eu_6747484_19.html,Subscribers only, By Eric Albert (Brussels special correspondent) and Benjamin Quénelle (Brussels special correspondent) ,https://img.lemde.fr/2025/11/17/0/0/5014/3342/360/0/95/0/d5b1b60_upload-1-s67plzae5elk-803758.jpg 2x,Conversation
Reindustrializing France requires greater coherence,0,https://www.lemonde.fr/en/opinion/article/2025/11/18/reindustrializing-france-requires-greater-coherence_6747571_23.html,Not premium,Le Monde,https://img.lemde.fr/2025/11/17/0/0/5014/3342/360/0/95/0/d5b1b60_upload-1-s67plzae5elk-803758.jpg 2x,Editorial
Volodymyr Zelensky's two fronts,0,https://www.lemonde.fr/en/opinion/article/2025/11/17/volodymyr-zelensky-s-two-fronts_6747532_23.html,Not premium,Le Monde,https://img.lemde.fr/2025/11/17/0/0/5014/3342/360/0/95/0/d5b1b60_upload-1-s67plzae5elk-803758.jpg 2x,Editorial
'Christophe Gleizes does not belong in prison. A journalist simply doing their job never belongs in prison',0,https://www.lemonde.fr/en/opinion/article/2025/11/17/christophe-gleizes-does-not-belong-in-prison-a-journalist-simply-doing-their-job-never-belongs-in-prison_6747534_23.html,Subscribe,Francis Godard,https://img.lemde.fr/2025/11/17/0/0/5014/3342/360/0/95/0/d5b1b60_upload-1-s67plzae5elk-803758.jpg 2x,Op-Ed
