title,subhead,url,suscription,byline,img_url,article_type
"Rio de Janeiro: Claudio Castro, the governor behind the deadliest police raid in the state's history",0,https://www.lemonde.fr/en/international/article/2025/10/31/rio-de-janeiro-claudio-castro-the-governor-behind-the-deadliest-police-raid-in-the-state-s-history_6746944_4.html,Subscribers only,  By Bruno Meyerfeld (Rio de Janeiro (Brazil) correspondent) ,https://img.lemde.fr/2025/10/29/0/310/3354/2236/360/0/95/0/7dea481_ftp-import-images-1-dtqmxdrtie2l-2025-10-29t150617z-735541787-rc2klhal3kcy-rtrmadp-3-brazil-violence.JPG 2x,
Trump-Xi meeting brings temporary lull to escalation between US and China,0,https://www.lemonde.fr/en/international/article/2025/10/30/trump-xi-meeting-brings-temporary-lull-to-escalation-between-us-and-china_6746920_4.html,Subscribers only,  By Arnaud Leparmentier (San Francisco (United States) correspondent) and Harold Thibault (Beijing (China) correspondent) ,https://img.lemde.fr/2025/10/29/0/310/3354/2236/360/0/95/0/7dea481_ftp-import-images-1-dtqmxdrtie2l-2025-10-29t150617z-735541787-rc2klhal3kcy-rtrmadp-3-brazil-violence.JPG 2x,
"Northern Haiti is the country's showcase for tourists, but gang violence is crippling activity",0,https://www.lemonde.fr/en/international/article/2025/10/30/northern-haiti-is-the-country-s-showcase-for-tourists-but-gang-violence-in-port-au-prince-is-crippling-activity_6746907_4.html,Subscribers only,"  By Jean-Michel Hauteville (Cap-Haïtien (Haiti), special correspondent) ",https://img.lemde.fr/2025/10/29/0/310/3354/2236/360/0/95/0/7dea481_ftp-import-images-1-dtqmxdrtie2l-2025-10-29t150617z-735541787-rc2klhal3kcy-rtrmadp-3-brazil-violence.JPG 2x,
Xi opts for strong-arm approach ahead of meeting with Trump,0,https://www.lemonde.fr/en/international/article/2025/10/29/xi-opts-for-strong-arm-approach-ahead-of-meeting-with-trump_6746900_4.html,Subscribers only,  By Harold Thibault (Beijing (China) correspondent) ,https://img.lemde.fr/2025/10/29/0/310/3354/2236/360/0/95/0/7dea481_ftp-import-images-1-dtqmxdrtie2l-2025-10-29t150617z-735541787-rc2klhal3kcy-rtrmadp-3-brazil-violence.JPG 2x,
"After Charlie Kirk's murder, Europe's far right swears allegiance to Trump's politics",0,https://www.lemonde.fr/en/les-decodeurs/article/2025/10/20/the-murder-of-charlie-kirk-how-europe-s-far-right-swore-allegiance-to-trump-s-politics_6746586_8.html,Subscribers only, By Allan Kaval (Rome (Italy) correspondent) and Manon Romain (with Clément Guillou and Le Monde correspondents in Europe) ,https://img.lemde.fr/2025/10/29/0/310/3354/2236/360/0/95/0/7dea481_ftp-import-images-1-dtqmxdrtie2l-2025-10-29t150617z-735541787-rc2klhal3kcy-rtrmadp-3-brazil-violence.JPG 2x,
Sanctions against Russia spark rift between US and Europe over China,0,https://www.lemonde.fr/en/international/article/2025/09/15/sanctions-against-russia-spark-rift-between-us-and-europe-over-china_6745411_4.html,Subscribers only,"  By Philippe Jacqué (Brussels, Europe bureau), Philippe Ricard and Harold Thibault (Beijing (China) correspondent) ",https://img.lemde.fr/2025/10/29/0/310/3354/2236/360/0/95/0/7dea481_ftp-import-images-1-dtqmxdrtie2l-2025-10-29t150617z-735541787-rc2klhal3kcy-rtrmadp-3-brazil-violence.JPG 2x,
France's political instability puts Franco-German alliance to the test,0,https://www.lemonde.fr/en/opinion/article/2025/08/30/france-s-political-instability-puts-franco-german-alliance-to-the-test_6744873_23.html,Not premium,Le Monde,https://img.lemde.fr/2025/10/29/0/310/3354/2236/360/0/95/0/7dea481_ftp-import-images-1-dtqmxdrtie2l-2025-10-29t150617z-735541787-rc2klhal3kcy-rtrmadp-3-brazil-violence.JPG 2x,
France faces prospect of paying higher borrowing costs than Italy,0,https://www.lemonde.fr/en/economy/article/2025/08/19/france-faces-prospect-of-paying-higher-borrowing-costs-than-italy_6744519_19.html,Subscribers only,  By Denis Cosnard and Allan Kaval (Rome (Italy) correspondent) ,https://img.lemde.fr/2025/10/29/0/310/3354/2236/360/0/95/0/7dea481_ftp-import-images-1-dtqmxdrtie2l-2025-10-29t150617z-735541787-rc2klhal3kcy-rtrmadp-3-brazil-violence.JPG 2x,
Trial over red hand graffiti at Paris Shoah Memorial: 'I did it for the money',0,https://www.lemonde.fr/en/france/article/2025/10/30/trial-over-red-hand-graffiti-at-paris-shoah-memorial-i-did-it-for-the-money_6746918_7.html,Subscribers only,  By Benoît Vitkine ,https://img.lemde.fr/2025/10/29/0/310/3354/2236/360/0/95/0/7dea481_ftp-import-images-1-dtqmxdrtie2l-2025-10-29t150617z-735541787-rc2klhal3kcy-rtrmadp-3-brazil-violence.JPG 2x,
Conspiracy theorists in court over false Brigitte Macron transgender claim,0,https://www.lemonde.fr/en/france/article/2025/10/29/conspiracy-theorists-in-court-over-false-brigitte-macron-transgender-claim_6746888_7.html,Subscribers only,  By Olivier Faye ,https://img.lemde.fr/2025/10/29/0/310/3354/2236/360/0/95/0/7dea481_ftp-import-images-1-dtqmxdrtie2l-2025-10-29t150617z-735541787-rc2klhal3kcy-rtrmadp-3-brazil-violence.JPG 2x,
Dr. Péchier serial poisoning trial: Former colleagues express remorse as evidence mounts,0,https://www.lemonde.fr/en/france/article/2025/10/29/dr-pechier-serial-poisoning-trial-former-colleagues-express-remorse-as-evidence-mounts_6746886_7.html,Subscribers only,  By Willy Graff ,https://img.lemde.fr/2025/10/29/0/310/3354/2236/360/0/95/0/7dea481_ftp-import-images-1-dtqmxdrtie2l-2025-10-29t150617z-735541787-rc2klhal3kcy-rtrmadp-3-brazil-violence.JPG 2x,
'You can see poverty spreading': France's welfare services confront growing hardship,0,https://www.lemonde.fr/en/france/article/2025/10/29/you-can-see-poverty-spreading-france-s-welfare-services-confront-growing-hardship_6746880_7.html,Subscribers only,  By Sylvia Zappi ,https://img.lemde.fr/2025/10/30/0/0/4051/2700/360/0/95/0/09b6d69_ftp-import-images-1-st2lfcpnh0xy-2025-10-30t042335z-187858574-rc24mha5smvs-rtrmadp-3-usa-trump-xi.JPG 2x,
Afghanistan: Relentless repression continues over four years into Taliban's rule,0,https://www.lemonde.fr/en/videos/video/2025/10/04/afghanistan-relentless-repression-continues-over-four-years-into-taliban-s-rule_6746092_108.html,Not premium,"  By Chloé Denis, Félix Pommier (Motion design) and Sinead McCausland ",https://img.lemde.fr/2025/10/29/0/310/3354/2236/360/0/95/0/7dea481_ftp-import-images-1-dtqmxdrtie2l-2025-10-29t150617z-735541787-rc2klhal3kcy-rtrmadp-3-brazil-violence.JPG 2x,
Watch: Hundreds of thousands march in France against budget cuts,0,https://www.lemonde.fr/en/videos/video/2025/09/19/french-strikes-watch-what-happened-as-hundreds-of-thousands-marched-against-budget-cuts_6745548_108.html,Not premium,  By Le Monde's video desk   ,https://img.lemde.fr/2025/10/29/0/310/3354/2236/360/0/95/0/7dea481_ftp-import-images-1-dtqmxdrtie2l-2025-10-29t150617z-735541787-rc2klhal3kcy-rtrmadp-3-brazil-violence.JPG 2x,
Emmys 2025: 'Adolescence' star Owen Cooper becomes youngest winner for best supporting actor,0,https://www.lemonde.fr/en/videos/video/2025/09/15/emmys-2025-adolescence-star-owen-cooper-becomes-youngest-winner-for-best-supporting-actor_6745427_108.html,Not premium,  By Le Monde's video desk   ,https://img.lemde.fr/2025/10/29/0/310/3354/2236/360/0/95/0/7dea481_ftp-import-images-1-dtqmxdrtie2l-2025-10-29t150617z-735541787-rc2klhal3kcy-rtrmadp-3-brazil-violence.JPG 2x,
"From 'influence peddling' to 'corruption,' what is French Culture Minister Rachida Dati accused of?",0,https://www.lemonde.fr/en/videos/video/2025/09/06/from-influence-peddling-to-corruption-what-is-french-culture-minister-rachida-dati-accused-of_6745094_108.html,Not premium,"  By Alexis Tromas, Arthur Navet  and Sinead McCausland ",https://img.lemde.fr/2025/10/29/0/310/3354/2236/360/0/95/0/7dea481_ftp-import-images-1-dtqmxdrtie2l-2025-10-29t150617z-735541787-rc2klhal3kcy-rtrmadp-3-brazil-violence.JPG 2x,
"'According to Peter Thiel, the 21st-century Antichrist uses fear of climate change'",0,https://www.lemonde.fr/en/opinion/article/2025/10/30/according-to-peter-thiel-the-21st-century-antichrist-uses-fear-of-climate-change_6746932_23.html,Subscribers only,Corine Lesnes,https://img.lemde.fr/2025/10/29/0/310/3354/2236/360/0/95/0/7dea481_ftp-import-images-1-dtqmxdrtie2l-2025-10-29t150617z-735541787-rc2klhal3kcy-rtrmadp-3-brazil-violence.JPG 2x,
'Argentina gradually joins the great authoritarian wave sweeping the globe',0,https://www.lemonde.fr/en/opinion/article/2025/10/30/argentina-gradually-joins-the-great-authoritarian-wave-sweeping-the-globe_6746940_23.html,Subscribers only,Olivier Compagnon,https://img.lemde.fr/2025/10/29/0/310/3354/2236/360/0/95/0/7dea481_ftp-import-images-1-dtqmxdrtie2l-2025-10-29t150617z-735541787-rc2klhal3kcy-rtrmadp-3-brazil-violence.JPG 2x,
Côte d'Ivoire elections reveal veneer of democracy,0,https://www.lemonde.fr/en/opinion/article/2025/10/30/cote-d-ivoire-elections-reveal-veneer-of-democracy_6746921_23.html,Not premium,Le Monde,https://img.lemde.fr/2025/10/29/0/310/3354/2236/360/0/95/0/7dea481_ftp-import-images-1-dtqmxdrtie2l-2025-10-29t150617z-735541787-rc2klhal3kcy-rtrmadp-3-brazil-violence.JPG 2x,
'Pessimism has taken hold in a once-optimistic China',0,https://www.lemonde.fr/en/opinion/article/2025/10/30/pessimism-has-taken-hold-in-a-once-optimistic-china_6746912_23.html,Subscribers only,Harold Thibault,https://img.lemde.fr/2025/10/29/0/310/3354/2236/360/0/95/0/7dea481_ftp-import-images-1-dtqmxdrtie2l-2025-10-29t150617z-735541787-rc2klhal3kcy-rtrmadp-3-brazil-violence.JPG 2x,
Brigitte Macron's never-ending fake news nightmare,0,https://www.lemonde.fr/en/m-le-mag/article/2025/10/25/brigitte-macron-s-never-ending-fake-news-nightmare_6746763_117.html,Subscribers only, By Olivier Faye ,https://img.lemde.fr/2025/10/29/0/310/3354/2236/360/0/95/0/7dea481_ftp-import-images-1-dtqmxdrtie2l-2025-10-29t150617z-735541787-rc2klhal3kcy-rtrmadp-3-brazil-violence.JPG 2x,
A new Israeli-Palestinian restaurant promotes peace through food in Paris,0,https://www.lemonde.fr/en/m-le-mag/article/2025/10/22/a-new-israeli-palestinian-restaurant-promotes-peace-through-food-in-paris_6746662_117.html,Subscribers only,  By Gaspard Dhellemmes ,https://img.lemde.fr/2025/10/29/0/310/3354/2236/360/0/95/0/7dea481_ftp-import-images-1-dtqmxdrtie2l-2025-10-29t150617z-735541787-rc2klhal3kcy-rtrmadp-3-brazil-violence.JPG 2x,
The wild Albanian island where the Trumps want to build a luxury hotel,0,https://www.lemonde.fr/en/m-le-mag/article/2025/10/19/the-wild-albanian-island-where-the-trumps-want-bid-to-build-a-luxury-hotel_6746568_117.html,Subscribers only, By Lucas Minisini ,https://img.lemde.fr/2025/10/29/0/310/3354/2236/360/0/95/0/7dea481_ftp-import-images-1-dtqmxdrtie2l-2025-10-29t150617z-735541787-rc2klhal3kcy-rtrmadp-3-brazil-violence.JPG 2x,
"France's last military pigeons, custodians of a fading tradition",0,https://www.lemonde.fr/en/m-le-mag/article/2025/10/17/france-s-last-military-pigeons-custodians-of-a-fading-tradition_6746510_117.html,Subscribers only,  By Etienne de Metz ,https://img.lemde.fr/2025/10/29/0/310/3354/2236/360/0/95/0/7dea481_ftp-import-images-1-dtqmxdrtie2l-2025-10-29t150617z-735541787-rc2klhal3kcy-rtrmadp-3-brazil-violence.JPG 2x,
Twelve artistic happenings to catch outside Art Basel Paris,0,https://www.lemonde.fr/en/culture/article/2025/10/24/twelve-artistic-happenings-to-catch-outside-art-basel-paris_6746743_30.html,Subscribers only,"  By Roxana Azimi, Philippe Dagen, Claire Guillot, Emmanuelle Jardonnet, Sylvie Kerviel and Emmanuelle Lequeux ",https://img.lemde.fr/2025/10/29/0/310/3354/2236/360/0/95/0/7dea481_ftp-import-images-1-dtqmxdrtie2l-2025-10-29t150617z-735541787-rc2klhal3kcy-rtrmadp-3-brazil-violence.JPG 2x,
A new Israeli-Palestinian restaurant promotes peace through food in Paris,0,https://www.lemonde.fr/en/m-le-mag/article/2025/10/22/a-new-israeli-palestinian-restaurant-promotes-peace-through-food-in-paris_6746662_117.html,Subscribers only,  By Gaspard Dhellemmes ,https://img.lemde.fr/2025/10/29/0/310/3354/2236/360/0/95/0/7dea481_ftp-import-images-1-dtqmxdrtie2l-2025-10-29t150617z-735541787-rc2klhal3kcy-rtrmadp-3-brazil-violence.JPG 2x,
"'The spirit of the new Fondation Cartier is not that of a cathedral where one must always do more, always bigger'",0,https://www.lemonde.fr/en/culture/article/2025/10/21/the-spirit-of-the-new-fondation-cartier-is-not-that-of-a-cathedral-where-one-must-always-do-more-always-bigger_6746624_30.html,Subscribers only,  Interview by Roxana Azimi   ,https://img.lemde.fr/2025/10/29/0/310/3354/2236/360/0/95/0/7dea481_ftp-import-images-1-dtqmxdrtie2l-2025-10-29t150617z-735541787-rc2klhal3kcy-rtrmadp-3-brazil-violence.JPG 2x,
"Jean-François Piège, guardian of Paris's bistro heritage",0,https://www.lemonde.fr/en/lifestyle/article/2025/10/18/jean-francois-piege-guardian-of-paris-s-bistro-heritage_6746545_37.html,Subscribers only,  By Léo Bourdin ,https://img.lemde.fr/2025/10/29/0/310/3354/2236/360/0/95/0/7dea481_ftp-import-images-1-dtqmxdrtie2l-2025-10-29t150617z-735541787-rc2klhal3kcy-rtrmadp-3-brazil-violence.JPG 2x,
"Massacres in Darfur: In el-Fasher, Sudan, 'we are witnessing mass atrocities through our screens'","Massacres, which have been filmed and shared on social media, have taken place in the capital of North Darfur since the city was seized by the Rapid Support Forces, led by General Mohammed Hamdan Dagalo.",https://www.lemonde.fr/en/le-monde-africa/article/2025/10/30/sudan-in-el-fasher-we-are-witnessing-mass-atrocities-through-our-screens_6746934_124.html,Subscribers only,  By Eliott Brachet (Cairo (Egypt) correspondent) ,https://img.lemde.fr/2025/10/29/0/310/3354/2236/360/0/95/0/7dea481_ftp-import-images-1-dtqmxdrtie2l-2025-10-29t150617z-735541787-rc2klhal3kcy-rtrmadp-3-brazil-violence.JPG 2x,
Trump-Xi meeting brings temporary lull to escalation between US and China,0,https://www.lemonde.fr/en/international/article/2025/10/30/trump-xi-meeting-brings-temporary-lull-to-escalation-between-us-and-china_6746920_4.html,Subscribers only,  By Arnaud Leparmentier (San Francisco (United States) correspondent) and Harold Thibault (Beijing (China) correspondent) ,https://img.lemde.fr/2025/10/29/0/310/3354/2236/360/0/95/0/7dea481_ftp-import-images-1-dtqmxdrtie2l-2025-10-29t150617z-735541787-rc2klhal3kcy-rtrmadp-3-brazil-violence.JPG 2x,
"Rio de Janeiro: Claudio Castro, the governor behind the deadliest police raid in the state's history",0,https://www.lemonde.fr/en/international/article/2025/10/31/rio-de-janeiro-claudio-castro-the-governor-behind-the-deadliest-police-raid-in-the-state-s-history_6746944_4.html,Subscribers only,  By Bruno Meyerfeld (Rio de Janeiro (Brazil) correspondent) ,https://img.lemde.fr/2025/10/29/0/310/3354/2236/360/0/95/0/7dea481_ftp-import-images-1-dtqmxdrtie2l-2025-10-29t150617z-735541787-rc2klhal3kcy-rtrmadp-3-brazil-violence.JPG 2x,
Israel confirms identities of deceased Gaza hostages returned Thursday,Militants have so far returned the remains of 17 of the 28 deceased hostages that Hamas had agreed to hand over as part of a United States-brokered truce deal with Israel.,https://www.lemonde.fr/en/international/article/2025/10/31/israel-confirms-identities-of-deceased-gaza-hostages-returned-thursday_6746942_4.html,Not premium,Le Monde with AFP,https://img.lemde.fr/2025/10/29/0/310/3354/2236/360/0/95/0/7dea481_ftp-import-images-1-dtqmxdrtie2l-2025-10-29t150617z-735541787-rc2klhal3kcy-rtrmadp-3-brazil-violence.JPG 2x,
'Argentina gradually joins the great authoritarian wave sweeping the globe',"In an op-ed for Le Monde, political scientist David Copello and historian Olivier Compagnon write that commentators' economic focus should not obscure the institutional changes underway after Milei's victory in the legislative elections.",https://www.lemonde.fr/en/opinion/article/2025/10/30/argentina-gradually-joins-the-great-authoritarian-wave-sweeping-the-globe_6746940_23.html,Subscribers only,Olivier Compagnon,https://img.lemde.fr/2025/10/29/0/310/3354/2236/360/0/95/0/7dea481_ftp-import-images-1-dtqmxdrtie2l-2025-10-29t150617z-735541787-rc2klhal3kcy-rtrmadp-3-brazil-violence.JPG 2x,
"Over 1,000 items looted in California museum heist","Stolen items include neckpieces by the late artist and metalsmith Florence Resnikoff, a pair of scrimshaw walrus tusks and Native American baskets. The burglary occurred in the early morning hours of Oct. 15 at an off-site storage facility of the Oakland Museum of California, Oakland Police said.",https://www.lemonde.fr/en/international/article/2025/10/31/heist-in-oakland-california-museum-over-1-000-items-looted_6746941_4.html,Not premium,Le Monde with AP,https://img.lemde.fr/2025/10/29/0/310/3354/2236/360/0/95/0/7dea481_ftp-import-images-1-dtqmxdrtie2l-2025-10-29t150617z-735541787-rc2klhal3kcy-rtrmadp-3-brazil-violence.JPG 2x,
'Airbnb has shaped the idea that everything can be monetized. It's a logic of constant optimization',"'The Airbnb Ogre' (2/6). In Paris, about one-third of the listings available on Airbnb have been removed from the 'permanent' housing market, which contributes to the housing crisis in the French capital, explains researcher Jeanne Richon in an interview with Le Monde.",https://www.lemonde.fr/en/economy/article/2025/10/30/airbnb-has-shaped-the-idea-that-everything-can-be-monetized-it-s-a-logic-of-constant-optimization_6746936_19.html,Subscribers only,  Interview by Jessica Gourdon ,https://img.lemde.fr/2025/10/29/0/310/3354/2236/360/0/95/0/7dea481_ftp-import-images-1-dtqmxdrtie2l-2025-10-29t150617z-735541787-rc2klhal3kcy-rtrmadp-3-brazil-violence.JPG 2x,Interview
"Melissa headed to Bermuda, while Haiti, Jamaica and Cuba pick up the pieces",0,https://www.lemonde.fr/en/environment/article/2025/10/30/melissa-headed-to-bermuda-while-haiti-jamaica-and-cuba-pick-up-the-pieces_6746939_114.html,Not premium,Le Monde with AP,https://img.lemde.fr/2025/10/29/0/310/3354/2236/360/0/95/0/7dea481_ftp-import-images-1-dtqmxdrtie2l-2025-10-29t150617z-735541787-rc2klhal3kcy-rtrmadp-3-brazil-violence.JPG 2x,
Sinner and Zverev march into Paris Masters last eight,0,https://www.lemonde.fr/en/sports/article/2025/10/31/sinner-and-zverev-march-into-paris-masters-last-eight_6746945_9.html,Not premium,Le Monde with AFP,https://img.lemde.fr/2025/10/29/0/310/3354/2236/360/0/95/0/7dea481_ftp-import-images-1-dtqmxdrtie2l-2025-10-29t150617z-735541787-rc2klhal3kcy-rtrmadp-3-brazil-violence.JPG 2x,
"King Charles will evict Prince Andrew from royal residence and strip him of titles, Buckingham Palace says",0,https://www.lemonde.fr/en/international/article/2025/10/30/king-charles-will-evict-prince-andrew-from-royal-residence-and-strip-him-of-titles-buckingham-palace-says_6746937_4.html,Not premium,Le Monde with AP,https://img.lemde.fr/2025/10/29/0/310/3354/2236/360/0/95/0/7dea481_ftp-import-images-1-dtqmxdrtie2l-2025-10-29t150617z-735541787-rc2klhal3kcy-rtrmadp-3-brazil-violence.JPG 2x,
Trump's administration drastically limits refugee admissions to mostly white South Africans,0,https://www.lemonde.fr/en/international/article/2025/10/31/trump-s-administration-drastically-limits-refugee-admissions-to-mostly-white-south-africans_6746943_4.html,Not premium,Le Monde with AP,https://img.lemde.fr/2025/10/29/0/310/3354/2236/360/0/95/0/7dea481_ftp-import-images-1-dtqmxdrtie2l-2025-10-29t150617z-735541787-rc2klhal3kcy-rtrmadp-3-brazil-violence.JPG 2x,
2026 budget bill: Voting likely delayed as wealth tax is set to be debated on Friday,0,https://www.lemonde.fr/en/politics/article/2025/10/30/2026-budget-bill-voting-likely-delayed-as-wealth-tax-is-set-to-be-debated-on-friday_6746919_5.html,Subscribers only,  By Robin Richardot ,https://img.lemde.fr/2025/10/29/0/310/3354/2236/360/0/95/0/7dea481_ftp-import-images-1-dtqmxdrtie2l-2025-10-29t150617z-735541787-rc2klhal3kcy-rtrmadp-3-brazil-violence.JPG 2x,
"French economy's unexpected rebound, driven by aircraft, pharmaceutical, defense exports",0,https://www.lemonde.fr/en/economy/article/2025/10/30/french-economy-s-unexpected-rebound-driven-by-aircraft-pharmaceutical-defense-exports_6746923_19.html,Subscribers only,  By Béatrice Madeline   ,https://img.lemde.fr/2025/10/29/0/310/3354/2236/360/0/95/0/7dea481_ftp-import-images-1-dtqmxdrtie2l-2025-10-29t150617z-735541787-rc2klhal3kcy-rtrmadp-3-brazil-violence.JPG 2x,
Trial over red hand graffiti at Paris Shoah Memorial: 'I did it for the money',0,https://www.lemonde.fr/en/france/article/2025/10/30/trial-over-red-hand-graffiti-at-paris-shoah-memorial-i-did-it-for-the-money_6746918_7.html,Subscribers only,  By Benoît Vitkine ,https://img.lemde.fr/2025/10/29/0/310/3354/2236/360/0/95/0/7dea481_ftp-import-images-1-dtqmxdrtie2l-2025-10-29t150617z-735541787-rc2klhal3kcy-rtrmadp-3-brazil-violence.JPG 2x,
Two French police officers 'immediately suspended' after rape allegation,0,https://www.lemonde.fr/en/police-and-justice/article/2025/10/30/two-french-police-officers-immediately-suspended-after-rape-allegation_6746929_105.html,Not premium,Le Monde with AFP,https://img.lemde.fr/2025/10/29/0/310/3354/2236/360/0/95/0/7dea481_ftp-import-images-1-dtqmxdrtie2l-2025-10-29t150617z-735541787-rc2klhal3kcy-rtrmadp-3-brazil-violence.JPG 2x,
Israel strikes Gaza arms site after deadly night of bombing leaves over 100 dead,0,https://www.lemonde.fr/en/international/article/2025/10/29/israel-strikes-gaza-arms-site-after-deadly-night-of-bombing-leaves-over-100-dead_6746905_4.html,Not premium,Le Monde with AFP,https://img.lemde.fr/2025/10/29/0/310/3354/2236/360/0/95/0/7dea481_ftp-import-images-1-dtqmxdrtie2l-2025-10-29t150617z-735541787-rc2klhal3kcy-rtrmadp-3-brazil-violence.JPG 2x,
Royals William and Kate win lawsuit against French magazine,0,https://www.lemonde.fr/en/france/article/2025/10/30/royals-william-and-kate-win-privacy-case-against-french-magazine_6746933_7.html,Not premium,Le Monde with AP,https://img.lemde.fr/2025/10/29/0/310/3354/2236/360/0/95/0/7dea481_ftp-import-images-1-dtqmxdrtie2l-2025-10-29t150617z-735541787-rc2klhal3kcy-rtrmadp-3-brazil-violence.JPG 2x,
Tens of thousands of ultra-Orthodox Jews protest military draft in Jerusalem,0,https://www.lemonde.fr/en/international/article/2025/10/30/tens-of-thousands-of-ultra-orthodox-jews-protest-military-draft-in-jerusalem_6746938_4.html,Not premium,Le Monde with AP,https://img.lemde.fr/2025/10/29/0/310/3354/2236/360/0/95/0/7dea481_ftp-import-images-1-dtqmxdrtie2l-2025-10-29t150617z-735541787-rc2klhal3kcy-rtrmadp-3-brazil-violence.JPG 2x,
EU will not force online platforms and messaging services to scan for child sex abuse images,0,https://www.lemonde.fr/en/international/article/2025/10/30/eu-will-not-force-online-platforms-and-messaging-services-to-scan-for-child-sex-abuse-images_6746931_4.html,Not premium,Le Monde with AFP,https://img.lemde.fr/2025/10/29/0/310/3354/2236/360/0/95/0/7dea481_ftp-import-images-1-dtqmxdrtie2l-2025-10-29t150617z-735541787-rc2klhal3kcy-rtrmadp-3-brazil-violence.JPG 2x,
"How Airbnb made France its favorite destination, with more than one million listings","'The Airbnb Ogre' (1/6). In 15 years, the platform has established itself in France, the leading tourist destination, thanks to effective lobbying and favorable tax conditions. It has even worsened the housing crisis. The company is now expanding its offerings to continue its growth.",https://www.lemonde.fr/en/economy/article/2025/10/30/how-airbnb-made-france-its-favorite-destination-with-more-than-one-million-listings_6746915_19.html,Subscribers only, By Véronique Chocron and Jessica Gourdon ,https://img.lemde.fr/2025/10/29/0/310/3354/2236/360/0/95/0/7dea481_ftp-import-images-1-dtqmxdrtie2l-2025-10-29t150617z-735541787-rc2klhal3kcy-rtrmadp-3-brazil-violence.JPG 2x,Investigation
"'We're buying time, but we won't win the fight': Senegal's Saint-Louis faces the inexorable rise of the sea",'Our planet at +1.5°C' (3/6). Senegal's historic city will be largely underwater by the end of the 21st century. Several thousand fishermen have already left their homes on the beach for a stifling dormitory town.,https://www.lemonde.fr/en/environment/article/2025/10/30/we-re-buying-time-but-we-won-t-win-the-fight-senegal-s-saint-louis-faces-the-inexorable-rise-of-the-sea_6746914_114.html,Subscribers only, By Maryline Baumard and Adrienne Surprenant ,https://img.lemde.fr/2025/10/29/0/310/3354/2236/360/0/95/0/7dea481_ftp-import-images-1-dtqmxdrtie2l-2025-10-29t150617z-735541787-rc2klhal3kcy-rtrmadp-3-brazil-violence.JPG 2x,Feature
Madagascar's new government faces scrutiny from Gen Z,"President Michaël Randrianirina announced the 28 members of the government on Tuesday, October 28. Opposition leaders to the ousted regime, newcomers and technocrats now have 60 days to deliver results.",https://www.lemonde.fr/en/le-monde-africa/article/2025/10/29/madagascar-s-new-government-faces-scrutiny-from-gen-z_6746894_124.html,Subscribers only,  By Laurence Caramel   ,https://img.lemde.fr/2025/10/29/0/310/3354/2236/360/0/95/0/7dea481_ftp-import-images-1-dtqmxdrtie2l-2025-10-29t150617z-735541787-rc2klhal3kcy-rtrmadp-3-brazil-violence.JPG 2x,News
Côte d'Ivoire elections reveal veneer of democracy,0,https://www.lemonde.fr/en/opinion/article/2025/10/30/cote-d-ivoire-elections-reveal-veneer-of-democracy_6746921_23.html,Not premium,Le Monde,https://img.lemde.fr/2025/10/29/0/310/3354/2236/360/0/95/0/7dea481_ftp-import-images-1-dtqmxdrtie2l-2025-10-29t150617z-735541787-rc2klhal3kcy-rtrmadp-3-brazil-violence.JPG 2x,Editorial
Sudan's tragedy and the unbearable international inaction,0,https://www.lemonde.fr/en/opinion/article/2025/10/29/sudan-s-tragedy-and-the-unbearable-international-inaction_6746885_23.html,Not premium,Le Monde,https://img.lemde.fr/2025/10/29/0/310/3354/2236/360/0/95/0/7dea481_ftp-import-images-1-dtqmxdrtie2l-2025-10-29t150617z-735541787-rc2klhal3kcy-rtrmadp-3-brazil-violence.JPG 2x,Editorial
