title,subhead,url,suscription,byline,img_url,article_type
A tense power-sharing coalition takes shape in Poland,0,https://www.lemonde.fr/en/international/article/2025/08/06/a-tense-power-sharing-coalition-begins-in-poland_6744119_4.html,Subscribers only,  By Hélène Bienvenu (Warsaw (Poland) correspondent) ,https://img.lemde.fr/2025/08/06/0/0/5500/3666/360/0/95/0/3562b69_upload-1-y2hanrynj9mv-028115.jpg 2x,
Israel raises threat of Gaza occupation,0,https://www.lemonde.fr/en/international/article/2025/08/06/israel-raises-threat-of-gaza-occupation_6744116_4.html,Subscribers only,"  By Luc Bronner (Jerusalem, correspondent) ",https://img.lemde.fr/2025/08/06/0/0/5500/3666/360/0/95/0/3562b69_upload-1-y2hanrynj9mv-028115.jpg 2x,
Palestinians can now live on only 12% of Gazan territory,0,https://www.lemonde.fr/en/international/video/2025/08/06/palestinians-can-now-live-on-only-12-of-gazan-territory_6744114_4.html,Not premium,"  By Juliette Prigent, Asia Balluffier, Adrien Sahli and Sinead McCausland ",https://img.lemde.fr/2025/08/06/0/0/5500/3666/360/0/95/0/3562b69_upload-1-y2hanrynj9mv-028115.jpg 2x,
French man arrested in Slovenia for crimes committed in Croatia during 1991 war,0,https://www.lemonde.fr/en/international/article/2025/08/06/french-man-arrested-in-slovenia-for-crimes-committed-in-croatia-during-1991-war_6744113_4.html,Subscribers only,  By Stéphanie Maupas (The Hague (Netherlands) correspondent) and Richard Schittly (Lyon (France) correspondent) ,https://img.lemde.fr/2025/08/06/0/0/5500/3666/360/0/95/0/3562b69_upload-1-y2hanrynj9mv-028115.jpg 2x,
French man arrested in Slovenia for crimes committed in Croatia during 1991 war,0,https://www.lemonde.fr/en/international/article/2025/08/06/french-man-arrested-in-slovenia-for-crimes-committed-in-croatia-during-1991-war_6744113_4.html,Subscribers only,  By Stéphanie Maupas (The Hague (Netherlands) correspondent) and Richard Schittly (Lyon (France) correspondent) ,https://img.lemde.fr/2025/08/06/0/0/5500/3666/360/0/95/0/3562b69_upload-1-y2hanrynj9mv-028115.jpg 2x,
"30 years after the Bosnian War, its refugees still cannot return home",0,https://www.lemonde.fr/en/international/article/2025/08/03/thirty-years-after-the-bosnian-war-its-refugees-still-cannot-return-home_6744026_4.html,Subscribers only," By Jean-Baptiste Chastand (Visegrad, Bosnia and Herzegovina, special correspondent) ",https://img.lemde.fr/2025/08/06/0/0/5500/3666/360/0/95/0/3562b69_upload-1-y2hanrynj9mv-028115.jpg 2x,
Early and intense wildfire season has arrived around the Mediterranean,0,https://www.lemonde.fr/en/europe/article/2025/07/17/wildfire-season-arrives-early-and-intense-around-the-mediterranean_6743466_143.html,Subscribers only,"  By Maryline Baumard, Olivier Bonnel (Rome, correspondent), Nicolas Bourcier (Istanbul (Turkey) correspondent), Isabelle Piquer (Madrid (Spain) correspondent), Marina Rafenberg (Athens (Greece) correspondent) and Hélène Sallon (Beirut (Lebanon) correspondent) ",https://img.lemde.fr/2025/08/06/0/0/5500/3666/360/0/95/0/3562b69_upload-1-y2hanrynj9mv-028115.jpg 2x,
"Srebrenica massacre commemoration: 30 years later, the enduring bitterness of grieving families",0,https://www.lemonde.fr/en/international/article/2025/07/12/srebrenica-massacre-commemoration-30-years-later-the-enduring-bitterness-of-grieving-families_6743301_4.html,Subscribers only, By Jean-Baptiste Chastand (Srebrenica (Bosnia) special correspondent) ,https://img.lemde.fr/2025/08/06/0/0/5500/3666/360/0/95/0/3562b69_upload-1-y2hanrynj9mv-028115.jpg 2x,
"For the first time ever, the majority of doctors in France are women",0,https://www.lemonde.fr/en/france/article/2025/08/04/for-the-first-time-ever-the-majority-of-doctors-in-france-are-women_6744048_7.html,Subscribers only,  By Mattea Battaglia and Camille Stromboni ,https://img.lemde.fr/2025/08/06/0/0/5500/3666/360/0/95/0/3562b69_upload-1-y2hanrynj9mv-028115.jpg 2x,
The barriers preventing French people from going on vacation,0,https://www.lemonde.fr/en/france/article/2025/08/03/the-barriers-preventing-french-people-from-going-on-vacation_6744035_7.html,Subscribers only,"  By Claire Ané, Camille Bordenet and Laura Motet ",https://img.lemde.fr/2025/08/06/0/0/5500/3666/360/0/95/0/3562b69_upload-1-y2hanrynj9mv-028115.jpg 2x,
Former PM Gabriel Attal wants to make his mark with a  name change for Macron's Renaissance party,0,https://www.lemonde.fr/en/france/article/2025/08/02/former-pm-gabriel-attal-wants-to-make-his-mark-with-a-name-change-for-macron-s-renaissance-party_6744007_7.html,Subscribers only,  By Malika Cheklal  ,https://img.lemde.fr/2025/08/06/0/0/5500/3666/360/0/95/0/3562b69_upload-1-y2hanrynj9mv-028115.jpg 2x,
Trial ordered for deadly 1982 attack on Paris Jewish restaurant,0,https://www.lemonde.fr/en/france/article/2025/08/01/trial-ordered-for-deadly-1982-attack-on-paris-jewish-restaurant_6743989_7.html,Subscribers only,  By Christophe Ayad ,https://img.lemde.fr/2025/08/06/0/0/5500/3666/360/0/95/0/3562b69_upload-1-y2hanrynj9mv-028115.jpg 2x,
Watch: Tsunami warnings sound in Japan after 8.8 magnitude quake off Russian coast,0,https://www.lemonde.fr/en/videos/video/2025/07/30/watch-tsunami-warnings-sound-in-japan-after-8-8-magnitude-quake-off-russian-coast_6743900_108.html,Not premium,No byline,https://img.lemde.fr/2025/08/06/0/0/5500/3666/360/0/95/0/3562b69_upload-1-y2hanrynj9mv-028115.jpg 2x,
What is France's 'Black code' and why hasn't it been repealed?,0,https://www.lemonde.fr/en/videos/video/2025/05/31/what-is-france-s-black-code-and-why-hasn-t-it-been-repealed_6741860_108.html,Not premium,"  By Chloé Denis, Olivier Escher (motion design) and Diana Liu ",https://img.lemde.fr/2025/08/06/0/0/5500/3666/360/0/95/0/3562b69_upload-1-y2hanrynj9mv-028115.jpg 2x,
How was the European Union created?,0,https://www.lemonde.fr/en/videos/video/2025/05/29/how-was-the-european-union-created_6741795_108.html,Not premium,"  By Alexis Tromas, Robin Gasser (motion design) and Diana Liu ",https://img.lemde.fr/2025/08/06/0/0/5500/3666/360/0/95/0/3562b69_upload-1-y2hanrynj9mv-028115.jpg 2x,
Glide bombs: Russia's secret to making cheap weapons,0,https://www.lemonde.fr/en/videos/video/2025/05/25/glide-bombs-russia-s-secret-to-making-cheap-weapons_6741646_108.html,Subscribers only,"  By Thomas Eydoux, Marceau Bretonnier and Sinead McCausland ",https://img.lemde.fr/2025/08/06/0/0/5500/3666/360/0/95/0/3562b69_upload-1-y2hanrynj9mv-028115.jpg 2x,
The urgent need to halt plastic pollution,0,https://www.lemonde.fr/en/opinion/article/2025/08/06/the-urgent-need-to-halt-plastic-pollution_6744122_23.html,Not premium,Le Monde,https://img.lemde.fr/2025/08/06/0/0/5500/3666/360/0/95/0/3562b69_upload-1-y2hanrynj9mv-028115.jpg 2x,
The only solution for Gaza and the hostages? International pressure,0,https://www.lemonde.fr/en/opinion/article/2025/08/05/the-only-solution-for-gaza-and-the-hostages-international-pressure_6744083_23.html,Not premium,Le Monde,https://img.lemde.fr/2025/08/06/0/0/5500/3666/360/0/95/0/3562b69_upload-1-y2hanrynj9mv-028115.jpg 2x,
"Leila Sansour: 'This is not a war between religions, but a brutal domination of one people by another'",0,https://www.lemonde.fr/en/opinion/article/2025/08/04/leila-sansour-this-is-not-a-war-between-religions-but-a-brutal-domination-of-one-people-by-another_6744059_23.html,Subscribers only,Leila Sansour,https://img.lemde.fr/2025/08/06/0/0/5500/3666/360/0/95/0/3562b69_upload-1-y2hanrynj9mv-028115.jpg 2x,
Ukraine's commendable democratic pushback against corruption,0,https://www.lemonde.fr/en/opinion/article/2025/08/04/ukraine-s-commendable-democratic-pushback-against-corruption_6744050_23.html,Not premium,Le Monde,https://img.lemde.fr/2025/08/06/0/0/5500/3666/360/0/95/0/3562b69_upload-1-y2hanrynj9mv-028115.jpg 2x,
"A Hiroshima survivor breaks decades of silence: 'Speaking about it could be seen as shameful, for the person or their family'",0,https://www.lemonde.fr/en/m-le-mag/article/2025/08/06/a-hiroshima-survivor-breaks-decades-of-silence-speaking-about-it-could-be-seen-as-shameful-for-the-person-or-their-family_6744103_117.html,Subscribers only,  By  Léocadie Petillot ,https://img.lemde.fr/2025/08/06/0/0/5500/3666/360/0/95/0/3562b69_upload-1-y2hanrynj9mv-028115.jpg 2x,
"China's 'Dalifornia,' a bohemian haven for young people searching for meaning",0,https://www.lemonde.fr/en/m-le-mag/article/2025/08/02/china-s-dalifornia-a-bohemian-haven-for-young-people-searching-for-meaning_6744014_117.html,Subscribers only," By Harold Thibault (Dali (Yunnan), special correspondent) ",https://img.lemde.fr/2025/08/06/0/0/5500/3666/360/0/95/0/3562b69_upload-1-y2hanrynj9mv-028115.jpg 2x,
"Retracing James Baldwin's footsteps in Istanbul, the city that saved his life",0,https://www.lemonde.fr/en/m-le-mag/article/2025/07/27/retracing-james-baldwin-s-footsteps-in-istanbul-the-city-that-saved-his-life_6743763_117.html,Subscribers only, By Nicolas Bourcier (Istanbul (Turkey) correspondent) ,https://img.lemde.fr/2025/08/06/0/0/5500/3666/360/0/95/0/3562b69_upload-1-y2hanrynj9mv-028115.jpg 2x,
Three erotic experiences inspired by… your wardrobe,0,https://www.lemonde.fr/en/m-le-mag/article/2025/07/22/three-erotic-experiences-inspired-by-your-wardrobe_6743593_117.html,Subscribers only,Maïa Mazaurette,https://img.lemde.fr/2025/08/06/0/0/5500/3666/360/0/95/0/3562b69_upload-1-y2hanrynj9mv-028115.jpg 2x,
"At Musée d'Orsay, a Courbet painting gets a new life before visitors' eyes",0,https://www.lemonde.fr/en/culture/article/2025/07/26/at-musee-d-orsay-a-courbet-painting-gets-a-new-life-before-visitors-eyes_6743744_30.html,Subscribers only,  By Max Blanc ,https://img.lemde.fr/2025/08/06/0/0/5500/3666/360/0/95/0/3562b69_upload-1-y2hanrynj9mv-028115.jpg 2x,
Avignon Festival 2025: An edition marked by emotion and fragility,0,https://www.lemonde.fr/en/culture/article/2025/07/26/avignon-festival-2025-an-edition-marked-by-emotion-and-fragility_6743733_30.html,Subscribers only,"  By Fabienne Darge (Avignon, France, special correspondent) ",https://img.lemde.fr/2025/08/06/0/0/5500/3666/360/0/95/0/3562b69_upload-1-y2hanrynj9mv-028115.jpg 2x,
The challenge of surtitling at the Avignon Festival,0,https://www.lemonde.fr/en/culture/article/2025/07/20/the-challenge-of-surtitling-at-the-avignon-festival_6743560_30.html,Subscribers only,  By Calypso Joyeux ,https://img.lemde.fr/2025/08/06/0/0/5500/3666/360/0/95/0/3562b69_upload-1-y2hanrynj9mv-028115.jpg 2x,
"In Arles, Fragonard's Museum of Fashion and Costume gracefully unveils treasures",0,https://www.lemonde.fr/en/m-le-mag/article/2025/07/17/in-arles-fragonard-s-museum-of-fashion-and-costume-gracefully-unveils-treasures_6743450_117.html,Subscribers only, By Litza Georgopoulos ,https://img.lemde.fr/2025/08/06/0/0/5500/3666/360/0/95/0/3562b69_upload-1-y2hanrynj9mv-028115.jpg 2x,
"Back from Gaza, doctors question Europe's torpor: 'Do we still have any humanity left?'",Five doctors and two nurses from France and Switzerland who carried out several humanitarian missions in Gaza since November 2023 spoke to Le Monde about the impossibility of meeting the population's needs and how the experience left a lasting mark on them.,https://www.lemonde.fr/en/international/article/2025/08/06/back-from-gaza-doctors-question-europe-s-torpor-do-we-still-have-any-humanity-left_6744112_4.html,Subscribers only,  By Clothilde Mraffko ,https://img.lemde.fr/2025/08/06/0/0/5500/3666/360/0/95/0/3562b69_upload-1-y2hanrynj9mv-028115.jpg 2x,
Scientists outraged by climate-skeptic report commissioned by Trump administration,0,https://www.lemonde.fr/en/environment/article/2025/08/06/scientists-outraged-by-climate-skeptic-report-commissioned-by-trump-administration_6744121_114.html,Subscribers only,  By Stéphane Foucart ,https://img.lemde.fr/2025/08/06/0/0/5500/3666/360/0/95/0/3562b69_upload-1-y2hanrynj9mv-028115.jpg 2x,
"Eighty years after Hiroshima and Nagasaki bombings, the fight for survivors' memories to live on",0,https://www.lemonde.fr/en/international/article/2025/08/06/eighty-years-after-hiroshima-and-nagasaki-bombings-the-fight-for-survivors-memories-to-live-on_6744110_4.html,Subscribers only,"  By Philippe Mesmer (Hiroshima and Nagasaki, special correspondent) ",https://img.lemde.fr/2025/08/06/0/0/5500/3666/360/0/95/0/3562b69_upload-1-y2hanrynj9mv-028115.jpg 2x,
A tense power-sharing coalition takes shape in Poland,"With the swearing-in of nationalist Karol Nawrocki as president on Wednesday, the center-right prime minister, Donald Tusk, faces the prospect of a particularly contentious working relationship.",https://www.lemonde.fr/en/international/article/2025/08/06/a-tense-power-sharing-coalition-begins-in-poland_6744119_4.html,Subscribers only,  By Hélène Bienvenu (Warsaw (Poland) correspondent) ,https://img.lemde.fr/2025/08/06/0/0/5500/3666/360/0/95/0/3562b69_upload-1-y2hanrynj9mv-028115.jpg 2x,
Israel raises threat of Gaza occupation,"As Benjamin Netanyahu convened a security council meeting on Tuesday, Israeli media discussed the possibility of a larger, even total, occupation of the enclave. This would be a turning point with far-reaching consequences.",https://www.lemonde.fr/en/international/article/2025/08/06/israel-raises-threat-of-gaza-occupation_6744116_4.html,Subscribers only,"  By Luc Bronner (Jerusalem, correspondent) ",https://img.lemde.fr/2025/08/06/0/0/5500/3666/360/0/95/0/3562b69_upload-1-y2hanrynj9mv-028115.jpg 2x,
French man arrested in Slovenia for crimes committed in Croatia during 1991 war,A French citizen originally from the former Yugoslavia has been imprisoned for three months and is facing extradition to Croatia. His lawyers condemned this as a violation of his rights. His family members in France fear 'revenge' for contested events.,https://www.lemonde.fr/en/international/article/2025/08/06/french-man-arrested-in-slovenia-for-crimes-committed-in-croatia-during-1991-war_6744113_4.html,Subscribers only,  By Stéphanie Maupas (The Hague (Netherlands) correspondent) and Richard Schittly (Lyon (France) correspondent) ,https://img.lemde.fr/2025/08/06/0/0/5500/3666/360/0/95/0/3562b69_upload-1-y2hanrynj9mv-028115.jpg 2x,
2026 budget: PM Bayrou stands alone in the spotlight to defend his unpopular measures,"French Prime Minister François Bayrou released a YouTube video on Tuesday titled 'FB Direct.' In the 'direct communication' operation, he amplified the threat of 'overindebtedness,' calling it 'an evil' threat to France's 'survival.'",https://www.lemonde.fr/en/politics/article/2025/08/06/2026-budget-pm-bayrou-stands-alone-in-the-spotlight-to-defend-his-unpopular-measures_6744117_5.html,Subscribers only,  By Mariama Darame ,https://img.lemde.fr/2025/08/06/0/0/5500/3666/360/0/95/0/3562b69_upload-1-y2hanrynj9mv-028115.jpg 2x,In Depth
"Video: Wildfires in southern France kill one person, injure nine",0,https://www.lemonde.fr/en/environment/video/2025/08/06/video-wildfires-in-southern-france-kill-one-person-injure-nine_6744115_114.html,Not premium,  By Le Monde's video desk   ,https://img.lemde.fr/2025/08/06/0/0/5500/3666/360/0/95/0/3562b69_upload-1-y2hanrynj9mv-028115.jpg 2x,
Trump threatens new sanctions as Putin meets US envoy in Moscow,0,https://www.lemonde.fr/en/international/article/2025/08/06/trump-threatens-new-sanctions-as-putin-meets-us-envoy-in-moscow_6744118_4.html,Not premium,Le Monde with AFP,https://img.lemde.fr/2025/08/06/0/0/5500/3666/360/0/95/0/3562b69_upload-1-y2hanrynj9mv-028115.jpg 2x,
Bosnian Serb President Dodik formally ousted after being given one-year jail term,0,https://www.lemonde.fr/en/international/article/2025/08/06/bosnian-serb-president-dodik-formally-ousted-after-being-given-one-year-jail-term_6744120_4.html,Not premium,Le Monde with AFP,https://img.lemde.fr/2025/08/06/0/0/5500/3666/360/0/95/0/3562b69_upload-1-y2hanrynj9mv-028115.jpg 2x,
South Korean prosecutors question ex-first lady accused of graft,0,https://www.lemonde.fr/en/international/article/2025/08/06/south-korean-prosecutors-question-ex-first-lady-accused-of-graft_6744109_4.html,Not premium,Le Monde with AFP,https://img.lemde.fr/2025/08/06/0/0/5500/3666/360/0/95/0/3562b69_upload-1-y2hanrynj9mv-028115.jpg 2x,
Palestinians can now live on only 12% of Gazan territory,0,https://www.lemonde.fr/en/international/video/2025/08/06/palestinians-can-now-live-on-only-12-of-gazan-territory_6744114_4.html,Not premium,"  By Juliette Prigent, Asia Balluffier, Adrien Sahli and Sinead McCausland ",https://img.lemde.fr/2025/08/06/0/0/5500/3666/360/0/95/0/3562b69_upload-1-y2hanrynj9mv-028115.jpg 2x,
Lake Chad residents caught between Boko Haram and rising waters,0,https://www.lemonde.fr/en/le-monde-africa/article/2025/08/06/lake-chad-residents-caught-between-boko-haram-and-rising-waters_6744111_124.html,Not premium,"  By Carol Valade (Lac province [Chad], special correspondent) ",https://img.lemde.fr/2025/08/06/0/0/5500/3666/360/0/95/0/3562b69_upload-1-y2hanrynj9mv-028115.jpg 2x,
Greece is becoming better equipped to fight wildfires,0,https://www.lemonde.fr/en/environment/article/2025/08/06/greece-becoming-better-equipped-to-fight-wildfires_6744104_114.html,Subscribers only,  By Marina Rafenberg (Athens (Greece) correspondent) ,https://img.lemde.fr/2025/08/06/0/0/5500/3666/360/0/95/0/3562b69_upload-1-y2hanrynj9mv-028115.jpg 2x,
RFK Jr. pulls $500 million in funding for vaccine development,0,https://www.lemonde.fr/en/health/article/2025/08/06/rfk-jr-pulls-500-million-in-funding-for-vaccine-development_6744108_14.html,Not premium,Le Monde with AP,https://img.lemde.fr/2025/08/06/0/0/5500/3666/360/0/95/0/3562b69_upload-1-y2hanrynj9mv-028115.jpg 2x,
The calculated return of Kamala Harris after defeat and months of silence,0,https://www.lemonde.fr/en/international/article/2025/08/05/the-calculated-return-of-kamala-harris-after-defeat-and-months-of-silence_6744101_4.html,Subscribers only,  By Corine Lesnes (San Francisco (United States) correspondent) ,https://img.lemde.fr/2025/08/06/0/0/5500/3666/360/0/95/0/3562b69_upload-1-y2hanrynj9mv-028115.jpg 2x,
Will tariffs eventually impact markets?,0,https://www.lemonde.fr/en/money-investments/article/2025/08/06/will-tariffs-eventually-impact-the-markets_6744106_102.html,Subscribers only,  By Aline Fauvarque ,https://img.lemde.fr/2025/08/06/0/0/5500/3666/360/0/95/0/3562b69_upload-1-y2hanrynj9mv-028115.jpg 2x,
Chinese service companies are targeting Brazil,0,https://www.lemonde.fr/en/economy/article/2025/08/06/chinese-service-companies-are-targeting-brazil_6744105_19.html,Subscribers only,"  By Anne-Dominique Correa (Rio de Janeiro, correspondent) ",https://img.lemde.fr/2025/08/06/0/0/5500/3666/360/0/95/0/3562b69_upload-1-y2hanrynj9mv-028115.jpg 2x,
Israeli former security officials urge Trump to help stop the war in Gaza,0,https://www.lemonde.fr/en/international/article/2025/08/05/israeli-former-security-officials-urge-trump-to-help-stop-the-war-in-gaza_6744081_4.html,Subscribers only,"  By Luc Bronner (Jerusalem, special correspondent) ",https://img.lemde.fr/2025/08/06/0/0/5500/3666/360/0/95/0/3562b69_upload-1-y2hanrynj9mv-028115.jpg 2x,
"Eva Nguyen Binh, head of the Institut Français: 'Attacking culture has long-term consequences'","The president of the Institut Français, a French overseas cultural policy actor which has just had its contract renewed, discusses the challenges that cultural diplomacy faces in a time of geopolitical tensions.",https://www.lemonde.fr/en/culture/article/2025/08/05/eva-nguyen-binh-head-of-the-institut-francais-attacking-culture-has-long-term-consequences_6744095_30.html,Subscribers only,  Interview by Guillaume Fraissard ,https://img.lemde.fr/2025/08/06/0/0/5500/3666/360/0/95/0/3562b69_upload-1-y2hanrynj9mv-028115.jpg 2x,Interview
Sydney Sweeney's American Eagle ad sparks controversy online and pleases Donald Trump,"With a slogan playing on the ambiguity between 'genes' and 'jeans' − 'Sydney Sweeney has great jeans' − the actress has sparked controversy. Some have accused her of promoting eugenics, while President Donald Trump has come to American Eagle's defense, triggering a surge in its stock price.",https://www.lemonde.fr/en/international/article/2025/08/05/sydney-sweeney-s-american-eagle-ad-sparks-controversy-online-and-pleases-donald-trump_6744075_4.html,Subscribers only,  By Arnaud Leparmentier (New York (United States) correspondent) ,https://img.lemde.fr/2025/08/06/0/0/5500/3666/360/0/95/0/3562b69_upload-1-y2hanrynj9mv-028115.jpg 2x,News
Agnès Varda's Parisian wanderings at the Musée Carnavalet,"An original exhibition focuses on the artist's relationship with Paris, highlighting her photographic work and her atelier in the 14th arrondissement.",https://www.lemonde.fr/en/culture/article/2025/08/04/agnes-varda-s-parisian-wanderings-at-the-musee-carnavalet_6744067_30.html,Subscribers only,  By Claire Guillot ,https://img.lemde.fr/2025/08/06/0/0/5500/3666/360/0/95/0/3562b69_upload-1-y2hanrynj9mv-028115.jpg 2x,Review
The urgent need to halt plastic pollution,0,https://www.lemonde.fr/en/opinion/article/2025/08/06/the-urgent-need-to-halt-plastic-pollution_6744122_23.html,Not premium,Le Monde,https://img.lemde.fr/2025/08/06/0/0/5500/3666/360/0/95/0/3562b69_upload-1-y2hanrynj9mv-028115.jpg 2x,Editorial
Trade war: 'The Americans are the ones paying for the tariffs',0,https://www.lemonde.fr/en/economy/article/2025/08/03/trade-war-the-americans-are-the-ones-paying-for-the-tariffs_6744025_19.html,Subscribe,  Interview by Eric Albert ,https://img.lemde.fr/2025/08/06/0/0/5500/3666/360/0/95/0/3562b69_upload-1-y2hanrynj9mv-028115.jpg 2x,Interview
Ukraine's commendable democratic pushback against corruption,0,https://www.lemonde.fr/en/opinion/article/2025/08/04/ukraine-s-commendable-democratic-pushback-against-corruption_6744050_23.html,Not premium,Le Monde,https://img.lemde.fr/2025/08/06/0/0/5500/3666/360/0/95/0/3562b69_upload-1-y2hanrynj9mv-028115.jpg 2x,Editorial
