title,subhead,url,suscription,byline,img_url,article_type
Mexican offering pays tribute to the 'victims of Engie',0,https://www.lemonde.fr/en/international/article/2025/11/10/mexican-offering-pays-tribute-to-the-victims-of-engie_6747305_4.html,Subscribers only,  By Anne Vigna (Mexico City (Mexico) correspondent) ,https://img.lemde.fr/2025/11/05/168/0/4032/2688/360/0/95/0/deae92d_upload-1-olrenlrj64ta-img-8570.jpeg 2x,
"US government shutdown: Democrats split in the Senate, paving the way to end budget deadlock",0,https://www.lemonde.fr/en/international/article/2025/11/10/us-government-shutdown-democrats-split-in-the-senate-paving-the-way-to-end-budget-deadlock_6747304_4.html,Subscribers only,  By Nicolas Chapuis (New York (United States) correspondent) ,https://img.lemde.fr/2025/11/05/168/0/4032/2688/360/0/95/0/deae92d_upload-1-olrenlrj64ta-img-8570.jpeg 2x,
Israelis grapple with the unspoken questions of the postwar era,0,https://www.lemonde.fr/en/international/article/2025/11/10/israelis-grapple-with-the-unspoken-questions-of-the-postwar-era_6747301_4.html,Subscribers only,Luc Bronner,https://img.lemde.fr/2025/11/05/168/0/4032/2688/360/0/95/0/deae92d_upload-1-olrenlrj64ta-img-8570.jpeg 2x,
Gang violence deepens Haiti's educational crisis,0,https://www.lemonde.fr/en/international/article/2025/11/10/gang-violence-deepens-haiti-s-educational-crisis_6747295_4.html,Subscribers only," By Jean-Michel Hauteville (Port-au-Prince (Haiti), special correspondent) ",https://img.lemde.fr/2025/11/05/168/0/4032/2688/360/0/95/0/deae92d_upload-1-olrenlrj64ta-img-8570.jpeg 2x,
Latvia: Public mobilization grows in support of treaty for preventing violence against women,0,https://www.lemonde.fr/en/international/article/2025/11/06/in-latvia-public-mobilization-continues-to-grow-in-support-of-the-istanbul-convention-for-preventing-violence-against-women_6747156_4.html,Subscribers only,  By Anne-Françoise Hivert (Malmö (Sweden) correspondent) ,https://img.lemde.fr/2025/11/05/168/0/4032/2688/360/0/95/0/deae92d_upload-1-olrenlrj64ta-img-8570.jpeg 2x,
"After Charlie Kirk's murder, Europe's far right swears allegiance to Trump's politics",0,https://www.lemonde.fr/en/les-decodeurs/article/2025/10/20/the-murder-of-charlie-kirk-how-europe-s-far-right-swore-allegiance-to-trump-s-politics_6746586_8.html,Subscribers only, By Allan Kaval (Rome (Italy) correspondent) and Manon Romain (with Clément Guillou and Le Monde correspondents in Europe) ,https://img.lemde.fr/2025/11/05/168/0/4032/2688/360/0/95/0/deae92d_upload-1-olrenlrj64ta-img-8570.jpeg 2x,
Sanctions against Russia spark rift between US and Europe over China,0,https://www.lemonde.fr/en/international/article/2025/09/15/sanctions-against-russia-spark-rift-between-us-and-europe-over-china_6745411_4.html,Subscribers only,"  By Philippe Jacqué (Brussels, Europe bureau), Philippe Ricard and Harold Thibault (Beijing (China) correspondent) ",https://img.lemde.fr/2025/11/05/168/0/4032/2688/360/0/95/0/deae92d_upload-1-olrenlrj64ta-img-8570.jpeg 2x,
France's political instability puts Franco-German alliance to the test,0,https://www.lemonde.fr/en/opinion/article/2025/08/30/france-s-political-instability-puts-franco-german-alliance-to-the-test_6744873_23.html,Not premium,Le Monde,https://img.lemde.fr/2025/11/05/168/0/4032/2688/360/0/95/0/deae92d_upload-1-olrenlrj64ta-img-8570.jpeg 2x,
French appeals court orders Sarkozy's release from jail,0,https://www.lemonde.fr/en/france/article/2025/11/10/french-appeals-court-to-decide-if-ex-president-sarkozy-can-leave-jail_6747300_7.html,Not premium,Le Monde with AP and AFP,https://img.lemde.fr/2025/11/05/168/0/4032/2688/360/0/95/0/deae92d_upload-1-olrenlrj64ta-img-8570.jpeg 2x,
"France faces younger, less experienced and more unpredictable jihadist threat",0,https://www.lemonde.fr/en/france/article/2025/11/10/france-faces-younger-less-experienced-and-more-unpredictable-jihadist-threat_6747310_7.html,Subscribers only,  By Christophe Ayad ,https://img.lemde.fr/2025/11/05/168/0/4032/2688/360/0/95/0/deae92d_upload-1-olrenlrj64ta-img-8570.jpeg 2x,
"The new malaise of civilization: When words, truth and reality fall apart",0,https://www.lemonde.fr/en/opinion/article/2025/11/09/the-new-malaise-of-civilization-when-words-truth-and-reality-fall-apart_6747290_23.html,Subscribers only, By Nicolas Truong ,https://img.lemde.fr/2025/11/05/168/0/4032/2688/360/0/95/0/deae92d_upload-1-olrenlrj64ta-img-8570.jpeg 2x,
She was hanging from the Bataclan's window. He caught her hand.,0,https://www.lemonde.fr/en/france/article/2025/11/09/she-was-hanging-from-the-bataclan-s-window-and-pregnant-he-caught-her-hand_6747274_7.html,Subscribers only, By Raphaëlle Bacqué ,https://img.lemde.fr/2025/11/05/168/0/4032/2688/360/0/95/0/deae92d_upload-1-olrenlrj64ta-img-8570.jpeg 2x,
Afghanistan: Relentless repression continues over four years into Taliban's rule,0,https://www.lemonde.fr/en/videos/video/2025/10/04/afghanistan-relentless-repression-continues-over-four-years-into-taliban-s-rule_6746092_108.html,Not premium,"  By Chloé Denis, Félix Pommier (Motion design) and Sinead McCausland ",https://img.lemde.fr/2025/11/05/168/0/4032/2688/360/0/95/0/deae92d_upload-1-olrenlrj64ta-img-8570.jpeg 2x,
Watch: Hundreds of thousands march in France against budget cuts,0,https://www.lemonde.fr/en/videos/video/2025/09/19/french-strikes-watch-what-happened-as-hundreds-of-thousands-marched-against-budget-cuts_6745548_108.html,Not premium,  By Le Monde's video desk   ,https://img.lemde.fr/2025/11/05/168/0/4032/2688/360/0/95/0/deae92d_upload-1-olrenlrj64ta-img-8570.jpeg 2x,
Emmys 2025: 'Adolescence' star Owen Cooper becomes youngest winner for best supporting actor,0,https://www.lemonde.fr/en/videos/video/2025/09/15/emmys-2025-adolescence-star-owen-cooper-becomes-youngest-winner-for-best-supporting-actor_6745427_108.html,Not premium,  By Le Monde's video desk   ,https://img.lemde.fr/2025/11/05/168/0/4032/2688/360/0/95/0/deae92d_upload-1-olrenlrj64ta-img-8570.jpeg 2x,
"From 'influence peddling' to 'corruption,' what is French Culture Minister Rachida Dati accused of?",0,https://www.lemonde.fr/en/videos/video/2025/09/06/from-influence-peddling-to-corruption-what-is-french-culture-minister-rachida-dati-accused-of_6745094_108.html,Not premium,"  By Alexis Tromas, Arthur Navet  and Sinead McCausland ",https://img.lemde.fr/2025/11/05/168/0/4032/2688/360/0/95/0/deae92d_upload-1-olrenlrj64ta-img-8570.jpeg 2x,
"The new malaise of civilization: When words, truth and reality fall apart",0,https://www.lemonde.fr/en/opinion/article/2025/11/09/the-new-malaise-of-civilization-when-words-truth-and-reality-fall-apart_6747290_23.html,Subscribers only, By Nicolas Truong ,https://img.lemde.fr/2025/11/05/168/0/4032/2688/360/0/95/0/deae92d_upload-1-olrenlrj64ta-img-8570.jpeg 2x,
The urgent need to lift sanctions against Syria,0,https://www.lemonde.fr/en/opinion/article/2025/11/10/the-urgent-need-to-lift-sanctions-against-syria_6747307_23.html,Not premium,Le Monde,https://img.lemde.fr/2025/11/05/168/0/4032/2688/360/0/95/0/deae92d_upload-1-olrenlrj64ta-img-8570.jpeg 2x,
'Striking down Trump's tariffs would make the rule of law prevail over the law of the jungle',0,https://www.lemonde.fr/en/opinion/article/2025/11/10/striking-down-trump-s-tariffs-would-make-the-rule-of-law-prevail-over-the-law-of-the-jungle_6747298_23.html,Subscribers only,Stéphane Lauer,https://img.lemde.fr/2025/11/05/168/0/4032/2688/360/0/95/0/deae92d_upload-1-olrenlrj64ta-img-8570.jpeg 2x,
'Paris's inaction after French journalist Antoni Lallican was killed by a Russian drone raises questions',0,https://www.lemonde.fr/en/opinion/article/2025/11/09/paris-s-inaction-after-french-journalist-antoni-lallican-was-killed-by-a-russian-drone-raises-questions_6747282_23.html,Subscribers only,Aïda Belloulid,https://img.lemde.fr/2025/11/05/168/0/4032/2688/360/0/95/0/deae92d_upload-1-olrenlrj64ta-img-8570.jpeg 2x,
"L'Arrêt by The Grey, an American bistro in Paris",0,https://www.lemonde.fr/en/m-le-mag/article/2025/11/10/l-arret-by-the-grey-an-american-bistro-in-paris_6747294_117.html,Subscribers only,  By Léo Bourdin ,https://img.lemde.fr/2025/11/05/168/0/4032/2688/360/0/95/0/deae92d_upload-1-olrenlrj64ta-img-8570.jpeg 2x,
Life after terror for France's most famous prosecutor,0,https://www.lemonde.fr/en/m-le-mag/article/2025/11/08/life-after-terror-for-france-s-most-famous-prosecutor_6747264_117.html,Subscribers only, By Laure Marchand ,https://img.lemde.fr/2025/11/05/168/0/4032/2688/360/0/95/0/deae92d_upload-1-olrenlrj64ta-img-8570.jpeg 2x,
"What one trillion dollars means, according to Le Monde",0,https://www.lemonde.fr/en/m-le-mag/article/2025/11/08/what-one-trillion-dollars-means-according-to-le-monde_6747247_117.html,Subscribers only,Benoît Hopquin,https://img.lemde.fr/2025/11/05/168/0/4032/2688/360/0/95/0/deae92d_upload-1-olrenlrj64ta-img-8570.jpeg 2x,
Marlene Dumas becomes first contemporary woman artist in Louvre's permanent collection,0,https://www.lemonde.fr/en/m-le-mag/article/2025/11/07/marlene-dumas-becomes-first-contemporary-woman-to-join-the-louvre-s-permanent-collection_6747215_117.html,Subscribers only, By Clément Ghys ,https://img.lemde.fr/2025/11/05/168/0/4032/2688/360/0/95/0/deae92d_upload-1-olrenlrj64ta-img-8570.jpeg 2x,
"L'Arrêt by The Grey, an American bistro in Paris",0,https://www.lemonde.fr/en/m-le-mag/article/2025/11/10/l-arret-by-the-grey-an-american-bistro-in-paris_6747294_117.html,Subscribers only,  By Léo Bourdin ,https://img.lemde.fr/2025/11/05/168/0/4032/2688/360/0/95/0/deae92d_upload-1-olrenlrj64ta-img-8570.jpeg 2x,
"Three historical walks in Paris, in the footsteps of the French Revolution",0,https://www.lemonde.fr/en/intimacy/article/2025/11/07/three-historical-walks-in-paris-in-the-footsteps-of-the-french-revolution_6747207_310.html,Subscribers only,  By Yoanna Sultan-R'bibo ,https://img.lemde.fr/2025/11/05/168/0/4032/2688/360/0/95/0/deae92d_upload-1-olrenlrj64ta-img-8570.jpeg 2x,
The Orient Express pulls up in Paris: An opulent journey into the 1920s,0,https://www.lemonde.fr/en/lifestyle/article/2025/11/02/the-orient-express-pulls-up-in-paris-an-opulent-journey-into-the-1920s_6747014_37.html,Subscribers only, By Valentin Pérez ,https://img.lemde.fr/2025/11/05/168/0/4032/2688/360/0/95/0/deae92d_upload-1-olrenlrj64ta-img-8570.jpeg 2x,
Twelve artistic happenings to catch outside Art Basel Paris,0,https://www.lemonde.fr/en/culture/article/2025/10/24/twelve-artistic-happenings-to-catch-outside-art-basel-paris_6746743_30.html,Subscribers only,"  By Roxana Azimi, Philippe Dagen, Claire Guillot, Emmanuelle Jardonnet, Sylvie Kerviel and Emmanuelle Lequeux ",https://img.lemde.fr/2025/11/05/168/0/4032/2688/360/0/95/0/deae92d_upload-1-olrenlrj64ta-img-8570.jpeg 2x,
French appeals court orders Sarkozy's release from jail,"A Paris appeals court decided that the former French president will be released from prison and placed under judicial supervision, pending an appeals trial over Libyan funding due to take place in March.",https://www.lemonde.fr/en/france/article/2025/11/10/french-appeals-court-to-decide-if-ex-president-sarkozy-can-leave-jail_6747300_7.html,Subscribers only,Le Monde with AP and AFP,https://img.lemde.fr/2025/11/05/168/0/4032/2688/360/0/95/0/deae92d_upload-1-olrenlrj64ta-img-8570.jpeg 2x,
"US government shutdown: Democrats split in the Senate, paving the way to end budget deadlock",0,https://www.lemonde.fr/en/international/article/2025/11/10/us-government-shutdown-democrats-split-in-the-senate-paving-the-way-to-end-budget-deadlock_6747304_4.html,Subscribers only,  By Nicolas Chapuis (New York (United States) correspondent) ,https://img.lemde.fr/2025/11/05/168/0/4032/2688/360/0/95/0/deae92d_upload-1-olrenlrj64ta-img-8570.jpeg 2x,
"Trump pardons Giuliani, allies accused of attempting to overturn 2020 election",0,https://www.lemonde.fr/en/international/article/2025/11/10/trump-pardons-giuliani-allies-accused-of-attempting-to-overturn-2020-election_6747309_4.html,Not premium,Le Monde with AFP,https://img.lemde.fr/2025/11/05/168/0/4032/2688/360/0/95/0/deae92d_upload-1-olrenlrj64ta-img-8570.jpeg 2x,
"Among France's centrists, Macron's succession is still anyone's game","A year and a half ahead of the 2027 presidential election, no 'natural' candidate has managed to dominate the fractured former majority coalition. Edouard Philippe, the only declared candidate, has distanced himself from Emmanuel Macron, while Gabriel Attal has held back.",https://www.lemonde.fr/en/politics/article/2025/11/10/among-france-s-centrists-macron-s-succession-is-still-anyone-s-game_6747297_5.html,Subscribers only,  By Marie Pouzadoux ,https://img.lemde.fr/2025/11/05/168/0/4032/2688/360/0/95/0/deae92d_upload-1-olrenlrj64ta-img-8570.jpeg 2x,
BBC says Trump threatens to sue over speech-editing controversy,"The British Broadcasting Corporation said Monday it was reviewing a letter in which United States President Donald Trump threatened legal action over the editing of a speech he delivered in the hours prior to the assault on the Capital in Washington of January 6, 2021.",https://www.lemonde.fr/en/international/article/2025/11/10/bbc-says-trump-threatens-to-sue-over-speech-editing-controversy_6747313_4.html,Not premium,Le Monde with AP,https://img.lemde.fr/2025/11/05/168/0/4032/2688/360/0/95/0/deae92d_upload-1-olrenlrj64ta-img-8570.jpeg 2x,
Israelis grapple with the unspoken questions of the postwar era,"As the 2026 legislative elections approach, Israeli society faces deep divisions between an increasingly security-focused far right and a left tempted by emigration.",https://www.lemonde.fr/en/international/article/2025/11/10/israelis-grapple-with-the-unspoken-questions-of-the-postwar-era_6747301_4.html,Subscribers only,Luc Bronner,https://img.lemde.fr/2025/11/05/168/0/4032/2688/360/0/95/0/deae92d_upload-1-olrenlrj64ta-img-8570.jpeg 2x,
"France faces younger, less experienced and more unpredictable jihadist threat","Nearly 70% of terrorism-related arrests now involve people under 21, and two-thirds of attackers since 2020 were previously unknown to authorities. Since October 7, 2023, over half of all attacks or foiled plots have been linked to the war in Gaza.",https://www.lemonde.fr/en/france/article/2025/11/10/france-faces-younger-less-experienced-and-more-unpredictable-jihadist-threat_6747310_7.html,Subscribers only,  By Christophe Ayad ,https://img.lemde.fr/2025/11/05/168/0/4032/2688/360/0/95/0/deae92d_upload-1-olrenlrj64ta-img-8570.jpeg 2x,In Depth
Four charged over protest of Israeli orchestra concert in France,0,https://www.lemonde.fr/en/france/article/2025/11/09/four-charged-over-protest-of-israeli-orchestra-concert-in-france_6747288_7.html,Not premium,Le Monde with AFP,https://img.lemde.fr/2025/11/05/168/0/4032/2688/360/0/95/0/deae92d_upload-1-olrenlrj64ta-img-8570.jpeg 2x,
"Neves saves the day for PSG, who return to top of Ligue 1",0,https://www.lemonde.fr/en/sports/article/2025/11/09/neves-saves-the-day-for-psg-who-return-to-top-of-ligue-1_6747292_9.html,Not premium,Le Monde with AFP,https://img.lemde.fr/2025/11/05/168/0/4032/2688/360/0/95/0/deae92d_upload-1-olrenlrj64ta-img-8570.jpeg 2x,
Germany asks Algiers to pardon Franco-Algerian writer Boualem Sansal,0,https://www.lemonde.fr/en/international/article/2025/11/10/germany-asks-algiers-to-pardon-franco-algerian-writer-boualem-sansal_6747308_4.html,Not premium,Le Monde with AFP,https://img.lemde.fr/2025/11/05/168/0/4032/2688/360/0/95/0/deae92d_upload-1-olrenlrj64ta-img-8570.jpeg 2x,
France probes plot linked to jailed jihadist's ex-girlfriend,0,https://www.lemonde.fr/en/police-and-justice/article/2025/11/10/france-probes-plot-linked-to-jailed-jihadist-s-ex-girlfriend_6747312_105.html,Not premium,Le Monde with AFP,https://img.lemde.fr/2025/11/05/168/0/4032/2688/360/0/95/0/deae92d_upload-1-olrenlrj64ta-img-8570.jpeg 2x,
Gang violence deepens Haiti's educational crisis,0,https://www.lemonde.fr/en/international/article/2025/11/10/gang-violence-deepens-haiti-s-educational-crisis_6747295_4.html,Subscribers only," By Jean-Michel Hauteville (Port-au-Prince (Haiti), special correspondent) ",https://img.lemde.fr/2025/11/05/168/0/4032/2688/360/0/95/0/deae92d_upload-1-olrenlrj64ta-img-8570.jpeg 2x,
South Korea indicts ex-president Yoon for aiding enemy,0,https://www.lemonde.fr/en/international/article/2025/11/10/south-korea-indicts-ex-president-yoon-for-aiding-enemy_6747299_4.html,Not premium,Le Monde with AFP,https://img.lemde.fr/2025/11/05/168/0/4032/2688/360/0/95/0/deae92d_upload-1-olrenlrj64ta-img-8570.jpeg 2x,
Mexican offering pays tribute to the 'victims of Engie',0,https://www.lemonde.fr/en/international/article/2025/11/10/mexican-offering-pays-tribute-to-the-victims-of-engie_6747305_4.html,Subscribers only,  By Anne Vigna (Mexico City (Mexico) correspondent) ,https://img.lemde.fr/2025/11/05/168/0/4032/2688/360/0/95/0/deae92d_upload-1-olrenlrj64ta-img-8570.jpeg 2x,
Hors-Studio: The French duo transforming waste into design,0,https://www.lemonde.fr/en/lifestyle/article/2025/11/10/hors-studio-the-french-duo-transforming-waste-into-design_6747296_37.html,Subscribers only,  By Véronique Lorelle ,https://img.lemde.fr/2025/11/05/168/0/4032/2688/360/0/95/0/deae92d_upload-1-olrenlrj64ta-img-8570.jpeg 2x,
"L'Arrêt by The Grey, an American bistro in Paris",0,https://www.lemonde.fr/en/m-le-mag/article/2025/11/10/l-arret-by-the-grey-an-american-bistro-in-paris_6747294_117.html,Subscribers only,  By Léo Bourdin ,https://img.lemde.fr/2025/11/05/168/0/4032/2688/360/0/95/0/deae92d_upload-1-olrenlrj64ta-img-8570.jpeg 2x,
Elysée hopeful Xavier Bertrand wants conservatives to steer clear of far right,0,https://www.lemonde.fr/en/politics/article/2025/11/09/elysee-hopeful-xavier-bertrand-wants-conservatives-to-steer-clear-of-far-right_6747285_5.html,Subscribers only,  By Alexandre Pedro ,https://img.lemde.fr/2025/11/05/168/0/4032/2688/360/0/95/0/deae92d_upload-1-olrenlrj64ta-img-8570.jpeg 2x,
The rise of 'crypto bros' and neoliberalism in France's business schools,0,https://www.lemonde.fr/en/campus/article/2025/11/09/the-rise-of-crypto-bros-and-neoliberalism-in-france-s-business-schools_6747289_11.html,Subscribers only,  By Nastasia Hadjadji ,https://img.lemde.fr/2025/11/05/168/0/4032/2688/360/0/95/0/deae92d_upload-1-olrenlrj64ta-img-8570.jpeg 2x,
"Jean-François Bayart, sociologist: 'Gen Z embodies an ambivalent protest'",0,https://www.lemonde.fr/en/international/article/2025/11/09/jean-francois-bayart-sociologist-gen-z-embodies-an-ambivalent-protest_6747283_4.html,Subscribers only,  Interview by Frédéric Bobin   ,https://img.lemde.fr/2025/11/05/168/0/4032/2688/360/0/95/0/deae92d_upload-1-olrenlrj64ta-img-8570.jpeg 2x,
She was hanging from the Bataclan's window. He caught her hand.,"Sébastien and Charlotte should never have met. Yet their lives have been inextricably linked since a tragic night in November 2015, when the young man saved the pregnant woman clinging to a window ledge as they both tried to escape the terrorists.",https://www.lemonde.fr/en/france/article/2025/11/09/she-was-hanging-from-the-bataclan-s-window-and-pregnant-he-caught-her-hand_6747274_7.html,Subscribers only, By Raphaëlle Bacqué ,https://img.lemde.fr/2025/11/05/168/0/4032/2688/360/0/95/0/deae92d_upload-1-olrenlrj64ta-img-8570.jpeg 2x,Long Read
"What is left of Yitzhak Rabin's legacy, 30 years after his assassination?","Benjamin Netanyahu has methodically dismantled the policies of the Labor prime minister who was assassinated by a far-right activist on November 4, 1995, blaming him in particular for signing the Oslo Accords.",https://www.lemonde.fr/en/opinion/article/2025/11/09/what-is-left-of-yitzhak-rabin-s-legacy-30-years-after-his-assassination_6747276_23.html,Subscribers only,Jean-Pierre Filiu,https://img.lemde.fr/2025/11/05/168/0/4032/2688/360/0/95/0/deae92d_upload-1-olrenlrj64ta-img-8570.jpeg 2x,Column
The Donetsk wedding of two devoted Kremlin propagandists,"Ekaterina Mizoulina and Yaroslav Dronov exchanged wedding rings on Wednesday in the heart of the Ukrainian region annexed by Russia. The images were widely circulated, reinforcing the patriotic message of Vladimir Putin's regime.",https://www.lemonde.fr/en/international/article/2025/11/09/the-donetsk-wedding-of-two-devoted-kremlin-propagandists_6747268_4.html,Subscribers only,  By Benjamin Quénelle ,https://img.lemde.fr/2025/11/05/168/0/4032/2688/360/0/95/0/deae92d_upload-1-olrenlrj64ta-img-8570.jpeg 2x,News
The urgent need to lift sanctions against Syria,0,https://www.lemonde.fr/en/opinion/article/2025/11/10/the-urgent-need-to-lift-sanctions-against-syria_6747307_23.html,Not premium,Le Monde,https://img.lemde.fr/2025/11/05/168/0/4032/2688/360/0/95/0/deae92d_upload-1-olrenlrj64ta-img-8570.jpeg 2x,Editorial
The dangerous game being played by France's right-wing leaders,0,https://www.lemonde.fr/en/opinion/article/2025/11/09/rn-the-dangerous-game-being-played-by-right-wing-leaders_6747281_23.html,Not premium,Le Monde,https://img.lemde.fr/2025/11/05/168/0/4032/2688/360/0/95/0/deae92d_upload-1-olrenlrj64ta-img-8570.jpeg 2x,Editorial
"'With Grokipedia, AI will be trained using the world as Elon Musk describes, perceives and desires it'",0,https://www.lemonde.fr/en/opinion/article/2025/11/08/with-grokipedia-ai-will-be-trained-using-the-world-as-elon-musk-describes-perceives-and-desires-it_6747249_23.html,Subscribe,Julien Malaurent,https://img.lemde.fr/2025/11/05/168/0/4032/2688/360/0/95/0/deae92d_upload-1-olrenlrj64ta-img-8570.jpeg 2x,Op-Ed
