title,subhead,url,suscription,byline,img_url,article_type
Serbia's protest movement spreads to small towns,0,https://www.lemonde.fr/en/international/article/2025/08/23/serbia-s-protest-movement-spreads-to-small-towns_6744655_4.html,Subscribers only," By Jean-Baptiste Chastand (Pancevo, Valjevo (Serbia), special correspondent) ",https://img.lemde.fr/2025/08/22/0/0/4000/2666/360/0/95/0/a32dd1b_upload-1-9dpdh4mm34av-valjevo-serbia-protests-38.jpg 2x,
Mali arrests French intelligence officer despite diplomatic immunity,0,https://www.lemonde.fr/en/international/article/2025/08/23/mali-arrests-french-intelligence-officer-despite-diplomatic-immunity_6744654_4.html,Subscribers only,  By Jacques Follorou ,https://img.lemde.fr/2025/08/22/0/0/4000/2666/360/0/95/0/a32dd1b_upload-1-9dpdh4mm34av-valjevo-serbia-protests-38.jpg 2x,
"For Israel, UN recognition of Gaza famine is a diplomatic and legal setback",0,https://www.lemonde.fr/en/international/article/2025/08/23/for-israel-un-recognition-of-gaza-famine-is-a-diplomatic-and-legal-setback_6744653_4.html,Subscribers only,  By Philippe Ricard ,https://img.lemde.fr/2025/08/22/0/0/4000/2666/360/0/95/0/a32dd1b_upload-1-9dpdh4mm34av-valjevo-serbia-protests-38.jpg 2x,
"Paris summons Italian ambassador after Salvini criticizes Macron,",0,https://www.lemonde.fr/en/international/article/2025/08/23/after-an-attack-by-matteo-salvini-paris-summons-italian-ambassador_6744651_4.html,Subscribers only,  By Allan Kaval (Rome (Italy) correspondent) ,https://img.lemde.fr/2025/08/22/0/0/4000/2666/360/0/95/0/a32dd1b_upload-1-9dpdh4mm34av-valjevo-serbia-protests-38.jpg 2x,
France faces prospect of paying higher borrowing costs than Italy,0,https://www.lemonde.fr/en/economy/article/2025/08/19/france-faces-prospect-of-paying-higher-borrowing-costs-than-italy_6744519_19.html,Subscribers only,  By Denis Cosnard and Allan Kaval (Rome (Italy) correspondent) ,https://img.lemde.fr/2025/08/22/0/0/4000/2666/360/0/95/0/a32dd1b_upload-1-9dpdh4mm34av-valjevo-serbia-protests-38.jpg 2x,
French man arrested in Slovenia for crimes committed in Croatia during 1991 war,0,https://www.lemonde.fr/en/international/article/2025/08/06/french-man-arrested-in-slovenia-for-crimes-committed-in-croatia-during-1991-war_6744113_4.html,Subscribers only,  By Stéphanie Maupas (The Hague (Netherlands) correspondent) and Richard Schittly (Lyon (France) correspondent) ,https://img.lemde.fr/2025/08/22/0/0/4000/2666/360/0/95/0/a32dd1b_upload-1-9dpdh4mm34av-valjevo-serbia-protests-38.jpg 2x,
"30 years after the Bosnian War, its refugees still cannot return home",0,https://www.lemonde.fr/en/international/article/2025/08/03/thirty-years-after-the-bosnian-war-its-refugees-still-cannot-return-home_6744026_4.html,Subscribers only," By Jean-Baptiste Chastand (Visegrad, Bosnia and Herzegovina, special correspondent) ",https://img.lemde.fr/2025/08/22/0/0/4000/2666/360/0/95/0/a32dd1b_upload-1-9dpdh4mm34av-valjevo-serbia-protests-38.jpg 2x,
Early and intense wildfire season has arrived around the Mediterranean,0,https://www.lemonde.fr/en/europe/article/2025/07/17/wildfire-season-arrives-early-and-intense-around-the-mediterranean_6743466_143.html,Subscribers only,"  By Maryline Baumard, Olivier Bonnel (Rome, correspondent), Nicolas Bourcier (Istanbul (Turkey) correspondent), Isabelle Piquer (Madrid (Spain) correspondent), Marina Rafenberg (Athens (Greece) correspondent) and Hélène Sallon (Beirut (Lebanon) correspondent) ",https://img.lemde.fr/2025/08/22/0/0/4000/2666/360/0/95/0/a32dd1b_upload-1-9dpdh4mm34av-valjevo-serbia-protests-38.jpg 2x,
Judges uphold French mayor's ban on panhandling despite protests from advocacy groups,0,https://www.lemonde.fr/en/france/article/2025/08/23/judges-uphold-french-mayor-s-ban-on-panhandling-despite-protests-from-advocacy-groups_6744636_7.html,Subscribers only,"  By Dounia Dimou (Nevers, special correspondent) ",https://img.lemde.fr/2025/08/22/0/0/4000/2666/360/0/95/0/a32dd1b_upload-1-9dpdh4mm34av-valjevo-serbia-protests-38.jpg 2x,
"From Brittany to the Alps, French cities restrict holiday homes",0,https://www.lemonde.fr/en/france/article/2025/08/23/from-brittany-to-the-alps-french-cities-restrict-holiday-homes_6744657_7.html,Subscribers only,  By Véronique Chocron ,https://img.lemde.fr/2025/08/22/0/0/4000/2666/360/0/95/0/a32dd1b_upload-1-9dpdh4mm34av-valjevo-serbia-protests-38.jpg 2x,
French streamer's death not due to blow inflicted by another as the investigation continues,0,https://www.lemonde.fr/en/france/article/2025/08/22/french-streamer-s-death-not-due-to-blow-inflicted-by-another-as-the-investigation-continues_6744609_7.html,Subscribers only,  By Jérôme Lefilliâtre ,https://img.lemde.fr/2025/08/22/0/0/4000/2666/360/0/95/0/a32dd1b_upload-1-9dpdh4mm34av-valjevo-serbia-protests-38.jpg 2x,
Man arrested in Seine bodies investigation,0,https://www.lemonde.fr/en/france/article/2025/08/20/man-arrested-in-seine-bodies-investigation_6744552_7.html,Not premium,  By Soren Seelow ,https://img.lemde.fr/2025/08/22/0/0/4000/2666/360/0/95/0/a32dd1b_upload-1-9dpdh4mm34av-valjevo-serbia-protests-38.jpg 2x,
Watch: Tsunami warnings sound in Japan after 8.8 magnitude quake off Russian coast,0,https://www.lemonde.fr/en/videos/video/2025/07/30/watch-tsunami-warnings-sound-in-japan-after-8-8-magnitude-quake-off-russian-coast_6743900_108.html,Not premium,No byline,https://img.lemde.fr/2025/08/22/0/0/4000/2666/360/0/95/0/a32dd1b_upload-1-9dpdh4mm34av-valjevo-serbia-protests-38.jpg 2x,
What is France's 'Black code' and why hasn't it been repealed?,0,https://www.lemonde.fr/en/videos/video/2025/05/31/what-is-france-s-black-code-and-why-hasn-t-it-been-repealed_6741860_108.html,Not premium,"  By Chloé Denis, Olivier Escher (motion design) and Diana Liu ",https://img.lemde.fr/2025/08/22/0/0/4000/2666/360/0/95/0/a32dd1b_upload-1-9dpdh4mm34av-valjevo-serbia-protests-38.jpg 2x,
How was the European Union created?,0,https://www.lemonde.fr/en/videos/video/2025/05/29/how-was-the-european-union-created_6741795_108.html,Not premium,"  By Alexis Tromas, Robin Gasser (motion design) and Diana Liu ",https://img.lemde.fr/2025/08/22/0/0/4000/2666/360/0/95/0/a32dd1b_upload-1-9dpdh4mm34av-valjevo-serbia-protests-38.jpg 2x,
Glide bombs: Russia's secret to making cheap weapons,0,https://www.lemonde.fr/en/videos/video/2025/05/25/glide-bombs-russia-s-secret-to-making-cheap-weapons_6741646_108.html,Subscribers only,"  By Thomas Eydoux, Marceau Bretonnier and Sinead McCausland ",https://img.lemde.fr/2025/08/22/0/0/4000/2666/360/0/95/0/a32dd1b_upload-1-9dpdh4mm34av-valjevo-serbia-protests-38.jpg 2x,
Ukraine must 'turn time to its advantage' against Putin,0,https://www.lemonde.fr/en/opinion/article/2025/08/23/ukraine-must-turn-time-to-its-advantage-against-putin_6744638_23.html,Subscribers only,Elie Tenenbaum,https://img.lemde.fr/2025/08/22/0/0/4000/2666/360/0/95/0/a32dd1b_upload-1-9dpdh4mm34av-valjevo-serbia-protests-38.jpg 2x,
Global South: Trump is playing into China's hands,0,https://www.lemonde.fr/en/opinion/article/2025/08/23/global-south-trump-is-playing-into-china-s-hands_6744648_23.html,Not premium,Le Monde,https://img.lemde.fr/2025/08/22/0/0/4000/2666/360/0/95/0/a32dd1b_upload-1-9dpdh4mm34av-valjevo-serbia-protests-38.jpg 2x,
"French streamer's death: Dying live, a lucrative scandal",0,https://www.lemonde.fr/en/opinion/article/2025/08/22/french-streamer-s-on-air-death-was-a-lucrative-scandal_6744617_23.html,Not premium,Le Monde,https://img.lemde.fr/2025/08/22/0/0/4000/2666/360/0/95/0/a32dd1b_upload-1-9dpdh4mm34av-valjevo-serbia-protests-38.jpg 2x,
Violence against women: 'France would benefit from implementing a unified policy under a specialized prosecutor's office',0,https://www.lemonde.fr/en/opinion/article/2025/08/21/violence-against-women-france-would-benefit-from-implementing-a-unified-policy-under-a-specialized-prosecutor-s-office_6744582_23.html,Subscribers only,Vanessa Bousardo,https://img.lemde.fr/2025/08/22/0/0/4000/2666/360/0/95/0/a32dd1b_upload-1-9dpdh4mm34av-valjevo-serbia-protests-38.jpg 2x,
Soviet-era relics in Kazakhstan rescued from ruin,0,https://www.lemonde.fr/en/m-le-mag/article/2025/08/17/soviet-era-relics-in-kazakhstan-rescued-from-ruin_6744459_117.html,Subscribers only,  By Emma Collet ,https://img.lemde.fr/2025/08/22/0/0/4000/2666/360/0/95/0/a32dd1b_upload-1-9dpdh4mm34av-valjevo-serbia-protests-38.jpg 2x,
Chinese Hollywood races to cash in on minidramas boom,0,https://www.lemonde.fr/en/m-le-mag/article/2025/08/17/chinese-hollywood-races-to-cash-in-on-the-minidramas-boom_6744449_117.html,Subscribers only,"  By Harold Thibault (Hengdian, special correspondent) ",https://img.lemde.fr/2025/08/22/0/0/4000/2666/360/0/95/0/a32dd1b_upload-1-9dpdh4mm34av-valjevo-serbia-protests-38.jpg 2x,
"A winemaker, his daughter and a vintage for their undocumented workers",0,https://www.lemonde.fr/en/m-le-mag/article/2025/08/15/a-winemaker-his-daughter-and-a-vintage-for-their-undocumented-workers_6744410_117.html,Subscribers only,  By Laure Marchand ,https://img.lemde.fr/2025/08/22/0/0/4000/2666/360/0/95/0/a32dd1b_upload-1-9dpdh4mm34av-valjevo-serbia-protests-38.jpg 2x,
Gaza: A few notes of beauty amid the devastation,0,https://www.lemonde.fr/en/m-le-mag/article/2025/08/11/in-gaza-a-few-notes-of-beauty-amid-the-devastation_6744255_117.html,Subscribers only,"  By Lucas Minisini (Tel Aviv, special correspondent) ",https://img.lemde.fr/2025/08/22/0/0/4000/2666/360/0/95/0/a32dd1b_upload-1-9dpdh4mm34av-valjevo-serbia-protests-38.jpg 2x,
"At Musée d'Orsay, a Courbet painting gets a new life before visitors' eyes",0,https://www.lemonde.fr/en/culture/article/2025/07/26/at-musee-d-orsay-a-courbet-painting-gets-a-new-life-before-visitors-eyes_6743744_30.html,Subscribers only,  By Max Blanc ,https://img.lemde.fr/2025/08/22/0/0/4000/2666/360/0/95/0/a32dd1b_upload-1-9dpdh4mm34av-valjevo-serbia-protests-38.jpg 2x,
Avignon Festival 2025: An edition marked by emotion and fragility,0,https://www.lemonde.fr/en/culture/article/2025/07/26/avignon-festival-2025-an-edition-marked-by-emotion-and-fragility_6743733_30.html,Subscribers only,"  By Fabienne Darge (Avignon, France, special correspondent) ",https://img.lemde.fr/2025/08/22/0/0/4000/2666/360/0/95/0/a32dd1b_upload-1-9dpdh4mm34av-valjevo-serbia-protests-38.jpg 2x,
The challenge of surtitling at the Avignon Festival,0,https://www.lemonde.fr/en/culture/article/2025/07/20/the-challenge-of-surtitling-at-the-avignon-festival_6743560_30.html,Subscribers only,  By Calypso Joyeux ,https://img.lemde.fr/2025/08/22/0/0/4000/2666/360/0/95/0/a32dd1b_upload-1-9dpdh4mm34av-valjevo-serbia-protests-38.jpg 2x,
"In Arles, Fragonard's Museum of Fashion and Costume gracefully unveils treasures",0,https://www.lemonde.fr/en/m-le-mag/article/2025/07/17/in-arles-fragonard-s-museum-of-fashion-and-costume-gracefully-unveils-treasures_6743450_117.html,Subscribers only, By Litza Georgopoulos ,https://img.lemde.fr/2025/08/22/0/0/4000/2666/360/0/95/0/a32dd1b_upload-1-9dpdh4mm34av-valjevo-serbia-protests-38.jpg 2x,
The mysteries of actress Isabelle Adjani's vocation,"'Adjani, The Famous Stranger' (1/6). Nothing seemed to predestine her to become one of the greatest stars of French cinema. Yet the young actress, born to an Algerian father and a German mother, experienced a meteoric rise. She made her debut on stage at barely 17 years old and quickly transitioned to film.",https://www.lemonde.fr/en/summer-reads/article/2025/08/23/the-mysteries-of-actress-isabelle-adjani-s-vocation_6744641_183.html,Subscribers only, By Samuel Blumenfeld ,https://img.lemde.fr/2025/08/22/0/0/4000/2666/360/0/95/0/a32dd1b_upload-1-9dpdh4mm34av-valjevo-serbia-protests-38.jpg 2x,
"For Israel, UN recognition of Gaza famine is a diplomatic and legal setback",0,https://www.lemonde.fr/en/international/article/2025/08/23/for-israel-un-recognition-of-gaza-famine-is-a-diplomatic-and-legal-setback_6744653_4.html,Subscribers only,  By Philippe Ricard ,https://img.lemde.fr/2025/08/22/0/0/4000/2666/360/0/95/0/a32dd1b_upload-1-9dpdh4mm34av-valjevo-serbia-protests-38.jpg 2x,
Global South: Trump is playing into China's hands,0,https://www.lemonde.fr/en/opinion/article/2025/08/23/global-south-trump-is-playing-into-china-s-hands_6744648_23.html,Not premium,Le Monde,https://img.lemde.fr/2025/08/22/0/0/4000/2666/360/0/95/0/a32dd1b_upload-1-9dpdh4mm34av-valjevo-serbia-protests-38.jpg 2x,Editorial
Serbia's protest movement spreads to small towns,"The anti-corruption movement that began in universities in November 2024 is spreading. In Valjevo, law enforcement officers beat and arrested protesters while masked men, apparently sent by those in power, ransacked businesses owned by President Aleksandar Vucic's opponents.",https://www.lemonde.fr/en/international/article/2025/08/23/serbia-s-protest-movement-spreads-to-small-towns_6744655_4.html,Subscribers only," By Jean-Baptiste Chastand (Pancevo, Valjevo (Serbia), special correspondent) ",https://img.lemde.fr/2025/08/22/0/0/4000/2666/360/0/95/0/a32dd1b_upload-1-9dpdh4mm34av-valjevo-serbia-protests-38.jpg 2x,
Spike in suspicious incidents in Iran fuels fears of a simmering war,"Iranians remain on edge two months after the end of the 12-day war, worried about renewed fighting with Israel and burdened by inflation and water and power shortages.",https://www.lemonde.fr/en/middle-east-crisis/article/2025/08/23/spike-in-suspicious-incidents-in-iran-fuels-fears-of-a-simmering-war_6744637_368.html,Subscribers only,  By Ghazal Golshiri ,https://img.lemde.fr/2025/08/22/0/0/4000/2666/360/0/95/0/a32dd1b_upload-1-9dpdh4mm34av-valjevo-serbia-protests-38.jpg 2x,
Women's Rugby World Cup: France enters tournament aiming for title,France kicks off its World Cup campaign on Saturday in Exeter against Italy. The third-place regulars now have their sights set on outright victory.,https://www.lemonde.fr/en/sports/article/2025/08/23/women-s-rugby-world-cup-france-enters-tournament-aiming-for-title_6744652_9.html,Subscribers only,  By Valentin Moinard ,https://img.lemde.fr/2025/08/22/0/0/4000/2666/360/0/95/0/a32dd1b_upload-1-9dpdh4mm34av-valjevo-serbia-protests-38.jpg 2x,
"From Brittany to the Alps, French cities restrict holiday homes","Faced with the challenge of housing the residents of highly touristic or attractive cities, some mayors have decided to ban the construction of new vacation properties.",https://www.lemonde.fr/en/france/article/2025/08/23/from-brittany-to-the-alps-french-cities-restrict-holiday-homes_6744657_7.html,Subscribers only,  By Véronique Chocron ,https://img.lemde.fr/2025/08/22/0/0/4000/2666/360/0/95/0/a32dd1b_upload-1-9dpdh4mm34av-valjevo-serbia-protests-38.jpg 2x,In Depth
"Gaza: As UN declares famine, Israel condemns what it calls an antisemitic campaign",0,https://www.lemonde.fr/en/international/article/2025/08/23/gaza-as-un-declares-famine-israel-condemns-what-it-calls-an-antisemitic-campaign_6744647_4.html,Subscribers only,"  By Luc Bronner (Jerusalem, correspondent) ",https://img.lemde.fr/2025/08/22/0/0/4000/2666/360/0/95/0/a32dd1b_upload-1-9dpdh4mm34av-valjevo-serbia-protests-38.jpg 2x,
"Paris summons Italian ambassador after Salvini criticizes Macron,",0,https://www.lemonde.fr/en/international/article/2025/08/23/after-an-attack-by-matteo-salvini-paris-summons-italian-ambassador_6744651_4.html,Subscribers only,  By Allan Kaval (Rome (Italy) correspondent) ,https://img.lemde.fr/2025/08/22/0/0/4000/2666/360/0/95/0/a32dd1b_upload-1-9dpdh4mm34av-valjevo-serbia-protests-38.jpg 2x,
Trump's Justice Department releases interviews with Epstein ex-girlfriend Maxwell,0,https://www.lemonde.fr/en/international/article/2025/08/22/trump-s-justice-department-releases-interviews-with-epstein-ex-girlfriend-maxwell_6744629_4.html,Not premium,Le Monde with AP,https://img.lemde.fr/2025/08/22/0/0/4000/2666/360/0/95/0/a32dd1b_upload-1-9dpdh4mm34av-valjevo-serbia-protests-38.jpg 2x,
US Defense Intelligence Agency chief fired after contradicting Trump on Iran strikes results,0,https://www.lemonde.fr/en/international/article/2025/08/23/us-defense-intelligence-agency-chief-fired-after-contradicting-trump-on-iran-strikes-results_6744639_4.html,Not premium,Le Monde with AFP,https://img.lemde.fr/2025/08/22/0/0/4000/2666/360/0/95/0/a32dd1b_upload-1-9dpdh4mm34av-valjevo-serbia-protests-38.jpg 2x,
Former French PM Gabriel Attal wants to end surrogacy 'taboo',0,https://www.lemonde.fr/en/politics/article/2025/08/23/former-french-pm-gabriel-attal-wants-to-end-surrogacy-taboo_6744640_5.html,Subscribers only,  By François-Régis Couteau ,https://img.lemde.fr/2025/08/22/0/0/4000/2666/360/0/95/0/a32dd1b_upload-1-9dpdh4mm34av-valjevo-serbia-protests-38.jpg 2x,
Mali arrests French intelligence officer despite diplomatic immunity,0,https://www.lemonde.fr/en/international/article/2025/08/23/mali-arrests-french-intelligence-officer-despite-diplomatic-immunity_6744654_4.html,Subscribers only,  By Jacques Follorou ,https://img.lemde.fr/2025/08/22/0/0/4000/2666/360/0/95/0/a32dd1b_upload-1-9dpdh4mm34av-valjevo-serbia-protests-38.jpg 2x,
Putin holds firm on Ukraine a week after diplomatic gains at Anchorage summit,0,https://www.lemonde.fr/en/international/article/2025/08/22/putin-holds-firm-on-ukraine-a-week-after-diplomatic-gains-at-anchorage-summit_6744615_4.html,Subscribers only,  By Benjamin Quénelle ,https://img.lemde.fr/2025/08/22/0/0/4000/2666/360/0/95/0/a32dd1b_upload-1-9dpdh4mm34av-valjevo-serbia-protests-38.jpg 2x,
Deadly monsoon leaves devastation in Pakistan and India: 'It's as if Judgment Day has already come for us',0,https://www.lemonde.fr/en/environment/article/2025/08/22/deadly-monsoon-leaves-devastation-in-pakistan-and-india-it-s-as-if-judgment-day-has-already-come-for-us_6744626_114.html,Subscribers only,"  By Sophie Landrin (New Delhi, India, correspondent) and Zain Zaman (Buner and Swabi districts (Pakistan), special correspondent) ",https://img.lemde.fr/2025/08/22/0/0/4000/2666/360/0/95/0/a32dd1b_upload-1-9dpdh4mm34av-valjevo-serbia-protests-38.jpg 2x,
Berlin renames 'Moors' Street' after philosopher Anton Wilhelm Amo,0,https://www.lemonde.fr/en/international/article/2025/08/23/berlin-renames-moors-street-after-philosopher-anton-wilhelm-amo_6744650_4.html,Not premium,Le Monde with AFP,https://img.lemde.fr/2025/08/22/0/0/4000/2666/360/0/95/0/a32dd1b_upload-1-9dpdh4mm34av-valjevo-serbia-protests-38.jpg 2x,
A controversial FBI search at John Bolton's home and office,0,https://www.lemonde.fr/en/international/article/2025/08/23/a-controversial-fbi-search-at-john-bolton-s-home-and-office_6744642_4.html,Subscribers only,  By Piotr Smolar (Washington (United States) correspondent) ,https://img.lemde.fr/2025/08/22/0/0/4000/2666/360/0/95/0/a32dd1b_upload-1-9dpdh4mm34av-valjevo-serbia-protests-38.jpg 2x,
Bosnia's Serb entity calls referendum on verdict against leader,0,https://www.lemonde.fr/en/international/article/2025/08/23/bosnia-s-serb-entity-calls-referendum-on-verdict-against-leader_6744656_4.html,Not premium,Le Monde with AFP,https://img.lemde.fr/2025/08/22/0/0/4000/2666/360/0/95/0/a32dd1b_upload-1-9dpdh4mm34av-valjevo-serbia-protests-38.jpg 2x,
Jerome Powell signals potential rate cut and defends Fed independence in final Jackson Hole address,0,https://www.lemonde.fr/en/economy/article/2025/08/23/jerome-powell-signals-potential-rate-cut-and-defends-fed-independence-in-final-jackson-hole-address_6744633_19.html,Subscribers only,  By Nicolas Chapuis (New York (United States) correspondent) ,https://img.lemde.fr/2025/08/22/0/0/4000/2666/360/0/95/0/a32dd1b_upload-1-9dpdh4mm34av-valjevo-serbia-protests-38.jpg 2x,
"Death of French streamer: Behind Kick, an Australian crypto casino and two young billionaires","The livestreaming platform began as an offshoot of one of the world's largest online gambling sites: Stake. From the outset, lax moderation was part of its DNA.",https://www.lemonde.fr/en/pixels/article/2025/08/22/death-of-french-streamer-behind-kick-an-australian-crypto-casino-and-two-young-billionaires_6744620_13.html,Subscribers only,  By Damien Leloup ,https://img.lemde.fr/2025/08/22/0/0/4000/2666/360/0/95/0/a32dd1b_upload-1-9dpdh4mm34av-valjevo-serbia-protests-38.jpg 2x,In Depth
Being a writer in the digital age? James Baldwin 'seemed free in ways we no longer can be',"'Letters from America' (6/6). Writer and journalist Thomas Chatterton Williams envies the great American author's bohemian, technology-free existence, despite the chaos it represented.",https://www.lemonde.fr/en/summer-reads/article/2025/08/23/being-a-writer-in-an-age-of-digital-omnipresence-james-baldwin-seemed-free-in-ways-we-sense-we-no-longer-can-be_6744644_183.html,Subscribers only,  By Thomas Chatterton Williams ,https://img.lemde.fr/2025/08/22/0/0/4000/2666/360/0/95/0/a32dd1b_upload-1-9dpdh4mm34av-valjevo-serbia-protests-38.jpg 2x,Series
"In 'Kolkhoze,' Emmanuel Carrère becomes his mother's son","In his new book, the French author reflects on his often tumultuous relationship with his late mother, Hélène Carrère d'Encausse, and explores what he owes her. This major work addresses themes of death, love and writing.",https://www.lemonde.fr/en/culture/article/2025/08/22/in-kolkhoze-emmanuel-carrere-becomes-his-mother-s-son_6744599_30.html,Subscribers only,  By Jean Birnbaum ,https://img.lemde.fr/2025/08/22/0/0/4000/2666/360/0/95/0/a32dd1b_upload-1-9dpdh4mm34av-valjevo-serbia-protests-38.jpg 2x,Review
Global South: Trump is playing into China's hands,0,https://www.lemonde.fr/en/opinion/article/2025/08/23/global-south-trump-is-playing-into-china-s-hands_6744648_23.html,Not premium,Le Monde,https://img.lemde.fr/2025/08/22/0/0/4000/2666/360/0/95/0/a32dd1b_upload-1-9dpdh4mm34av-valjevo-serbia-protests-38.jpg 2x,Editorial
Ukraine must 'turn time to its advantage' against Putin,0,https://www.lemonde.fr/en/opinion/article/2025/08/23/ukraine-must-turn-time-to-its-advantage-against-putin_6744638_23.html,Subscribe,Elie Tenenbaum,https://img.lemde.fr/2025/08/22/0/0/4000/2666/360/0/95/0/a32dd1b_upload-1-9dpdh4mm34av-valjevo-serbia-protests-38.jpg 2x,Op-Ed
Netanyahu's manipulation of antisemitism is unworthy,0,https://www.lemonde.fr/en/opinion/article/2025/08/21/netanyahu-s-manipulation-of-antisemitism-is-unworthy_6744575_23.html,Not premium,Le Monde,https://img.lemde.fr/2025/08/22/0/0/4000/2666/360/0/95/0/a32dd1b_upload-1-9dpdh4mm34av-valjevo-serbia-protests-38.jpg 2x,Editorial
