title,subhead,url,suscription,byline,img_url,article_type
"In Iran, the government steps up repression as executions surge",0,https://www.lemonde.fr/en/international/article/2025/07/30/in-iran-the-government-steps-up-repression-as-executions-surge_6743893_4.html,Subscribers only,  By Madjid Zerrouky ,https://img.lemde.fr/2025/07/29/0/146/507/338/360/0/95/0/f3ae105_upload-1-vcrvcmb971t4-untitled-design.jpg 2x,
Journalists in the West Bank face mounting suppression,0,https://www.lemonde.fr/en/international/article/2025/07/30/journalists-in-the-west-bank-face-mounting-suppression_6743892_4.html,Subscribers only, By Lucas Minisini (Ramallah (West Bank) special correspondent) ,https://img.lemde.fr/2025/07/29/0/146/507/338/360/0/95/0/f3ae105_upload-1-vcrvcmb971t4-untitled-design.jpg 2x,
Russia sees push for return of official censorship,0,https://www.lemonde.fr/en/international/article/2025/07/29/russia-sees-push-for-return-of-official-censorship_6743879_4.html,Subscribers only,  By Marie Jégo ,https://img.lemde.fr/2025/07/29/0/146/507/338/360/0/95/0/f3ae105_upload-1-vcrvcmb971t4-untitled-design.jpg 2x,
Russian internet hangs in the balance after network outages,0,https://www.lemonde.fr/en/international/article/2025/07/29/russian-internet-hangs-in-the-balance-after-network-outages_6743872_4.html,Subscribers only,  By Filip Meyer and Benjamin Quénelle ,https://img.lemde.fr/2025/07/29/0/146/507/338/360/0/95/0/f3ae105_upload-1-vcrvcmb971t4-untitled-design.jpg 2x,
Early and intense wildfire season has arrived around the Mediterranean,0,https://www.lemonde.fr/en/europe/article/2025/07/17/wildfire-season-arrives-early-and-intense-around-the-mediterranean_6743466_143.html,Subscribers only,"  By Maryline Baumard, Olivier Bonnel (Rome, correspondent), Nicolas Bourcier (Istanbul (Turkey) correspondent), Isabelle Piquer (Madrid (Spain) correspondent), Marina Rafenberg (Athens (Greece) correspondent) and Hélène Sallon (Beirut (Lebanon) correspondent) ",https://img.lemde.fr/2025/07/29/0/146/507/338/360/0/95/0/f3ae105_upload-1-vcrvcmb971t4-untitled-design.jpg 2x,
"Srebrenica massacre commemoration: 30 years later, the enduring bitterness of grieving families",0,https://www.lemonde.fr/en/international/article/2025/07/12/srebrenica-massacre-commemoration-30-years-later-the-enduring-bitterness-of-grieving-families_6743301_4.html,Subscribers only, By Jean-Baptiste Chastand (Srebrenica (Bosnia) special correspondent) ,https://img.lemde.fr/2025/07/29/0/146/507/338/360/0/95/0/f3ae105_upload-1-vcrvcmb971t4-untitled-design.jpg 2x,
International justice confronts the genocide of Srebrenica,0,https://www.lemonde.fr/en/international/article/2025/07/11/international-justice-confronts-the-genocide-of-srebrenica_6743275_4.html,Subscribers only,  By Stéphanie Maupas (The Hague (Netherlands) correspondent) ,https://img.lemde.fr/2025/07/29/0/146/507/338/360/0/95/0/f3ae105_upload-1-vcrvcmb971t4-untitled-design.jpg 2x,
"In Srebrenica, 30 years after the genocide, the 'vicious circle' of denial continues",0,https://www.lemonde.fr/en/international/article/2025/07/11/in-srebrenica-30-years-after-the-genocide-the-vicious-circle-of-denial-continues_6743270_4.html,Subscribers only," By Jean-Baptiste Chastand (Srebrenica [Bosnia and Herzegovina], special correspondent) ",https://img.lemde.fr/2025/07/29/0/146/507/338/360/0/95/0/f3ae105_upload-1-vcrvcmb971t4-untitled-design.jpg 2x,
France to start airdrops of aid into Gaza on Friday,0,https://www.lemonde.fr/en/france/article/2025/07/29/france-to-air-drop-aid-to-gaza-from-friday_6743874_7.html,Not premium,Le Monde,https://img.lemde.fr/2025/07/29/0/146/507/338/360/0/95/0/f3ae105_upload-1-vcrvcmb971t4-untitled-design.jpg 2x,
No progress made on France's terrorism memorial despite years of studies,0,https://www.lemonde.fr/en/france/article/2025/07/30/no-progress-made-on-france-s-terrorism-memorial-despite-years-of-studies_6743898_7.html,Subscribers only,  By Dounia Dimou ,https://img.lemde.fr/2025/07/29/0/146/507/338/360/0/95/0/f3ae105_upload-1-vcrvcmb971t4-untitled-design.jpg 2x,
Letters from prisoners held in solitary confinement: 'I feel like becoming violent again',0,https://www.lemonde.fr/en/france/article/2025/07/28/letters-from-prisoners-held-in-solitary-confinement-i-feel-like-becoming-violent-again_6743831_7.html,Subscribers only," By Grégoire Biseau, Thomas Saintourens and Lucie Soullier ",https://img.lemde.fr/2025/07/29/0/146/507/338/360/0/95/0/f3ae105_upload-1-vcrvcmb971t4-untitled-design.jpg 2x,
"Paralympics shifted perceptions, but not the living conditions of people with disabilities",0,https://www.lemonde.fr/en/france/article/2025/07/28/paralympics-shifted-perceptions-but-not-the-living-conditions-of-people-with-disabilities_6743792_7.html,Subscribers only,  By Anne-Aël Durand ,https://img.lemde.fr/2025/07/29/0/146/507/338/360/0/95/0/f3ae105_upload-1-vcrvcmb971t4-untitled-design.jpg 2x,
Watch: Tsunami warnings sound in Japan after 8.8 magnitude quake off Russian coast,0,https://www.lemonde.fr/en/videos/video/2025/07/30/watch-tsunami-warnings-sound-in-japan-after-8-8-magnitude-quake-off-russian-coast_6743900_108.html,Not premium,No byline,https://img.lemde.fr/2025/07/29/0/146/507/338/360/0/95/0/f3ae105_upload-1-vcrvcmb971t4-untitled-design.jpg 2x,
What is France's 'Black code' and why hasn't it been repealed?,0,https://www.lemonde.fr/en/videos/video/2025/05/31/what-is-france-s-black-code-and-why-hasn-t-it-been-repealed_6741860_108.html,Not premium,"  By Chloé Denis, Olivier Escher (motion design) and Diana Liu ",https://img.lemde.fr/2025/07/29/0/146/507/338/360/0/95/0/f3ae105_upload-1-vcrvcmb971t4-untitled-design.jpg 2x,
How was the European Union created?,0,https://www.lemonde.fr/en/videos/video/2025/05/29/how-was-the-european-union-created_6741795_108.html,Not premium,"  By Alexis Tromas, Robin Gasser (motion design) and Diana Liu ",https://img.lemde.fr/2025/07/29/0/146/507/338/360/0/95/0/f3ae105_upload-1-vcrvcmb971t4-untitled-design.jpg 2x,
Glide bombs: Russia's secret to making cheap weapons,0,https://www.lemonde.fr/en/videos/video/2025/05/25/glide-bombs-russia-s-secret-to-making-cheap-weapons_6741646_108.html,Subscribers only,"  By Thomas Eydoux, Marceau Bretonnier and Sinead McCausland ",https://img.lemde.fr/2025/07/29/0/146/507/338/360/0/95/0/f3ae105_upload-1-vcrvcmb971t4-untitled-design.jpg 2x,
"'The EU seeks economic deals, preferably for free trade, because the member states leading it gain from them'",0,https://www.lemonde.fr/en/opinion/article/2025/07/29/the-eu-seeks-economic-deals-preferably-for-free-trade-because-the-member-states-leading-it-gain-from-them_6743861_23.html,Subscribers only,Nicolas Ravailhe,https://img.lemde.fr/2025/07/29/0/146/507/338/360/0/95/0/f3ae105_upload-1-vcrvcmb971t4-untitled-design.jpg 2x,
French PM risks reaching breaking point with unions,0,https://www.lemonde.fr/en/opinion/article/2025/07/29/french-pm-risks-reaching-breaking-point-with-unions_6743851_23.html,Not premium,Le Monde,https://img.lemde.fr/2025/07/29/0/146/507/338/360/0/95/0/f3ae105_upload-1-vcrvcmb971t4-untitled-design.jpg 2x,
"'The slide into climate despair occurs when the conviction sets in that... no, we won't make it'",0,https://www.lemonde.fr/en/opinion/article/2025/07/29/the-slide-into-climate-despair-occurs-when-the-conviction-sets-in-that-no-we-won-t-make-it_6743837_23.html,Subscribers only,Vincent Escoffier,https://img.lemde.fr/2025/07/29/0/146/507/338/360/0/95/0/f3ae105_upload-1-vcrvcmb971t4-untitled-design.jpg 2x,
EU-US trade deal: A bittersweet compromise for the EU,0,https://www.lemonde.fr/en/opinion/article/2025/07/28/eu-us-trade-deal-a-bittersweet-compromise-for-the-eu_6743802_23.html,Not premium,Le Monde,https://img.lemde.fr/2025/07/29/0/146/507/338/360/0/95/0/f3ae105_upload-1-vcrvcmb971t4-untitled-design.jpg 2x,
"Retracing James Baldwin's footsteps in Istanbul, the city that saved his life",0,https://www.lemonde.fr/en/m-le-mag/article/2025/07/27/retracing-james-baldwin-s-footsteps-in-istanbul-the-city-that-saved-his-life_6743763_117.html,Subscribers only, By Nicolas Bourcier (Istanbul (Turkey) correspondent) ,https://img.lemde.fr/2025/07/29/0/146/507/338/360/0/95/0/f3ae105_upload-1-vcrvcmb971t4-untitled-design.jpg 2x,
Three erotic experiences inspired by… your wardrobe,0,https://www.lemonde.fr/en/m-le-mag/article/2025/07/22/three-erotic-experiences-inspired-by-your-wardrobe_6743593_117.html,Subscribers only,Maïa Mazaurette,https://img.lemde.fr/2025/07/29/0/146/507/338/360/0/95/0/f3ae105_upload-1-vcrvcmb971t4-untitled-design.jpg 2x,
The unshakable friendship of Nan Goldin and David Armstrong,0,https://www.lemonde.fr/en/m-le-mag/article/2025/07/20/the-unshakable-friendship-of-nan-goldin-and-david-armstrong_6743545_117.html,Subscribers only, By Clément Ghys ,https://img.lemde.fr/2025/07/29/0/146/507/338/360/0/95/0/f3ae105_upload-1-vcrvcmb971t4-untitled-design.jpg 2x,
"Lucy Duff Gordon, a free-spirited couturière erased by history",0,https://www.lemonde.fr/en/m-le-mag/article/2025/07/20/lucy-duff-gordon-a-free-spirited-couturiere-erased-by-history_6743543_117.html,Subscribers only, By Valentin Pérez ,https://img.lemde.fr/2025/07/29/0/146/507/338/360/0/95/0/f3ae105_upload-1-vcrvcmb971t4-untitled-design.jpg 2x,
"At Musée d'Orsay, a Courbet painting gets a new life before visitors' eyes",0,https://www.lemonde.fr/en/culture/article/2025/07/26/at-musee-d-orsay-a-courbet-painting-gets-a-new-life-before-visitors-eyes_6743744_30.html,Subscribers only,  By Max Blanc ,https://img.lemde.fr/2025/07/29/0/146/507/338/360/0/95/0/f3ae105_upload-1-vcrvcmb971t4-untitled-design.jpg 2x,
Avignon Festival 2025: An edition marked by emotion and fragility,0,https://www.lemonde.fr/en/culture/article/2025/07/26/avignon-festival-2025-an-edition-marked-by-emotion-and-fragility_6743733_30.html,Subscribers only,"  By Fabienne Darge (Avignon, France, special correspondent) ",https://img.lemde.fr/2025/07/29/0/146/507/338/360/0/95/0/f3ae105_upload-1-vcrvcmb971t4-untitled-design.jpg 2x,
The challenge of surtitling at the Avignon Festival,0,https://www.lemonde.fr/en/culture/article/2025/07/20/the-challenge-of-surtitling-at-the-avignon-festival_6743560_30.html,Subscribers only,  By Calypso Joyeux ,https://img.lemde.fr/2025/07/29/0/146/507/338/360/0/95/0/f3ae105_upload-1-vcrvcmb971t4-untitled-design.jpg 2x,
"In Arles, Fragonard's Museum of Fashion and Costume gracefully unveils treasures",0,https://www.lemonde.fr/en/m-le-mag/article/2025/07/17/in-arles-fragonard-s-museum-of-fashion-and-costume-gracefully-unveils-treasures_6743450_117.html,Subscribers only, By Litza Georgopoulos ,https://img.lemde.fr/2025/07/29/0/146/507/338/360/0/95/0/f3ae105_upload-1-vcrvcmb971t4-untitled-design.jpg 2x,
Journalists in the West Bank face mounting suppression,"Since October 7, Israel has arrested and imprisoned at least 140 journalists working in this occupied territory, most often under the catch-all charge of 'incitement to terrorism.' The Palestinian Journalists Syndicate has condemned what it describes as a strategy to 'silence' media professionals.",https://www.lemonde.fr/en/international/article/2025/07/30/journalists-in-the-west-bank-face-mounting-suppression_6743892_4.html,Subscribers only, By Lucas Minisini (Ramallah (West Bank) special correspondent) ,https://img.lemde.fr/2025/07/29/0/146/507/338/360/0/95/0/f3ae105_upload-1-vcrvcmb971t4-untitled-design.jpg 2x,
Watch: Tsunami warnings sound in Japan after 8.8 magnitude quake off Russian coast,0,https://www.lemonde.fr/en/videos/video/2025/07/30/watch-tsunami-warnings-sound-in-japan-after-8-8-magnitude-quake-off-russian-coast_6743900_108.html,Not premium,No byline,https://img.lemde.fr/2025/07/29/0/146/507/338/360/0/95/0/f3ae105_upload-1-vcrvcmb971t4-untitled-design.jpg 2x,
"In Iran, the government steps up repression as executions surge",0,https://www.lemonde.fr/en/international/article/2025/07/30/in-iran-the-government-steps-up-repression-as-executions-surge_6743893_4.html,Subscribers only,  By Madjid Zerrouky ,https://img.lemde.fr/2025/07/29/0/146/507/338/360/0/95/0/f3ae105_upload-1-vcrvcmb971t4-untitled-design.jpg 2x,
How France's far right is betting on cryptocurrencies,"The Rassemblement National is preparing a draft law to 'mine' bitcoin using surplus electricity from nuclear power plants, demonstrating the far right's parliamentary advocacy on the issue.",https://www.lemonde.fr/en/politics/article/2025/07/30/how-france-s-far-right-is-betting-on-cryptocurrencies_6743899_5.html,Subscribers only,  By Robin D’Angelo and Corentin Lesueur ,https://img.lemde.fr/2025/07/29/0/146/507/338/360/0/95/0/f3ae105_upload-1-vcrvcmb971t4-untitled-design.jpg 2x,
US and China agree to work on extending the deadline for new tariffs in trade talks,The latest round of talks opened Monday and concluded Tuesday in Stockholm to try to break a logjam over tariffs that have skewed the pivotal commercial ties between the world's two largest economies.,https://www.lemonde.fr/en/international/article/2025/07/30/us-and-china-agree-to-work-on-extending-the-deadline-for-new-tariffs-in-trade-talks_6743882_4.html,Not premium,Le Monde with AP,https://img.lemde.fr/2025/07/29/0/146/507/338/360/0/95/0/f3ae105_upload-1-vcrvcmb971t4-untitled-design.jpg 2x,
Suing the state in France: How does this universal right work in practice?,"Climate, health, femicides: Lawsuits against the state have surged in recent years. Beyond securing compensation for victims, these legal procedures primarily aim to raise public awareness and drive change.",https://www.lemonde.fr/en/les-decodeurs/article/2025/07/30/suing-the-state-how-does-this-universal-right-work-in-practice_6743886_8.html,Subscribers only,  By Noa Moussa ,https://img.lemde.fr/2025/07/29/0/146/507/338/360/0/95/0/f3ae105_upload-1-vcrvcmb971t4-untitled-design.jpg 2x,
No progress made on France's terrorism memorial despite years of studies,French President Emmanuel Macron reaffirmed his commitment in January to see the site inaugurated after years of back-and-forth in the planning process. But the funding has not been secured.,https://www.lemonde.fr/en/france/article/2025/07/30/no-progress-made-on-france-s-terrorism-memorial-despite-years-of-studies_6743898_7.html,Subscribers only,  By Dounia Dimou ,https://img.lemde.fr/2025/07/29/0/146/507/338/360/0/95/0/f3ae105_upload-1-vcrvcmb971t4-untitled-design.jpg 2x,In Depth
Attack on military base in Burkina Faso reportedly leaves 50 soldiers dead,0,https://www.lemonde.fr/en/international/article/2025/07/29/attack-on-military-base-in-burkina-faso-reportedly-leaves-50-soldiers-dead_6743878_4.html,Not premium,Le Monde with AP,https://img.lemde.fr/2025/07/29/0/146/507/338/360/0/95/0/f3ae105_upload-1-vcrvcmb971t4-untitled-design.jpg 2x,
"In Brazil, the free and instant mobile payment system Pix challenges US dominance",0,https://www.lemonde.fr/en/economy/article/2025/07/30/in-brazil-the-free-and-instant-mobile-payment-system-pix-challenges-us-dominance_6743880_19.html,Subscribers only,  By Raphaël Bernard ,https://img.lemde.fr/2025/07/29/0/146/507/338/360/0/95/0/f3ae105_upload-1-vcrvcmb971t4-untitled-design.jpg 2x,
Cybèle Idelot: From Hollywood to self-sufficiency in the Paris region,0,https://www.lemonde.fr/en/summer-reads/article/2025/07/30/cybele-idelot-s-ile-de-france-adventure-from-hollywood-childhood-to-kitchen-gardens_6743883_183.html,Subscribers only,  By Léo Pajon ,https://img.lemde.fr/2025/07/29/0/146/507/338/360/0/95/0/f3ae105_upload-1-vcrvcmb971t4-untitled-design.jpg 2x,
"Spike Lee, Benin's star ambassador to attract the Afro-descendant diaspora",0,https://www.lemonde.fr/en/le-monde-africa/article/2025/07/30/spike-lee-benin-s-star-ambassador-to-attract-the-afro-descendant-diaspora_6743885_124.html,Subscribers only,  By Sélène Agapé and Aby Faye ,https://img.lemde.fr/2025/07/29/0/146/507/338/360/0/95/0/f3ae105_upload-1-vcrvcmb971t4-untitled-design.jpg 2x,
Russia sees push for return of official censorship,0,https://www.lemonde.fr/en/international/article/2025/07/29/russia-sees-push-for-return-of-official-censorship_6743879_4.html,Subscribers only,  By Marie Jégo ,https://img.lemde.fr/2025/07/29/0/146/507/338/360/0/95/0/f3ae105_upload-1-vcrvcmb971t4-untitled-design.jpg 2x,
New York mass shooting: Gunman blamed NFL for brain injuries,0,https://www.lemonde.fr/en/international/article/2025/07/29/new-york-mass-shooting-gunman-blamed-nfl-for-brain-injuries_6743877_4.html,Not premium,Le Monde with AP and AFP,https://img.lemde.fr/2025/07/29/0/146/507/338/360/0/95/0/f3ae105_upload-1-vcrvcmb971t4-untitled-design.jpg 2x,
Low-calorie French pastries struggle to win over chefs and consumers,0,https://www.lemonde.fr/en/gastronomie/article/2025/07/30/low-calorie-french-pastries-struggle-to-win-over-chefs-and-consumers_6743887_89.html,Subscribers only,  By Elvire von Bardeleben ,https://img.lemde.fr/2025/07/29/0/146/507/338/360/0/95/0/f3ae105_upload-1-vcrvcmb971t4-untitled-design.jpg 2x,
"Trump says Epstein 'stole' young women from Mar-a-Lago spa, including Virginia Giuffre",0,https://www.lemonde.fr/en/international/article/2025/07/30/trump-says-epstein-stole-young-women-from-mar-a-lago-spa-including-virginia-giuffre_6743881_4.html,Not premium,Le Monde with AP,https://img.lemde.fr/2025/07/29/0/146/507/338/360/0/95/0/f3ae105_upload-1-vcrvcmb971t4-untitled-design.jpg 2x,
France to start airdrops of aid into Gaza on Friday,0,https://www.lemonde.fr/en/france/article/2025/07/29/france-to-air-drop-aid-to-gaza-from-friday_6743874_7.html,Not premium,Le Monde,https://img.lemde.fr/2025/07/29/0/146/507/338/360/0/95/0/f3ae105_upload-1-vcrvcmb971t4-untitled-design.jpg 2x,
Trump administration pushes to revoke scientific ruling that underpins climate regulations,0,https://www.lemonde.fr/en/environment/article/2025/07/29/trump-administration-pushes-to-revoke-scientific-ruling-that-underpins-climate-regulations_6743876_114.html,Not premium,Le Monde with AFP,https://img.lemde.fr/2025/07/29/0/146/507/338/360/0/95/0/f3ae105_upload-1-vcrvcmb971t4-untitled-design.jpg 2x,
François Provost to head French carmaker Renault,0,https://www.lemonde.fr/en/economy/article/2025/07/29/francois-provost-to-head-french-carmaker-renault_6743875_19.html,Subscribers only,  By Sophie Fay ,https://img.lemde.fr/2025/07/29/0/146/507/338/360/0/95/0/f3ae105_upload-1-vcrvcmb971t4-untitled-design.jpg 2x,
Russian internet hangs in the balance after network outages,0,https://www.lemonde.fr/en/international/article/2025/07/29/russian-internet-hangs-in-the-balance-after-network-outages_6743872_4.html,Subscribers only,  By Filip Meyer and Benjamin Quénelle ,https://img.lemde.fr/2025/07/29/0/146/507/338/360/0/95/0/f3ae105_upload-1-vcrvcmb971t4-untitled-design.jpg 2x,
"'In the West Berlin squats, we argued but lived together': Karin Wieland, political rebel","'Being 20 in West Berlin' (2/6). In the late 1970s, Karin Wieland fled her small German town to live communally in an abandoned building in Kreuzberg, throwing herself into every cause of the era.",https://www.lemonde.fr/en/summer-reads/article/2025/07/29/in-the-west-berlin-squats-we-argued-but-lived-together-karin-wieland-political-rebel_6743873_183.html,Subscribers only," By Brigitte Salino (Berlin, special correspondent) ",https://img.lemde.fr/2025/07/29/0/146/507/338/360/0/95/0/f3ae105_upload-1-vcrvcmb971t4-untitled-design.jpg 2x,Profile
"'We often go to bed on empty stomachs': In Ethiopia's Afar region, hunger takes its toll","In northern Ethiopia, the freeze on USAID threatens to worsen food insecurity, already affecting thousands of families impacted by land drying up.",https://www.lemonde.fr/en/le-monde-africa/article/2025/07/29/we-often-go-to-bed-on-empty-stomachs-in-ethiopia-s-afar-region-hunger-takes-its-toll_6743856_124.html,Subscribers only,"  By Marlène Panara (Abala, Ethiopia, special correspondent) ",https://img.lemde.fr/2025/07/29/0/146/507/338/360/0/95/0/f3ae105_upload-1-vcrvcmb971t4-untitled-design.jpg 2x,Feature
Three erotic experiences inspired by artistic performances,"Maïa Mazaurette is on a mission to spice up your steamy summer nights. This week, she offers suggestions to awaken your creativity and transform your intimate space into the stage for a very unique happening.",https://www.lemonde.fr/en/summer-reads/article/2025/07/29/three-erotic-experiences-inspired-by-artistic-performances_6743836_183.html,Subscribers only,Maïa Mazaurette,https://img.lemde.fr/2025/07/29/0/146/507/338/360/0/95/0/f3ae105_upload-1-vcrvcmb971t4-untitled-design.jpg 2x,Column
French PM risks reaching breaking point with unions,0,https://www.lemonde.fr/en/opinion/article/2025/07/29/french-pm-risks-reaching-breaking-point-with-unions_6743851_23.html,Not premium,Le Monde,https://img.lemde.fr/2025/07/29/0/146/507/338/360/0/95/0/f3ae105_upload-1-vcrvcmb971t4-untitled-design.jpg 2x,Editorial
The logic behind recognizing Palestine,0,https://www.lemonde.fr/en/opinion/article/2025/07/26/the-logic-behind-recognizing-palestine_6743742_23.html,Not premium,Le Monde,https://img.lemde.fr/2025/07/29/0/146/507/338/360/0/95/0/f3ae105_upload-1-vcrvcmb971t4-untitled-design.jpg 2x,Editorial
"Faced with China, Europe is weak",0,https://www.lemonde.fr/en/opinion/article/2025/07/25/faced-with-china-europe-is-weak_6743708_23.html,Not premium,Le Monde,https://img.lemde.fr/2025/07/29/0/146/507/338/360/0/95/0/f3ae105_upload-1-vcrvcmb971t4-untitled-design.jpg 2x,Editorial
