title,subhead,url,suscription,byline,img_url,article_type
"India-US alliance weakened by trade, Pakistan and oil disputes",0,https://www.lemonde.fr/en/international/article/2025/08/07/india-us-alliance-weakened-by-trade-pakistan-and-oil-disputes_6744158_4.html,Subscribers only,"  By Sophie Landrin (New Delhi, India, correspondent) and Arnaud Leparmentier (New York, United States, correspondent) ",https://img.lemde.fr/2025/08/01/0/0/8640/5760/360/0/95/0/b906683_ftp-import-images-1-p37gwmxhoan3-0fde0877b7534c4aa15364055225230f-0-bdf8d86894274844a03f964d0206f2d0.jpg 2x,
War in Ukraine: Trump could meet with Putin 'as soon as next week',0,https://www.lemonde.fr/en/international/article/2025/08/07/war-in-ukraine-trump-could-meet-with-putin-as-soon-as-next-week_6744149_4.html,Subscribers only,  By Emmanuel Grynszpan ,https://img.lemde.fr/2025/08/01/0/0/8640/5760/360/0/95/0/b906683_ftp-import-images-1-p37gwmxhoan3-0fde0877b7534c4aa15364055225230f-0-bdf8d86894274844a03f964d0206f2d0.jpg 2x,
"In Iran, regular power and water outages disrupt daily life and economic activity",0,https://www.lemonde.fr/en/international/article/2025/08/07/in-iran-daily-power-and-water-outages-disrupt-daily-life-and-economic-activity_6744139_4.html,Subscribers only,  By Ghazal Golshiri ,https://img.lemde.fr/2025/08/01/0/0/8640/5760/360/0/95/0/b906683_ftp-import-images-1-p37gwmxhoan3-0fde0877b7534c4aa15364055225230f-0-bdf8d86894274844a03f964d0206f2d0.jpg 2x,
War in Gaza causes rift within the British left,0,https://www.lemonde.fr/en/international/article/2025/08/07/war-in-gaza-causes-rift-within-the-british-left_6744138_4.html,Subscribers only,"  By Julie Zaugg  (London, correspondent) ",https://img.lemde.fr/2025/08/01/0/0/8640/5760/360/0/95/0/b906683_ftp-import-images-1-p37gwmxhoan3-0fde0877b7534c4aa15364055225230f-0-bdf8d86894274844a03f964d0206f2d0.jpg 2x,
French man arrested in Slovenia for crimes committed in Croatia during 1991 war,0,https://www.lemonde.fr/en/international/article/2025/08/06/french-man-arrested-in-slovenia-for-crimes-committed-in-croatia-during-1991-war_6744113_4.html,Subscribers only,  By Stéphanie Maupas (The Hague (Netherlands) correspondent) and Richard Schittly (Lyon (France) correspondent) ,https://img.lemde.fr/2025/08/01/0/0/8640/5760/360/0/95/0/b906683_ftp-import-images-1-p37gwmxhoan3-0fde0877b7534c4aa15364055225230f-0-bdf8d86894274844a03f964d0206f2d0.jpg 2x,
"30 years after the Bosnian War, its refugees still cannot return home",0,https://www.lemonde.fr/en/international/article/2025/08/03/thirty-years-after-the-bosnian-war-its-refugees-still-cannot-return-home_6744026_4.html,Subscribers only," By Jean-Baptiste Chastand (Visegrad, Bosnia and Herzegovina, special correspondent) ",https://img.lemde.fr/2025/08/01/0/0/8640/5760/360/0/95/0/b906683_ftp-import-images-1-p37gwmxhoan3-0fde0877b7534c4aa15364055225230f-0-bdf8d86894274844a03f964d0206f2d0.jpg 2x,
Early and intense wildfire season has arrived around the Mediterranean,0,https://www.lemonde.fr/en/europe/article/2025/07/17/wildfire-season-arrives-early-and-intense-around-the-mediterranean_6743466_143.html,Subscribers only,"  By Maryline Baumard, Olivier Bonnel (Rome, correspondent), Nicolas Bourcier (Istanbul (Turkey) correspondent), Isabelle Piquer (Madrid (Spain) correspondent), Marina Rafenberg (Athens (Greece) correspondent) and Hélène Sallon (Beirut (Lebanon) correspondent) ",https://img.lemde.fr/2025/08/01/0/0/8640/5760/360/0/95/0/b906683_ftp-import-images-1-p37gwmxhoan3-0fde0877b7534c4aa15364055225230f-0-bdf8d86894274844a03f964d0206f2d0.jpg 2x,
"Srebrenica massacre commemoration: 30 years later, the enduring bitterness of grieving families",0,https://www.lemonde.fr/en/international/article/2025/07/12/srebrenica-massacre-commemoration-30-years-later-the-enduring-bitterness-of-grieving-families_6743301_4.html,Subscribers only, By Jean-Baptiste Chastand (Srebrenica (Bosnia) special correspondent) ,https://img.lemde.fr/2025/08/01/0/0/8640/5760/360/0/95/0/b906683_ftp-import-images-1-p37gwmxhoan3-0fde0877b7534c4aa15364055225230f-0-bdf8d86894274844a03f964d0206f2d0.jpg 2x,
Qatargate: French investigators scrutinize FIFA's contracts,0,https://www.lemonde.fr/en/france/article/2025/08/06/qatargate-french-investigators-scrutinize-fifa-s-contracts_6744124_7.html,Subscribers only,  By Rémi Dupré ,https://img.lemde.fr/2025/08/01/0/0/8640/5760/360/0/95/0/b906683_ftp-import-images-1-p37gwmxhoan3-0fde0877b7534c4aa15364055225230f-0-bdf8d86894274844a03f964d0206f2d0.jpg 2x,
"For the first time ever, the majority of doctors in France are women",0,https://www.lemonde.fr/en/france/article/2025/08/04/for-the-first-time-ever-the-majority-of-doctors-in-france-are-women_6744048_7.html,Subscribers only,  By Mattea Battaglia and Camille Stromboni ,https://img.lemde.fr/2025/08/01/0/0/8640/5760/360/0/95/0/b906683_ftp-import-images-1-p37gwmxhoan3-0fde0877b7534c4aa15364055225230f-0-bdf8d86894274844a03f964d0206f2d0.jpg 2x,
The barriers preventing French people from going on vacation,0,https://www.lemonde.fr/en/france/article/2025/08/03/the-barriers-preventing-french-people-from-going-on-vacation_6744035_7.html,Subscribers only,"  By Claire Ané, Camille Bordenet and Laura Motet ",https://img.lemde.fr/2025/08/01/0/0/8640/5760/360/0/95/0/b906683_ftp-import-images-1-p37gwmxhoan3-0fde0877b7534c4aa15364055225230f-0-bdf8d86894274844a03f964d0206f2d0.jpg 2x,
Former PM Gabriel Attal wants to make his mark with a  name change for Macron's Renaissance party,0,https://www.lemonde.fr/en/france/article/2025/08/02/former-pm-gabriel-attal-wants-to-make-his-mark-with-a-name-change-for-macron-s-renaissance-party_6744007_7.html,Subscribers only,  By Malika Cheklal  ,https://img.lemde.fr/2025/08/01/0/0/8640/5760/360/0/95/0/b906683_ftp-import-images-1-p37gwmxhoan3-0fde0877b7534c4aa15364055225230f-0-bdf8d86894274844a03f964d0206f2d0.jpg 2x,
Watch: Tsunami warnings sound in Japan after 8.8 magnitude quake off Russian coast,0,https://www.lemonde.fr/en/videos/video/2025/07/30/watch-tsunami-warnings-sound-in-japan-after-8-8-magnitude-quake-off-russian-coast_6743900_108.html,Not premium,No byline,https://img.lemde.fr/2025/08/01/0/0/8640/5760/360/0/95/0/b906683_ftp-import-images-1-p37gwmxhoan3-0fde0877b7534c4aa15364055225230f-0-bdf8d86894274844a03f964d0206f2d0.jpg 2x,
What is France's 'Black code' and why hasn't it been repealed?,0,https://www.lemonde.fr/en/videos/video/2025/05/31/what-is-france-s-black-code-and-why-hasn-t-it-been-repealed_6741860_108.html,Not premium,"  By Chloé Denis, Olivier Escher (motion design) and Diana Liu ",https://img.lemde.fr/2025/08/01/0/0/8640/5760/360/0/95/0/b906683_ftp-import-images-1-p37gwmxhoan3-0fde0877b7534c4aa15364055225230f-0-bdf8d86894274844a03f964d0206f2d0.jpg 2x,
How was the European Union created?,0,https://www.lemonde.fr/en/videos/video/2025/05/29/how-was-the-european-union-created_6741795_108.html,Not premium,"  By Alexis Tromas, Robin Gasser (motion design) and Diana Liu ",https://img.lemde.fr/2025/08/01/0/0/8640/5760/360/0/95/0/b906683_ftp-import-images-1-p37gwmxhoan3-0fde0877b7534c4aa15364055225230f-0-bdf8d86894274844a03f964d0206f2d0.jpg 2x,
Glide bombs: Russia's secret to making cheap weapons,0,https://www.lemonde.fr/en/videos/video/2025/05/25/glide-bombs-russia-s-secret-to-making-cheap-weapons_6741646_108.html,Subscribers only,"  By Thomas Eydoux, Marceau Bretonnier and Sinead McCausland ",https://img.lemde.fr/2025/08/01/0/0/8640/5760/360/0/95/0/b906683_ftp-import-images-1-p37gwmxhoan3-0fde0877b7534c4aa15364055225230f-0-bdf8d86894274844a03f964d0206f2d0.jpg 2x,
'The real villain of World War II': Winston Churchill is now a target of American revisionism,0,https://www.lemonde.fr/en/opinion/article/2025/08/07/the-real-villain-of-world-war-ii-winston-churchill-is-now-a-target-of-american-revisionism_6744144_23.html,Subscribers only,  By Valentine Faure ,https://img.lemde.fr/2025/08/01/0/0/8640/5760/360/0/95/0/b906683_ftp-import-images-1-p37gwmxhoan3-0fde0877b7534c4aa15364055225230f-0-bdf8d86894274844a03f964d0206f2d0.jpg 2x,
The imperative of reversing Africa's democratic drift,0,https://www.lemonde.fr/en/opinion/article/2025/08/07/the-imperative-of-reversing-africa-s-democratic-drift_6744153_23.html,Not premium,Le Monde,https://img.lemde.fr/2025/08/01/0/0/8640/5760/360/0/95/0/b906683_ftp-import-images-1-p37gwmxhoan3-0fde0877b7534c4aa15364055225230f-0-bdf8d86894274844a03f964d0206f2d0.jpg 2x,
The urgent need to halt plastic pollution,0,https://www.lemonde.fr/en/opinion/article/2025/08/06/the-urgent-need-to-halt-plastic-pollution_6744122_23.html,Not premium,Le Monde,https://img.lemde.fr/2025/08/01/0/0/8640/5760/360/0/95/0/b906683_ftp-import-images-1-p37gwmxhoan3-0fde0877b7534c4aa15364055225230f-0-bdf8d86894274844a03f964d0206f2d0.jpg 2x,
The only solution for Gaza and the hostages? International pressure,0,https://www.lemonde.fr/en/opinion/article/2025/08/05/the-only-solution-for-gaza-and-the-hostages-international-pressure_6744083_23.html,Not premium,Le Monde,https://img.lemde.fr/2025/08/01/0/0/8640/5760/360/0/95/0/b906683_ftp-import-images-1-p37gwmxhoan3-0fde0877b7534c4aa15364055225230f-0-bdf8d86894274844a03f964d0206f2d0.jpg 2x,
"A Hiroshima survivor breaks decades of silence: 'Speaking about it could be seen as shameful, for the person or their family'",0,https://www.lemonde.fr/en/m-le-mag/article/2025/08/06/a-hiroshima-survivor-breaks-decades-of-silence-speaking-about-it-could-be-seen-as-shameful-for-the-person-or-their-family_6744103_117.html,Subscribers only,  By  Léocadie Petillot ,https://img.lemde.fr/2025/08/01/0/0/8640/5760/360/0/95/0/b906683_ftp-import-images-1-p37gwmxhoan3-0fde0877b7534c4aa15364055225230f-0-bdf8d86894274844a03f964d0206f2d0.jpg 2x,
"China's 'Dalifornia,' a bohemian haven for young people searching for meaning",0,https://www.lemonde.fr/en/m-le-mag/article/2025/08/02/china-s-dalifornia-a-bohemian-haven-for-young-people-searching-for-meaning_6744014_117.html,Subscribers only," By Harold Thibault (Dali (Yunnan), special correspondent) ",https://img.lemde.fr/2025/08/01/0/0/8640/5760/360/0/95/0/b906683_ftp-import-images-1-p37gwmxhoan3-0fde0877b7534c4aa15364055225230f-0-bdf8d86894274844a03f964d0206f2d0.jpg 2x,
"Retracing James Baldwin's footsteps in Istanbul, the city that saved his life",0,https://www.lemonde.fr/en/m-le-mag/article/2025/07/27/retracing-james-baldwin-s-footsteps-in-istanbul-the-city-that-saved-his-life_6743763_117.html,Subscribers only, By Nicolas Bourcier (Istanbul (Turkey) correspondent) ,https://img.lemde.fr/2025/08/01/0/0/8640/5760/360/0/95/0/b906683_ftp-import-images-1-p37gwmxhoan3-0fde0877b7534c4aa15364055225230f-0-bdf8d86894274844a03f964d0206f2d0.jpg 2x,
Three erotic experiences inspired by… your wardrobe,0,https://www.lemonde.fr/en/m-le-mag/article/2025/07/22/three-erotic-experiences-inspired-by-your-wardrobe_6743593_117.html,Subscribers only,Maïa Mazaurette,https://img.lemde.fr/2025/08/01/0/0/8640/5760/360/0/95/0/b906683_ftp-import-images-1-p37gwmxhoan3-0fde0877b7534c4aa15364055225230f-0-bdf8d86894274844a03f964d0206f2d0.jpg 2x,
"At Musée d'Orsay, a Courbet painting gets a new life before visitors' eyes",0,https://www.lemonde.fr/en/culture/article/2025/07/26/at-musee-d-orsay-a-courbet-painting-gets-a-new-life-before-visitors-eyes_6743744_30.html,Subscribers only,  By Max Blanc ,https://img.lemde.fr/2025/08/01/0/0/8640/5760/360/0/95/0/b906683_ftp-import-images-1-p37gwmxhoan3-0fde0877b7534c4aa15364055225230f-0-bdf8d86894274844a03f964d0206f2d0.jpg 2x,
Avignon Festival 2025: An edition marked by emotion and fragility,0,https://www.lemonde.fr/en/culture/article/2025/07/26/avignon-festival-2025-an-edition-marked-by-emotion-and-fragility_6743733_30.html,Subscribers only,"  By Fabienne Darge (Avignon, France, special correspondent) ",https://img.lemde.fr/2025/08/01/0/0/8640/5760/360/0/95/0/b906683_ftp-import-images-1-p37gwmxhoan3-0fde0877b7534c4aa15364055225230f-0-bdf8d86894274844a03f964d0206f2d0.jpg 2x,
The challenge of surtitling at the Avignon Festival,0,https://www.lemonde.fr/en/culture/article/2025/07/20/the-challenge-of-surtitling-at-the-avignon-festival_6743560_30.html,Subscribers only,  By Calypso Joyeux ,https://img.lemde.fr/2025/08/01/0/0/8640/5760/360/0/95/0/b906683_ftp-import-images-1-p37gwmxhoan3-0fde0877b7534c4aa15364055225230f-0-bdf8d86894274844a03f964d0206f2d0.jpg 2x,
"In Arles, Fragonard's Museum of Fashion and Costume gracefully unveils treasures",0,https://www.lemonde.fr/en/m-le-mag/article/2025/07/17/in-arles-fragonard-s-museum-of-fashion-and-costume-gracefully-unveils-treasures_6743450_117.html,Subscribers only, By Litza Georgopoulos ,https://img.lemde.fr/2025/08/01/0/0/8640/5760/360/0/95/0/b906683_ftp-import-images-1-p37gwmxhoan3-0fde0877b7534c4aa15364055225230f-0-bdf8d86894274844a03f964d0206f2d0.jpg 2x,
Wildfires blaze in southern France: 'It looked like the apocalypse',"In the Corbières hills, 16,000 hectares went up in flames in just 24 hours, despite 2,500 firefighters and the mobilization of nearly all of France's aerial resources.",https://www.lemonde.fr/en/environment/article/2025/08/07/wildfires-blaze-in-southern-france-it-looked-like-the-apocalypse_6744148_114.html,Subscribers only,"  By Maryline Baumard (Coustouge, Saint-Laurent-de-la-Cabrerisse (southern France), special correspondent) ",https://img.lemde.fr/2025/08/01/0/0/8640/5760/360/0/95/0/b906683_ftp-import-images-1-p37gwmxhoan3-0fde0877b7534c4aa15364055225230f-0-bdf8d86894274844a03f964d0206f2d0.jpg 2x,
"Trump's tariffs take effect, ushering in a new world trade order",0,https://www.lemonde.fr/en/economy/article/2025/08/07/trump-s-tariffs-take-effect-ushering-in-a-new-world-trade-order_6744146_19.html,Subscribers only,  By Nicolas Chapuis (New York (United States) correspondent) ,https://img.lemde.fr/2025/08/01/0/0/8640/5760/360/0/95/0/b906683_ftp-import-images-1-p37gwmxhoan3-0fde0877b7534c4aa15364055225230f-0-bdf8d86894274844a03f964d0206f2d0.jpg 2x,
French foreign trade deficit widens even before new tariffs take effect,0,https://www.lemonde.fr/en/economy/article/2025/08/07/french-foreign-trade-deficit-widens-before-new-tariffs-take-effect_6744151_19.html,Subscribers only,  By Denis Cosnard ,https://img.lemde.fr/2025/08/01/0/0/8640/5760/360/0/95/0/b906683_ftp-import-images-1-p37gwmxhoan3-0fde0877b7534c4aa15364055225230f-0-bdf8d86894274844a03f964d0206f2d0.jpg 2x,
War in Ukraine: Trump could meet with Putin 'as soon as next week',US Special Envoy Steve Witkoff met with the Russian leader on Wednesday to try to convince him to agree to a ceasefire with Ukraine before the August 8 deadline set by the White House. Moscow is considering a concession to delay sanctions on its oil exports.,https://www.lemonde.fr/en/international/article/2025/08/07/war-in-ukraine-trump-could-meet-with-putin-as-soon-as-next-week_6744149_4.html,Subscribers only,  By Emmanuel Grynszpan ,https://img.lemde.fr/2025/08/01/0/0/8640/5760/360/0/95/0/b906683_ftp-import-images-1-p37gwmxhoan3-0fde0877b7534c4aa15364055225230f-0-bdf8d86894274844a03f964d0206f2d0.jpg 2x,
"July was Earth's third-warmest on record, EU scientists say","Despite a somewhat cooler July, the Copernicus Climate Change Service found that the 12-month period between August 2024 and July 2025 was 1.53 degrees above pre-industrial levels, exceeding the threshold set in 2015 to limit human-caused warming to 1.5 degrees.",https://www.lemonde.fr/en/international/article/2025/08/07/july-was-earth-s-third-warmest-on-record-eu-scientists-say_6744160_4.html,Not premium,Le Monde with AP,https://img.lemde.fr/2025/08/01/0/0/8640/5760/360/0/95/0/b906683_ftp-import-images-1-p37gwmxhoan3-0fde0877b7534c4aa15364055225230f-0-bdf8d86894274844a03f964d0206f2d0.jpg 2x,
Success of French anti-pesticide petition revives interest in the political tool,"A petition against the 'Duplomb Law' has become the second most signed in French history, and the first of its kind on a parliamentary platform. However, its impact will likely remain symbolic.",https://www.lemonde.fr/en/politics/article/2025/08/07/success-of-french-anti-pesticide-petition-revives-interest-in-the-political-tool_6744155_5.html,Subscribers only,  By Juliette Fekkar ,https://img.lemde.fr/2025/08/01/0/0/8640/5760/360/0/95/0/b906683_ftp-import-images-1-p37gwmxhoan3-0fde0877b7534c4aa15364055225230f-0-bdf8d86894274844a03f964d0206f2d0.jpg 2x,
"In rural France, young people keep the local tradition of partying alive","'Why Do We Party?' (1/6). In eastern Rignieu-le-Désert, the Amicale Des Jeunes youth association upholds the tradition of local balls, a custom that in some places is now seen as a way of preserving local identity.",https://www.lemonde.fr/en/summer-reads/article/2025/08/07/in-rural-france-young-people-keep-the-local-tradition-of-partying-alive_6744154_183.html,Subscribers only," By Camille Bordenet (Chazey-sur-Ain (eastern France), special correspondent) ",https://img.lemde.fr/2025/08/01/0/0/8640/5760/360/0/95/0/b906683_ftp-import-images-1-p37gwmxhoan3-0fde0877b7534c4aa15364055225230f-0-bdf8d86894274844a03f964d0206f2d0.jpg 2x,Feature
Macron hardens his approach toward Algeria,0,https://www.lemonde.fr/en/le-monde-africa/article/2025/08/07/macron-hardens-his-approach-toward-algeria_6744150_124.html,Subscribers only,  By Frédéric Bobin   ,https://img.lemde.fr/2025/08/01/0/0/8640/5760/360/0/95/0/b906683_ftp-import-images-1-p37gwmxhoan3-0fde0877b7534c4aa15364055225230f-0-bdf8d86894274844a03f964d0206f2d0.jpg 2x,
Israeli airline's Paris offices sprayed with red paint and slogans,0,https://www.lemonde.fr/en/international/article/2025/08/07/israeli-airline-s-paris-offices-sprayed-with-red-paint-and-slogans_6744159_4.html,Not premium,Le Monde with AFP,https://img.lemde.fr/2025/08/01/0/0/8640/5760/360/0/95/0/b906683_ftp-import-images-1-p37gwmxhoan3-0fde0877b7534c4aa15364055225230f-0-bdf8d86894274844a03f964d0206f2d0.jpg 2x,
UK says first migrants held under return deal with France,0,https://www.lemonde.fr/en/united-kingdom/article/2025/08/07/uk-says-first-migrants-held-under-return-deal-with-france_6744157_135.html,Not premium,Le Monde with AFP,https://img.lemde.fr/2025/08/01/0/0/8640/5760/360/0/95/0/b906683_ftp-import-images-1-p37gwmxhoan3-0fde0877b7534c4aa15364055225230f-0-bdf8d86894274844a03f964d0206f2d0.jpg 2x,
"India-US alliance weakened by trade, Pakistan and oil disputes",0,https://www.lemonde.fr/en/international/article/2025/08/07/india-us-alliance-weakened-by-trade-pakistan-and-oil-disputes_6744158_4.html,Subscribers only,"  By Sophie Landrin (New Delhi, India, correspondent) and Arnaud Leparmentier (New York, United States, correspondent) ",https://img.lemde.fr/2025/08/01/0/0/8640/5760/360/0/95/0/b906683_ftp-import-images-1-p37gwmxhoan3-0fde0877b7534c4aa15364055225230f-0-bdf8d86894274844a03f964d0206f2d0.jpg 2x,
Thailand and Cambodia extend shaky ceasefire deal,0,https://www.lemonde.fr/en/international/article/2025/08/07/thailand-and-cambodia-extend-ceasefire-deal_6744156_4.html,Not premium,Le Monde with AFP,https://img.lemde.fr/2025/08/01/0/0/8640/5760/360/0/95/0/b906683_ftp-import-images-1-p37gwmxhoan3-0fde0877b7534c4aa15364055225230f-0-bdf8d86894274844a03f964d0206f2d0.jpg 2x,
'The real villain of World War II': Winston Churchill is now a target of American revisionism,0,https://www.lemonde.fr/en/opinion/article/2025/08/07/the-real-villain-of-world-war-ii-winston-churchill-is-now-a-target-of-american-revisionism_6744144_23.html,Subscribers only,  By Valentine Faure ,https://img.lemde.fr/2025/08/01/0/0/8640/5760/360/0/95/0/b906683_ftp-import-images-1-p37gwmxhoan3-0fde0877b7534c4aa15364055225230f-0-bdf8d86894274844a03f964d0206f2d0.jpg 2x,
European steel and aluminum industries shrouded in trade uncertainty,0,https://www.lemonde.fr/en/economy/article/2025/08/07/european-steel-and-aluminum-industries-shrouded-in-trade-uncertainty_6744136_19.html,Subscribers only,"  By  Elie Allan (Brussels, correspondent) ",https://img.lemde.fr/2025/08/01/0/0/8640/5760/360/0/95/0/b906683_ftp-import-images-1-p37gwmxhoan3-0fde0877b7534c4aa15364055225230f-0-bdf8d86894274844a03f964d0206f2d0.jpg 2x,
"The scars of Boko Haram on the shores of Lake Chad: 'At night, they are the masters'",0,https://www.lemonde.fr/en/le-monde-africa/article/2025/08/07/the-scars-of-boko-haram-on-the-shores-of-lake-chad-at-night-they-are-the-masters_6744145_124.html,Subscribers only,"  By Carol Valade (Lac province [Chad], special correspondent) ",https://img.lemde.fr/2025/08/01/0/0/8640/5760/360/0/95/0/b906683_ftp-import-images-1-p37gwmxhoan3-0fde0877b7534c4aa15364055225230f-0-bdf8d86894274844a03f964d0206f2d0.jpg 2x,
Outsider art: Two African artists somewhat lost amid the vast Decharme collection in Paris,0,https://www.lemonde.fr/en/le-monde-africa/article/2025/08/07/outsider-art-two-african-artists-somewhat-lost-amid-the-vast-decharme-collection-in-paris_6744143_124.html,Not premium,  By Olivier Herviaux ,https://img.lemde.fr/2025/08/01/0/0/8640/5760/360/0/95/0/b906683_ftp-import-images-1-p37gwmxhoan3-0fde0877b7534c4aa15364055225230f-0-bdf8d86894274844a03f964d0206f2d0.jpg 2x,
War in Gaza causes rift within the British left,0,https://www.lemonde.fr/en/international/article/2025/08/07/war-in-gaza-causes-rift-within-the-british-left_6744138_4.html,Subscribers only,"  By Julie Zaugg  (London, correspondent) ",https://img.lemde.fr/2025/08/01/0/0/8640/5760/360/0/95/0/b906683_ftp-import-images-1-p37gwmxhoan3-0fde0877b7534c4aa15364055225230f-0-bdf8d86894274844a03f964d0206f2d0.jpg 2x,
Scientists outraged by climate-skeptic report commissioned by Trump administration,0,https://www.lemonde.fr/en/environment/article/2025/08/06/scientists-outraged-by-climate-skeptic-report-commissioned-by-trump-administration_6744121_114.html,Subscribers only,  By Stéphane Foucart ,https://img.lemde.fr/2025/08/01/0/0/8640/5760/360/0/95/0/b906683_ftp-import-images-1-p37gwmxhoan3-0fde0877b7534c4aa15364055225230f-0-bdf8d86894274844a03f964d0206f2d0.jpg 2x,
"Elon Musk, Robert A. Heinlein and the urgent call to colonize space",0,https://www.lemonde.fr/en/summer-reads/article/2025/08/06/elon-musk-robert-a-heinlein-and-the-urgent-call-to-colonize-space_6744129_183.html,Subscribers only, By Julien Laroche-Joubert ,https://img.lemde.fr/2025/08/01/0/0/8640/5760/360/0/95/0/b906683_ftp-import-images-1-p37gwmxhoan3-0fde0877b7534c4aa15364055225230f-0-bdf8d86894274844a03f964d0206f2d0.jpg 2x,
"Mojgan Habibi, chef: 'Before, I was afraid of everything. Now, I have found my freedom'","'Refuge Recipes' (4/6). Iranian native Mojgan Habibi is the breakfast chef at Hôtel du Couvent in Nice. Khoresht mast, a dish reserved for special occasions and made with yogurt, spices, honey and meat, brings back memories of her happy youth in Isfahan before her marriage, when she was free to create and sing.",https://www.lemonde.fr/en/summer-reads/article/2025/08/06/mojgan-habibi-chef-before-i-was-afraid-of-everything-now-i-have-found-my-freedom_6744130_183.html,Subscribers only,  By Camille Labro ,https://img.lemde.fr/2025/08/01/0/0/8640/5760/360/0/95/0/b906683_ftp-import-images-1-p37gwmxhoan3-0fde0877b7534c4aa15364055225230f-0-bdf8d86894274844a03f964d0206f2d0.jpg 2x,Your stories
Agnès Varda's Parisian wanderings at the Musée Carnavalet,"An original exhibition focuses on the artist's relationship with Paris, highlighting her photographic work and her atelier in the 14th arrondissement.",https://www.lemonde.fr/en/culture/article/2025/08/04/agnes-varda-s-parisian-wanderings-at-the-musee-carnavalet_6744067_30.html,Subscribers only,  By Claire Guillot ,https://img.lemde.fr/2025/08/01/0/0/8640/5760/360/0/95/0/b906683_ftp-import-images-1-p37gwmxhoan3-0fde0877b7534c4aa15364055225230f-0-bdf8d86894274844a03f964d0206f2d0.jpg 2x,Review
"Eighty years after Hiroshima and Nagasaki bombings, the fight for survivors' memories to live on","In Japan, the two cities have long promoted peace and nuclear disarmament, led by survivors of the 1945 nuclear bombings. As their voices fade, both cities are striving to carry their message forward.",https://www.lemonde.fr/en/international/article/2025/08/06/eighty-years-after-hiroshima-and-nagasaki-bombings-the-fight-for-survivors-memories-to-live-on_6744110_4.html,Subscribers only,"  By Philippe Mesmer (Hiroshima and Nagasaki, special correspondent) ",https://img.lemde.fr/2025/08/01/0/0/8640/5760/360/0/95/0/b906683_ftp-import-images-1-p37gwmxhoan3-0fde0877b7534c4aa15364055225230f-0-bdf8d86894274844a03f964d0206f2d0.jpg 2x,News
The imperative of reversing Africa's democratic drift,0,https://www.lemonde.fr/en/opinion/article/2025/08/07/the-imperative-of-reversing-africa-s-democratic-drift_6744153_23.html,Not premium,Le Monde,https://img.lemde.fr/2025/08/01/0/0/8640/5760/360/0/95/0/b906683_ftp-import-images-1-p37gwmxhoan3-0fde0877b7534c4aa15364055225230f-0-bdf8d86894274844a03f964d0206f2d0.jpg 2x,Editorial
The only solution for Gaza and the hostages? International pressure,0,https://www.lemonde.fr/en/opinion/article/2025/08/05/the-only-solution-for-gaza-and-the-hostages-international-pressure_6744083_23.html,Not premium,Le Monde,https://img.lemde.fr/2025/08/01/0/0/8640/5760/360/0/95/0/b906683_ftp-import-images-1-p37gwmxhoan3-0fde0877b7534c4aa15364055225230f-0-bdf8d86894274844a03f964d0206f2d0.jpg 2x,Editorial
Ukraine's commendable democratic pushback against corruption,0,https://www.lemonde.fr/en/opinion/article/2025/08/04/ukraine-s-commendable-democratic-pushback-against-corruption_6744050_23.html,Not premium,Le Monde,https://img.lemde.fr/2025/08/01/0/0/8640/5760/360/0/95/0/b906683_ftp-import-images-1-p37gwmxhoan3-0fde0877b7534c4aa15364055225230f-0-bdf8d86894274844a03f964d0206f2d0.jpg 2x,Editorial
